BusinessName,DBAName,LegalOwner,NameLast,NameFirst,LICENSENO,ISSDTTM,EXPDTTM,LICSTATUS,LICENSECAT,DESCRIPT,RESULT,RESULTDTTM,Violation,ViolLevel,ViolDesc,VIOLDTTM,ViolStatus,StatusDate,Comments,Address,City,State,Zip,Property_ID,Location
Uno Chicago Grill,,NICOLE E. ADAMS,NICOLE E. ADAMS,,18961,01/09/2012 03:57:09 PM,12/31/2016 11:59:00 PM,Active,FT,Eating & Drinking w/ Take Out,HE_Fail,11/28/2014 02:14:37 PM,14-4-202.11,*,Food Contact Surfaces Design,11/28/2014 02:14:37 PM,Fail,,Some cutting boards at the prep area heavily scored. Resurface or replace.,1   Brookline AV,Boston,MA,02215,157196,"(42.34842, -71.097471)"
Ziti's Express,,LAMBERT GREGORY,Tremont Street Burger L L C,,67693,12/19/2011 01:53:23 PM,12/31/2016 11:59:00 PM,Active,FS,Eating & Drinking,HE_Filed,12/19/2014 01:38:25 PM,36-6-501.11-.12,*,Improper Maintenance of Floors,12/19/2014 01:38:25 PM,Pass,2014-12-19 15:24:32,Built up debris  food  grease and grime on floor. Clean floor under & behind all equipment.,140   Tremont ST,Boston,MA,02111,156397,"(42.355646, -71.062559)"
Uno Chicago Grill,,SPENCER AARONN D,UNO RESTAURANTS,LLC  LEGAL DEPARTMENT,18958,01/09/2012 03:53:57 PM,12/31/2016 11:59:00 PM,Active,FT,Eating & Drinking w/ Take Out,HE_Pass,02/28/2008 02:27:43 PM,17-4-302.14,*,Test Kit Provided,02/28/2008 03:22:56 PM,Pass,2008-02-28 15:22:56,No test kit available for wiping cloth buckets. Provide.,727   Boylston ST,Boston,MA,02116,18385,"(42.349589, -71.080292)"
Pizza Stop,,DEMERTZIDIS NICHOLAS,Efstathios,Andreadis,98122,10/01/2013 08:44:22 AM,12/31/2016 11:59:00 PM,Active,FS,Eating & Drinking,HE_Filed,12/03/2015 11:36:29 AM,23-4-602.13,*,Non-Food Contact Surfaces Clean,12/03/2015 11:36:29 AM,Pass,2015-12-04 09:18:17,clean all bulk containers...clean all shelving at prep area...clean and degrease all cooking equipment interior and exterior...clean 3 compartmant sink and remove mold buildup...,851   Harrison AV,Roxbury,MA,02118,70068,"(42.33474, -71.07567)"
CANTON HOUSE,,,LI TING LI PRESIDENT,,23526,02/01/2012 03:06:08 PM,12/31/2016 11:59:00 PM,Active,FT,Eating & Drinking w/ Take Out,HE_Fail,06/17/2013 02:27:00 PM,42-6-501.113/.114,*,Premises Maintained,06/17/2013 02:27:00 PM,Fail,,Cell phones and other non-cooking equipment stored on shelves on cook line and prep table. Discontinue and store properly.,6  Hancock St,Dorchester,MA,02125,158300,"(42.315595, -71.065919)"
Uno Chicago Grill,,SPENCER AARONN D,UNO RESTAURANTS,LLC  LEGAL DEPARTMENT,18958,01/09/2012 03:53:57 PM,12/31/2016 11:59:00 PM,Active,FT,Eating & Drinking w/ Take Out,HE_Fail,04/17/2012 11:41:11 AM,23-4-602.13,*,Non-Food Contact Surfaces Clean,04/17/2012 11:41:11 AM,Fail,,Condensor fans with dust build up  clean to remove.,727   Boylston ST,Boston,MA,02116,18385,"(42.349589, -71.080292)"
UNION OYSTER HOUSE,,MILANO JOSEPH A JR TRST,MILANO,JOSEPH A.,19089,12/14/2011 02:11:17 PM,12/31/2016 11:59:00 PM,Active,FS,Eating & Drinking,HE_Fail,12/18/2012 11:07:29 AM,15-4-202.16,*,Non-Food Contact Surfaces,12/18/2012 11:07:29 AM,Fail,,Main kitchen-teal exposed insulation at ice machine.,41  Union St,Boston,MA,02108,139293,"(42.36127, -71.05688)"
BUKHARA INDIAN BISTRO,,BRUCE THERESA,AMRIK SINGH PABLA,,21016,01/12/2012 03:33:18 PM,12/31/2016 11:59:00 PM,Active,FS,Eating & Drinking,HE_Pass,06/05/2014 02:35:07 PM,08-3-302.11/3-304.11,***,Separation  Segregation Cross Contamination,06/05/2014 02:35:07 PM,Pass,2014-06-05 15:33:21,Raw lamb stored above cooked spinch in walk in refrigerator. Hand out left.,701   Centre ST,Jamaica Plain,MA,02130,28172,"(42.31159, -71.11461)"
PHO 2000,,SCHIAVO BRUNO A TS,Dung Ngu,,76202,04/06/2012 12:14:16 PM,12/31/2016 11:59:00 PM,Active,FS,Eating & Drinking,HE_Pass,03/06/2013 01:24:07 PM,29-5-201/02.11,*,Installed and Maintained,03/06/2013 01:24:07 PM,Pass,2013-03-06 15:43:00,Prep sink leaking. Have repaired,198   Adams ST,Dorchester,MA,02122,606,"(42.30224, -71.06)"
DRAGON CHEF CHINESE REST.,,,RU BANG CHEN PRES.,,21347,02/06/2012 10:55:13 AM,12/31/2016 11:59:00 PM,Active,FT,Eating & Drinking w/ Take Out,HE_Fail,05/17/2012 05:30:11 PM,M-2-201.11/.14 .15,***,Non-Compliance w/Employee Health Policy,05/17/2012 05:30:11 PM,Fail,,,411  Washington St,Brighton,MA,02135,156051,"(42.349266, -71.15532)"
UNION OYSTER HOUSE,,MILANO JOSEPH A JR TRST,MILANO,JOSEPH A.,19089,12/14/2011 02:11:17 PM,12/31/2016 11:59:00 PM,Active,FS,Eating & Drinking,HE_Pass,12/28/2012 10:46:14 AM,14-4-202.11,*,Food Contact Surfaces Design,12/28/2012 10:46:14 AM,Pass,2012-12-31 07:48:37,Oyster bar- Repair lobster scale and basket.,41  Union St,Boston,MA,02108,139293,"(42.36127, -71.05688)"
Peggy O'Neil's Pub & Grille,,LIMERICK CO INC,LIMERICK CO INC,,19097,12/13/2011 03:15:33 PM,12/31/2016 11:59:00 PM,Active,FS,Eating & Drinking,HE_Fail,11/21/2008 01:43:40 PM,21-3-304.14,*,Wiping Cloths  Clean  Sanitize,11/24/2008 08:07:44 AM,Fail,,,1310   DORCHESTER  AV,DORCHESTER,MA,02122,,
Double Tree Club Hotel,,BOSTON REDEVELOPMENT AUTH,C.J. WASHINGTON STREET L.L.C.,,21472,03/09/2012 11:17:16 AM,12/31/2016 11:59:00 PM,Active,FS,Eating & Drinking,HE_Filed,05/21/2012 02:50:43 PM,15-4-202.16,*,Non-Food Contact Surfaces,05/21/2012 02:50:43 PM,Fail,,Provide an alternative remedy for the ventillation issue in the kitchen discussed above.  The wooden board should be replaced with rubber bumpers or another cleanable material.  An alternative solution could be to cut ventillation holes within the shelving in front of the unit.,821    Washington ST,BOSTON,MA,02116,,
CANTON HOUSE,,,LI TING LI PRESIDENT,,23526,02/01/2012 03:06:08 PM,12/31/2016 11:59:00 PM,Active,FT,Eating & Drinking w/ Take Out,HE_Fail,07/29/2015 02:19:23 PM,35-6-501.111/.115,**,Insects  Rodents  Animals,07/29/2015 02:19:23 PM,Fail,,Evidence of flies at ware washing area  provide pest control report.,6  Hancock St,Dorchester,MA,02125,158300,"(42.315595, -71.065919)"
CANTON HOUSE,,,LI TING LI PRESIDENT,,23526,02/01/2012 03:06:08 PM,12/31/2016 11:59:00 PM,Active,FT,Eating & Drinking w/ Take Out,HE_Pass,04/22/2015 02:26:28 PM,02-3-602.11-.12/3-302.12,*,Food Container Labels,04/22/2015 02:26:28 PM,Pass,2015-04-22 15:48:46,Label all bulk food containers with ingredient name.,6  Hancock St,Dorchester,MA,02125,158300,"(42.315595, -71.065919)"
Peggy O'Neil's Pub & Grille,,LIMERICK CO INC,LIMERICK CO INC,,19097,12/13/2011 03:15:33 PM,12/31/2016 11:59:00 PM,Active,FS,Eating & Drinking,HE_Fail,05/08/2009 01:48:24 PM,23-4-602.13,*,Non-Food Contact Surfaces Clean,05/11/2009 08:04:21 AM,Fail,,Interior walls of upright cooler in basement visibly soiled. Clean to remove.,1310   DORCHESTER  AV,DORCHESTER,MA,02122,,
CANTON HOUSE,,,LI TING LI PRESIDENT,,23526,02/01/2012 03:06:08 PM,12/31/2016 11:59:00 PM,Active,FT,Eating & Drinking w/ Take Out,HE_Fail,11/05/2014 02:20:26 PM,21-3-304.14,*,Wiping Cloths  Clean  Sanitize,11/05/2014 02:20:26 PM,Fail,,Replace all heavily worn wiping cloths.,6  Hancock St,Dorchester,MA,02125,158300,"(42.315595, -71.065919)"
Nicholas Sub & Pizza Shop,,NICHOLAS MARKOPOULOS,Kourtelidis,Nicholas,33364,01/17/2012 03:37:47 PM,12/31/2016 11:59:00 PM,Active,FT,Eating & Drinking w/ Take Out,HE_Fail,10/19/2011 11:52:16 AM,32-6-301.11-02.11,*,Hand Cleaner  Drying  Tissue Signage,10/19/2011 11:52:16 AM,Fail,,KITCHEN-- provide paper towels at handsink-( roller empty at inspection ),600   Hyde Park AV,Roslindale,MA,02131,156517,"(42.280027, -71.118658)"
Finagle A Bagel,,,FINALGE A BAGEL,ATTN: Human Resources,20653,12/15/2011 10:47:55 AM,12/31/2016 11:59:00 PM,Active,FT,Eating & Drinking w/ Take Out,HE_Fail,12/27/2007 11:10:25 AM,29-5-201/02.11,*,Installed and Maintained,12/28/2007 08:48:13 AM,Fail,,coffee area -Clogged floor drain.,275   Cambridge ST,Boston,MA,02114,155973,"(42.361357, -71.068227)"
A K's Take Out & Delivery,,BOUKOUVALAS ATHENA TS,Saini,Jasbir,28531,12/20/2011 02:29:52 PM,12/31/2016 11:59:00 PM,Active,FT,Eating & Drinking w/ Take Out,HE_FailExt,05/22/2012 11:58:29 AM,38-6-202.11,*,Fixture's not properly shielded,05/22/2012 11:58:29 AM,Pass,2012-05-23 08:17:14,Basement lignhts are not covered - repair or provide tough skin bulbs as discussed,1427   Tremont ST,Mission Hill,MA,02120,136818,"(42.331858, -71.096333)"
UPTOWN CAFE,,,GARY FORZIATI,,23109,12/14/2011 11:10:59 AM,12/31/2016 11:59:00 PM,Active,FT,Eating & Drinking w/ Take Out,HE_Filed,08/17/2012 10:33:34 AM,23-4-602.13,*,Non-Food Contact Surfaces Clean,08/17/2012 10:33:34 AM,Pass,2012-08-17 15:28:01,Clean all cooking equipment.,116   CAMBRIDGE,BOSTON,MA,02114,,
LOLLICUP TEA ZONE,,PETER LUU  PRES.,LONG JIANG,,22229,02/14/2012 12:48:34 PM,12/31/2016 11:59:00 PM,Active,FT,Eating & Drinking w/ Take Out,HE_Pass,12/05/2007 01:38:13 PM,35-6-501.111/.115,**,Insects  Rodents  Animals,12/06/2007 08:21:52 AM,Pass,2007-12-06 08:21:52,Cockroaches found under Sink in foil container and in dry storage room. Also rodent droppings in Store room. Provide pest reports treating the problems.,1   Brighton AV,Allston,MA,02134,157732,"(42.352411, -71.125329)"
EL PENOL RESTAURANT,,,MIGUEL A. MEDINA BALBIN,,23581,12/29/2011 09:39:51 AM,12/31/2016 11:59:00 PM,Active,FS,Eating & Drinking,HE_Fail,05/15/2008 12:58:45 PM,21-3-304.14,*,Wiping Cloths  Clean  Sanitize,05/16/2008 07:52:22 AM,Fail,,Keep wiping cloths in sanitizer,54   Bennington ST,East Boston,MA,02128,156292,"(42.375798, -71.037101)"
ROSLINDALE HOUSE OF PIZZA,,,VASSILIOS GLYKIS,,19964,01/06/2012 10:23:12 AM,12/31/2016 11:59:00 PM,Active,FT,Eating & Drinking w/ Take Out,HE_Pass,07/08/2013 02:30:48 PM,15-4-202.16,*,Non-Food Contact Surfaces,07/08/2013 02:30:48 PM,Pass,2013-07-09 08:36:35,provide shelving for all storage of beverages...,4168   Washington ST,Roslindale,MA,02131,157416,"(42.287818, -71.126399)"
Uno Chicago Grill,,SPENCER AARONN D,UNO RESTAURANTS,LLC  LEGAL DEPARTMENT,18958,01/09/2012 03:53:57 PM,12/31/2016 11:59:00 PM,Active,FT,Eating & Drinking w/ Take Out,HE_Fail,11/06/2013 11:33:49 AM,15-4-202.16,*,Non-Food Contact Surfaces,11/06/2013 11:33:49 AM,Fail,,Resurface / Repaint rusted metal shelving in basement.,727   Boylston ST,Boston,MA,02116,18385,"(42.349589, -71.080292)"
LOLLICUP TEA ZONE,,PETER LUU  PRES.,LONG JIANG,,22229,02/14/2012 12:48:34 PM,12/31/2016 11:59:00 PM,Active,FT,Eating & Drinking w/ Take Out,HE_Fail,02/23/2012 10:47:03 AM,23-4-602.13,*,Non-Food Contact Surfaces Clean,02/23/2012 10:47:03 AM,Fail,,Lower shelf of ice cream cooler visibly soiled. Clean to remove.,1   Brighton AV,Allston,MA,02134,157732,"(42.352411, -71.125329)"
DAYIB CAFE,,ABDULLAH FARAH ANSHUR,ABDULLAH FARAH ANSHUR,,22700,02/13/2012 12:56:03 PM,12/31/2016 11:59:00 PM,Active,FT,Eating & Drinking w/ Take Out,HE_FailExt,11/06/2012 01:22:07 PM,32-6-501.11-.12/6-202.14,*,Toilet Enclosed Clean,11/06/2012 01:22:07 PM,Pass,2012-11-06 15:30:56,mens restroom/provide self closing door,722   Shawmut AV,Roxbury,MA,02119,157649,"(42.332783, -71.083221)"
Tavolo,,,Trinity Ashmont Restaurant LLC,Chris Douglass,28452,02/06/2012 01:24:23 PM,12/31/2016 11:59:00 PM,Active,FS,Eating & Drinking,HE_NotReq,12/30/2012 12:00:00 AM,,,,,,,,1917   DORCHESTER,DORCHESTER,MA,02124,,
CANTON HOUSE,,,LI TING LI PRESIDENT,,23526,02/01/2012 03:06:08 PM,12/31/2016 11:59:00 PM,Active,FT,Eating & Drinking w/ Take Out,HE_Fail,08/10/2009 01:52:17 PM,15-4-202.16,*,Non-Food Contact Surfaces,08/11/2009 08:02:45 AM,Fail,,Small cold holding unit registering at 47F. Discontinue use until unit can mantain a temperature of 40F and below.,6  Hancock St,Dorchester,MA,02125,158300,"(42.315595, -71.065919)"
Beth Isreal Deaconess,,BETH ISRAEL DEACONESS,SODEXO OPERATIONS L L C,,26033,02/13/2012 10:14:16 AM,12/31/2016 11:59:00 PM,Active,FS,Eating & Drinking,HE_Fail,12/08/2014 12:31:17 PM,15-4-202.16,*,Non-Food Contact Surfaces,12/08/2014 12:31:17 PM,Fail,,Grab and go refrigeration unit at 46F- Repair to maintain temperature of 41F or below.,330   Brookline AV,Boston,MA,02115,22096,"(42.33982, -71.10568)"
COPLEY PLAZA HOTEL,,DALEY,DALEY,JAMES,18878,02/21/2012 10:53:44 AM,12/31/2016 11:59:00 PM,Active,FS,Eating & Drinking,HE_Fail,08/05/2014 10:48:40 AM,29-5-201/02.11,*,Installed and Maintained,08/05/2014 10:48:40 AM,Fail,,mens locker/repair faucet to handsinks,138   ST JAMES  AV,BOSTON,MA,02116,,
PHO 2000,,SCHIAVO BRUNO A TS,Dung Ngu,,76202,04/06/2012 12:14:16 PM,12/31/2016 11:59:00 PM,Active,FS,Eating & Drinking,HE_Pass,06/03/2014 02:34:22 PM,24-4-904.11AB,*,Improper Storage of Re-usable Utensils,06/03/2014 02:34:22 PM,Pass,2014-06-04 08:14:01,"Dish rack stored on floor elevate 6"" to 8"" or higher.",198   Adams ST,Dorchester,MA,02122,606,"(42.30224, -71.06)"
BUKHARA INDIAN BISTRO,,BRUCE THERESA,AMRIK SINGH PABLA,,21016,01/12/2012 03:33:18 PM,12/31/2016 11:59:00 PM,Active,FS,Eating & Drinking,HE_Pass,11/06/2012 01:49:06 PM,20-4-703.11,***,Food Contact Surfaces Clean,11/06/2012 01:49:06 PM,Pass,2012-11-06 15:08:25,CLEAN & SANITIZE  all the white food bins of built-up grime-,701   Centre ST,Jamaica Plain,MA,02130,28172,"(42.31159, -71.11461)"
The Corner Tavern,,BACON DOUGLAS F TS,DOUGLAS BACON PRES.,,19829,12/15/2011 11:23:57 AM,12/31/2016 11:59:00 PM,Active,FS,Eating & Drinking,HE_Fail,01/28/2008 01:33:35 PM,37-6-501.11-.12,*,Improper Maintenance of Walls/Ceilings,01/28/2008 03:33:02 PM,Fail,,Replace the missing  damaged and removed FRP in the kitchen area. Seal all penetrations within the kitchen area to prevent rodent access.Replace the missing ceiling tiles in the kitchen area. All ceiling tiles should be non absorbent.,421   Marlborough ST,Boston,MA,02115,91385,"(42.35014, -71.08944)"
Uno Chicago Grill,,NICOLE E. ADAMS,NICOLE E. ADAMS,,19118,01/09/2012 03:55:20 PM,12/31/2016 11:59:00 PM,Active,FT,Eating & Drinking w/ Take Out,HE_Pass,02/24/2012 12:25:35 PM,37-6-501.11-.12,*,Improper Maintenance of Walls/Ceilings,02/24/2012 12:25:35 PM,Pass,2012-02-28 08:18:23,clean to remove all soil and debris and maintain clean,270   HUNTINGTON  AV,BOSTON,MA,02125,,
Daily Catch,,RICCIO GERALDO TS,CALAMARI FISHERIES INC.,,18578,02/15/2012 01:09:29 PM,12/31/2016 11:59:00 PM,Active,FS,Eating & Drinking,HE_Fail,04/29/2015 12:23:58 PM,23-4-602.13,*,Non-Food Contact Surfaces Clean,04/29/2015 12:23:58 PM,Fail,,Clean inside / outside of all refrigeration units - exterior of all cooking equipment - exterior of all bulk food containers from old food soils,319   Hanover ST,Boston,MA,02113,69107,"(42.36408, -71.05395)"
Langham Hotel,,CHRISTINE GILPIN  CONTROL LER,CHRISTINE GILPIN CONTROL,LER,23003,01/11/2012 08:50:36 AM,12/31/2016 11:59:00 PM,Active,FS,Eating & Drinking,HE_Pass,09/09/2015 11:42:46 AM,20-4-703.11,***,Food Contact Surfaces Clean,09/09/2015 11:42:46 AM,Pass,2015-09-10 09:05:40,Final rinse 101F / Repair (Need 180F),250   Franklin ST,Boston,MA,02110,157806,"(42.35663, -71.054279)"
West Napoli Pizza,,VRATTOS SOCRATES TS,BARDHI,SOKOL,21409,06/06/2012 03:38:02 PM,12/31/2016 11:59:00 PM,Active,FT,Eating & Drinking w/ Take Out,HE_Pass,05/16/2013 03:31:25 PM,42-6-501.113/.114,*,Premises Maintained,05/16/2013 03:31:25 PM,Pass,2013-05-17 08:07:56,Remove all unnecessary articles from basement.,1946  Centre St,West Roxbury,MA,02132,27764,"(42.28358, -71.15676)"
Country Kitchen,,AMINPOUR AMIR,Arleen Campbell,,32027,01/05/2012 08:42:50 AM,12/31/2016 11:59:00 PM,Active,FS,Eating & Drinking,HE_Fail,04/23/2012 10:57:17 AM,17-4-204.112/.115,*,Equipment Thermometers,04/23/2012 10:57:17 AM,Fail,,provide a thermometer for reach-in case in serving  area,830   Blue Hill AV,Dorchester,MA,02124,16567,"(42.29621, -71.08718)"
Double Tree Club Hotel,,BOSTON REDEVELOPMENT AUTH,C.J. WASHINGTON STREET L.L.C.,,21472,03/09/2012 11:17:16 AM,12/31/2016 11:59:00 PM,Active,FS,Eating & Drinking,HE_Filed,04/23/2008 12:44:39 PM,36-6-501.11-.12,*,Improper Maintenance of Floors,04/24/2008 08:19:00 AM,Pass,2008-04-24 08:19:00,Clean floor throughout.  clean floor drains.clean floor at garage storage area  storage area and kitchen throughout,821    Washington ST,BOSTON,MA,02116,,
WINDY CITY AT ADAMS VILLAGE,,BAYTURK MUZAFFER,BAYTURK MUZAFFER,,19800,02/13/2012 10:40:46 AM,12/31/2016 11:59:00 PM,Active,FT,Eating & Drinking w/ Take Out,HE_Fail,05/13/2015 10:56:17 AM,36-6-501.11-.12,*,Improper Maintenance of Floors,05/13/2015 10:56:17 AM,Fail,,Floor under the 4 top burner visibly soiled. Clean to remove. Floor in the back changing room used for employees with evidence of heavy rodent droppings. Clean to remove. Back room used by employees to change and store belongings with evidence of moisture and debris. Clean to remove all excess water and debris. At the time of the inspection there was no evidence of any pipes leaking.,516   Gallivan BL,Dorchester,MA,02124,156552,"(42.282928, -71.055559)"
Burger King,,,MASTORAN CORP.,,19935,12/16/2011 09:50:24 AM,12/31/2016 11:59:00 PM,Active,FT,Eating & Drinking w/ Take Out,HE_Fail,09/08/2009 12:21:24 PM,M-2-102.11,***,PIC Knowledge,09/09/2009 08:14:27 AM,Fail,,Manager stated incorrect final cooking temperatures. Complete illness policy not known.  Unable to state risks to  public health.,944   Bennington ST,East Boston,MA,02128,155885,"(42.386166, -71.00953)"
NEW YORK FRIED CHICKEN & PIZZA,,AYAZ A. SHAH,AYAZ A. SHAH,,23286,05/02/2012 11:48:20 AM,12/31/2016 11:59:00 PM,Active,FT,Eating & Drinking w/ Take Out,HE_Fail,07/24/2013 02:18:50 PM,34-5-501.111/.115,*,Outside Storage Improperly Maintained,07/24/2013 02:18:50 PM,Fail,,Trash area is overgrown with weeds  grease on sidewalk and loose trash. Clean to remove,531   Columbia RD,Dorchester,MA,02125,156840,"(42.315432, -71.06626)"
ZESTO'S PIZZA,,FOUR 60-468 CENTRE STREET,K & M Pizza Inc.,,75590,12/12/2011 12:47:41 PM,12/31/2016 11:59:00 PM,Active,FT,Eating & Drinking w/ Take Out,HE_Filed,11/04/2013 12:31:05 PM,13-2-304/402.11,*,Clean Cloths  Hair Restraint,11/04/2013 12:31:05 PM,Pass,2013-11-06 08:29:27,replace missing hair restraints...,460   Centre ST,Jamaica Plain,MA,02130,28061,"(42.31935, -71.11154)"
ZESTO'S PIZZA,,FOUR 60-468 CENTRE STREET,K & M Pizza Inc.,,75590,12/12/2011 12:47:41 PM,12/31/2016 11:59:00 PM,Active,FT,Eating & Drinking w/ Take Out,HE_Fail,10/24/2013 12:58:52 PM,25-4-904.11,*,Single Service Articles Stored Dispensed,10/24/2013 12:58:52 PM,Fail,,properly store all single service articles.....,460   Centre ST,Jamaica Plain,MA,02130,28061,"(42.31935, -71.11154)"
RISTORANTE EUNO,,REGNETTA LEIZE,RISTORANTE,EUNO,20538,02/13/2012 02:19:04 PM,12/31/2016 11:59:00 PM,Active,FS,Eating & Drinking,HE_Pass,04/25/2012 02:04:54 PM,23-4-602.13,*,Non-Food Contact Surfaces Clean,04/25/2012 02:04:54 PM,Pass,2012-04-25 15:27:25,Kitchen-clean fyolatn cabinets.,119   Salem ST,Boston,MA,02113,121721,"(42.364531, -71.055371)"
Langham Hotel,,CHRISTINE GILPIN  CONTROL LER,CHRISTINE GILPIN CONTROL,LER,23003,01/11/2012 08:50:36 AM,12/31/2016 11:59:00 PM,Active,FS,Eating & Drinking,HE_Pass,,04-3-501.15/4-301.11,*,Inadequate Facilities/Cooling Methods,06/25/2007 03:41:00 PM,,,,250   Franklin ST,Boston,MA,02110,157806,"(42.35663, -71.054279)"
Prime Shoppe,,,Touarsi,Benemar,28544,02/08/2012 04:33:52 PM,12/31/2016 11:59:00 PM,Active,FT,Eating & Drinking w/ Take Out,HE_Pass,09/09/2014 12:01:48 PM,37-6-501.11-.12,*,Improper Maintenance of Walls/Ceilings,09/09/2014 12:01:48 PM,Pass,2014-09-10 08:00:05,shelf on wall to right of convection oven with peeling paint  paint,104-112   Faneuil Hall Mkt,Boston,Ma,02109,,
No.  7 RESTAURANT,,,HUANG FAMILY INC.,REN XIANGHUANG  PRES.,25414,02/08/2012 04:32:36 PM,12/31/2016 11:59:00 PM,Active,FT,Eating & Drinking w/ Take Out,HE_Fail,01/25/2010 01:36:34 PM,22-4-601/602.11,**,Food Contact Surfaces Clean,01/25/2010 01:36:34 PM,Fail,,Food containers are crusted with old food. Clean containers every twenty-four hours.,225   Grove ST,West Roxbury,MA,02132,156965,"(42.261873, -71.15741)"
Daily Catch,,RICCIO GERALDO TS,CALAMARI FISHERIES INC.,,18578,02/15/2012 01:09:29 PM,12/31/2016 11:59:00 PM,Active,FS,Eating & Drinking,HE_Fail,08/06/2012 11:58:34 AM,37-6-501.11-.12,*,Improper Maintenance of Walls/Ceilings,08/06/2012 11:58:34 AM,Fail,,"""kitchen-clean cooking vent-hood and provide updated cleaning sticker",319   Hanover ST,Boston,MA,02113,69107,"(42.36408, -71.05395)"
DAYIB CAFE,,ABDULLAH FARAH ANSHUR,ABDULLAH FARAH ANSHUR,,22700,02/13/2012 12:56:03 PM,12/31/2016 11:59:00 PM,Active,FT,Eating & Drinking w/ Take Out,HE_FailExt,05/08/2009 10:16:24 AM,22-4-601/602.11,**,Food Contact Surfaces Clean,05/08/2009 03:28:43 PM,Fail,,clean/sanitize all knives,722   Shawmut AV,Roxbury,MA,02119,157649,"(42.332783, -71.083221)"
FENWAY PARK H.M.S. INC.,,JACK LYONS  MANAGER,FENWAY PARK H.M.S. INC.,,18275,10/27/2008 10:04:53 AM,12/31/2008 11:59:00 PM,Inactive,FT,Eating & Drinking w/ Take Out,HE_Fail,09/03/2008 09:16:46 AM,16-4-501.11/.15,*,Dishwashng Facilities,09/04/2008 10:49:40 AM,Fail,,Stand 5 - the two compartment sink was improperly setup with soap and sanitizer  provide proper setup,4  Yawkey Wy,Boston,MA,02215,156417,"(42.346723, -71.09868)"
NEW YORK FRIED CHICKEN & PIZZA,,AYAZ A. SHAH,AYAZ A. SHAH,,23286,05/02/2012 11:48:20 AM,12/31/2016 11:59:00 PM,Active,FT,Eating & Drinking w/ Take Out,HE_Fail,07/12/2011 10:22:45 AM,32-6-301.11-02.11,*,Hand Cleaner  Drying  Tissue Signage,07/12/2011 10:22:45 AM,Fail,,No hand soap in restroom. Provide.,531   Columbia RD,Dorchester,MA,02125,156840,"(42.315432, -71.06626)"
Mehak Restaurant,,DE PASQUALE RONALD,Akram,Mohammad,33626,02/29/2012 12:55:00 PM,12/31/2016 11:59:00 PM,Active,FS,Eating & Drinking,HE_Fail,06/09/2011 01:06:42 PM,24-4-903.11,*,Clean Equipment & Utensils Storage,06/09/2011 01:06:42 PM,Fail,,Invert clean pots and pans to properly air dry - clean pans on the ground,329   Sumner ST,East Boston,MA,02128,132398,"(42.36711, -71.03607)"
Back Bay Social Club,,DHANDA 867 BOYLSTON ST LPS,c/o Lyons Group,,68305,02/08/2012 07:50:46 AM,12/31/2016 11:59:00 PM,Active,FS,Eating & Drinking,HE_Pass,08/19/2015 10:52:10 AM,24-4-903.11,*,Clean Equipment & Utensils Storage,08/19/2015 10:52:10 AM,Pass,2015-08-19 15:41:03,Some boxes with paper equipment stored on the floor near the mop sink. Elevate 6 inches or above.,867   Boylston ST,Boston,MA,02116,18414,"(42.34874, -71.083445)"
RISTORANTE EUNO,,REGNETTA LEIZE,RISTORANTE,EUNO,20538,02/13/2012 02:19:04 PM,12/31/2016 11:59:00 PM,Active,FS,Eating & Drinking,HE_Pass,04/25/2012 02:04:54 PM,M-3-603.11,***,Consumer Advisories,04/25/2012 02:04:54 PM,Pass,2012-04-25 15:27:25,Provide consumer advisory for menus,119   Salem ST,Boston,MA,02113,121721,"(42.364531, -71.055371)"
DRAGON CHEF CHINESE REST.,,,RU BANG CHEN PRES.,,21347,02/06/2012 10:55:13 AM,12/31/2016 11:59:00 PM,Active,FT,Eating & Drinking w/ Take Out,HE_Fail,11/13/2009 05:11:05 PM,23-4-602.13,*,Non-Food Contact Surfaces Clean,11/13/2009 05:11:05 PM,Fail,,Doors of refrigerators  interior walls  and racks have food soils. Clean to remove. Clean soils from exterior 3 bay sinks.,411  Washington St,Brighton,MA,02135,156051,"(42.349266, -71.15532)"
Uno Chicago Grill,,NICOLE E. ADAMS,NICOLE E. ADAMS,,18961,01/09/2012 03:57:09 PM,12/31/2016 11:59:00 PM,Active,FT,Eating & Drinking w/ Take Out,HE_Fail,10/05/2015 02:36:15 PM,22-4-601/602.11,**,Food Contact Surfaces Clean,10/05/2015 02:36:15 PM,Fail,,Can opener at the pizza station soiled with dried up debris. Slicer at the prep area soiled with dried up debris. Clean and sanitize properly. Knifes stored soiled on the magnetic knife holder. Clean and sanitize properly.,1   Brookline AV,Boston,MA,02215,157196,"(42.34842, -71.097471)"
Fuel America,,,Apollonia Enterprises L L C,,78057,09/13/2012 09:36:42 AM,12/31/2016 11:59:00 PM,Active,FS,Eating & Drinking,HE_Filed,09/20/2013 01:46:01 PM,14-4-202.11,*,Food Contact Surfaces Design,09/20/2013 01:46:01 PM,Fail,,Long white cutting board over deli cooler visibly soiled and scoared. Clean to remove  resurface or replace.,152   Chestnut Hill AV,Brighton,MA,02135,31659,"(42.34145, -71.15433)"
BUKHARA INDIAN BISTRO,,BRUCE THERESA,AMRIK SINGH PABLA,,21016,01/12/2012 03:33:18 PM,12/31/2016 11:59:00 PM,Active,FS,Eating & Drinking,HE_Fail,08/18/2014 12:56:12 PM,03-3-501.16,***,Hot Holding,08/18/2014 12:56:12 PM,Fail,,Beef Curry 134F  baked chicken 96F and vegetable pakoras 114F. Must be keeped above 140F at all times.,701   Centre ST,Jamaica Plain,MA,02130,28172,"(42.31159, -71.11461)"
COPLEY PLAZA HOTEL,,DALEY,DALEY,JAMES,18878,02/21/2012 10:53:44 AM,12/31/2016 11:59:00 PM,Active,FS,Eating & Drinking,HE_Fail,11/29/2011 12:00:51 PM,37-6-501.11-.12,*,Improper Maintenance of Walls/Ceilings,11/29/2011 12:00:51 PM,Fail,,Ceiling vents with dust build up  clean to remove.,138   ST JAMES  AV,BOSTON,MA,02116,,
Langham Hotel,,CHRISTINE GILPIN  CONTROL LER,CHRISTINE GILPIN CONTROL,LER,23003,01/11/2012 08:50:36 AM,12/31/2016 11:59:00 PM,Active,FS,Eating & Drinking,HE_Pass,12/14/2010 11:04:48 AM,14-4-202.11,*,Food Contact Surfaces Design,12/14/2010 11:04:48 AM,Pass,2010-12-15 08:48:53,Ceiling area above ice machine in kitchen is in disrepair.Repair.,250   Franklin ST,Boston,MA,02110,157806,"(42.35663, -71.054279)"
Uno Chicago Grill,,NICOLE E. ADAMS,NICOLE E. ADAMS,,18961,01/09/2012 03:57:09 PM,12/31/2016 11:59:00 PM,Active,FT,Eating & Drinking w/ Take Out,HE_Pass,12/01/2008 12:19:23 PM,23-4-602.13,*,Non-Food Contact Surfaces Clean,12/01/2008 03:24:34 PM,Pass,2008-12-01 15:24:34,Exterior of the refrigerator next to ice machine is soiled. Clean.,1   Brookline AV,Boston,MA,02215,157196,"(42.34842, -71.097471)"
Country Kitchen,,AMINPOUR AMIR,Arleen Campbell,,32027,01/05/2012 08:42:50 AM,12/31/2016 11:59:00 PM,Active,FS,Eating & Drinking,HE_Fail,04/23/2012 10:57:17 AM,42-6-501.113/.114,*,Premises Maintained,04/23/2012 10:57:17 AM,Fail,,clean or remove all un-used equipment through-out basement/storage areas,830   Blue Hill AV,Dorchester,MA,02124,16567,"(42.29621, -71.08718)"
WINDY CITY AT ADAMS VILLAGE,,BAYTURK MUZAFFER,BAYTURK MUZAFFER,,19800,02/13/2012 10:40:46 AM,12/31/2016 11:59:00 PM,Active,FT,Eating & Drinking w/ Take Out,HE_Pass,09/07/2012 01:09:35 PM,20-4-703.11,***,Food Contact Surfaces Clean,09/07/2012 01:09:35 PM,Pass,2012-09-07 15:11:02,clean & sanitize the can opener all parts--,516   Gallivan BL,Dorchester,MA,02124,156552,"(42.282928, -71.055559)"
Anshur Restauruant,,REARDON THOMAS B,Anshur,Abdullah F.,31241,02/08/2012 03:13:24 PM,12/31/2016 11:59:00 PM,Active,FT,Eating & Drinking w/ Take Out,HE_Fail,03/31/2014 11:54:33 AM,38-6-202.11,*,Fixture's not properly shielded,03/31/2014 11:54:33 AM,Fail,,,291   Roxbury ST,Roxbury,MA,02119,119179,"(42.33041, -71.0943)"
The Upper Crust,,PESIRIDIS THEODORE TRST,Shenefield,Shawn,90116,03/25/2013 02:37:01 PM,12/31/2016 11:59:00 PM,Active,FT,Eating & Drinking w/ Take Out,HE_Fail,09/24/2014 12:18:20 PM,15-4-202.16,*,Non-Food Contact Surfaces,09/24/2014 12:18:20 PM,Fail,,repair 2 door undercounter freezer,683   Tremont ST,Roxbury,MA,02118,137919,"(42.34156, -71.07662)"
Uno Due Go,,DRUKER BERTRAM A TRSTS,URC L L C,,74800,12/30/2011 01:59:52 PM,12/31/2016 11:59:00 PM,Active,FS,Eating & Drinking,HE_Fail,03/27/2015 01:17:33 PM,37-6-501.11-.12,*,Improper Maintenance of Walls/Ceilings,03/27/2015 01:17:33 PM,Fail,,Main hood sticker is expired from February 2015 / Contact hood cleaning company immediately.,52   Summer ST,Boston,MA,02110,132025,"(42.35445, -71.05881)"
Durgin Park Restaurant,,,Weinstein,Michael,24748,02/13/2012 11:17:17 AM,12/31/2016 11:59:00 PM,Active,FS,Eating & Drinking,HE_Pass,01/02/2013 12:55:20 PM,15-4-202.16,*,Non-Food Contact Surfaces,01/02/2013 12:55:20 PM,Pass,2013-01-02 15:40:21,Resurface wooden counter top,300  Faneuil Hall Marketplace,Boston,MA,02109,341035,"(42.360036, -71.056253)"
ODYSSEY CRUISES,,MASS BAY LINES INC. FREEDOM,ODYSSEY CRUISES PREMIER YACHTS INC.,,24485,02/01/2012 03:02:49 PM,12/31/2016 11:59:00 PM,Active,FS,Eating & Drinking,HE_Fail,06/02/2011 11:01:57 AM,31-5-204/05.11,***,Location  Accessible,06/02/2011 11:01:57 AM,Fail,,Multiple handsinks used as dump sinks.Discontinue practice and provide proper setups.Discussed with chef.,60  Rowes Wh,Boston,MA,02110,156112,"(42.356532, -71.050251)"
SIMCO'S INC.,,RUSSO SALVATORE G,DENISE FOTOPOULOS,,21265,03/01/2012 03:54:24 PM,12/31/2016 11:59:00 PM,Active,FT,Eating & Drinking w/ Take Out,HE_Pass,01/18/2013 11:49:07 AM,16-4-501.11/.15,*,Dishwashng Facilities,01/18/2013 11:49:07 AM,Pass,2013-01-22 08:38:34,Only 1 plug at ware washing sink  provide missing  plugs.,679   Canterbury ST,Roslindale,MA,02131,25482,"(42.28542, -71.11)"
West Napoli Pizza,,VRATTOS SOCRATES TS,BARDHI,SOKOL,21409,06/06/2012 03:38:02 PM,12/31/2016 11:59:00 PM,Active,FT,Eating & Drinking w/ Take Out,HE_Fail,06/14/2010 11:20:39 AM,29-5-201/02.11,*,Installed and Maintained,06/14/2010 11:20:39 AM,Fail,,The hot water faucet at the handsink is broken.  Repair.,1946  Centre St,West Roxbury,MA,02132,27764,"(42.28358, -71.15676)"
DAYIB CAFE,,ABDULLAH FARAH ANSHUR,ABDULLAH FARAH ANSHUR,,22700,02/13/2012 12:56:03 PM,12/31/2016 11:59:00 PM,Active,FT,Eating & Drinking w/ Take Out,HE_Fail,10/22/2012 10:51:11 AM,21-3-304.14,*,Wiping Cloths  Clean  Sanitize,10/22/2012 10:51:11 AM,Fail,,properly store all wiping cloths in a sanitizing solution,722   Shawmut AV,Roxbury,MA,02119,157649,"(42.332783, -71.083221)"
Currito Burrito,,,Park,Chan,28764,01/05/2012 12:58:58 PM,12/31/2016 11:59:00 PM,Active,FT,Eating & Drinking w/ Take Out,HE_Pass,03/08/2011 01:32:21 PM,,,,,,,,300   LOGAN AIRPORT TRMNL C,EAST BOSTON,MA,02128,,
ODYSSEY CRUISES,,MASS BAY LINES INC. FREEDOM,ODYSSEY CRUISES PREMIER YACHTS INC.,,24485,02/01/2012 03:02:49 PM,12/31/2016 11:59:00 PM,Active,FS,Eating & Drinking,HE_Fail,06/08/2012 12:01:22 PM,20-4-703.11,***,Food Contact Surfaces Clean,06/08/2012 12:01:22 PM,Pass,2012-06-11 08:38:01,Main dishwasher tested at 0ppm and a bar glasswasher not functioning properly.Repair.,60  Rowes Wh,Boston,MA,02110,156112,"(42.356532, -71.050251)"
Durgin Park Restaurant,,,Weinstein,Michael,24748,02/13/2012 11:17:17 AM,12/31/2016 11:59:00 PM,Active,FS,Eating & Drinking,HE_Fail,08/02/2013 10:06:29 AM,02-3-602.11-.12/3-302.12,*,Food Container Labels,08/02/2013 10:06:29 AM,Fail,,3rd floor -label bulk food containers.,300  Faneuil Hall Marketplace,Boston,MA,02109,341035,"(42.360036, -71.056253)"
PATS PIZZA,,LOWER MILLS RESTAURANT,LOWER MILLS RESTAURANT,GROUP LLC,24124,12/19/2011 11:01:23 AM,12/31/2016 11:59:00 PM,Active,FT,Eating & Drinking w/ Take Out,HE_Fail,01/31/2014 01:11:15 PM,29-5-201/02.11,*,Installed and Maintained,01/31/2014 01:11:15 PM,Fail,,Hot water faucet of the 3 bay sink in the basement area appears to be leaking. Repair.,2254   Dorchester AV,Dorchester,MA,02124,156905,"(42.273506, -71.067541)"
BUKHARA INDIAN BISTRO,,BRUCE THERESA,AMRIK SINGH PABLA,,21016,01/12/2012 03:33:18 PM,12/31/2016 11:59:00 PM,Active,FS,Eating & Drinking,HE_Fail,09/03/2009 11:23:54 AM,41-7-101.11,***,Toxic Items: Original Container,09/04/2009 10:43:19 AM,Fail,,Murphies wood cleaner connected directly to automatic soap dispenser at 2 bay sink in basement.  Discontinue and use appropriate cleaner for 2 bay sink.,701   Centre ST,Jamaica Plain,MA,02130,28172,"(42.31159, -71.11461)"
Cafeteria Y Pizzaria Mi Columbia,,,E.B. Crown Fried Chicken & Pizza Inc.,,124996,01/09/2014 01:41:04 PM,12/31/2016 11:59:00 PM,Active,FT,Eating & Drinking w/ Take Out,HE_Pass,05/19/2015 11:57:41 AM,21-3-304.14,*,Wiping Cloths  Clean  Sanitize,05/19/2015 11:57:41 AM,Pass,2015-05-20 08:09:36,Keep wiping cloths in sanitizer.,50   Maverick SQ,East Boston,MA,02128,92897,"(42.37017, -71.03868)"
UNION OYSTER HOUSE,,MILANO JOSEPH A JR TRST,MILANO,JOSEPH A.,19089,12/14/2011 02:11:17 PM,12/31/2016 11:59:00 PM,Active,FS,Eating & Drinking,HE_Pass,08/31/2015 11:32:02 AM,08-3-305-307.11,*,Food Protection,08/31/2015 11:32:02 AM,Pass,2015-09-01 08:33:03,Store raw shell eggs under all ready to eat foods in the walk-in units Shellfish stored above sliced cherry tomatoes in one of the sandwich units on the cooking line -  relocate and store as discussed SEA GRILL BAR: keep all ready to eat foods stored above all raw poultry  seafood and beef,41  Union St,Boston,MA,02108,139293,"(42.36127, -71.05688)"
Aramark at Houghton Mifflin,,TWO TWENTY TWO BERKELEY,ARAMARK,C/O JARED LESSARD,24693,02/15/2012 01:55:00 PM,12/31/2016 11:59:00 PM,Active,FS,Eating & Drinking,HE_Fail,07/14/2008 10:19:48 AM,03-3-501.16(A),***,Cold Holding,07/14/2008 03:15:55 PM,Fail,,Deli turkey piled up over lip of container at open top refridge at 44F.Roast beef at 46-48F.Yellow american cheese at 50F(all product piled high over lip of container).,222   Berkeley ST,Boston,MA,02116,15007,"(42.35084, -71.07311)"
Peggy O'Neil's Pub & Grille,,LIMERICK CO INC,LIMERICK CO INC,,19097,12/13/2011 03:15:33 PM,12/31/2016 11:59:00 PM,Active,FS,Eating & Drinking,HE_Pass,10/13/2010 01:49:24 PM,37-6-501.11-.12,*,Improper Maintenance of Walls/Ceilings,10/13/2010 01:49:24 PM,Pass,2010-10-14 08:05:13,Filters above stove top and grill with heavy grease build-up. Clean to remove. Hood and vent company scheduled to do cleaning. PIC stated she would fax all documentation to the Health Department.,1310   DORCHESTER  AV,DORCHESTER,MA,02122,,
Aramark at Houghton Mifflin,,TWO TWENTY TWO BERKELEY,ARAMARK,C/O JARED LESSARD,24693,02/15/2012 01:55:00 PM,12/31/2016 11:59:00 PM,Active,FS,Eating & Drinking,HE_Fail,01/09/2012 10:42:23 AM,37-6-501.11-.12,*,Improper Maintenance of Walls/Ceilings,01/09/2012 10:42:23 AM,Fail,,1) vents above ovens with heavy dust build up  clean to remove 2) vent above pannini's with dust and grease build up  clean to remove 3) walls and light behind panini's with grease build up  clean to remove,222   Berkeley ST,Boston,MA,02116,15007,"(42.35084, -71.07311)"
J J Foley's Cafe,,FOLEY JEREMIAH,J J Foley's Cafe,Inc.,27092,01/31/2012 06:21:48 PM,12/31/2016 11:59:00 PM,Active,FS,Eating & Drinking,HE_Pass,03/24/2011 11:08:09 AM,15-4-202.16,*,Non-Food Contact Surfaces,03/24/2011 11:08:09 AM,Pass,2011-03-25 07:51:12,Bar- Provide tonic hose holder drain hoses,117   EAST BERKELEY,BOSTON,MA,02118,,
UNION OYSTER HOUSE,,MILANO JOSEPH A JR TRST,MILANO,JOSEPH A.,19089,12/14/2011 02:11:17 PM,12/31/2016 11:59:00 PM,Active,FS,Eating & Drinking,HE_Fail,12/18/2012 11:07:29 AM,14-4-202.11,*,Food Contact Surfaces Design,12/18/2012 11:07:29 AM,Fail,,Oyster bar- Repair lobster scale and basket.,41  Union St,Boston,MA,02108,139293,"(42.36127, -71.05688)"
Dunkin Donuts,,ONE HUNDRED CAMBRIDGE STREET,DN Donuts Inc.,Danny Haddad,26507,01/11/2012 11:22:31 AM,12/31/2016 11:59:00 PM,Active,FT,Eating & Drinking w/ Take Out,HE_Pass,08/31/2012 01:29:25 PM,08-3-305-307.11,*,Food Protection,08/31/2012 01:29:25 PM,Pass,2012-08-31 15:45:51,Open boxes of coffee not stoned in food grade covered containers.,100   Cambridge ST,Boston,MA,02114,25222,"(42.360584, -71.062109)"
No.  7 RESTAURANT,,,HUANG FAMILY INC.,REN XIANGHUANG  PRES.,25414,02/08/2012 04:32:36 PM,12/31/2016 11:59:00 PM,Active,FT,Eating & Drinking w/ Take Out,HE_Fail,10/26/2015 11:49:04 AM,37-6-501.11-.12,*,Improper Maintenance of Walls/Ceilings,10/26/2015 11:49:04 AM,Fail,,Clean walls and ceiling in walk in refrigerator of build up from fan.  Clean fan cover in walk in refrigerator of grime build up.,225   Grove ST,West Roxbury,MA,02132,156965,"(42.261873, -71.15741)"
CANTON HOUSE,,,LI TING LI PRESIDENT,,23526,02/01/2012 03:06:08 PM,12/31/2016 11:59:00 PM,Active,FT,Eating & Drinking w/ Take Out,HE_Fail,01/27/2014 02:12:48 PM,02-3-602.11-.12/3-302.12,*,Food Container Labels,01/27/2014 02:12:48 PM,Fail,,Label all bulk food containers with ingredient name.,6  Hancock St,Dorchester,MA,02125,158300,"(42.315595, -71.065919)"
The Upper Crust,,,Snow,John,140027,03/02/2015 08:46:12 AM,12/31/2016 11:59:00 PM,Active,FT,Eating & Drinking w/ Take Out,HE_Hearing,05/18/2015 02:32:05 PM,23-4-602.13,*,Non-Food Contact Surfaces Clean,05/18/2015 02:32:05 PM,Fail,,Exterior and interior of several refrigerator and freezer units (on both levels) soiled. Clean properly.,20   Charles ST,Boston,MA,02114,163154,"(42.356834, -71.07005)"
Uno Chicago Grill,,NICOLE E. ADAMS,NICOLE E. ADAMS,,18961,01/09/2012 03:57:09 PM,12/31/2016 11:59:00 PM,Active,FT,Eating & Drinking w/ Take Out,HE_Fail,10/05/2015 02:36:15 PM,14-4-202.11,*,Food Contact Surfaces Design,10/05/2015 02:36:15 PM,Fail,,Plastic cup used to dispense flour. Use handled utensils only.,1   Brookline AV,Boston,MA,02215,157196,"(42.34842, -71.097471)"
Uno Chicago Grill,,NICOLE E. ADAMS,NICOLE E. ADAMS,,18961,01/09/2012 03:57:09 PM,12/31/2016 11:59:00 PM,Active,FT,Eating & Drinking w/ Take Out,HE_Fail,12/02/2013 11:58:48 AM,15-4-202.16,*,Non-Food Contact Surfaces,12/02/2013 11:58:48 AM,Fail,,Replace missing air curtains in black box walk in.,1   Brookline AV,Boston,MA,02215,157196,"(42.34842, -71.097471)"
MIAMI RESTAURANT,,,JUAN A. REYES,,21019,01/05/2012 10:56:50 AM,12/31/2016 11:59:00 PM,Active,FS,Eating & Drinking,HE_Hearing,06/24/2009 11:01:38 AM,15-4-202.16,*,Non-Food Contact Surfaces,06/29/2009 11:42:23 AM,Fail,,No divider between hand sink & clean equipment.,381   Centre ST,Jamaica Plain,MA,02130,158224,"(42.322337, -71.10927)"
No.  7 RESTAURANT,,,HUANG FAMILY INC.,REN XIANGHUANG  PRES.,25414,02/08/2012 04:32:36 PM,12/31/2016 11:59:00 PM,Active,FT,Eating & Drinking w/ Take Out,HE_Pass,05/01/2009 02:09:19 PM,05-4-302.12,*,Food Thermometers Provided,05/01/2009 03:27:27 PM,Pass,2009-05-01 15:27:27,Provide working  visible thermometer in unit.,225   Grove ST,West Roxbury,MA,02132,156965,"(42.261873, -71.15741)"
PHO 2000,,SCHIAVO BRUNO A TS,Dung Ngu,,76202,04/06/2012 12:14:16 PM,12/31/2016 11:59:00 PM,Active,FS,Eating & Drinking,HE_Filed,11/13/2012 01:49:35 PM,37-6-501.11-.12,*,Improper Maintenance of Walls/Ceilings,11/13/2012 01:49:35 PM,Pass,2012-11-13 15:42:20,Walls behind  slicer and upright freezer soile. Clean,198   Adams ST,Dorchester,MA,02122,606,"(42.30224, -71.06)"
DRAGON CHEF CHINESE REST.,,,RU BANG CHEN PRES.,,21347,02/06/2012 10:55:13 AM,12/31/2016 11:59:00 PM,Active,FT,Eating & Drinking w/ Take Out,HE_Filed,10/21/2008 12:20:59 PM,37-6-501.11-.12,*,Improper Maintenance of Walls/Ceilings,10/21/2008 03:35:24 PM,Pass,2008-10-21 15:35:24,1) hood with greas build up  clean to remove,411  Washington St,Brighton,MA,02135,156051,"(42.349266, -71.15532)"
SIMCO'S INC.,,RUSSO SALVATORE G,DENISE FOTOPOULOS,,21265,03/01/2012 03:54:24 PM,12/31/2016 11:59:00 PM,Active,FT,Eating & Drinking w/ Take Out,HE_FailExt,11/09/2015 02:48:29 PM,32-6-301.11-02.11,*,Hand Cleaner  Drying  Tissue Signage,11/09/2015 02:48:29 PM,Pass,2015-11-10 08:33:27,No cover receptacle in restroom .Provide,679   Canterbury ST,Roslindale,MA,02131,25482,"(42.28542, -71.11)"
ZESTO'S PIZZA,,FOUR 60-468 CENTRE STREET,K & M Pizza Inc.,,75590,12/12/2011 12:47:41 PM,12/31/2016 11:59:00 PM,Active,FT,Eating & Drinking w/ Take Out,HE_Filed,03/27/2015 02:34:34 PM,32-6-301.11-02.11,*,Hand Cleaner  Drying  Tissue Signage,03/27/2015 02:34:34 PM,Pass,2015-03-27 15:20:24,No soap hand hand snk in basement prep area.,460   Centre ST,Jamaica Plain,MA,02130,28061,"(42.31935, -71.11154)"
Durgin Park Restaurant,,,Weinstein,Michael,24748,02/13/2012 11:17:17 AM,12/31/2016 11:59:00 PM,Active,FS,Eating & Drinking,HE_Fail,08/30/2012 10:10:51 AM,17-4-302.14,*,Test Kit Provided,08/30/2012 10:10:51 AM,Fail,,No thermometer in walk in refrig.,300  Faneuil Hall Marketplace,Boston,MA,02109,341035,"(42.360036, -71.056253)"
Peggy O'Neil's Pub & Grille,,LIMERICK CO INC,LIMERICK CO INC,,19097,12/13/2011 03:15:33 PM,12/31/2016 11:59:00 PM,Active,FS,Eating & Drinking,HE_Pass,05/15/2009 01:50:43 PM,32-6-301.11-02.11,*,Hand Cleaner  Drying  Tissue Signage,05/18/2009 08:10:37 AM,Pass,2009-05-18 08:10:37,Liquid dishwashing soap being used for hands. Discontinue and use proper hand washing soap.,1310   DORCHESTER  AV,DORCHESTER,MA,02122,,
Yamato II,,,Jiang,Ming,137896,06/30/2015 08:46:46 AM,12/31/2016 11:59:00 PM,Active,FS,Eating & Drinking,HE_Fail,11/17/2015 12:21:25 PM,32-6-301.11-02.11,*,Hand Cleaner  Drying  Tissue Signage,11/17/2015 12:21:25 PM,Fail,,Hand Washing Sink near three bay sink without proper signage. Provide.,545  Boylston St,Boston,MA,02116,193086,"(42.35081, -71.07581)"
MCKENNA'S CAFE,,KENNETH OSHEROW  PRES.,KENNETH OSHEROW PRES.,,23628,12/28/2011 09:11:33 AM,12/31/2016 11:59:00 PM,Active,FS,Eating & Drinking,HE_Pass,02/13/2012 12:52:52 PM,37-6-501.11-.12,*,Improper Maintenance of Walls/Ceilings,02/13/2012 12:52:52 PM,Pass,2012-02-13 14:59:50,Hotline hood sticker indicates that it was serviced in 9-2011 and expired in 12-2011.Please provide documentation that it is up to date.,109   Savin Hill AV,Dorchester,MA,02125,156864,"(42.311515, -71.05382)"
Durgin Park Restaurant,,,Weinstein,Michael,24748,02/13/2012 11:17:17 AM,12/31/2016 11:59:00 PM,Active,FS,Eating & Drinking,HE_Fail,08/24/2010 11:20:31 AM,32-6-301.11-02.11,*,Hand Cleaner  Drying  Tissue Signage,08/24/2010 11:20:31 AM,Fail,,Provide paper towels for hand sink in prep area,300  Faneuil Hall Marketplace,Boston,MA,02109,341035,"(42.360036, -71.056253)"
WINDY CITY AT ADAMS VILLAGE,,BAYTURK MUZAFFER,BAYTURK MUZAFFER,,19800,02/13/2012 10:40:46 AM,12/31/2016 11:59:00 PM,Active,FT,Eating & Drinking w/ Take Out,HE_Fail,02/08/2010 11:58:24 AM,02-3-602.11-.12/3-302.12,*,Food Container Labels,02/08/2010 11:58:24 AM,Fail,,,516   Gallivan BL,Dorchester,MA,02124,156552,"(42.282928, -71.055559)"
Langham Hotel,,CHRISTINE GILPIN  CONTROL LER,CHRISTINE GILPIN CONTROL,LER,23003,01/11/2012 08:50:36 AM,12/31/2016 11:59:00 PM,Active,FS,Eating & Drinking,HE_Fail,09/26/2008 11:59:23 AM,37-6-201.11,*,Walls/Ceilings Designed Constructed Installed,09/29/2008 08:55:41 AM,Fail,,Replace out of place ceiling tile in employee dining area  Replace damaged fan motor Covers inside  pastry freezer clean fan motor covers inside  pastry walk in,250   Franklin ST,Boston,MA,02110,157806,"(42.35663, -71.054279)"
Masona Grill,,JOF REALTY LLC,Masona Inc.,,28939,01/18/2012 05:50:35 PM,12/31/2016 11:59:00 PM,Active,FS,Eating & Drinking,HE_Fail,09/19/2013 05:45:36 PM,20-4-703.11,***,Food Contact Surfaces Clean,09/19/2013 05:45:36 PM,Fail,,provide institutional sanitizer,2  Corey St,West Roxbury,MA,02132,42766,"(42.28468, -71.15523)"
UNION OYSTER HOUSE,,MILANO JOSEPH A JR TRST,MILANO,JOSEPH A.,19089,12/14/2011 02:11:17 PM,12/31/2016 11:59:00 PM,Active,FS,Eating & Drinking,HE_Fail,12/18/2012 11:07:29 AM,15-4-202.16,*,Non-Food Contact Surfaces,12/18/2012 11:07:29 AM,Fail,,Main kitchen (salad reach in) remove excess water.,41  Union St,Boston,MA,02108,139293,"(42.36127, -71.05688)"
Durgin Park Restaurant,,,Weinstein,Michael,24748,02/13/2012 11:17:17 AM,12/31/2016 11:59:00 PM,Active,FS,Eating & Drinking,HE_Filed,11/07/2014 01:22:31 PM,36-6-201.11,*,Floors Designed Constructed Installed,11/07/2014 01:22:31 PM,Fail,,floor of Ladies room with missing tiles and in disrepair  repair,300  Faneuil Hall Marketplace,Boston,MA,02109,341035,"(42.360036, -71.056253)"
Fenmore American Bistro,,,Buckminster Restaurant Group L L C,,86937,07/29/2013 08:50:28 AM,12/31/2016 11:59:00 PM,Active,FS,Eating & Drinking,HE_Pass,06/12/2015 01:22:58 PM,22-4-601/602.11,**,Food Contact Surfaces Clean,06/12/2015 01:22:58 PM,Pass,2015-06-12 15:48:30,Knife store soiled in the clean knife box at the cooking line. Clean and sanitize properly. Deli slicer with dried up food debris. Clean and sanitize properly. Can Opener with dried up food debris. Clean and sanitize properly.,645   Beacon ST,Boston,MA,02215,161922,"(42.348363, -71.097697)"
UNION OYSTER HOUSE,,MILANO JOSEPH A JR TRST,MILANO,JOSEPH A.,19089,12/14/2011 02:11:17 PM,12/31/2016 11:59:00 PM,Active,FS,Eating & Drinking,HE_Pass,06/01/2011 12:07:56 PM,32-6-501.11-.12/6-202.14,*,Toilet Enclosed Clean,06/01/2011 12:07:56 PM,Pass,2011-06-01 15:17:47,Provide proper self closing mechanism for employee restroom door upstairs.,41  Union St,Boston,MA,02108,139293,"(42.36127, -71.05688)"
New York Fried Chicken (1251 River St.),,DANA MARSHALL A,Shah,Raiz Ali,29713,12/08/2011 11:14:53 AM,12/31/2016 11:59:00 PM,Active,FT,Eating & Drinking w/ Take Out,HE_Filed,05/05/2008 11:22:14 AM,38-6-202.11,*,Fixture's not properly shielded,05/05/2008 03:36:24 PM,Pass,2008-05-05 15:36:24,replace missing bulb.,1251   River ST,Hyde Park,MA,02136,116347,"(42.25605, -71.12345)"
Sapient Corp. Aramark Coffee Bar,,ONE-31 DARTMOUTH STREET LLC,Aramark Corp.,,90488,01/06/2014 01:23:00 PM,12/31/2016 11:59:00 PM,Active,FS,Eating & Drinking,HE_Hearing,07/02/2015 12:22:15 PM,04-3-501.15/4-301.11,*,Inadequate Facilities/Cooling Methods,07/02/2015 12:22:15 PM,Fail,,repair display case to operate at 41 degrees or below,131  Dartmouth St,Boston,MA,02116,46311,"(42.34682, -71.07543)"
WINDY CITY AT ADAMS VILLAGE,,BAYTURK MUZAFFER,BAYTURK MUZAFFER,,19800,02/13/2012 10:40:46 AM,12/31/2016 11:59:00 PM,Active,FT,Eating & Drinking w/ Take Out,HE_Fail,10/14/2011 11:24:05 AM,36-6-501.11-.12,*,Improper Maintenance of Floors,10/14/2011 11:24:05 AM,Fail,,clean floor under and inbetween equipment....,516   Gallivan BL,Dorchester,MA,02124,156552,"(42.282928, -71.055559)"
M.J. O'CONNOR'S,,O'CONNOR,O'CONNOR,AUSTIN,21420,02/15/2012 01:48:07 PM,12/31/2016 11:59:00 PM,Active,FS,Eating & Drinking,HE_Pass,12/29/2015 12:06:52 PM,22-4-601/602.11,**,Food Contact Surfaces Clean,12/29/2015 12:06:52 PM,Pass,2015-12-29 15:03:13,Ice machine interior soiled. Can opener soiled with dried up debris. Clean and sanitize properly.,27   COLUMBUS  AV,BOSTON,MA,02116,,
Minina's Cafe,,ROSA JOSE TS,Jose Rosa,,74391,02/01/2012 01:10:59 PM,12/31/2016 11:59:00 PM,Active,FT,Eating & Drinking w/ Take Out,HE_Fail,04/01/2013 01:27:22 PM,08-3-302.11/3-304.11,***,Separation  Segregation Cross Contamination,04/01/2013 01:27:22 PM,Fail,,Raw whole eggs stored above cut vegetables in two door refrigerator. PIC corrected.,430   Geneva AV,Dorchester,MA,02122,63341,"(42.30059, -71.06637)"
Mattapan House of Pizza,,FETFATSIDIS SIMON,Isidoros Poulopoulos,,78448,04/04/2012 10:27:46 AM,12/31/2016 11:59:00 PM,Active,FT,Eating & Drinking w/ Take Out,HE_Pass,10/27/2015 11:14:28 AM,15-4-202.16,*,Non-Food Contact Surfaces,10/27/2015 11:14:28 AM,Pass,2015-10-27 15:48:28,Torn gaskets on freeze in kitchen area. Repair or replace.,1621   Blue Hill AV,Mattapan,MA,02126,155684,"(42.268453, -71.094131)"
Burger King,,,MASTORAN CORP.,,19935,12/16/2011 09:50:24 AM,12/31/2016 11:59:00 PM,Active,FT,Eating & Drinking w/ Take Out,HE_Fail,07/10/2008 12:59:48 PM,23-4-602.13,*,Non-Food Contact Surfaces Clean,07/11/2008 08:35:09 AM,Fail,,Clean grease trap,944   Bennington ST,East Boston,MA,02128,155885,"(42.386166, -71.00953)"
New York Fried Chicken (1251 River St.),,DANA MARSHALL A,Shah,Raiz Ali,29713,12/08/2011 11:14:53 AM,12/31/2016 11:59:00 PM,Active,FT,Eating & Drinking w/ Take Out,HE_FailExt,03/09/2015 02:35:36 PM,41-7-207-09.11,***,Medicines  FirstAid Storage,03/09/2015 02:35:36 PM,Pass,2015-03-10 07:56:12,Food products stored with medicines.Remove and store properly,1251   River ST,Hyde Park,MA,02136,116347,"(42.25605, -71.12345)"
Uno Chicago Grill,,SPENCER AARONN D,UNO RESTAURANTS,LLC  LEGAL DEPARTMENT,18958,01/09/2012 03:53:57 PM,12/31/2016 11:59:00 PM,Active,FT,Eating & Drinking w/ Take Out,HE_Fail,04/17/2012 11:41:11 AM,04-3-501.15/4-301.11,*,Inadequate Facilities/Cooling Methods,04/17/2012 11:41:11 AM,Fail,,Do not store foods to be cooled in the single door stand up reach in   cool all foods in walk in.,727   Boylston ST,Boston,MA,02116,18385,"(42.349589, -71.080292)"
Hungry Traveler,,,Jisung Oh,,31164,01/17/2012 04:29:57 PM,12/31/2016 11:59:00 PM,Active,FS,Eating & Drinking,HE_Fail,03/25/2011 10:36:46 AM,M-3-603.11,***,Consumer Advisories,03/25/2011 10:36:46 AM,Fail,,Provide all required Consumer advisories  for new allergy regulations  and provide at least one person trained  in allergy awareness,27   COURT SQ SQ,BOSTON,MA,02108,,
EL PENOL RESTAURANT,,,MIGUEL A. MEDINA BALBIN,,23581,12/29/2011 09:39:51 AM,12/31/2016 11:59:00 PM,Active,FS,Eating & Drinking,HE_Pass,04/02/2009 01:46:14 PM,10-3-304.12,*,Food Utensil Storage,04/02/2009 02:55:53 PM,Pass,2009-04-02 14:55:53,Spatulas being stored in between sinks and wall. Discontinue and store as discussed.,54   Bennington ST,East Boston,MA,02128,156292,"(42.375798, -71.037101)"
Caffe Nero,,COREY DONALD J,Caffe Nero Americas Inc.,Michael Ford-Deegan,134829,01/21/2015 11:26:11 AM,12/31/2016 11:59:00 PM,Active,FS,Eating & Drinking,HE_Fail,06/09/2015 10:27:49 AM,23-4-602.13,*,Non-Food Contact Surfaces Clean,06/09/2015 10:27:49 AM,Fail,,Clean shelves at front counter and basement prep of visible soils.  Clean exterior of all equipment (ice machine  coffee makers  etc.),725   Centre ST,Jamaica Plain,MA,02130,28179,"(42.31117, -71.11475)"
UNION OYSTER HOUSE,,MILANO JOSEPH A JR TRST,MILANO,JOSEPH A.,19089,12/14/2011 02:11:17 PM,12/31/2016 11:59:00 PM,Active,FS,Eating & Drinking,HE_Pass,07/20/2007 01:52:33 PM,15-4-202.16,*,Non-Food Contact Surfaces,07/20/2007 02:24:16 PM,Pass,2007-07-20 14:24:16,,41  Union St,Boston,MA,02108,139293,"(42.36127, -71.05688)"
Brighams & Womens Hospital - Tower Cafe,,AU BON PAIN CO  INC. #508 (LAURA),Langill BWH CFSD,Susan,18544,02/08/2012 05:33:24 PM,12/31/2016 11:59:00 PM,Active,FS,Eating & Drinking,HE_NotReq,,,,,,,,,75   FRANCIS ST,Boston,MA,02115,158148,"(42.336106, -71.10748)"
SUSAN'S DELI OF COURSE,,ALTAF AHMAD,KIM,SUNNY S.,20533,02/09/2012 08:45:25 AM,12/31/2016 11:59:00 PM,Active,FT,Eating & Drinking w/ Take Out,HE_Fail,09/23/2008 10:07:44 AM,41-7-201/04.11,***,Separation/Sanitizer Criteria,09/23/2008 03:21:26 PM,Fail,,Sanitizer buckets are setup with over 200 ppm.  Provide proper sanitizer levels.,695   ATLANTIC  AV,BOSTON,MA,02111,,
EL PENOL RESTAURANT,,,MIGUEL A. MEDINA BALBIN,,23581,12/29/2011 09:39:51 AM,12/31/2016 11:59:00 PM,Active,FS,Eating & Drinking,HE_Pass,04/02/2009 01:46:14 PM,08-3-305-307.11,*,Food Protection,04/02/2009 02:55:53 PM,Pass,2009-04-02 14:55:53,Keep all food protects covered during storage. Elevate food products at least six inches off the floor during storage.,54   Bennington ST,East Boston,MA,02128,156292,"(42.375798, -71.037101)"
ODYSSEY CRUISES,,MASS BAY LINES INC. FREEDOM,ODYSSEY CRUISES PREMIER YACHTS INC.,,24485,02/01/2012 03:02:49 PM,12/31/2016 11:59:00 PM,Active,FS,Eating & Drinking,HE_Pass,07/26/2013 10:50:19 AM,04-3-501.15/4-301.11,*,Inadequate Facilities/Cooling Methods,07/26/2013 10:50:19 AM,Pass,2013-07-29 09:43:46,There is chicken and pork loin cooling in the reach in that is stacked four of five hotel pans high.  There is condensation on the inside of the pans and the chicken is still 50F.  Provide proper cooling to ensure that items drop from 140F to 70F in two hours and then from 70F to 41F in an additional four hours.,60  Rowes Wh,Boston,MA,02110,156112,"(42.356532, -71.050251)"
WINDY CITY AT ADAMS VILLAGE,,BAYTURK MUZAFFER,BAYTURK MUZAFFER,,19800,02/13/2012 10:40:46 AM,12/31/2016 11:59:00 PM,Active,FT,Eating & Drinking w/ Take Out,HE_Filed,11/12/2015 11:06:57 AM,31-5-203.11,***,Number  Convenient,11/12/2015 11:06:57 AM,Pass,2015-11-13 08:39:34,Batering station observed set in the back room with no hand sink available. Either discontinue preapration in the back room or re-install hand sink with splash guards. There is to be no preparation in the back room until hand sink has been installed.,516   Gallivan BL,Dorchester,MA,02124,156552,"(42.282928, -71.055559)"
Beth Isreal Deaconess,,BETH ISRAEL DEACONESS,SODEXO OPERATIONS L L C,,26033,02/13/2012 10:14:16 AM,12/31/2016 11:59:00 PM,Active,FS,Eating & Drinking,HE_Hearing,05/15/2009 12:08:43 PM,29-5-201/02.11,*,Installed and Maintained,05/18/2009 08:38:08 AM,Pass,2009-05-18 08:38:08,Property repair hand sink in tray line area.,330   Brookline AV,Boston,MA,02115,22096,"(42.33982, -71.10568)"
MCKENNA'S CAFE,,KENNETH OSHEROW  PRES.,KENNETH OSHEROW PRES.,,23628,12/28/2011 09:11:33 AM,12/31/2016 11:59:00 PM,Active,FS,Eating & Drinking,HE_Pass,01/03/2013 10:45:45 AM,23-4-602.13,*,Non-Food Contact Surfaces Clean,01/03/2013 10:45:45 AM,Pass,2013-01-03 14:40:32,In kitchen and basement exterior of coffin style freezer soiled. Clean In kitchen and basement exterior of refrigerators soiled. Clean In kitchen exterior of bulk food containers soiled. Clean In basement exterior of ice machine soiled. Clean,109   Savin Hill AV,Dorchester,MA,02125,156864,"(42.311515, -71.05382)"
BUKHARA INDIAN BISTRO,,BRUCE THERESA,AMRIK SINGH PABLA,,21016,01/12/2012 03:33:18 PM,12/31/2016 11:59:00 PM,Active,FS,Eating & Drinking,HE_Pass,05/05/2011 01:49:08 PM,23-4-602.13,*,Non-Food Contact Surfaces Clean,05/05/2011 01:49:08 PM,Pass,2011-05-10 08:21:02,Refrigerators and other surfaces throughout the establishment are soiled with food debris.  Clean to remove.,701   Centre ST,Jamaica Plain,MA,02130,28172,"(42.31159, -71.11461)"
MCKENNA'S CAFE,,KENNETH OSHEROW  PRES.,KENNETH OSHEROW PRES.,,23628,12/28/2011 09:11:33 AM,12/31/2016 11:59:00 PM,Active,FS,Eating & Drinking,HE_Filed,11/12/2010 02:01:34 PM,10-3-304.12,*,Food Utensil Storage,11/12/2010 02:01:34 PM,Pass,2010-11-15 08:13:33,knife being stored in box of bread. Discontinue and store all utensils clean and prtotected.,109   Savin Hill AV,Dorchester,MA,02125,156864,"(42.311515, -71.05382)"
BUKHARA INDIAN BISTRO,,BRUCE THERESA,AMRIK SINGH PABLA,,21016,01/12/2012 03:33:18 PM,12/31/2016 11:59:00 PM,Active,FS,Eating & Drinking,HE_Pass,04/05/2011 01:56:50 PM,23-4-602.13,*,Non-Food Contact Surfaces Clean,04/05/2011 01:56:50 PM,Pass,2011-04-06 08:27:47,The refirgerator handles and kitchen surfaces are soiled.  Clean to remove. The exterior of the dishwasher is soiled.  Clean to remove.,701   Centre ST,Jamaica Plain,MA,02130,28172,"(42.31159, -71.11461)"
A K's Take Out & Delivery,,BOUKOUVALAS ATHENA TS,Saini,Jasbir,28531,12/20/2011 02:29:52 PM,12/31/2016 11:59:00 PM,Active,FT,Eating & Drinking w/ Take Out,HE_Fail,08/26/2008 10:27:17 AM,02-3-602.11-.12/3-302.12,*,Food Container Labels,08/26/2008 03:28:31 PM,Fail,,properly label all bulk food bins,1427   Tremont ST,Mission Hill,MA,02120,136818,"(42.331858, -71.096333)"
Spirit of Boston,,SPIRIT CRUISES LLC,SPIRIT CRUISES LLC,,18739,02/01/2012 02:57:48 PM,12/31/2016 11:59:00 PM,Active,FS,Eating & Drinking,HE_Pass,11/19/2008 10:29:24 AM,22-4-601/602.11,**,Food Contact Surfaces Clean,11/20/2008 08:15:22 AM,Pass,2008-11-20 08:15:22,1) ice machine interior with mold-like build up  clean to remove 2) interior of ice machine with soils  clean to remove,200   SEAPORT LA,BOSTON,MA,02210,,
Hungry Traveler,,,Jisung Oh,,31164,01/17/2012 04:29:57 PM,12/31/2016 11:59:00 PM,Active,FS,Eating & Drinking,HE_Filed,12/30/2013 01:42:24 PM,15-4-202.16,*,Non-Food Contact Surfaces,12/30/2013 01:42:24 PM,Fail,,Remove all contact paper and cardboard from shelving,27   COURT SQ SQ,BOSTON,MA,02108,,
BRIGHAM & WOMENS FAULKNER HOSPITAL,,,Susan Langill,Food Serv. Dir.,18286,02/15/2012 09:39:45 AM,12/31/2016 11:59:00 PM,Active,FS,Eating & Drinking,HE_Fail,03/24/2010 12:38:44 PM,23-4-602.13,*,Non-Food Contact Surfaces Clean,03/24/2010 12:38:44 PM,Fail,,The spaces in between fryolator are soiled. Clean to remove.,1153   CENTRE,JAMAICA PLAIN,MA,02130,,
MCKENNA'S CAFE,,KENNETH OSHEROW  PRES.,KENNETH OSHEROW PRES.,,23628,12/28/2011 09:11:33 AM,12/31/2016 11:59:00 PM,Active,FS,Eating & Drinking,HE_Fail,03/11/2013 11:15:15 AM,03-3-501.16(A),***,Cold Holding,03/11/2013 11:15:15 AM,Fail,,Eggs stored at 70F on cook line. Discontinue and store properly. Individual balsamic vinaigrette dressing store at room temperature. Bulk container of dressing states must be store in refrigerator after opening.,109   Savin Hill AV,Dorchester,MA,02125,156864,"(42.311515, -71.05382)"
Brighams & Womens Hospital - Tower Cafe,,AU BON PAIN CO  INC. #508 (LAURA),Langill BWH CFSD,Susan,18544,02/08/2012 05:33:24 PM,12/31/2016 11:59:00 PM,Active,FS,Eating & Drinking,HE_Pass,08/05/2014 11:14:25 AM,03-3-501.16(A),***,Cold Holding,08/05/2014 11:14:25 AM,Pass,2014-08-05 15:43:55,1)Cooked onions and peppers at 49F on counter. Removed by PIC and discarded 2)Prepared sandwiches 47F  cooked chicken breast 46F Removed by PIC Ensure cold holding temperatures of 41F or below.,75   FRANCIS ST,Boston,MA,02115,158148,"(42.336106, -71.10748)"
Uno Chicago Grill,,NICOLE E. ADAMS,NICOLE E. ADAMS,,19118,01/09/2012 03:55:20 PM,12/31/2016 11:59:00 PM,Active,FT,Eating & Drinking w/ Take Out,HE_Pass,04/25/2008 02:23:44 PM,15-4-202.16,*,Non-Food Contact Surfaces,04/29/2008 08:16:52 AM,Pass,2008-04-29 08:16:52,Back door sweep is showing light. Repair.,270   HUNTINGTON  AV,BOSTON,MA,02125,,
ODYSSEY CRUISES,,MASS BAY LINES INC. FREEDOM,ODYSSEY CRUISES PREMIER YACHTS INC.,,24485,02/01/2012 03:02:49 PM,12/31/2016 11:59:00 PM,Active,FS,Eating & Drinking,HE_Fail,10/13/2010 10:58:01 AM,29-5-201/02.11,*,Installed and Maintained,10/13/2010 10:58:01 AM,Fail,,Hot water at handsinks throughout at 140F.Hotwater at handsinks should be at 110F.,60  Rowes Wh,Boston,MA,02110,156112,"(42.356532, -71.050251)"
A K's Take Out & Delivery,,BOUKOUVALAS ATHENA TS,Saini,Jasbir,28531,12/20/2011 02:29:52 PM,12/31/2016 11:59:00 PM,Active,FT,Eating & Drinking w/ Take Out,HE_Fail,08/26/2008 10:27:17 AM,08-3-305-307.11,*,Food Protection,08/26/2008 03:28:31 PM,Fail,,store all chicken 6 inches off floor store all opened bulk food bags in covered containers 1door glass/remove cardboard boxes for storage,1427   Tremont ST,Mission Hill,MA,02120,136818,"(42.331858, -71.096333)"
PERKIN'S SQ DELI,,ONE 06 DORCHESTER ST LLC,FALLON,JAMES,18439,12/19/2011 10:37:47 AM,12/31/2016 11:59:00 PM,Active,FT,Eating & Drinking w/ Take Out,HE_Fail,01/07/2009 01:33:12 PM,32-6-301.11-02.11,*,Hand Cleaner  Drying  Tissue Signage,01/08/2009 08:19:05 AM,Fail,,1) no soap at hand sink  supply,106   Dorchester ST,South Boston,MA,02127,48839,"(42.3352, -71.04583)"
Uno Due Go,,DRUKER BERTRAM A TRSTS,URC L L C,,74800,12/30/2011 01:59:52 PM,12/31/2016 11:59:00 PM,Active,FS,Eating & Drinking,HE_Fail,09/02/2015 01:23:40 PM,36-6-501.11-.12,*,Improper Maintenance of Floors,09/02/2015 01:23:40 PM,Fail,,Floors throughout back prep area and front service area with visible soils / Clean to remove. Include floors under equipment and along the walls.,52   Summer ST,Boston,MA,02110,132025,"(42.35445, -71.05881)"
West Napoli Pizza,,VRATTOS SOCRATES TS,BARDHI,SOKOL,21409,06/06/2012 03:38:02 PM,12/31/2016 11:59:00 PM,Active,FT,Eating & Drinking w/ Take Out,HE_Fail,08/21/2013 02:38:22 PM,02-3-602.11-.12/3-302.12,*,Food Container Labels,08/21/2013 02:38:22 PM,Fail,,,1946  Centre St,West Roxbury,MA,02132,27764,"(42.28358, -71.15676)"
A K's Take Out & Delivery,,BOUKOUVALAS ATHENA TS,Saini,Jasbir,28531,12/20/2011 02:29:52 PM,12/31/2016 11:59:00 PM,Active,FT,Eating & Drinking w/ Take Out,HE_Hearing,02/26/2009 10:47:56 AM,22-4-601/602.11,**,Food Contact Surfaces Clean,02/27/2009 08:17:22 AM,Pass,2009-02-27 08:17:22,clean can opener blade,1427   Tremont ST,Mission Hill,MA,02120,136818,"(42.331858, -71.096333)"
Hilton Boston Back Bay Coffee Bar,,HILTON SYSTEMS INC,PIM TRS Boston,Back Bay LLC,30407,01/09/2012 02:14:52 PM,12/31/2016 11:59:00 PM,Active,FS,Eating & Drinking,HE_Pass,04/22/2014 12:19:35 PM,17-4-204.112/.115,*,Equipment Thermometers,04/22/2014 12:19:35 PM,Pass,2014-04-22 15:25:53,display case/provide accurate internal thermometer,40   Dalton ST,Boston,MA,02115,45831,"(42.34645, -71.08526)"
FLOUR BAKERY & CAFE,,,JOANNE CHANG,,21518,01/26/2012 03:07:20 PM,12/31/2016 11:59:00 PM,Active,FT,Eating & Drinking w/ Take Out,HE_Fail,06/04/2013 10:01:20 AM,21-3-304.14,*,Wiping Cloths  Clean  Sanitize,06/04/2013 10:01:20 AM,Fail,,properly store all wiping cloths in a sanitizing solution,1595   Washington ST,Roxbury,MA,02114,157458,"(42.338323, -71.07488)"
Durgin Park Restaurant,,,Weinstein,Michael,24748,02/13/2012 11:17:17 AM,12/31/2016 11:59:00 PM,Active,FS,Eating & Drinking,HE_Fail,08/30/2012 10:10:51 AM,15-4-202.16,*,Non-Food Contact Surfaces,08/30/2012 10:10:51 AM,Fail,,Remove towels/ cloths from countertops and  shelving.,300  Faneuil Hall Marketplace,Boston,MA,02109,341035,"(42.360036, -71.056253)"
No.  7 RESTAURANT,,,HUANG FAMILY INC.,REN XIANGHUANG  PRES.,25414,02/08/2012 04:32:36 PM,12/31/2016 11:59:00 PM,Active,FT,Eating & Drinking w/ Take Out,HE_Fail,01/10/2013 02:26:41 PM,02-3-602.11-.12/3-302.12,*,Food Container Labels,01/10/2013 02:26:41 PM,Fail,,,225   Grove ST,West Roxbury,MA,02132,156965,"(42.261873, -71.15741)"
CANTON HOUSE,,,LI TING LI PRESIDENT,,23526,02/01/2012 03:06:08 PM,12/31/2016 11:59:00 PM,Active,FT,Eating & Drinking w/ Take Out,HE_FailExt,03/05/2010 02:18:08 PM,12-2-401.11-.12,***,Good Hygienic Practices,03/05/2010 02:18:08 PM,Pass,2010-03-08 08:00:12,Evidence of employee smoking in kitchen. Discontinue.,6  Hancock St,Dorchester,MA,02125,158300,"(42.315595, -71.065919)"
CANTON HOUSE,,,LI TING LI PRESIDENT,,23526,02/01/2012 03:06:08 PM,12/31/2016 11:59:00 PM,Active,FT,Eating & Drinking w/ Take Out,HE_Fail,03/04/2010 01:47:36 PM,15-4-202.16,*,Non-Food Contact Surfaces,03/04/2010 01:47:36 PM,Fail,,2 Lights out in upright refrigerator and freezer. Replace. Cloth being used to cover produce in basement walk-in. Discontinue and use food grade material.,6  Hancock St,Dorchester,MA,02125,158300,"(42.315595, -71.065919)"
FLOUR BAKERY & CAFE,,,JOANNE CHANG,,21518,01/26/2012 03:07:20 PM,12/31/2016 11:59:00 PM,Active,FT,Eating & Drinking w/ Take Out,HE_Fail,01/04/2012 10:06:53 AM,04-3-501.15/4-301.11,*,Inadequate Facilities/Cooling Methods,01/04/2012 10:06:53 AM,Fail,,provide proper cooling methods for roast beef and carmelized onions/roadt beef cooled whole in plastic contianer and onions cooled in covered plastic container,1595   Washington ST,Roxbury,MA,02114,157458,"(42.338323, -71.07488)"
Mehak Restaurant,,DE PASQUALE RONALD,Akram,Mohammad,33626,02/29/2012 12:55:00 PM,12/31/2016 11:59:00 PM,Active,FS,Eating & Drinking,HE_Fail,04/17/2013 02:31:11 PM,21-3-304.14,*,Wiping Cloths  Clean  Sanitize,04/17/2013 02:31:11 PM,Fail,,provide proper storage of wiping cloths. Keep in a solution when not in use.,329   Sumner ST,East Boston,MA,02128,132398,"(42.36711, -71.03607)"
Prime Shoppe,,,Touarsi,Benemar,28544,02/08/2012 04:33:52 PM,12/31/2016 11:59:00 PM,Active,FT,Eating & Drinking w/ Take Out,HE_Fail,10/09/2013 11:46:42 AM,03-3-501.16,***,Hot Holding,10/09/2013 11:46:42 AM,Fail,,Chicken 92 F  106 F  and 131 F Roasted Potatoes 80 F and 114 F Whole turkey 111 F  127 F  and 131 F Hot holding unit 107 F Repeat violation,104-112   Faneuil Hall Mkt,Boston,Ma,02109,,
The Reserve,,CHRISTINE GILPIN  CONTROL LER,Pacific Boston Holdings Corp.,,83565,10/24/2012 10:24:17 AM,12/31/2016 11:59:00 PM,Active,FS,Eating & Drinking,HE_Pass,04/04/2013 02:40:03 PM,17-4-204.112/.115,*,Equipment Thermometers,04/04/2013 02:40:03 PM,Pass,2013-04-04 15:32:28,There are no internal thermometers in the wine and beer coolers that are used for food storage.  Provide.,250   Franklin ST,Boston,MA,02110,157806,"(42.35663, -71.054279)"
CAFE ESPLANADE,,,Pamela Bardhi,,91465,07/02/2013 08:38:33 AM,12/31/2016 11:59:00 PM,Active,FT,Eating & Drinking w/ Take Out,HE_Pass,06/26/2015 10:27:45 AM,15-4-202.16,*,Non-Food Contact Surfaces,06/26/2015 10:27:45 AM,Pass,2015-06-26 15:40:09,Reach in deli unit with internal leak.Repair.PIC states the issue has been addressed. Interior of microwave ove soiled.Maintain clean. Tablecloth  at front outside condiment area soiled.Maintain clean during working hours.,0   David G Mugar WY,Boston,MA,02108,46576,"(42.355594, -71.074207)"
PHO 2000,,SCHIAVO BRUNO A TS,Dung Ngu,,76202,04/06/2012 12:14:16 PM,12/31/2016 11:59:00 PM,Active,FS,Eating & Drinking,HE_Fail,11/09/2012 02:44:40 PM,39-6-304.11,*,Rooms and Equipment Vented,11/09/2012 02:44:40 PM,Fail,,Vent in bathroom not working. Repair,198   Adams ST,Dorchester,MA,02122,606,"(42.30224, -71.06)"
Anshur Restauruant,,REARDON THOMAS B,Anshur,Abdullah F.,31241,02/08/2012 03:13:24 PM,12/31/2016 11:59:00 PM,Active,FT,Eating & Drinking w/ Take Out,HE_Pass,04/06/2010 11:47:05 AM,37-6-501.11-.12,*,Improper Maintenance of Walls/Ceilings,04/06/2010 11:47:05 AM,Pass,2010-04-06 15:37:29,Repair leaky ceiling. Near Rest Room Area,291   Roxbury ST,Roxbury,MA,02119,119179,"(42.33041, -71.0943)"
PHO 2000,,SCHIAVO BRUNO A TS,Dung Ngu,,76202,04/06/2012 12:14:16 PM,12/31/2016 11:59:00 PM,Active,FS,Eating & Drinking,HE_Pass,11/16/2011 10:13:46 AM,22-4-601/602.11,**,Food Contact Surfaces Clean,11/16/2011 10:13:46 AM,Pass,2011-11-17 08:05:18,Cutting board on 2 door cooler directly in front of Wok station visibly soiled and scoared. Clean to remove. American Range grill with heavy grease build-up. Clean to remove.,198   Adams ST,Dorchester,MA,02122,606,"(42.30224, -71.06)"
Grille 705,,SEVEN-05 MASSACHUSETTS AVE,Antreassian,Sarkis,28817,01/31/2012 10:52:38 AM,12/31/2016 11:59:00 PM,Active,FT,Eating & Drinking w/ Take Out,HE_NotReq,,,,,,,,,705    Massachusetts AV,BOSTON,MA,02118,,
Boston Globe Cafeteria,,FLIK INTERNATIONAL CORP.,FLIK INTERNATIONAL CORP.,Compass Group,26254,02/06/2012 08:00:29 AM,12/31/2016 11:59:00 PM,Active,FS,Eating & Drinking,HE_Pass,12/12/2008 10:56:27 AM,32-6-301.11-02.11,*,Hand Cleaner  Drying  Tissue Signage,12/15/2008 08:14:04 AM,Pass,2008-12-15 08:14:04,No paper towels at back hand wash sink. Provide.,135   William T Morrissey BL,Dorchester,MA,02125,156975,"(42.315997, -71.049211)"
BUKHARA INDIAN BISTRO,,BRUCE THERESA,AMRIK SINGH PABLA,,21016,01/12/2012 03:33:18 PM,12/31/2016 11:59:00 PM,Active,FS,Eating & Drinking,HE_Fail,08/25/2010 11:10:22 AM,03-3-501.14,***,Cooling,08/25/2010 11:10:22 AM,Fail,,Items in the walk-in that were cooked yesterday are still 47F.  Provide proper cooling methods and make sure that all items are being cooled properly.  This is especially important because of the amount of items that are cooked  cooled  and reheated.  The certified food manager should review with the staff and supervise cooling procedures.,701   Centre ST,Jamaica Plain,MA,02130,28172,"(42.31159, -71.11461)"
PHO 2000,,SCHIAVO BRUNO A TS,Dung Ngu,,76202,04/06/2012 12:14:16 PM,12/31/2016 11:59:00 PM,Active,FS,Eating & Drinking,HE_Pass,06/14/2013 01:40:03 PM,03-3-501.16(A),***,Cold Holding,06/14/2013 01:40:03 PM,Pass,2013-06-14 15:45:48,Cat fish out hang drying at a temperature between 48F to 52F. PIC stated that she took out fish less than a hour ago. PIC removed and put cat fish back into walk in and will take out only what she can cook. Monitor Bean sprouts at front counter at 74F. PIC voluntary discarded. Sprouts must be keeped at 41F or below.,198   Adams ST,Dorchester,MA,02122,606,"(42.30224, -71.06)"
Momogoose 2,,,Smart Gourmet LLC,Loc Vo,68113,12/14/2011 02:53:19 PM,12/31/2016 11:59:00 PM,Active,MFW,Mobile Food Walk On,HE_Fail,11/13/2014 11:07:50 AM,41-7-102.11,***,Labeled  Common Name,11/13/2014 11:07:50 AM,Fail,,Label all spay bottles containing toxic chemicals.,1   Citywide ST,Boston,MA,02128,0,
SUSAN'S DELI OF COURSE,,ALTAF AHMAD,KIM,SUNNY S.,20533,02/09/2012 08:45:25 AM,12/31/2016 11:59:00 PM,Active,FT,Eating & Drinking w/ Take Out,HE_Pass,08/06/2015 12:37:56 PM,14-4-202.11,*,Food Contact Surfaces Design,08/06/2015 12:37:56 PM,Pass,2015-08-07 08:39:44,At the service area  replace worn and heavily worn and stained cutting board on the cold unit in the kitchen,695   ATLANTIC  AV,BOSTON,MA,02111,,
The Gallows,,,Henry's Delicatessen L L C,,68121,01/17/2012 04:30:41 PM,12/31/2016 11:59:00 PM,Active,FS,Eating & Drinking,HE_Pass,08/15/2014 10:28:50 AM,02-3-602.11-.12/3-302.12,*,Food Container Labels,08/15/2014 10:28:50 AM,Pass,2014-08-19 08:25:12,Bulk food bin labels are worn / Replace.,1395   Washington ST,Roxbury,MA,02118,171075,"(42.34137, -71.070211)"
Currito Burrito,,,Park,Chan,28764,01/05/2012 12:58:58 PM,12/31/2016 11:59:00 PM,Active,FT,Eating & Drinking w/ Take Out,HE_Pass,08/07/2009 12:06:41 PM,02-3-602.11-.12/3-302.12,*,Food Container Labels,08/07/2009 03:46:39 PM,Pass,2009-08-07 15:46:39,Label all bulk food containers to identify product properly,300   LOGAN AIRPORT TRMNL C,EAST BOSTON,MA,02128,,
Nicholas Sub & Pizza Shop,,NICHOLAS MARKOPOULOS,Kourtelidis,Nicholas,33364,01/17/2012 03:37:47 PM,12/31/2016 11:59:00 PM,Active,FT,Eating & Drinking w/ Take Out,HE_Fail,05/17/2012 01:30:54 PM,32-6-301.11-02.11,*,Hand Cleaner  Drying  Tissue Signage,05/17/2012 01:30:54 PM,Fail,,Post hand wash signages at handsink.,600   Hyde Park AV,Roslindale,MA,02131,156517,"(42.280027, -71.118658)"
Grille 705,,SEVEN-05 MASSACHUSETTS AVE,Antreassian,Sarkis,28817,01/31/2012 10:52:38 AM,12/31/2016 11:59:00 PM,Active,FT,Eating & Drinking w/ Take Out,HE_Fail,12/16/2008 11:54:54 AM,08-3-302.11/3-304.11,***,Separation  Segregation Cross Contamination,12/16/2008 03:13:07 PM,Fail,,properly store all raw foods in walk in,705    Massachusetts AV,BOSTON,MA,02118,,
Durgin Park Restaurant,,,Weinstein,Michael,24748,02/13/2012 11:17:17 AM,12/31/2016 11:59:00 PM,Active,FS,Eating & Drinking,HE_Hearing,09/07/2012 11:14:11 AM,17-4-204.112/.115,*,Equipment Thermometers,09/07/2012 11:14:11 AM,Pass,2012-09-07 15:16:06,2 door refrig. Broken thermometer,300  Faneuil Hall Marketplace,Boston,MA,02109,341035,"(42.360036, -71.056253)"
CANTON HOUSE,,,LI TING LI PRESIDENT,,23526,02/01/2012 03:06:08 PM,12/31/2016 11:59:00 PM,Active,FT,Eating & Drinking w/ Take Out,HE_Fail,04/15/2015 03:00:02 PM,08-3-305-307.11,*,Food Protection,04/15/2015 03:00:02 PM,Fail,,Discontinue stacking food containers on top of each other with out covers to avoid cross contaminatioin.,6  Hancock St,Dorchester,MA,02125,158300,"(42.315595, -71.065919)"
Durgin Park Restaurant,,,Weinstein,Michael,24748,02/13/2012 11:17:17 AM,12/31/2016 11:59:00 PM,Active,FS,Eating & Drinking,HE_Hearing,09/07/2012 11:14:11 AM,08-3-305-307.11,*,Food Protection,09/07/2012 11:14:11 AM,Pass,2012-09-07 15:16:06,Tubing in contact with customer ice,300  Faneuil Hall Marketplace,Boston,MA,02109,341035,"(42.360036, -71.056253)"
Barcelona Restaurant,,,Phorzhiemer,Andy,126674,12/11/2014 09:01:26 AM,12/31/2016 11:59:00 PM,Active,FS,Eating & Drinking,HE_Fail,09/30/2015 08:26:05 PM,23-4-602.13,*,Non-Food Contact Surfaces Clean,09/30/2015 08:26:05 PM,Fail,,Interior of reach in unit soiled.Maintain clean,525   Tremont ST,Boston,MA,02116,344153,"(42.344859, -71.070789)"
Mehak Restaurant,,DE PASQUALE RONALD,Akram,Mohammad,33626,02/29/2012 12:55:00 PM,12/31/2016 11:59:00 PM,Active,FS,Eating & Drinking,HE_Fail,06/09/2011 01:06:42 PM,M-2-102.11,***,PIC Knowledge,06/09/2011 01:06:42 PM,Fail,,No food allergen awareness certification  - Final cooking temperature of chicken unknown,329   Sumner ST,East Boston,MA,02128,132398,"(42.36711, -71.03607)"
Durgin Park Restaurant,,,Weinstein,Michael,24748,02/13/2012 11:17:17 AM,12/31/2016 11:59:00 PM,Active,FS,Eating & Drinking,HE_Fail,12/15/2011 12:48:58 PM,08-3-305-307.11,*,Food Protection,12/15/2011 12:48:58 PM,Fail,,provide proper scoops for dispensing bulk foods. Use scoops with a handle.,300  Faneuil Hall Marketplace,Boston,MA,02109,341035,"(42.360036, -71.056253)"
PATS PIZZA,,LOWER MILLS RESTAURANT,LOWER MILLS RESTAURANT,GROUP LLC,24124,12/19/2011 11:01:23 AM,12/31/2016 11:59:00 PM,Active,FT,Eating & Drinking w/ Take Out,HE_Fail,04/27/2015 11:26:47 AM,32-6-301.11-02.11,*,Hand Cleaner  Drying  Tissue Signage,04/27/2015 11:26:47 AM,Fail,,No paper towels at hand sink in the basement preparation area. Provide.,2254   Dorchester AV,Dorchester,MA,02124,156905,"(42.273506, -71.067541)"
Uno Due Go,,DRUKER BERTRAM A TRSTS,URC L L C,,74800,12/30/2011 01:59:52 PM,12/31/2016 11:59:00 PM,Active,FS,Eating & Drinking,HE_Pass,10/16/2012 02:17:34 PM,15-4-202.16,*,Non-Food Contact Surfaces,10/16/2012 02:17:34 PM,Pass,2012-10-16 15:41:52,Products are stored on flipped pepsi containers.  Provide food grade shelving. The doors to the salad refrigerator are broken.  Repair or replace. The plastic on the ice machine is cracked.  Repair or replace.,52   Summer ST,Boston,MA,02110,132025,"(42.35445, -71.05881)"
MIAMI RESTAURANT,,,JUAN A. REYES,,21019,01/05/2012 10:56:50 AM,12/31/2016 11:59:00 PM,Active,FS,Eating & Drinking,HE_Hearing,06/24/2009 11:01:38 AM,08-3-305-307.11,*,Food Protection,06/29/2009 11:42:23 AM,Fail,,All open foods must be stored in food grade containers. Rice  etc.,381   Centre ST,Jamaica Plain,MA,02130,158224,"(42.322337, -71.10927)"
CANTON HOUSE,,,LI TING LI PRESIDENT,,23526,02/01/2012 03:06:08 PM,12/31/2016 11:59:00 PM,Active,FT,Eating & Drinking w/ Take Out,HE_Fail,08/10/2009 01:52:17 PM,30-5-203.14,**,Cross Connection Back Siphonage  Backflow,08/11/2009 08:02:45 AM,Fail,,No back flow preventor on hose connected under 3 bay sink. Provide.,6  Hancock St,Dorchester,MA,02125,158300,"(42.315595, -71.065919)"
BUKHARA INDIAN BISTRO,,BRUCE THERESA,AMRIK SINGH PABLA,,21016,01/12/2012 03:33:18 PM,12/31/2016 11:59:00 PM,Active,FS,Eating & Drinking,HE_Filed,09/07/2010 01:55:25 PM,23-4-602.13,*,Non-Food Contact Surfaces Clean,09/07/2010 01:55:25 PM,Pass,2010-09-08 08:32:39,The cleanliness of the kitchen has greatly improved since the last inspection but refrigerator handles are still soiled with food buildup and exterior of refrigerators and equipment are soiled.  Clean to remove.,701   Centre ST,Jamaica Plain,MA,02130,28172,"(42.31159, -71.11461)"
Burger King,,,MASTORAN CORP.,,19935,12/16/2011 09:50:24 AM,12/31/2016 11:59:00 PM,Active,FT,Eating & Drinking w/ Take Out,HE_Pass,08/07/2008 01:45:41 PM,23-4-602.13,*,Non-Food Contact Surfaces Clean,08/07/2008 02:54:17 PM,Pass,2008-08-07 14:54:17,Clean grease trap,944   Bennington ST,East Boston,MA,02128,155885,"(42.386166, -71.00953)"
Durgin Park Restaurant,,,Weinstein,Michael,24748,02/13/2012 11:17:17 AM,12/31/2016 11:59:00 PM,Active,FS,Eating & Drinking,HE_Hearing,12/18/2012 11:47:43 AM,15-4-202.16,*,Non-Food Contact Surfaces,12/18/2012 11:47:43 AM,Fail,,Resurface wooden counter top,300  Faneuil Hall Marketplace,Boston,MA,02109,341035,"(42.360036, -71.056253)"
SUSAN'S DELI OF COURSE,,ALTAF AHMAD,KIM,SUNNY S.,20533,02/09/2012 08:45:25 AM,12/31/2016 11:59:00 PM,Active,FT,Eating & Drinking w/ Take Out,HE_Pass,11/07/2011 01:04:28 PM,41-7-201/04.11,***,Separation/Sanitizer Criteria,11/07/2011 01:04:28 PM,Pass,2011-11-08 07:39:50,Do not store chemicals over food products.,695   ATLANTIC  AV,BOSTON,MA,02111,,
LOCONTES RESTAURANT,,,BROOK FARM INC.,,19366,12/29/2011 02:31:28 PM,12/31/2016 11:59:00 PM,Active,FS,Eating & Drinking,HE_Fail,02/13/2013 12:49:35 PM,08-3-305-307.11,*,Food Protection,02/13/2013 12:49:35 PM,Fail,,Cover all open prepared foods in reach ins.,116   Salem ST,Boston,MA,02113,157396,"(42.364676, -71.055658)"
ZESTO'S PIZZA,,FOUR 60-468 CENTRE STREET,K & M Pizza Inc.,,75590,12/12/2011 12:47:41 PM,12/31/2016 11:59:00 PM,Active,FT,Eating & Drinking w/ Take Out,HE_Fail,10/24/2013 12:58:52 PM,12-2-401.11-.12,***,Good Hygienic Practices,10/24/2013 12:58:52 PM,Fail,,remove all common towels throughout establishment...,460   Centre ST,Jamaica Plain,MA,02130,28061,"(42.31935, -71.11154)"
New York Fried Chicken (1251 River St.),,DANA MARSHALL A,Shah,Raiz Ali,29713,12/08/2011 11:14:53 AM,12/31/2016 11:59:00 PM,Active,FT,Eating & Drinking w/ Take Out,HE_Pass,01/16/2014 11:49:23 AM,,,,,,,,1251   River ST,Hyde Park,MA,02136,116347,"(42.25605, -71.12345)"
Anshur Restauruant,,REARDON THOMAS B,Anshur,Abdullah F.,31241,02/08/2012 03:13:24 PM,12/31/2016 11:59:00 PM,Active,FT,Eating & Drinking w/ Take Out,HE_Fail,03/05/2009 11:53:11 AM,22-4-601/602.11,**,Food Contact Surfaces Clean,03/05/2009 03:24:10 PM,Fail,,properly clean sanitize knives between use,291   Roxbury ST,Roxbury,MA,02119,119179,"(42.33041, -71.0943)"
J P House of Pizza,,KAHN LEO TRSTS,Katsinis,George,85008,01/03/2013 03:01:12 PM,12/31/2016 11:59:00 PM,Active,FT,Eating & Drinking w/ Take Out,HE_Fail,01/06/2015 10:45:43 AM,23-4-602.13,*,Non-Food Contact Surfaces Clean,01/06/2015 10:45:43 AM,Fail,,General cleaning of larger freezers in basement. Visibly soiled with dry food and ice build up.,775   Centre ST,Jamaica Plain,MA,02130,28202,"(42.31006, -71.11548)"
Ziti's Express,,LAMBERT GREGORY,Tremont Street Burger L L C,,67693,12/19/2011 01:53:23 PM,12/31/2016 11:59:00 PM,Active,FS,Eating & Drinking,HE_Fail,12/17/2014 12:25:49 PM,16-4-501.11/.15,*,Dishwashng Facilities,12/17/2014 12:25:49 PM,Fail,,Hole in sanitizing bay of 3 bay sink.,140   Tremont ST,Boston,MA,02111,156397,"(42.355646, -71.062559)"
PARKWAY LITTLE LEAGUE STAND,,,PARKWAY LITTLE LEAGUE INC.,,26023,03/19/2012 08:30:43 AM,12/31/2016 11:59:00 PM,Active,FS,Eating & Drinking,HE_Fail,06/04/2012 02:05:25 PM,15-4-202.16,*,Non-Food Contact Surfaces,06/04/2012 02:05:25 PM,Fail,,repair loose door hing as needed....reseal all barewood as needed....,315   BAKER ST,WEST ROXBURY,MA,02132,,
ODYSSEY CRUISES,,MASS BAY LINES INC. FREEDOM,ODYSSEY CRUISES PREMIER YACHTS INC.,,24485,02/01/2012 03:02:49 PM,12/31/2016 11:59:00 PM,Active,FS,Eating & Drinking,HE_Fail,07/12/2013 11:35:16 AM,04-3-501.15/4-301.11,*,Inadequate Facilities/Cooling Methods,07/12/2013 11:35:16 AM,Fail,,There is chicken and pork loin cooling in the reach in that is stacked four of five hotel pans high.  There is condensation on the inside of the pans and the chicken is still 50F.  Provide proper cooling to ensure that items drop from 140F to 70F in two hours and then from 70F to 41F in an additional four hours.,60  Rowes Wh,Boston,MA,02110,156112,"(42.356532, -71.050251)"
Little Caesars,,,A.H.M. Enterprises Inc.,,121632,11/01/2013 10:10:18 AM,12/31/2016 11:59:00 PM,Active,FT,Eating & Drinking w/ Take Out,HE_Filed,01/27/2014 01:36:46 PM,25-4-904.11,*,Single Service Articles Stored Dispensed,01/27/2014 01:36:46 PM,Fail,,store all paper goods off the floor at least 6 inches ( corrected at inspection ),628   American Legion HW,Roslindale,MA,02131,172176,"(42.284551, -71.110244)"
Uno Chicago Grill,,SPENCER AARONN D,UNO RESTAURANTS,LLC  LEGAL DEPARTMENT,18958,01/09/2012 03:53:57 PM,12/31/2016 11:59:00 PM,Active,FT,Eating & Drinking w/ Take Out,HE_Pass,03/26/2015 11:35:16 AM,M-2-103.11,***,PIC Performing Duties,03/26/2015 11:35:16 AM,Pass,2015-03-26 15:36:00,Re-train the staff with regard to hand wash sink usage  cold holding and food storage. Maintain establishment clean and free of  soil and debris.,727   Boylston ST,Boston,MA,02116,18385,"(42.349589, -71.080292)"
Uno Chicago Grill,,SPENCER AARONN D,UNO RESTAURANTS,LLC  LEGAL DEPARTMENT,18958,01/09/2012 03:53:57 PM,12/31/2016 11:59:00 PM,Active,FT,Eating & Drinking w/ Take Out,HE_Pass,04/27/2012 11:53:05 AM,29-5-201/02.11,*,Installed and Maintained,04/27/2012 11:53:05 AM,Pass,2012-04-27 15:21:29,Condensor fan leaking  repair.,727   Boylston ST,Boston,MA,02116,18385,"(42.349589, -71.080292)"
Union Club of Boston,,UNION CLUB OF BOSTON INC,UNION CLUB OF BOSTON INC,,18725,12/13/2011 11:17:44 AM,12/31/2016 11:59:00 PM,Active,FS,Eating & Drinking,HE_Fail,02/26/2009 10:51:10 AM,22-4-601/602.11,**,Food Contact Surfaces Clean,02/27/2009 07:36:04 AM,Fail,,Prep areas -Clean interior of ice machine.,8   Park ST,Boston,MA,02108,107194,"(42.3575, -71.0627)"
Panera Bread,,,Boston Bread LLc,Attn: Lori Engel,26330,01/18/2012 04:43:59 PM,12/31/2016 11:59:00 PM,Active,FS,Eating & Drinking,HE_Fail,09/09/2011 11:34:18 AM,14-4-202.11,*,Food Contact Surfaces Design,09/09/2011 11:34:18 AM,Fail,,Interior/exterior of ice machine dirty.Clean on a regular consistent basis(Recommend 1x monthly).,200   High ST,Boston,Ma,02110,,
Double Tree Club Hotel,,BOSTON REDEVELOPMENT AUTH,C.J. WASHINGTON STREET L.L.C.,,21472,03/09/2012 11:17:16 AM,12/31/2016 11:59:00 PM,Active,FS,Eating & Drinking,HE_Fail,05/09/2014 11:49:48 AM,24-4-904.11AB,*,Improper Storage of Re-usable Utensils,05/09/2014 11:49:48 AM,Fail,,Ice bucket not inverted,821    Washington ST,BOSTON,MA,02116,,
CAFE ESPLANADE,,,Pamela Bardhi,,91465,07/02/2013 08:38:33 AM,12/31/2016 11:59:00 PM,Active,FT,Eating & Drinking w/ Take Out,HE_FailExt,06/27/2013 10:38:18 AM,42-6-501.113/.114,*,Premises Maintained,06/27/2013 10:38:18 AM,Fail,,provide properly enclosed mop sink per plans,0   David G Mugar WY,Boston,MA,02108,46576,"(42.355594, -71.074207)"
Minina's Cafe,,ROSA JOSE TS,Jose Rosa,,74391,02/01/2012 01:10:59 PM,12/31/2016 11:59:00 PM,Active,FT,Eating & Drinking w/ Take Out,HE_Pass,08/15/2014 11:36:04 AM,15-4-202.16,*,Non-Food Contact Surfaces,08/15/2014 11:36:04 AM,Pass,2014-08-15 15:52:10,No vent cover  at refrigerator  provide.,430   Geneva AV,Dorchester,MA,02122,63341,"(42.30059, -71.06637)"
The Kitchen,,POCKEL JEANNE C TRSTS,Herritt,Scott,79722,06/13/2012 10:16:32 AM,12/31/2016 11:59:00 PM,Active,FS,Eating & Drinking,HE_Hearing,04/02/2014 02:16:08 PM,37-6-501.11-.12,*,Improper Maintenance of Walls/Ceilings,04/02/2014 02:16:08 PM,Pass,2014-04-03 09:15:08,Chipped paint on walls  doors etc. Seal all opening in walls.,560   Tremont ST,Roxbury,MA,02118,137658,"(42.34363, -71.07176)"
Double Tree Club Hotel,,BOSTON REDEVELOPMENT AUTH,C.J. WASHINGTON STREET L.L.C.,,21472,03/09/2012 11:17:16 AM,12/31/2016 11:59:00 PM,Active,FS,Eating & Drinking,HE_Fail,03/17/2015 11:02:35 AM,20-4-703.11,***,Food Contact Surfaces Clean,03/17/2015 11:02:35 AM,Fail,,Low temp dish machine must maintain 50 - 100 PPM  PIC does not have proper test kit to determine sanitation.,821    Washington ST,BOSTON,MA,02116,,
Tavolo,,,Trinity Ashmont Restaurant LLC,Chris Douglass,28452,02/06/2012 01:24:23 PM,12/31/2016 11:59:00 PM,Active,FS,Eating & Drinking,HE_Fail,07/09/2009 12:09:44 PM,37-6-201.11,*,Walls/Ceilings Designed Constructed Installed,07/10/2009 08:51:23 AM,Fail,,clean grease filters of dust build up,1917   DORCHESTER,DORCHESTER,MA,02124,,
Durgin Park Restaurant,,,Weinstein,Michael,24748,02/13/2012 11:17:17 AM,12/31/2016 11:59:00 PM,Active,FS,Eating & Drinking,HE_Pass,08/12/2013 11:37:12 AM,29-5-201/02.11,*,Installed and Maintained,08/12/2013 11:37:12 AM,Pass,2013-08-12 15:24:27,Basement -Repair insulation to plumbing at customer ice bin.,300  Faneuil Hall Marketplace,Boston,MA,02109,341035,"(42.360036, -71.056253)"
No.  7 RESTAURANT,,,HUANG FAMILY INC.,REN XIANGHUANG  PRES.,25414,02/08/2012 04:32:36 PM,12/31/2016 11:59:00 PM,Active,FT,Eating & Drinking w/ Take Out,HE_Filed,01/25/2013 12:45:58 PM,15-4-202.16,*,Non-Food Contact Surfaces,01/25/2013 12:45:58 PM,Pass,2013-01-28 09:02:18,remove all tape on food containers and equipment....replace all worn stools..replace mlody caulking at 3 compartment sink...replace all defective doorgaskets...elevate all shelving 6 to 8 inches off the floor...,225   Grove ST,West Roxbury,MA,02132,156965,"(42.261873, -71.15741)"
Happy Garden,,,Brighton Ventures Inc.,,24662,01/31/2012 01:17:53 PM,12/31/2016 11:59:00 PM,Active,FT,Eating & Drinking w/ Take Out,HE_Hearing,01/13/2014 02:37:25 PM,08-3-305-307.11,*,Food Protection,01/13/2014 02:37:25 PM,Pass,2014-01-13 15:41:09,The freezer and refrigerator are overcrowded.  There are items stored in the coolers that are unwrapped and large amounts of items stored on the ground.  store items elavated and wrapped.,377   Washington ST,Brighton,MA,02135,156389,"(42.349291, -71.15428)"
Happy Garden,,,Brighton Ventures Inc.,,24662,01/31/2012 01:17:53 PM,12/31/2016 11:59:00 PM,Active,FT,Eating & Drinking w/ Take Out,HE_Hearing,01/13/2014 02:37:25 PM,M-2-101.11,***,Person in charge Assigned,01/13/2014 02:37:25 PM,Fail,,There is no person in charge assigned and there are numerous risk factor violations.  Provide an additional certified manager to control risk factors at the establishment.,377   Washington ST,Brighton,MA,02135,156389,"(42.349291, -71.15428)"
DAYIB CAFE,,ABDULLAH FARAH ANSHUR,ABDULLAH FARAH ANSHUR,,22700,02/13/2012 12:56:03 PM,12/31/2016 11:59:00 PM,Active,FT,Eating & Drinking w/ Take Out,HE_Filed,11/20/2009 10:32:36 AM,15-4-202.16,*,Non-Food Contact Surfaces,11/20/2009 10:32:36 AM,Fail,,hot line/replace worn table with food service grade table,722   Shawmut AV,Roxbury,MA,02119,157649,"(42.332783, -71.083221)"
Uno Chicago Grill,,NICOLE E. ADAMS,NICOLE E. ADAMS,,19118,01/09/2012 03:55:20 PM,12/31/2016 11:59:00 PM,Active,FT,Eating & Drinking w/ Take Out,HE_Pass,11/16/2010 11:04:49 AM,37-6-501.11-.12,*,Improper Maintenance of Walls/Ceilings,11/16/2010 11:04:49 AM,Pass,2010-11-16 15:15:06,dishroom/replace worn/loose ceiling tiles/clean walls behind dishmachine,270   HUNTINGTON  AV,BOSTON,MA,02125,,
Slush King,,,KIM NOLAN & MARK NOLAN,,19010,02/15/2012 09:42:58 AM,12/31/2016 11:59:00 PM,Active,FT,Eating & Drinking w/ Take Out,HE_Pass,05/07/2010 12:44:37 PM,23-4-602.13,*,Non-Food Contact Surfaces Clean,05/07/2010 12:44:37 PM,Pass,2010-05-10 08:43:43,Clean shelving - outside of all food containers - outside of portable coolers - inside and outside of three bay sink from old food stains and soils,211   BENNINGTON,EAST BOSTON,MA,02128,,
J J Foley's Cafe,,FOLEY JEREMIAH,J J Foley's Cafe,Inc.,27092,01/31/2012 06:21:48 PM,12/31/2016 11:59:00 PM,Active,FS,Eating & Drinking,HE_NotReq,06/27/2007 03:48:00 PM,,,,,,,,117   EAST BERKELEY,BOSTON,MA,02118,,
Dunkin Donuts,,COUTO JOSE S.,JOSE S. COUTO PRES.,C/O COUTO MANAGEMENT,18326,02/13/2012 10:07:55 AM,12/31/2016 11:59:00 PM,Active,FT,Eating & Drinking w/ Take Out,HE_Filed,06/02/2014 12:46:32 PM,23-4-602.13,*,Non-Food Contact Surfaces Clean,06/02/2014 12:46:32 PM,Fail,,General cleaning of the interior cabinets at front counter area.,4175   WASHINGTON,ROSLINDALE,MA,02131,,
Morgan Lewis & Bockius LLP,Flik International,JAMESTOWN ONE FEDERAL LP,Flik International,Peter Molloy,29909,02/29/2012 12:02:02 PM,12/31/2016 11:59:00 PM,Active,FS,Eating & Drinking,HE_Pass,03/04/2010 08:16:38 AM,32-6-301.11-02.11,*,Hand Cleaner  Drying  Tissue Signage,03/04/2010 08:16:38 AM,Pass,2010-03-04 08:35:18,Sinage missing at handsinks.,1   Federal ST,Boston,MA,02110,57149,"(42.3561, -71.05695)"
Aramark at Houghton Mifflin,,TWO TWENTY TWO BERKELEY,ARAMARK,C/O JARED LESSARD,24693,02/15/2012 01:55:00 PM,12/31/2016 11:59:00 PM,Active,FS,Eating & Drinking,HE_Pass,02/17/2009 10:19:24 AM,17-4-302.14,*,Test Kit Provided,02/18/2009 08:23:16 AM,Pass,2009-02-18 08:23:16,Improper warewashing instructions.,222   Berkeley ST,Boston,MA,02116,15007,"(42.35084, -71.07311)"
Eaton Vance Harbor Cafe (13th fl.),,,Prince Street Caterers,,32124,01/06/2012 03:25:41 PM,12/31/2016 11:59:00 PM,Active,FS,Eating & Drinking,HE_Fail,02/07/2012 11:17:32 AM,32-6-301.11-02.11,*,Hand Cleaner  Drying  Tissue Signage,02/07/2012 11:17:32 AM,Fail,,There are no paper towels or paper towel dispenser at the handsink on the cooking line.  Provide.,2   International PL,Boston,Ma,02110,,
West Napoli Pizza,,VRATTOS SOCRATES TS,BARDHI,SOKOL,21409,06/06/2012 03:38:02 PM,12/31/2016 11:59:00 PM,Active,FT,Eating & Drinking w/ Take Out,HE_Pass,06/02/2009 11:50:32 AM,37-6-501.11-.12,*,Improper Maintenance of Walls/Ceilings,06/02/2009 03:35:45 PM,Pass,2009-06-02 15:35:45,clean fan inside and out to removell dust and soil,1946  Centre St,West Roxbury,MA,02132,27764,"(42.28358, -71.15676)"
FLOUR BAKERY & CAFE,,,JOANNE CHANG,,21518,01/26/2012 03:07:20 PM,12/31/2016 11:59:00 PM,Active,FT,Eating & Drinking w/ Take Out,HE_Pass,12/05/2008 03:31:48 PM,14-4-202.11,*,Food Contact Surfaces Design,12/05/2008 03:42:52 PM,Pass,2008-12-05 15:42:52,replace all worn white cutting boards,1595   Washington ST,Roxbury,MA,02114,157458,"(42.338323, -71.07488)"
Minina's Cafe,,ROSA JOSE TS,Jose Rosa,,74391,02/01/2012 01:10:59 PM,12/31/2016 11:59:00 PM,Active,FT,Eating & Drinking w/ Take Out,HE_Fail,04/24/2015 12:29:20 PM,29-5-201/02.11,*,Installed and Maintained,04/24/2015 12:29:20 PM,Fail,,water draining slowly at hand sink  repair.,430   Geneva AV,Dorchester,MA,02122,63341,"(42.30059, -71.06637)"
Anshur Restauruant,,REARDON THOMAS B,Anshur,Abdullah F.,31241,02/08/2012 03:13:24 PM,12/31/2016 11:59:00 PM,Active,FT,Eating & Drinking w/ Take Out,HE_Hearing,10/05/2015 08:41:53 AM,32-6-501.11-.12/6-202.14,*,Toilet Enclosed Clean,10/05/2015 08:41:53 AM,Fail,,post employee handwash signage  papertowels /handsoap...,291   Roxbury ST,Roxbury,MA,02119,119179,"(42.33041, -71.0943)"
FENWAY PARK H.M.S. INC.,,JACK LYONS  MANAGER,FENWAY PARK H.M.S. INC.,,18275,10/27/2008 10:04:53 AM,12/31/2008 11:59:00 PM,Inactive,FT,Eating & Drinking w/ Take Out,HE_Fail,07/09/2008 10:48:12 AM,10-4.302.11,*,Food Utensil Storage,07/10/2008 09:07:09 AM,Fail,,Staff observed scooping ice out of ice unit with a non handled utensil at Pavilion 3.,4  Yawkey Wy,Boston,MA,02215,156417,"(42.346723, -71.09868)"
FENWAY PARK H.M.S. INC.,,JACK LYONS  MANAGER,FENWAY PARK H.M.S. INC.,,18275,10/27/2008 10:04:53 AM,12/31/2008 11:59:00 PM,Inactive,FT,Eating & Drinking w/ Take Out,HE_Fail,07/09/2008 10:48:12 AM,12-3--301.11,***,Prevention of Contamination from Hands,07/10/2008 09:07:09 AM,Fail,,Staff observed touching unwrapped portion of icecream cone at LY1.,4  Yawkey Wy,Boston,MA,02215,156417,"(42.346723, -71.09868)"
WAI WAI ICE CREAM SHOP,,WONG SHU YING TRSTS,HUI,DAVID,24990,01/06/2012 09:20:52 AM,12/31/2016 11:59:00 PM,Active,FS,Eating & Drinking,HE_Fail,01/26/2015 10:10:47 AM,16-4-501.11/.15,*,Dishwashng Facilities,01/26/2015 10:10:47 AM,Fail,,Missing plugs for each bay of 3 bay sink,26   Oxford ST,Boston,MA,02111,106209,"(42.35168, -71.06027)"
Burger King,,,MASTORAN CORP.,,19935,12/16/2011 09:50:24 AM,12/31/2016 11:59:00 PM,Active,FT,Eating & Drinking w/ Take Out,HE_Pass,05/21/2014 12:33:51 PM,29-5-201/02.11,*,Installed and Maintained,05/21/2014 12:33:51 PM,Pass,2014-05-21 15:31:14,Repair drain to office hand sink.,944   Bennington ST,East Boston,MA,02128,155885,"(42.386166, -71.00953)"
MCKENNA'S CAFE,,KENNETH OSHEROW  PRES.,KENNETH OSHEROW PRES.,,23628,12/28/2011 09:11:33 AM,12/31/2016 11:59:00 PM,Active,FS,Eating & Drinking,HE_Pass,11/19/2014 08:45:48 AM,16-4-501.11/.15,*,Dishwashng Facilities,11/19/2014 08:45:48 AM,Pass,2014-12-05 08:47:36,Replace missing sink plugs at ware washing sink.,109   Savin Hill AV,Dorchester,MA,02125,156864,"(42.311515, -71.05382)"
SQUEALING PIG,,COLE SARA TS,SARA COLE PRES.,,20872,02/15/2012 10:30:32 AM,12/31/2016 11:59:00 PM,Active,FS,Eating & Drinking,HE_Fail,12/03/2015 10:38:22 AM,29-5-201/02.11,*,Installed and Maintained,12/03/2015 10:38:22 AM,Fail,,ladies restroom/repair faucet handle mens restroom/repair urinal to flush properly kitchen handsink/repair hot water faucet handle,134   Smith ST,Roxbury,MA,02120,128190,"(42.33471, -71.10204)"
DAYIB CAFE,,ABDULLAH FARAH ANSHUR,ABDULLAH FARAH ANSHUR,,22700,02/13/2012 12:56:03 PM,12/31/2016 11:59:00 PM,Active,FT,Eating & Drinking w/ Take Out,HE_Pass,12/19/2013 12:39:13 PM,20-4-703.11,***,Food Contact Surfaces Clean,12/19/2013 12:39:13 PM,Pass,2013-12-19 15:16:45,3 bay sink/provide institutional sanitizer,722   Shawmut AV,Roxbury,MA,02119,157649,"(42.332783, -71.083221)"
Cafeteria Y Pizzaria Mi Columbia,,,E.B. Crown Fried Chicken & Pizza Inc.,,124996,01/09/2014 01:41:04 PM,12/31/2016 11:59:00 PM,Active,FT,Eating & Drinking w/ Take Out,HE_Fail,05/11/2015 10:51:37 AM,17-4-302.14,*,Test Kit Provided,05/11/2015 10:51:37 AM,Fail,,Provide test kit for sanitizer,50   Maverick SQ,East Boston,MA,02128,92897,"(42.37017, -71.03868)"
NEW YORK FRIED CHICKEN & PIZZA,,AYAZ A. SHAH,AYAZ A. SHAH,,23286,05/02/2012 11:48:20 AM,12/31/2016 11:59:00 PM,Active,FT,Eating & Drinking w/ Take Out,HE_Fail,11/27/2012 02:21:39 PM,05-4-302.12,*,Food Thermometers Provided,11/27/2012 02:21:39 PM,Fail,,No food thermometer in kitchen. Provide.,531   Columbia RD,Dorchester,MA,02125,156840,"(42.315432, -71.06626)"
Durgin Park Restaurant,,,Weinstein,Michael,24748,02/13/2012 11:17:17 AM,12/31/2016 11:59:00 PM,Active,FS,Eating & Drinking,HE_Fail,11/08/2007 10:09:28 AM,08-3-305-307.11,*,Food Protection,11/08/2007 01:16:57 PM,Fail,,first floor-remove glue traps from icemachine- in basement bar provide door for opening in icemachine-,300  Faneuil Hall Marketplace,Boston,MA,02109,341035,"(42.360036, -71.056253)"
ZESTO'S PIZZA,,FOUR 60-468 CENTRE STREET,K & M Pizza Inc.,,75590,12/12/2011 12:47:41 PM,12/31/2016 11:59:00 PM,Active,FT,Eating & Drinking w/ Take Out,HE_FailExt,01/15/2014 02:49:46 PM,22-4-601/602.11,**,Food Contact Surfaces Clean,01/15/2014 02:49:46 PM,Pass,2014-01-15 15:41:51,Can opener in basement soiled with dry food. Clean to remove.,460   Centre ST,Jamaica Plain,MA,02130,28061,"(42.31935, -71.11154)"
A K's Take Out & Delivery,,BOUKOUVALAS ATHENA TS,Saini,Jasbir,28531,12/20/2011 02:29:52 PM,12/31/2016 11:59:00 PM,Active,FT,Eating & Drinking w/ Take Out,HE_Filed,03/13/2008 09:10:37 AM,03-3-501.16,***,Hot Holding,03/13/2008 03:33:50 PM,Pass,2008-03-13 15:33:50,mashed potato 110 degrees baked beans 114 degrees,1427   Tremont ST,Mission Hill,MA,02120,136818,"(42.331858, -71.096333)"
Peggy O'Neil's Pub & Grille,,LIMERICK CO INC,LIMERICK CO INC,,19097,12/13/2011 03:15:33 PM,12/31/2016 11:59:00 PM,Active,FS,Eating & Drinking,HE_Fail,05/08/2009 01:48:24 PM,13-2-304/402.11,*,Clean Cloths  Hair Restraint,05/11/2009 08:04:21 AM,Pass,2009-05-11 08:04:21,,1310   DORCHESTER  AV,DORCHESTER,MA,02122,,
ROSLINDALE HOUSE OF PIZZA,,,VASSILIOS GLYKIS,,19964,01/06/2012 10:23:12 AM,12/31/2016 11:59:00 PM,Active,FT,Eating & Drinking w/ Take Out,HE_Pass,04/21/2011 02:23:55 PM,17-4-302.14,*,Test Kit Provided,04/21/2011 02:23:55 PM,Pass,2011-04-21 15:45:35,There are no chlorine test strips to test sanitizer in the buckets.  Provide chlorine test strips.,4168   Washington ST,Roslindale,MA,02131,157416,"(42.287818, -71.126399)"
N.E. Deaconess Hospital Cafe,,BETH ISRAEL DEACONESS,SODEXO OPERATIONS L L C,,26029,02/15/2012 09:27:05 AM,12/31/2016 11:59:00 PM,Active,FS,Eating & Drinking,HE_Pass,05/14/2013 01:46:08 PM,23-4-602.13,*,Non-Food Contact Surfaces Clean,05/14/2013 01:46:08 PM,Pass,2013-05-15 07:58:57,1) side of convection oven with grease build up  clean to remove 2) interior cabinet of fryer with grease build up  clean to remove 3) interior of hot hold cabinet with soils  clean to remove 4) top of pot wash machine with build up and debris  clean to remove,1    Deaconess RD,BOSTON,MA,02215,,
J J Foley's Cafe,,FOLEY JEREMIAH,J J Foley's Cafe,Inc.,27092,01/31/2012 06:21:48 PM,12/31/2016 11:59:00 PM,Active,FS,Eating & Drinking,HE_Fail,12/31/2009 12:48:15 PM,M-2-102.11,***,PIC Knowledge,12/31/2009 12:48:15 PM,Fail,,Provide a certified mgr.,117   EAST BERKELEY,BOSTON,MA,02118,,
Ester,,,2261 Dot LLC.,LLC,127375,04/08/2014 09:58:35 AM,12/31/2016 11:59:00 PM,Active,FS,Eating & Drinking,HE_Fail,04/28/2015 01:06:34 PM,32-6-301.11-02.11,*,Hand Cleaner  Drying  Tissue Signage,04/28/2015 01:06:34 PM,Fail,,No paper towels at hand sink in the basement preparation area. Provide.,2261   Dorchester AV,Dorchester,MA,02124,48561,"(42.27317, -71.06801)"
Panera Bread,,,Boston Bread LLc,Attn: Lori Engel,26330,01/18/2012 04:43:59 PM,12/31/2016 11:59:00 PM,Active,FS,Eating & Drinking,HE_Pass,09/13/2011 11:37:05 AM,12-2-301.12-.15,***,Adequate Handwashing/Where/When/How,09/13/2011 11:37:05 AM,Pass,2011-09-14 08:27:44,Insufficient handwashing observed from staff performing multiple tasks.Staff observed handling trash then clean dishes.Staff observed handling both soiled and clean equipment/utensils without any handwashing.The only person observed washing hands was store manager.Please provide a heavy focus on adequate handwashing(when how etc.).,200   High ST,Boston,Ma,02110,,
PATS PIZZA,,LOWER MILLS RESTAURANT,LOWER MILLS RESTAURANT,GROUP LLC,24124,12/19/2011 11:01:23 AM,12/31/2016 11:59:00 PM,Active,FT,Eating & Drinking w/ Take Out,HE_Fail,10/19/2011 11:19:43 AM,29-5-201/02.11,*,Installed and Maintained,10/19/2011 11:19:43 AM,Fail,,repair leaky handsink and adjust to wall..,2254   Dorchester AV,Dorchester,MA,02124,156905,"(42.273506, -71.067541)"
Qdoba Mexican Eats No. 2207,,CHAIR 5 RESTAURANTS LLC,Qdoba Mexican Grill #,Attn: Restaurant Accounting,75515,01/05/2012 01:57:51 PM,12/31/2016 11:59:00 PM,Active,FT,Eating & Drinking w/ Take Out,HE_FailExt,09/24/2012 11:56:15 AM,37-6-201.11,*,Walls/Ceilings Designed Constructed Installed,09/24/2012 11:56:15 AM,Fail,,,393   Huntington AV,Boston,MA,02115,157313,"(42.339776, -71.090882)"
Hungry Traveler,,,Jisung Oh,,31164,01/17/2012 04:29:57 PM,12/31/2016 11:59:00 PM,Active,FS,Eating & Drinking,HE_Fail,03/20/2013 10:37:21 AM,24-4-903.11,*,Clean Equipment & Utensils Storage,03/20/2013 10:37:21 AM,Fail,,Stacking wet equipment. Not allowing for proper airdrying.,27   COURT SQ SQ,BOSTON,MA,02108,,
Habibi's Lounge,,TALE CONSTANTINE G,Daoud Tayeh,,31949,12/29/2011 10:47:58 AM,12/31/2016 11:59:00 PM,Active,FS,Eating & Drinking,HE_Hearing,12/29/2015 02:36:34 PM,37-6-501.11-.12,*,Improper Maintenance of Walls/Ceilings,12/29/2015 02:36:34 PM,Pass,2015-12-29 15:47:43,Dusty light/vent.,1213   Commonwealth AV,Allston,MA,02134,37122,"(42.35081, -71.130724)"
A K's Take Out & Delivery,,BOUKOUVALAS ATHENA TS,Saini,Jasbir,28531,12/20/2011 02:29:52 PM,12/31/2016 11:59:00 PM,Active,FT,Eating & Drinking w/ Take Out,HE_Fail,03/25/2013 11:57:05 AM,23-4-602.13,*,Non-Food Contact Surfaces Clean,03/25/2013 11:57:05 AM,Fail,,hot line/clean all silver shelving hot line/clean grill drawers clean interior/exterior of all cooking equipment and reach in units clean pizza oven,1427   Tremont ST,Mission Hill,MA,02120,136818,"(42.331858, -71.096333)"
Masona Grill,,JOF REALTY LLC,Masona Inc.,,28939,01/18/2012 05:50:35 PM,12/31/2016 11:59:00 PM,Active,FS,Eating & Drinking,HE_Pass,10/01/2009 12:39:33 PM,36-6-501.11-.12,*,Improper Maintenance of Floors,10/01/2009 03:34:58 PM,Pass,2009-10-01 15:34:58,Clean floor of grime under  around behind equipment. Clean soils from walk-in floor. Resurface if not cleanable.,2  Corey St,West Roxbury,MA,02132,42766,"(42.28468, -71.15523)"
Levy Premium Main Kitchen & Commissary,,MASS CONVENTION CENTER AUTH,Levy Premium Foodservice Ltd.,Tim Townsell,68093,12/13/2011 04:01:07 PM,12/31/2016 11:59:00 PM,Active,FS,Eating & Drinking,HE_Pass,04/25/2012 12:13:44 PM,,,,,,,,415  Summer St,Boston,MA,02210,132014,"(42.344449, -71.044821)"
EL PENOL RESTAURANT,,,MIGUEL A. MEDINA BALBIN,,23581,12/29/2011 09:39:51 AM,12/31/2016 11:59:00 PM,Active,FS,Eating & Drinking,HE_Fail,08/10/2015 03:36:04 PM,09-3-301.11(C),*,Handling of Food & Ice,08/10/2015 03:36:04 PM,Fail,,Provide scoops with handles to bulk food containers.,54   Bennington ST,East Boston,MA,02128,156292,"(42.375798, -71.037101)"
Minina's Cafe,,ROSA JOSE TS,Jose Rosa,,74391,02/01/2012 01:10:59 PM,12/31/2016 11:59:00 PM,Active,FT,Eating & Drinking w/ Take Out,HE_FailExt,07/01/2011 02:37:51 PM,21-3-304.14,*,Wiping Cloths  Clean  Sanitize,07/01/2011 02:37:51 PM,Pass,2011-07-05 07:51:58,Soiled wiping cloths being left out on counter tops. Discontinue and provide proper sanitizing solution.,430   Geneva AV,Dorchester,MA,02122,63341,"(42.30059, -71.06637)"
DAYIB CAFE,,ABDULLAH FARAH ANSHUR,ABDULLAH FARAH ANSHUR,,22700,02/13/2012 12:56:03 PM,12/31/2016 11:59:00 PM,Active,FT,Eating & Drinking w/ Take Out,HE_Pass,05/09/2008 01:30:43 PM,35-6-501.111/.115,**,Insects  Rodents  Animals,05/09/2008 03:26:09 PM,Pass,2008-05-09 15:26:09,steamtable/clean lower shelving/remove evidence of rodent droppings,722   Shawmut AV,Roxbury,MA,02119,157649,"(42.332783, -71.083221)"
Uno Chicago Grill,,NICOLE E. ADAMS,NICOLE E. ADAMS,,19118,01/09/2012 03:55:20 PM,12/31/2016 11:59:00 PM,Active,FT,Eating & Drinking w/ Take Out,HE_Fail,02/04/2010 10:03:45 AM,15-4-202.16,*,Non-Food Contact Surfaces,02/04/2010 10:03:45 AM,Fail,,reach in units/remove brown paper from interior of units,270   HUNTINGTON  AV,BOSTON,MA,02125,,
Momogoose 2,,,Smart Gourmet LLC,Loc Vo,68113,12/14/2011 02:53:19 PM,12/31/2016 11:59:00 PM,Active,MFW,Mobile Food Walk On,HE_Pass,10/22/2015 01:10:41 PM,13-2-304/402.11,*,Clean Cloths  Hair Restraint,10/22/2015 01:10:41 PM,Pass,2015-10-22 15:49:35,PIC without hair restraint .Provide,1   Citywide ST,Boston,MA,02128,0,
UNION OYSTER HOUSE,,MILANO JOSEPH A JR TRST,MILANO,JOSEPH A.,19089,12/14/2011 02:11:17 PM,12/31/2016 11:59:00 PM,Active,FS,Eating & Drinking,HE_Pass,05/10/2013 11:03:52 AM,15-4-202.16,*,Non-Food Contact Surfaces,05/10/2013 11:03:52 AM,Pass,2013-05-13 08:04:20,Refinishlobster scale.,41  Union St,Boston,MA,02108,139293,"(42.36127, -71.05688)"
WINDY CITY AT ADAMS VILLAGE,,BAYTURK MUZAFFER,BAYTURK MUZAFFER,,19800,02/13/2012 10:40:46 AM,12/31/2016 11:59:00 PM,Active,FT,Eating & Drinking w/ Take Out,HE_Filed,02/17/2010 11:40:46 AM,22-4-601/602.11,**,Food Contact Surfaces Clean,02/17/2010 11:40:46 AM,Pass,2010-02-18 09:18:53,,516   Gallivan BL,Dorchester,MA,02124,156552,"(42.282928, -71.055559)"
DAYIB CAFE,,ABDULLAH FARAH ANSHUR,ABDULLAH FARAH ANSHUR,,22700,02/13/2012 12:56:03 PM,12/31/2016 11:59:00 PM,Active,FT,Eating & Drinking w/ Take Out,HE_Pass,05/09/2008 01:30:43 PM,14-4-202.11,*,Food Contact Surfaces Design,05/09/2008 03:26:09 PM,Pass,2008-05-09 15:26:09,remove all rusted shelving/racks,722   Shawmut AV,Roxbury,MA,02119,157649,"(42.332783, -71.083221)"
The Kitchen,,POCKEL JEANNE C TRSTS,Herritt,Scott,79722,06/13/2012 10:16:32 AM,12/31/2016 11:59:00 PM,Active,FS,Eating & Drinking,HE_Hearing,04/02/2014 02:16:08 PM,20-4-703.11,***,Food Contact Surfaces Clean,04/02/2014 02:16:08 PM,Fail,,Low temp dish machine 0 PPM  Ware washing will be performed in 3 bay sink.,560   Tremont ST,Roxbury,MA,02118,137658,"(42.34363, -71.07176)"
Durgin Park Restaurant,,,Weinstein,Michael,24748,02/13/2012 11:17:17 AM,12/31/2016 11:59:00 PM,Active,FS,Eating & Drinking,HE_Hearing,12/18/2012 11:47:43 AM,15-4-202.16,*,Non-Food Contact Surfaces,12/18/2012 11:47:43 AM,Pass,2012-12-18 15:27:27,Remove linen cloths from are refrig. units,300  Faneuil Hall Marketplace,Boston,MA,02109,341035,"(42.360036, -71.056253)"
Mehak Restaurant,,DE PASQUALE RONALD,Akram,Mohammad,33626,02/29/2012 12:55:00 PM,12/31/2016 11:59:00 PM,Active,FS,Eating & Drinking,HE_FailExt,06/16/2011 02:17:13 PM,41-7-207-09.11,***,Medicines  FirstAid Storage,06/16/2011 02:17:13 PM,Pass,2011-06-17 08:33:40,Medicine and other creams and lotions being stored in the kitchen- Remove and relocate,329   Sumner ST,East Boston,MA,02128,132398,"(42.36711, -71.03607)"
Brighams & Womens Hospital - Tower Cafe,,AU BON PAIN CO  INC. #508 (LAURA),Langill BWH CFSD,Susan,18544,02/08/2012 05:33:24 PM,12/31/2016 11:59:00 PM,Active,FS,Eating & Drinking,HE_Fail,,17-4-204.112/.115,*,Equipment Thermometers,06/04/2007 12:00:00 AM,,,replace defective gauge at dishmachine.,75   FRANCIS ST,Boston,MA,02115,158148,"(42.336106, -71.10748)"
DAYIB CAFE,,ABDULLAH FARAH ANSHUR,ABDULLAH FARAH ANSHUR,,22700,02/13/2012 12:56:03 PM,12/31/2016 11:59:00 PM,Active,FT,Eating & Drinking w/ Take Out,HE_Fail,07/23/2015 11:39:55 AM,08-3-302.11/3-304.11,***,Separation  Segregation Cross Contamination,07/23/2015 11:39:55 AM,Fail,,properly store all raw foods on the bottom of reachin...,722   Shawmut AV,Roxbury,MA,02119,157649,"(42.332783, -71.083221)"
IPIZZA AND GRILL,,,Khalid Salih,,124147,11/29/2013 09:47:37 AM,12/31/2015 11:59:00 PM,Inactive,FS,Eating & Drinking,HE_Pass,04/23/2015 11:23:38 AM,42-6-501.113/.114,*,Premises Maintained,04/23/2015 11:23:38 AM,Pass,2015-04-24 08:32:15,Near the bathroom door  provide better storage of employees personal beloingings. Do not store so close to supplies.,283   Old Colony AV,South Boston,MA,02127,105086,"(42.33032, -71.05288)"
McDonald's,,CHIN VERN & CAROL,CHIN,VERN & CAROL,19210,01/10/2012 11:28:49 AM,12/31/2015 11:59:00 PM,Inactive,FT,Eating & Drinking w/ Take Out,HE_Pass,04/05/2010 10:08:52 AM,32-6-501.11-.12/6-202.14,*,Toilet Enclosed Clean,04/05/2010 10:08:52 AM,Pass,2010-04-06 08:03:26,Provide cover for barrel in rest room.,702  Washington St,Boston,MA,02111,155789,"(42.351037, -71.06269)"
McDonald's,,CHIN VERN & CAROL,CHIN,VERN & CAROL,19210,01/10/2012 11:28:49 AM,12/31/2015 11:59:00 PM,Inactive,FT,Eating & Drinking w/ Take Out,HE_Pass,08/01/2011 11:07:43 AM,41-7-102.11,***,Labeled  Common Name,08/01/2011 11:07:43 AM,Pass,2011-08-02 07:15:21,Label all plastic spray bottles.,702  Washington St,Boston,MA,02111,155789,"(42.351037, -71.06269)"
Minina's Cafe,,ROSA JOSE TS,Jose Rosa,,74391,02/01/2012 01:10:59 PM,12/31/2016 11:59:00 PM,Active,FT,Eating & Drinking w/ Take Out,HE_FailExt,07/01/2011 02:37:51 PM,03-3-501.16(A),***,Cold Holding,07/01/2011 02:37:51 PM,Pass,2011-07-05 07:51:58,Raw eggs being left out at room temperature. Discontinue and ensure all potentially hazardous foods are maintained at 41F and below. PIC removed and placed eggs in a refrigerator to ensure no bacterial growth.,430   Geneva AV,Dorchester,MA,02122,63341,"(42.30059, -71.06637)"
Mehak Restaurant,,DE PASQUALE RONALD,Akram,Mohammad,33626,02/29/2012 12:55:00 PM,12/31/2016 11:59:00 PM,Active,FS,Eating & Drinking,HE_Pass,06/12/2012 02:31:53 PM,15-4-202.16,*,Non-Food Contact Surfaces,06/12/2012 02:31:53 PM,Pass,2012-06-13 08:50:56,remove tin foil from cooking equioment. remove ice buildup from freezer.,329   Sumner ST,East Boston,MA,02128,132398,"(42.36711, -71.03607)"
Burger King,,,MASTORAN CORP.,,19935,12/16/2011 09:50:24 AM,12/31/2016 11:59:00 PM,Active,FT,Eating & Drinking w/ Take Out,HE_Pass,03/29/2013 02:17:19 PM,42-6-501.113/.114,*,Premises Maintained,03/29/2013 02:17:19 PM,Pass,2013-03-29 15:01:43,provide better storaqe of employees personal belongings.,944   Bennington ST,East Boston,MA,02128,155885,"(42.386166, -71.00953)"
COPLEY PLAZA HOTEL,,DALEY,DALEY,JAMES,18878,02/21/2012 10:53:44 AM,12/31/2016 11:59:00 PM,Active,FS,Eating & Drinking,HE_Pass,04/24/2008 11:14:21 AM,36-6-501.11-.12,*,Improper Maintenance of Floors,04/25/2008 08:34:14 AM,Pass,2008-04-25 08:34:14,Worn floor area under soup vats.Work order present-ok,138   ST JAMES  AV,BOSTON,MA,02116,,
P S Gourmet Coffee,,,PS Gourmet Coffee Inc.,James E. Fallon,75947,06/13/2012 10:03:40 AM,12/31/2016 11:59:00 PM,Active,FT,Eating & Drinking w/ Take Out,HE_Fail,08/10/2015 02:08:48 PM,08-3-305-307.11,*,Food Protection,08/10/2015 02:08:48 PM,Fail,,Bags of ice observed being stored on the ground of the walk-in freezer. Discontinue and store all foods elevated at least 6 inches off the ground.,758   Adams ST,Dorchester,MA,02121,158263,"(42.283805, -71.055331)"
COPLEY PLAZA HOTEL,,DALEY,DALEY,JAMES,18878,02/21/2012 10:53:44 AM,12/31/2016 11:59:00 PM,Active,FS,Eating & Drinking,HE_Pass,01/29/2009 10:18:24 AM,16-4-501.11/.15,*,Dishwashng Facilities,01/29/2009 03:12:00 PM,Pass,2009-01-29 15:12:00,Low temperature gloss washer at Oak room bar not functioning properly. Unit has been consistently Malfunctioning (on initial inspections).Recommend replacing unit. (Staff have consistently shown insufficient Knowledge on how unit operates).,138   ST JAMES  AV,BOSTON,MA,02116,,
EL PENOL RESTAURANT,,,MIGUEL A. MEDINA BALBIN,,23581,12/29/2011 09:39:51 AM,12/31/2016 11:59:00 PM,Active,FS,Eating & Drinking,HE_Fail,03/11/2013 12:24:01 PM,23-4-602.13,*,Non-Food Contact Surfaces Clean,03/11/2013 12:24:01 PM,Fail,,clean exterior of bulk foods containers located in basement,54   Bennington ST,East Boston,MA,02128,156292,"(42.375798, -71.037101)"
MIAMI RESTAURANT,,,JUAN A. REYES,,21019,01/05/2012 10:56:50 AM,12/31/2016 11:59:00 PM,Active,FS,Eating & Drinking,HE_FailExt,05/15/2012 02:33:45 PM,22-4-601/602.11,**,Food Contact Surfaces Clean,05/15/2012 02:33:45 PM,Fail,,Panini Machine is heavily soiled - clean as discussed Meat slicer has some old foods still underneath the blade - when cleaning  cover and arm can come completely off.Submerge into the three bay sink and then follow the procedures as discussed,381   Centre ST,Jamaica Plain,MA,02130,158224,"(42.322337, -71.10927)"
DOLCE VITA (1696 Comm. Ave.),,,Mario & Marilda Kocibelli,,77591,06/13/2012 01:08:44 PM,12/31/2016 11:59:00 PM,Active,FT,Eating & Drinking w/ Take Out,HE_Filed,09/27/2013 10:15:16 AM,29-5-201/02.11,*,Installed and Maintained,09/27/2013 10:15:16 AM,Fail,,Cold water faucet at hand sink in back preparation room not oeprating properly. Address and repair if necessary.,1696   Commonwealth AV,Brighton,MA,02135,163787,"(42.341247, -71.146504)"
MCKENNA'S CAFE,,KENNETH OSHEROW  PRES.,KENNETH OSHEROW PRES.,,23628,12/28/2011 09:11:33 AM,12/31/2016 11:59:00 PM,Active,FS,Eating & Drinking,HE_Pass,03/18/2013 09:58:25 AM,13-2-304/402.11,*,Clean Cloths  Hair Restraint,03/18/2013 09:58:25 AM,Pass,2013-03-18 15:38:50,Not all staff with hair restraints. Provide,109   Savin Hill AV,Dorchester,MA,02125,156864,"(42.311515, -71.05382)"
Mehak Restaurant,,DE PASQUALE RONALD,Akram,Mohammad,33626,02/29/2012 12:55:00 PM,12/31/2016 11:59:00 PM,Active,FS,Eating & Drinking,HE_Pass,05/01/2013 10:36:25 AM,08-3-305-307.11,*,Food Protection,05/01/2013 10:36:25 AM,Pass,2013-05-03 08:12:33,keep all supplies at least 6 inches off floor area in basement.,329   Sumner ST,East Boston,MA,02128,132398,"(42.36711, -71.03607)"
Prime Shoppe,,,Touarsi,Benemar,28544,02/08/2012 04:33:52 PM,12/31/2016 11:59:00 PM,Active,FT,Eating & Drinking w/ Take Out,HE_Fail,10/09/2013 11:46:42 AM,17-4-204.112/.115,*,Equipment Thermometers,10/09/2013 11:46:42 AM,Fail,,Provide working thermometer to hot holing cabinet.,104-112   Faneuil Hall Mkt,Boston,Ma,02109,,
No.  7 RESTAURANT,,,HUANG FAMILY INC.,REN XIANGHUANG  PRES.,25414,02/08/2012 04:32:36 PM,12/31/2016 11:59:00 PM,Active,FT,Eating & Drinking w/ Take Out,HE_FailExt,01/11/2013 03:01:38 PM,40-6-305.11,*,Dressing Rooms Clean/Lockers Provided,01/11/2013 03:01:38 PM,Pass,2013-01-15 08:45:56,,225   Grove ST,West Roxbury,MA,02132,156965,"(42.261873, -71.15741)"
SULTAN'S KITCHEN,,STATE ENTERPRISES LIMITED PA,OZCAN OZAN,,22884,02/06/2012 10:58:13 AM,12/31/2016 11:59:00 PM,Active,FT,Eating & Drinking w/ Take Out,HE_Filed,02/27/2009 10:17:14 AM,21-3-304.14,*,Wiping Cloths  Clean  Sanitize,03/03/2009 08:12:16 AM,Fail,,Keep wiping cloths in sanitizer.,112   State ST,Boston,MA,02109,130370,"(42.359299, -71.054864)"
LOLLICUP TEA ZONE,,PETER LUU  PRES.,LONG JIANG,,22229,02/14/2012 12:48:34 PM,12/31/2016 11:59:00 PM,Active,FT,Eating & Drinking w/ Take Out,HE_Pass,01/09/2014 02:39:59 PM,36-6-501.11-.12,*,Improper Maintenance of Floors,01/09/2014 02:39:59 PM,Pass,2014-01-10 08:15:14,Floor under fryer with excess grease and debris. Clean to remove.,1   Brighton AV,Allston,MA,02134,157732,"(42.352411, -71.125329)"
Regina Pizza of Allston,,,Regina Pizza of Allston L L C,,68183,01/31/2012 02:16:51 PM,12/31/2016 11:59:00 PM,Active,FS,Eating & Drinking,HE_Pass,06/28/2013 11:03:06 AM,23-4-602.13,*,Non-Food Contact Surfaces Clean,06/28/2013 11:03:06 AM,Pass,2013-07-01 08:50:45,BASEMENT STOREROOM -clean white shelves of built-up soil-,353   Cambridge ST,Brighton,MA,02134,157036,"(42.356111, -71.132629)"
DAYIB CAFE,,ABDULLAH FARAH ANSHUR,ABDULLAH FARAH ANSHUR,,22700,02/13/2012 12:56:03 PM,12/31/2016 11:59:00 PM,Active,FT,Eating & Drinking w/ Take Out,HE_Fail,03/25/2010 10:40:44 AM,23-4-602.13,*,Non-Food Contact Surfaces Clean,03/25/2010 10:40:44 AM,Fail,,Clean storage shelving in ware washing area.,722   Shawmut AV,Roxbury,MA,02119,157649,"(42.332783, -71.083221)"
Brighams & Womens Hospital - Tower Cafe,,AU BON PAIN CO  INC. #508 (LAURA),Langill BWH CFSD,Susan,18544,02/08/2012 05:33:24 PM,12/31/2016 11:59:00 PM,Active,FS,Eating & Drinking,HE_Pass,02/01/2008 11:08:04 AM,22-4-601/602.11,**,Food Contact Surfaces Clean,02/05/2008 09:57:50 AM,Pass,2008-02-05 09:57:50,Using cloth towels to dry patient tays.Using same(wet) cloth to moisten hands then handle items to go on patient trays.,75   FRANCIS ST,Boston,MA,02115,158148,"(42.336106, -71.10748)"
Anshur Restauruant,,REARDON THOMAS B,Anshur,Abdullah F.,31241,02/08/2012 03:13:24 PM,12/31/2016 11:59:00 PM,Active,FT,Eating & Drinking w/ Take Out,HE_FailExt,10/27/2015 08:36:19 AM,590.009(E),*,Anti-Choking,10/27/2015 08:36:19 AM,Pass,2015-10-28 08:55:27,,291   Roxbury ST,Roxbury,MA,02119,119179,"(42.33041, -71.0943)"
DAYIB CAFE,,ABDULLAH FARAH ANSHUR,ABDULLAH FARAH ANSHUR,,22700,02/13/2012 12:56:03 PM,12/31/2016 11:59:00 PM,Active,FT,Eating & Drinking w/ Take Out,HE_Filed,05/22/2009 10:21:53 AM,36-6-501.11-.12,*,Improper Maintenance of Floors,05/22/2009 03:07:44 PM,Pass,2009-05-22 15:07:44,storage room near restroom/replace/repair worn floor and clean kitchen/clean floor area under around and behind all equipment/remove grime build up from behind ovens,722   Shawmut AV,Roxbury,MA,02119,157649,"(42.332783, -71.083221)"
SULLY'S PUB,,SULLIVAN JOHN,SULLIVAN,JOHN,18892,01/10/2012 12:05:50 PM,12/31/2016 11:59:00 PM,Active,FS,Eating & Drinking,HE_Filed,07/02/2012 11:52:16 AM,37-6-501.11-.12,*,Improper Maintenance of Walls/Ceilings,07/02/2012 11:52:16 AM,Fail,,Clean walls and ceiling in walk in,85   Main ST,Charlestown,MA,02129,88685,"(42.373922, -71.062762)"
CANTON HOUSE,,,LI TING LI PRESIDENT,,23526,02/01/2012 03:06:08 PM,12/31/2016 11:59:00 PM,Active,FT,Eating & Drinking w/ Take Out,HE_FailExt,03/05/2010 02:18:08 PM,23-4-602.13,*,Non-Food Contact Surfaces Clean,03/05/2010 02:18:08 PM,Fail,,Fan cover of basement walk-in and first floor refrigerator visibly soiled. Clean to remove. Interior of upright Jordon refrigerator heavily soiled and with food debris. Clean to remove. Shelves where pots and pans are air dryed with cacked on foods. Clean to remove. Handles of upright freezer and refrigerator with cacked on foods. Clean to remove. Exteriors of flour bins in basement visibly soiled. Clean to remove.,6  Hancock St,Dorchester,MA,02125,158300,"(42.315595, -71.065919)"
RISTORANTE EUNO,,REGNETTA LEIZE,RISTORANTE,EUNO,20538,02/13/2012 02:19:04 PM,12/31/2016 11:59:00 PM,Active,FS,Eating & Drinking,HE_Fail,04/04/2011 08:42:45 AM,37-6-201.11,*,Walls/Ceilings Designed Constructed Installed,04/04/2011 08:42:45 AM,Pass,2011-04-04 09:14:14,clean ceiling of dust in walk-in,119   Salem ST,Boston,MA,02113,121721,"(42.364531, -71.055371)"
MIAMI RESTAURANT,,,JUAN A. REYES,,21019,01/05/2012 10:56:50 AM,12/31/2016 11:59:00 PM,Active,FS,Eating & Drinking,HE_Fail,06/19/2009 10:45:55 AM,17-4-204.112/.115,*,Equipment Thermometers,06/19/2009 02:51:45 PM,Fail,,No thermometer in glass refrigerator,381   Centre ST,Jamaica Plain,MA,02130,158224,"(42.322337, -71.10927)"
Back Bay Social Club,,DHANDA 867 BOYLSTON ST LPS,c/o Lyons Group,,68305,02/08/2012 07:50:46 AM,12/31/2016 11:59:00 PM,Active,FS,Eating & Drinking,HE_NotReq,12/30/2012 12:00:00 AM,,,,,,,,867   Boylston ST,Boston,MA,02116,18414,"(42.34874, -71.083445)"
P S Gourmet Coffee,,,PS Gourmet Coffee Inc.,James E. Fallon,75947,06/13/2012 10:03:40 AM,12/31/2016 11:59:00 PM,Active,FT,Eating & Drinking w/ Take Out,HE_Fail,08/10/2015 02:08:48 PM,17-4-302.14,*,Test Kit Provided,08/10/2015 02:08:48 PM,Fail,,Test kit for the 3 bay sink appears to be water damaged. Replace in order to provide an accurate reading for the sanitizer.,758   Adams ST,Dorchester,MA,02121,158263,"(42.283805, -71.055331)"
Dot 2 Dot Cafe,,BERTUCCI JOHN E TRST,Henry-Garrett,Karen,28291,01/24/2012 09:58:41 AM,12/31/2016 11:59:00 PM,Active,FS,Eating & Drinking,HE_FailExt,06/22/2010 02:59:48 PM,03-3-501.16(A),***,Cold Holding,06/22/2010 02:59:48 PM,Pass,2010-06-23 08:26:07,properly maintain all eggs and egg mix at 41f.....,1735   Dorchester AV,Dorchester,MA,02124,48397,"(42.29105, -71.06302)"
Langham Hotel (Chuan Body & Soul),,,Pacific Boston Holdings Corp.,,30021,01/11/2012 08:54:33 AM,12/31/2016 11:59:00 PM,Active,FS,Eating & Drinking,HE_NotReq,,,,,,,,,250   Franklin ST,Boston,Ma,02110,,
Subway,,CATALDO JOHN M JR,Patel,Jitendra,98011,09/30/2013 09:43:36 AM,12/31/2016 11:59:00 PM,Active,FT,Eating & Drinking w/ Take Out,HE_NotReq,12/30/2013 12:00:00 AM,,,,,,,,13   William C Kelly SQ,East Boston,MA,02128,151119,"(42.374597, -71.038799)"
UPTOWN CAFE,,,GARY FORZIATI,,23109,12/14/2011 11:10:59 AM,12/31/2016 11:59:00 PM,Active,FT,Eating & Drinking w/ Take Out,HE_Fail,03/08/2011 11:04:06 AM,14-4-202.11,*,Food Contact Surfaces Design,03/08/2011 11:04:06 AM,Fail,,Replace worn and stained cutting  boards  on cold unit in kitchen,116   CAMBRIDGE,BOSTON,MA,02114,,
Durgin Park Restaurant,,,Weinstein,Michael,24748,02/13/2012 11:17:17 AM,12/31/2016 11:59:00 PM,Active,FS,Eating & Drinking,HE_Hearing,12/18/2012 11:47:43 AM,23-4-602.13,*,Non-Food Contact Surfaces Clean,12/18/2012 11:47:43 AM,Fail,,Clean exterior of bulk food containers,300  Faneuil Hall Marketplace,Boston,MA,02109,341035,"(42.360036, -71.056253)"
CANTON HOUSE,,,LI TING LI PRESIDENT,,23526,02/01/2012 03:06:08 PM,12/31/2016 11:59:00 PM,Active,FT,Eating & Drinking w/ Take Out,HE_Fail,05/13/2014 02:44:23 PM,36-6-501.11-.12,*,Improper Maintenance of Floors,05/13/2014 02:44:23 PM,Fail,,Clean floor under  around and behind cooking equipment.,6  Hancock St,Dorchester,MA,02125,158300,"(42.315595, -71.065919)"
Aramark at Houghton Mifflin,,TWO TWENTY TWO BERKELEY,ARAMARK,C/O JARED LESSARD,24693,02/15/2012 01:55:00 PM,12/31/2016 11:59:00 PM,Active,FS,Eating & Drinking,HE_Filed,09/21/2015 12:01:26 PM,36-6-501.11-.12,*,Improper Maintenance of Floors,09/21/2015 12:01:26 PM,Pass,2015-09-21 15:10:01,clean floor area behind coffee station and display case,222   Berkeley ST,Boston,MA,02116,15007,"(42.35084, -71.07311)"
CANTON HOUSE,,,LI TING LI PRESIDENT,,23526,02/01/2012 03:06:08 PM,12/31/2016 11:59:00 PM,Active,FT,Eating & Drinking w/ Take Out,HE_Fail,01/13/2011 01:52:59 PM,42-6-501.113/.114,*,Premises Maintained,01/13/2011 01:52:59 PM,Fail,,Small canisters of oil stored on same shelf as dry goods. Discontinue and store appropriately.,6  Hancock St,Dorchester,MA,02125,158300,"(42.315595, -71.065919)"
Brighams & Womens Hospital - Tower Cafe,,AU BON PAIN CO  INC. #508 (LAURA),Langill BWH CFSD,Susan,18544,02/08/2012 05:33:24 PM,12/31/2016 11:59:00 PM,Active,FS,Eating & Drinking,HE_Pass,02/25/2010 08:19:45 AM,08-3-302.11/3-304.11,***,Separation  Segregation Cross Contamination,02/25/2010 08:19:45 AM,Pass,2010-02-25 08:25:57,1) Raw Chicken sitting over raw whole beef and fish  store raw chicken below,75   FRANCIS ST,Boston,MA,02115,158148,"(42.336106, -71.10748)"
MCKENNA'S CAFE,,KENNETH OSHEROW  PRES.,KENNETH OSHEROW PRES.,,23628,12/28/2011 09:11:33 AM,12/31/2016 11:59:00 PM,Active,FS,Eating & Drinking,HE_Fail,11/12/2014 08:31:04 AM,29-5-201/02.11,*,Installed and Maintained,11/12/2014 08:31:04 AM,Fail,,Leaky pipe below ware washing sink  repair.,109   Savin Hill AV,Dorchester,MA,02125,156864,"(42.311515, -71.05382)"
Morgan Lewis & Bockius LLP,Flik International,JAMESTOWN ONE FEDERAL LP,Flik International,Peter Molloy,29909,02/29/2012 12:02:02 PM,12/31/2016 11:59:00 PM,Active,FS,Eating & Drinking,HE_Pass,02/14/2012 12:08:38 PM,,,,,,,,1   Federal ST,Boston,MA,02110,57149,"(42.3561, -71.05695)"
WINDY CITY AT ADAMS VILLAGE,,BAYTURK MUZAFFER,BAYTURK MUZAFFER,,19800,02/13/2012 10:40:46 AM,12/31/2016 11:59:00 PM,Active,FT,Eating & Drinking w/ Take Out,HE_Pass,12/09/2009 02:01:40 PM,08-3-305-307.11,*,Food Protection,12/09/2009 02:01:40 PM,Pass,2009-12-10 08:11:48,keep food off floor,516   Gallivan BL,Dorchester,MA,02124,156552,"(42.282928, -71.055559)"
COPLEY PLAZA HOTEL,,DALEY,DALEY,JAMES,18878,02/21/2012 10:53:44 AM,12/31/2016 11:59:00 PM,Active,FS,Eating & Drinking,HE_Pass,08/14/2013 10:48:35 AM,37-6-501.11-.12,*,Improper Maintenance of Walls/Ceilings,08/14/2013 10:48:35 AM,Pass,2013-08-15 07:10:38,Vents of cooking line with carbon build up and dusts  clean to remove,138   ST JAMES  AV,BOSTON,MA,02116,,
Regina Pizza of Allston,,,Regina Pizza of Allston L L C,,68183,01/31/2012 02:16:51 PM,12/31/2016 11:59:00 PM,Active,FS,Eating & Drinking,HE_Fail,02/28/2012 01:09:13 PM,41-7-102.11,***,Labeled  Common Name,02/28/2012 01:09:13 PM,Fail,,Chemical spray bottles with no labels. Provide.,353   Cambridge ST,Brighton,MA,02134,157036,"(42.356111, -71.132629)"
Lanta Asian Cuisine,,,Yee Yang,J & Y Enterperises Inc.,84979,01/03/2013 03:06:25 PM,12/31/2016 11:59:00 PM,Active,FT,Eating & Drinking w/ Take Out,HE_Filed,07/16/2015 01:59:04 PM,36-6-501.11-.12,*,Improper Maintenance of Floors,07/16/2015 01:59:04 PM,Fail,,Floors are worn  uneven allowing for standing water / Refinish floors to provide a smooth  non-porous  durable and easily cleanable surface.,38   Batterymarch ST,Boston,MA,02110,157539,"(42.357589, -71.053939)"
Prime Shoppe,,,Touarsi,Benemar,28544,02/08/2012 04:33:52 PM,12/31/2016 11:59:00 PM,Active,FT,Eating & Drinking w/ Take Out,HE_NotReq,12/30/2013 12:00:00 AM,,,,,,,,104-112   Faneuil Hall Mkt,Boston,Ma,02109,,
Yamato II,,,Jiang,Ming,137896,06/30/2015 08:46:46 AM,12/31/2016 11:59:00 PM,Active,FS,Eating & Drinking,HE_Fail,06/24/2015 02:52:27 PM,02-3-602.11-.12/3-302.12,*,Food Container Labels,06/24/2015 02:52:27 PM,Fail,,Bulk food items containers without proper labels. Provide.,545  Boylston St,Boston,MA,02116,193086,"(42.35081, -71.07581)"
J J Foley's Cafe,,FOLEY JEREMIAH,J J Foley's Cafe,Inc.,27092,01/31/2012 06:21:48 PM,12/31/2016 11:59:00 PM,Active,FS,Eating & Drinking,HE_Pass,03/24/2011 11:08:09 AM,37-6-501.11-.12,*,Improper Maintenance of Walls/Ceilings,03/24/2011 11:08:09 AM,Pass,2011-03-25 07:51:12,Clean cooking vent hood.,117   EAST BERKELEY,BOSTON,MA,02118,,
BUKHARA INDIAN BISTRO,,BRUCE THERESA,AMRIK SINGH PABLA,,21016,01/12/2012 03:33:18 PM,12/31/2016 11:59:00 PM,Active,FS,Eating & Drinking,HE_Pass,04/08/2015 02:14:22 PM,36-6-501.11-.12,*,Improper Maintenance of Floors,04/08/2015 02:14:22 PM,Pass,2015-04-08 15:44:15,Clean floor in kitchen and basment under and behind cooking equipment. Visibly soiled.  Clean floor in walk in shelves.,701   Centre ST,Jamaica Plain,MA,02130,28172,"(42.31159, -71.11461)"
MCKENNA'S CAFE,,KENNETH OSHEROW  PRES.,KENNETH OSHEROW PRES.,,23628,12/28/2011 09:11:33 AM,12/31/2016 11:59:00 PM,Active,FS,Eating & Drinking,HE_Fail,12/27/2012 10:43:22 AM,23-4-602.13,*,Non-Food Contact Surfaces Clean,12/27/2012 10:43:22 AM,Fail,,In kitchen and basement exterior of coffin style freezer soiled. Clean In kitchen and basement exterior of refrigerators soiled. Clean In kitchen exterior of bulk food containers soiled. Clean In basement exterior of ice machine soiled. Clean,109   Savin Hill AV,Dorchester,MA,02125,156864,"(42.311515, -71.05382)"
UNION OYSTER HOUSE,,MILANO JOSEPH A JR TRST,MILANO,JOSEPH A.,19089,12/14/2011 02:11:17 PM,12/31/2016 11:59:00 PM,Active,FS,Eating & Drinking,HE_Fail,12/18/2012 11:07:29 AM,23-4-602.13,*,Non-Food Contact Surfaces Clean,12/18/2012 11:07:29 AM,Fail,,Sea grill -clean interior of reach iris and fry cabinet.s,41  Union St,Boston,MA,02108,139293,"(42.36127, -71.05688)"
Anshur Restauruant,,REARDON THOMAS B,Anshur,Abdullah F.,31241,02/08/2012 03:13:24 PM,12/31/2016 11:59:00 PM,Active,FT,Eating & Drinking w/ Take Out,HE_Hearing,10/05/2015 08:41:53 AM,17-4-204.112/.115,*,Equipment Thermometers,10/05/2015 08:41:53 AM,Fail,,provide thermometers....,291   Roxbury ST,Roxbury,MA,02119,119179,"(42.33041, -71.0943)"
LOCONTES RESTAURANT,,,BROOK FARM INC.,,19366,12/29/2011 02:31:28 PM,12/31/2016 11:59:00 PM,Active,FS,Eating & Drinking,HE_Filed,10/13/2009 08:41:21 AM,17-4-302.14,*,Test Kit Provided,10/13/2009 08:44:19 AM,Fail,,Provide test kit for dishwasher.,116   Salem ST,Boston,MA,02113,157396,"(42.364676, -71.055658)"
Anshur Restauruant,,REARDON THOMAS B,Anshur,Abdullah F.,31241,02/08/2012 03:13:24 PM,12/31/2016 11:59:00 PM,Active,FT,Eating & Drinking w/ Take Out,HE_Fail,03/30/2010 11:23:01 AM,23-4-602.13,*,Non-Food Contact Surfaces Clean,03/30/2010 11:23:01 AM,Fail,,Remove foil paper as liner and clean to remove visible soil.,291   Roxbury ST,Roxbury,MA,02119,119179,"(42.33041, -71.0943)"
SULTAN'S KITCHEN,,STATE ENTERPRISES LIMITED PA,OZCAN OZAN,,22884,02/06/2012 10:58:13 AM,12/31/2016 11:59:00 PM,Active,FT,Eating & Drinking w/ Take Out,HE_Pass,06/12/2012 10:20:55 AM,12-2-401.11-.12,***,Good Hygienic Practices,06/12/2012 10:20:55 AM,Pass,2012-06-13 08:50:56,do not handle ready to eat foods with bare hands. Observed employee packaging bread with bare hands,112   State ST,Boston,MA,02109,130370,"(42.359299, -71.054864)"
SULTAN'S KITCHEN,,STATE ENTERPRISES LIMITED PA,OZCAN OZAN,,22884,02/06/2012 10:58:13 AM,12/31/2016 11:59:00 PM,Active,FT,Eating & Drinking w/ Take Out,HE_Pass,07/21/2014 02:11:00 PM,23-4-602.13,*,Non-Food Contact Surfaces Clean,07/21/2014 02:11:00 PM,Pass,2014-07-21 15:13:31,1) Bulk food containers with soils  clean to remove 2) rail along clean dish area with worn paint and soils  clean to remove,112   State ST,Boston,MA,02109,130370,"(42.359299, -71.054864)"
ZESTO'S PIZZA,,FOUR 60-468 CENTRE STREET,K & M Pizza Inc.,,75590,12/12/2011 12:47:41 PM,12/31/2016 11:59:00 PM,Active,FT,Eating & Drinking w/ Take Out,HE_Pass,06/12/2015 02:43:40 PM,37-6-501.11-.12,*,Improper Maintenance of Walls/Ceilings,06/12/2015 02:43:40 PM,Pass,2015-06-12 15:32:56,Clean hood filters. Visible soiled with grease build up. Hood sticker expires shows sticker expired in March 2015. Hood was cleaned in Feb 2015. Besure that info on sticker is correct. Hood is now expired. Have hood clean before reinspection.  If back door is going to be opened provide a screen door.,460   Centre ST,Jamaica Plain,MA,02130,28061,"(42.31935, -71.11154)"
MCKENNA'S CAFE,,KENNETH OSHEROW  PRES.,KENNETH OSHEROW PRES.,,23628,12/28/2011 09:11:33 AM,12/31/2016 11:59:00 PM,Active,FS,Eating & Drinking,HE_Pass,01/18/2008 08:23:10 AM,08-3-302.11/3-304.11,***,Separation  Segregation Cross Contamination,01/25/2008 08:58:05 AM,Pass,2008-01-25 08:58:05,Raw hamburg patties stored next to deli turkey. Raw chicken next to lettuce .,109   Savin Hill AV,Dorchester,MA,02125,156864,"(42.311515, -71.05382)"
Slush King,,,KIM NOLAN & MARK NOLAN,,19010,02/15/2012 09:42:58 AM,12/31/2016 11:59:00 PM,Active,FT,Eating & Drinking w/ Take Out,HE_Pass,08/24/2009 10:17:05 AM,33-5-501.13-.17,*,Adequate Number  Frequency Vermin Proof,08/24/2009 03:19:30 PM,Pass,2009-08-24 15:19:30,Need more than one barrel with a tight fitting lid for business.,211   BENNINGTON,EAST BOSTON,MA,02128,,
Durgin Park Restaurant,,,Weinstein,Michael,24748,02/13/2012 11:17:17 AM,12/31/2016 11:59:00 PM,Active,FS,Eating & Drinking,HE_Fail,04/03/2014 12:29:22 PM,37-6-201.11,*,Walls/Ceilings Designed Constructed Installed,04/03/2014 12:29:22 PM,Fail,,wall of back stairway in disrepair  repair,300  Faneuil Hall Marketplace,Boston,MA,02109,341035,"(42.360036, -71.056253)"
Brighams & Womens Hospital - Tower Cafe,,AU BON PAIN CO  INC. #508 (LAURA),Langill BWH CFSD,Susan,18544,02/08/2012 05:33:24 PM,12/31/2016 11:59:00 PM,Active,FS,Eating & Drinking,HE_Filed,08/10/2012 01:26:57 PM,15-4-202.16,*,Non-Food Contact Surfaces,08/10/2012 01:26:57 PM,Fail,,repair or provide full air curtain at entry,75   FRANCIS ST,Boston,MA,02115,158148,"(42.336106, -71.10748)"
No.  7 RESTAURANT,,,HUANG FAMILY INC.,REN XIANGHUANG  PRES.,25414,02/08/2012 04:32:36 PM,12/31/2016 11:59:00 PM,Active,FT,Eating & Drinking w/ Take Out,HE_Pass,02/05/2010 11:50:00 AM,20-4-703.11,***,Food Contact Surfaces Clean,02/05/2010 11:50:00 AM,Pass,2010-02-05 15:40:22,Manager needed to be instructed on setting up sanitizer.  Figure out how much water to sanitizer is needed.  Employeers are observed rinsing out equipment without cleaning and sanitizing.  Train employees to clean and sanitize equipment.,225   Grove ST,West Roxbury,MA,02132,156965,"(42.261873, -71.15741)"
Subway,,HASSAN OUCHRAA  OWNER,HASSAN OUCHRAA OWNER,,23872,01/10/2012 12:35:06 PM,12/31/2016 11:59:00 PM,Active,FT,Eating & Drinking w/ Take Out,HE_FailExt,06/04/2010 10:43:14 AM,42-6-501.113/.114,*,Premises Maintained,06/04/2010 10:43:14 AM,Pass,2010-06-07 09:14:03,remove all unnessary articles,1576   Dorchester AV,Dorchester,MA,02122,156882,"(42.297107, -71.060479)"
Deli One,,,San Ko Inc.,,29195,01/05/2012 02:41:34 PM,12/31/2016 11:59:00 PM,Active,FT,Eating & Drinking w/ Take Out,HE_Fail,09/02/2011 11:09:03 AM,13-2-304/402.11,*,Clean Cloths  Hair Restraint,09/02/2011 11:09:03 AM,Fail,,Food handlers not wearing hair restraints.Provide.,85   ARCH ST ST,BOSTON,MA,02110,,
DRAGON CHEF CHINESE REST.,,,RU BANG CHEN PRES.,,21347,02/06/2012 10:55:13 AM,12/31/2016 11:59:00 PM,Active,FT,Eating & Drinking w/ Take Out,HE_Fail,10/23/2015 07:11:12 PM,42-5-203.13,*,Mop Sink not Provided,10/23/2015 07:11:12 PM,Fail,,Provide enclosed mop sink.,411  Washington St,Brighton,MA,02135,156051,"(42.349266, -71.15532)"
Nicholas Sub & Pizza Shop,,NICHOLAS MARKOPOULOS,Kourtelidis,Nicholas,33364,01/17/2012 03:37:47 PM,12/31/2016 11:59:00 PM,Active,FT,Eating & Drinking w/ Take Out,HE_Fail,05/18/2010 12:19:27 PM,22-4-601/602.11,**,Food Contact Surfaces Clean,05/18/2010 12:19:27 PM,Fail,,CLEAN or FLIP the white cutting board at prep reach-in refrige--,600   Hyde Park AV,Roslindale,MA,02131,156517,"(42.280027, -71.118658)"
Aramark at Houghton Mifflin,,TWO TWENTY TWO BERKELEY,ARAMARK,C/O JARED LESSARD,24693,02/15/2012 01:55:00 PM,12/31/2016 11:59:00 PM,Active,FS,Eating & Drinking,HE_Fail,09/19/2011 11:51:06 AM,05-4-302.12,*,Food Thermometers Provided,09/19/2011 11:51:06 AM,Fail,,Thermometer missing in beverage case  provide.   Provide thermometers for salad bar unit and sandwich bar unit.,222   Berkeley ST,Boston,MA,02116,15007,"(42.35084, -71.07311)"
Durgin Park Restaurant,,,Weinstein,Michael,24748,02/13/2012 11:17:17 AM,12/31/2016 11:59:00 PM,Active,FS,Eating & Drinking,HE_Pass,08/12/2013 11:37:12 AM,15-4-202.16,*,Non-Food Contact Surfaces,08/12/2013 11:37:12 AM,Pass,2013-08-12 15:24:27,1st floor -teal wood panel in meat walk in.,300  Faneuil Hall Marketplace,Boston,MA,02109,341035,"(42.360036, -71.056253)"
Uno Due Go,,DRUKER BERTRAM A TRSTS,URC L L C,,74800,12/30/2011 01:59:52 PM,12/31/2016 11:59:00 PM,Active,FS,Eating & Drinking,HE_Fail,06/24/2014 10:54:12 AM,23-4-602.13,*,Non-Food Contact Surfaces Clean,06/24/2014 10:54:12 AM,Fail,,Exterior of ice machine and vents with visible soils / Clean to remove.,52   Summer ST,Boston,MA,02110,132025,"(42.35445, -71.05881)"
Minina's Cafe,,ROSA JOSE TS,Jose Rosa,,74391,02/01/2012 01:10:59 PM,12/31/2016 11:59:00 PM,Active,FT,Eating & Drinking w/ Take Out,HE_Pass,02/14/2014 12:42:31 PM,15-4-202.16,*,Non-Food Contact Surfaces,02/14/2014 12:42:31 PM,Pass,2014-02-18 09:11:14,Storage shelving paint peeling  repair.,430   Geneva AV,Dorchester,MA,02122,63341,"(42.30059, -71.06637)"
CAFE ESPLANADE,,,Pamela Bardhi,,91465,07/02/2013 08:38:33 AM,12/31/2016 11:59:00 PM,Active,FT,Eating & Drinking w/ Take Out,HE_Filed,07/16/2013 10:40:00 AM,32-6-501.11-.12/6-202.14,*,Toilet Enclosed Clean,07/16/2013 10:40:00 AM,Pass,2013-07-16 15:21:56,restroom/provide self closing door to restroom,0   David G Mugar WY,Boston,MA,02108,46576,"(42.355594, -71.074207)"
West Napoli Pizza,,VRATTOS SOCRATES TS,BARDHI,SOKOL,21409,06/06/2012 03:38:02 PM,12/31/2016 11:59:00 PM,Active,FT,Eating & Drinking w/ Take Out,HE_Pass,05/16/2013 03:31:25 PM,42-6-501.113/.114,*,Premises Maintained,05/16/2013 03:31:25 PM,Pass,2013-05-17 08:07:56,Empty mop bucket and remove all unnecessary cardboard.,1946  Centre St,West Roxbury,MA,02132,27764,"(42.28358, -71.15676)"
Country Kitchen,,AMINPOUR AMIR,Arleen Campbell,,32027,01/05/2012 08:42:50 AM,12/31/2016 11:59:00 PM,Active,FS,Eating & Drinking,HE_Filed,11/05/2012 12:12:39 PM,23-4-602.13,*,Non-Food Contact Surfaces Clean,11/05/2012 12:12:39 PM,Pass,2012-11-06 08:05:54,clean all shelves through-out cooking area and all prep areas,830   Blue Hill AV,Dorchester,MA,02124,16567,"(42.29621, -71.08718)"
BUKHARA INDIAN BISTRO,,BRUCE THERESA,AMRIK SINGH PABLA,,21016,01/12/2012 03:33:18 PM,12/31/2016 11:59:00 PM,Active,FS,Eating & Drinking,HE_Fail,11/02/2012 11:21:40 AM,08-3-305-307.11,*,Food Protection,11/02/2012 11:21:40 AM,Fail,,IN REFRIGES - keep all food covered or wrapped-,701   Centre ST,Jamaica Plain,MA,02130,28172,"(42.31159, -71.11461)"
ZESTO'S PIZZA,,FOUR 60-468 CENTRE STREET,K & M Pizza Inc.,,75590,12/12/2011 12:47:41 PM,12/31/2016 11:59:00 PM,Active,FT,Eating & Drinking w/ Take Out,HE_Pass,05/10/2011 02:40:57 PM,M-2-102.11,***,PIC Knowledge,05/10/2011 02:40:57 PM,Pass,2011-05-10 15:41:22,There is no allergy awreness trained manager.  Provide an allergy awareness trained manager.,460   Centre ST,Jamaica Plain,MA,02130,28061,"(42.31935, -71.11154)"
Finagle A Bagel,,,FINALGE A BAGEL,ATTN: Human Resources,20653,12/15/2011 10:47:55 AM,12/31/2016 11:59:00 PM,Active,FT,Eating & Drinking w/ Take Out,HE_Fail,03/23/2015 10:42:25 AM,35-6-501.111/.115,**,Insects  Rodents  Animals,03/23/2015 10:42:25 AM,Fail,,fruit flies found in food prep and on top shelving area,275   Cambridge ST,Boston,MA,02114,155973,"(42.361357, -71.068227)"
EQUATOR RESTAURANT,,HOOPER FRANK III,SARAH PLABUTONG,,23186,12/16/2011 10:19:57 AM,12/31/2016 11:59:00 PM,Active,FS,Eating & Drinking,HE_Pass,10/22/2010 02:13:02 PM,14-4-202.11,*,Food Contact Surfaces Design,10/22/2010 02:13:02 PM,Pass,2010-10-25 08:09:24,Sponge being used at 3 bay sink. Discontinue and use appropriate equipment. Metal bowl being used to dispense rice. Discontinue and use a handled scoop to prevent contamination from hands.,1721   Washington ST,Roxbury,MA,02118,144411,"(42.337071, -71.076601)"
EL PENOL RESTAURANT,,,MIGUEL A. MEDINA BALBIN,,23581,12/29/2011 09:39:51 AM,12/31/2016 11:59:00 PM,Active,FS,Eating & Drinking,HE_Fail,10/29/2015 12:37:47 PM,23-4-602.13,*,Non-Food Contact Surfaces Clean,10/29/2015 12:37:47 PM,Fail,,Clean underside of shelving over prep-tables.,54   Bennington ST,East Boston,MA,02128,156292,"(42.375798, -71.037101)"
J J Foley's Cafe,,FOLEY JEREMIAH,J J Foley's Cafe,Inc.,27092,01/31/2012 06:21:48 PM,12/31/2016 11:59:00 PM,Active,FS,Eating & Drinking,HE_Pass,01/28/2009 11:29:02 AM,36-6-501.11-.12,*,Improper Maintenance of Floors,01/30/2009 08:59:57 AM,Pass,2009-01-30 08:59:57,Repair stair case landing     .  Floor shall be made smooth and easy cleanable in Cellar Box #1 #2 also clean floor. Reseal Rusty threshold at cellar box #1.,117   EAST BERKELEY,BOSTON,MA,02118,,
UNION OYSTER HOUSE,,MILANO JOSEPH A JR TRST,MILANO,JOSEPH A.,19089,12/14/2011 02:11:17 PM,12/31/2016 11:59:00 PM,Active,FS,Eating & Drinking,HE_Fail,07/31/2014 12:10:01 PM,38-6-202.11,*,Fixture's not properly shielded,07/31/2014 12:10:01 PM,Fail,,Cover lights above rear bar on the first floor that are located near the ice machine Replace all light bulbs that are not -[ tough skin ] located above the grill area on the first floor [ kitchen area that cooks burgers - chicken tenders ],41  Union St,Boston,MA,02108,139293,"(42.36127, -71.05688)"
Grille 705,,SEVEN-05 MASSACHUSETTS AVE,Antreassian,Sarkis,28817,01/31/2012 10:52:38 AM,12/31/2016 11:59:00 PM,Active,FT,Eating & Drinking w/ Take Out,HE_Fail,07/06/2012 10:59:47 AM,13-2-304/402.11,*,Clean Cloths  Hair Restraint,07/06/2012 10:59:47 AM,Pass,2012-07-09 07:53:20,observed staff preping food with no hair restraints  provide.,705    Massachusetts AV,BOSTON,MA,02118,,
Aramark at Houghton Mifflin,,TWO TWENTY TWO BERKELEY,ARAMARK,C/O JARED LESSARD,24693,02/15/2012 01:55:00 PM,12/31/2016 11:59:00 PM,Active,FS,Eating & Drinking,HE_Fail,04/23/2008 11:39:22 AM,02-3-602.11-.12/3-302.12,*,Food Container Labels,04/23/2008 03:29:19 PM,Fail,,Premade parfait(made on site) has no dates on product(packed on or use by).,222   Berkeley ST,Boston,MA,02116,15007,"(42.35084, -71.07311)"
Momogoose 2,,,Smart Gourmet LLC,Loc Vo,68113,12/14/2011 02:53:19 PM,12/31/2016 11:59:00 PM,Active,MFW,Mobile Food Walk On,HE_TSOP,02/24/2011 01:47:28 PM,17-4-204.112/.115,*,Equipment Thermometers,02/24/2011 01:47:28 PM,Fail,,Provide metal stemmed thermometer for  monitoring food temperatures,1   Citywide ST,Boston,MA,02128,0,
The Upper Crust,,PESIRIDIS THEODORE TRST,Shenefield,Shawn,90116,03/25/2013 02:37:01 PM,12/31/2016 11:59:00 PM,Active,FT,Eating & Drinking w/ Take Out,HE_Fail,09/24/2014 12:18:20 PM,32-6-301.11-02.11,*,Hand Cleaner  Drying  Tissue Signage,09/24/2014 12:18:20 PM,Fail,,pizza station/repair paper towel dispenser front handsink/provide refill of paper towels back restroom/provide refill of paper towels,683   Tremont ST,Roxbury,MA,02118,137919,"(42.34156, -71.07662)"
Tavern In The Square,,MC CLURE,JAJB INC.,,68446,12/29/2011 01:49:27 PM,12/31/2016 11:59:00 PM,Active,FS,Eating & Drinking,HE_Hearing,01/29/2015 03:36:27 PM,42-6-501.113/.114,*,Premises Maintained,01/29/2015 03:36:27 PM,Pass,2015-01-30 08:49:59,There are old paper products and broken equipment in the boiled room.  Remove all unecessary items.,161   Brighton AV,Allston,MA,02134,157226,"(42.353257, -71.132449)"
Uno Due Go,,DRUKER BERTRAM A TRSTS,URC L L C,,74800,12/30/2011 01:59:52 PM,12/31/2016 11:59:00 PM,Active,FS,Eating & Drinking,HE_Pass,07/01/2014 11:22:09 AM,M-2-101.11,***,Person in charge Assigned,07/01/2014 11:22:09 AM,Pass,2014-07-02 07:47:27,There are no CFPMs on site / Provide a certified food protection manager during all operational hours.,52   Summer ST,Boston,MA,02110,132025,"(42.35445, -71.05881)"
Finagle A Bagel,,,FINALGE A BAGEL,ATTN: Human Resources,20653,12/15/2011 10:47:55 AM,12/31/2016 11:59:00 PM,Active,FT,Eating & Drinking w/ Take Out,HE_Fail,08/22/2012 01:50:00 PM,32-6-501.11-.12/6-202.14,*,Toilet Enclosed Clean,08/22/2012 01:50:00 PM,Fail,,No employee hand wash sign at hand sink,275   Cambridge ST,Boston,MA,02114,155973,"(42.361357, -71.068227)"
Nutter  McClennen & Fish LLP,,SODEXHO OPERATIONS  LLC,Flik International Corp,Compass Group,27665,01/18/2012 06:00:22 PM,12/31/2016 11:59:00 PM,Active,FS,Eating & Drinking,HE_Filed,10/16/2007 12:05:14 PM,17-4-204.112/.115,*,Equipment Thermometers,10/16/2007 02:30:52 PM,Pass,2007-10-16 14:30:52,provide accurate thermometers to register 41 degrees or below,155   SEAPORT LA,BOSTON,MA,02110,,
Anshur Restauruant,,REARDON THOMAS B,Anshur,Abdullah F.,31241,02/08/2012 03:13:24 PM,12/31/2016 11:59:00 PM,Active,FT,Eating & Drinking w/ Take Out,HE_Hearing,10/05/2015 08:41:53 AM,40-6-305.11,*,Dressing Rooms Clean/Lockers Provided,10/05/2015 08:41:53 AM,Fail,,clean and organize locker area....,291   Roxbury ST,Roxbury,MA,02119,119179,"(42.33041, -71.0943)"
WINDY CITY AT ADAMS VILLAGE,,BAYTURK MUZAFFER,BAYTURK MUZAFFER,,19800,02/13/2012 10:40:46 AM,12/31/2016 11:59:00 PM,Active,FT,Eating & Drinking w/ Take Out,HE_Filed,10/21/2011 11:25:32 AM,14-4-202.11,*,Food Contact Surfaces Design,10/21/2011 11:25:32 AM,Pass,2011-10-24 08:31:54,replace scored cutting boards....,516   Gallivan BL,Dorchester,MA,02124,156552,"(42.282928, -71.055559)"
Nicholas Sub & Pizza Shop,,NICHOLAS MARKOPOULOS,Kourtelidis,Nicholas,33364,01/17/2012 03:37:47 PM,12/31/2016 11:59:00 PM,Active,FT,Eating & Drinking w/ Take Out,HE_Fail,05/17/2012 01:30:54 PM,16-4-501.11/.15,*,Dishwashng Facilities,05/17/2012 01:30:54 PM,Fail,,Ware washing sink missing dividers and plugs  repair or replace.,600   Hyde Park AV,Roslindale,MA,02131,156517,"(42.280027, -71.118658)"
Grille 705,,SEVEN-05 MASSACHUSETTS AVE,Antreassian,Sarkis,28817,01/31/2012 10:52:38 AM,12/31/2016 11:59:00 PM,Active,FT,Eating & Drinking w/ Take Out,HE_FailExt,06/25/2014 10:43:43 AM,M-2-102.11,***,PIC Knowledge,06/25/2014 10:43:43 AM,Fail,,PIC unable to answer questions regarding the illness policy for the establishment.,705    Massachusetts AV,BOSTON,MA,02118,,
Langham Hotel,,CHRISTINE GILPIN  CONTROL LER,CHRISTINE GILPIN CONTROL,LER,23003,01/11/2012 08:50:36 AM,12/31/2016 11:59:00 PM,Active,FS,Eating & Drinking,HE_Fail,08/31/2015 11:41:38 AM,05-4-302.12,*,Food Thermometers Provided,08/31/2015 11:41:38 AM,Fail,,Thermometer missing in top reach in unit / Provide.,250   Franklin ST,Boston,MA,02110,157806,"(42.35663, -71.054279)"
Dunkin Donuts,,COUTO JOSE S.,JOSE S. COUTO PRES.,C/O COUTO MANAGEMENT,18326,02/13/2012 10:07:55 AM,12/31/2016 11:59:00 PM,Active,FT,Eating & Drinking w/ Take Out,HE_Fail,06/21/2013 03:31:44 PM,36-6-501.11-.12,*,Improper Maintenance of Floors,06/21/2013 03:31:44 PM,Fail,,clean floor under equipment....,4175   WASHINGTON,ROSLINDALE,MA,02131,,
Back Bay Social Club,,DHANDA 867 BOYLSTON ST LPS,c/o Lyons Group,,68305,02/08/2012 07:50:46 AM,12/31/2016 11:59:00 PM,Active,FS,Eating & Drinking,HE_Fail,06/12/2014 12:34:15 PM,03-3-403.11,***,Reheating,06/12/2014 12:34:15 PM,Fail,,Brisket for hot hold at 92F. PIC stated that it is reheated before hot holding. Other foods for hot hold in the same unit at 140F or above. Reheat properly  review the reheating procedures.,867   Boylston ST,Boston,MA,02116,18414,"(42.34874, -71.083445)"
Frog Pond Boston @ Boston Common,,,The Skating Club of Boston,,75274,02/24/2012 02:04:35 PM,12/31/2016 11:59:00 PM,Active,FT,Eating & Drinking w/ Take Out,HE_Fail,04/15/2011 10:56:57 AM,16-4-501.11/.15,*,Dishwashng Facilities,04/15/2011 10:56:57 AM,Fail,,3 bay sink with quaternary ammonia on site,,,,,,
Langham Hotel,,CHRISTINE GILPIN  CONTROL LER,CHRISTINE GILPIN CONTROL,LER,23003,01/11/2012 08:50:36 AM,12/31/2016 11:59:00 PM,Active,FS,Eating & Drinking,HE_Pass,01/20/2010 12:01:32 PM,10-3-304.12,*,Food Utensil Storage,01/20/2010 12:01:32 PM,Pass,2010-01-21 08:58:39,utensils wedged behind Equipment /wall .,250   Franklin ST,Boston,MA,02110,157806,"(42.35663, -71.054279)"
Burger King,,,MASTORAN CORP.,,19935,12/16/2011 09:50:24 AM,12/31/2016 11:59:00 PM,Active,FT,Eating & Drinking w/ Take Out,HE_Fail,03/06/2015 10:07:03 AM,15-4-202.16,*,Non-Food Contact Surfaces,03/06/2015 10:07:03 AM,Fail,,Repair door real to take out window reach in .,944   Bennington ST,East Boston,MA,02128,155885,"(42.386166, -71.00953)"
DRAGON CHEF CHINESE REST.,,,RU BANG CHEN PRES.,,21347,02/06/2012 10:55:13 AM,12/31/2016 11:59:00 PM,Active,FT,Eating & Drinking w/ Take Out,HE_NotReq,,,,,,,,,411  Washington St,Brighton,MA,02135,156051,"(42.349266, -71.15532)"
Erie Pub,,STENSON JOHN P TS,IRISH PUB INC,,18026,12/19/2011 11:29:24 AM,12/31/2016 11:59:00 PM,Active,FS,Eating & Drinking,HE_Fail,11/18/2015 01:29:28 PM,37-6-501.11-.12,*,Improper Maintenance of Walls/Ceilings,11/18/2015 01:29:28 PM,Fail,,Hood and Ventilation tags with a past expiration date of Aug. 2015. Address and provide up to date Tags for the re-inspection date. Referral being made to the City of Boston Fire Department for expired Tags.,791   Adams ST,Dorchester,MA,02124,975,"(42.28316, -71.05602)"
New York Fried Chicken,,HAZRAT KHAN,Syed Hakim Shah,,67392,12/19/2011 10:40:10 AM,12/31/2016 11:59:00 PM,Active,FT,Eating & Drinking w/ Take Out,HE_Filed,05/13/2015 03:43:29 PM,14-4-202.11,*,Food Contact Surfaces Design,05/13/2015 03:43:29 PM,Pass,2015-05-13 15:52:57,Wooden strainer in chicken replace with cleanable NSF grade equipment.,442   Blue Hill AV,Dorchester,MA,02121,156812,"(42.309591, -71.082238)"
Momogoose 2,,,Smart Gourmet LLC,Loc Vo,68113,12/14/2011 02:53:19 PM,12/31/2016 11:59:00 PM,Active,MFW,Mobile Food Walk On,HE_Pass,10/22/2015 01:10:41 PM,15-4-202.16,*,Non-Food Contact Surfaces,10/22/2015 01:10:41 PM,Pass,2015-10-22 15:49:35,Both refrigeration unit in disrepair .Units 51F and 47F Repair or replace.,1   Citywide ST,Boston,MA,02128,0,
Lucy Ethopian Cafe,,OMER HONCA,Netsanet B. Woldesenbet,,67739,02/21/2012 10:26:23 AM,12/31/2016 11:59:00 PM,Active,FS,Eating & Drinking,HE_Pass,09/30/2010 02:28:48 PM,05-4-302.12,*,Food Thermometers Provided,09/30/2010 02:28:48 PM,Pass,2010-09-30 15:32:56,provide metal stem cooks thermometer,334   Massachusetts AV,Boston,MA,02115,156790,"(42.34261, -71.084169)"
EL PENOL RESTAURANT,,,MIGUEL A. MEDINA BALBIN,,23581,12/29/2011 09:39:51 AM,12/31/2016 11:59:00 PM,Active,FS,Eating & Drinking,HE_Fail,01/07/2015 11:02:39 AM,20-4-703.11,***,Food Contact Surfaces Clean,01/07/2015 11:02:39 AM,Fail,,Correct sanitizer reading OPM to low temp dishwasher (50 ppm),54   Bennington ST,East Boston,MA,02128,156292,"(42.375798, -71.037101)"
FLOUR BAKERY & CAFE,,,JOANNE CHANG,,21518,01/26/2012 03:07:20 PM,12/31/2016 11:59:00 PM,Active,FT,Eating & Drinking w/ Take Out,HE_Pass,01/11/2012 12:52:01 PM,37-6-501.11-.12,*,Improper Maintenance of Walls/Ceilings,01/11/2012 12:52:01 PM,Pass,2012-01-12 09:08:47,walk in/clean dust from compressor fan cover,1595   Washington ST,Roxbury,MA,02114,157458,"(42.338323, -71.07488)"
Durgin Park Restaurant,,,Weinstein,Michael,24748,02/13/2012 11:17:17 AM,12/31/2016 11:59:00 PM,Active,FS,Eating & Drinking,HE_Fail,04/28/2011 10:37:52 AM,31-5-203.11,***,Number  Convenient,04/28/2011 10:37:52 AM,Fail,,Do not block handsink in main kitchen. Remove pots and pans stored in sink and keep open.,300  Faneuil Hall Marketplace,Boston,MA,02109,341035,"(42.360036, -71.056253)"
Aramark at Houghton Mifflin,,TWO TWENTY TWO BERKELEY,ARAMARK,C/O JARED LESSARD,24693,02/15/2012 01:55:00 PM,12/31/2016 11:59:00 PM,Active,FS,Eating & Drinking,HE_FailExt,03/13/2015 12:30:31 PM,14-4-202.11,*,Food Contact Surfaces Design,03/13/2015 12:30:31 PM,Fail,,resurface all worn white cutting boards,222   Berkeley ST,Boston,MA,02116,15007,"(42.35084, -71.07311)"
Masona Grill,,JOF REALTY LLC,Masona Inc.,,28939,01/18/2012 05:50:35 PM,12/31/2016 11:59:00 PM,Active,FS,Eating & Drinking,HE_Fail,04/12/2012 09:39:54 PM,23-4-602.13,*,Non-Food Contact Surfaces Clean,04/12/2012 09:39:54 PM,Fail,,clean area under dish machine.,2  Corey St,West Roxbury,MA,02132,42766,"(42.28468, -71.15523)"
Finagle A Bagel,,,FINALGE A BAGEL,ATTN: Human Resources,20653,12/15/2011 10:47:55 AM,12/31/2016 11:59:00 PM,Active,FT,Eating & Drinking w/ Take Out,HE_Pass,01/22/2008 10:43:52 AM,41-7-201/04.11,***,Separation/Sanitizer Criteria,01/22/2008 03:19:37 PM,Pass,2008-01-22 15:19:37,sanitizer at 3 bay sink 400+ PPM,275   Cambridge ST,Boston,MA,02114,155973,"(42.361357, -71.068227)"
DUNKIN DONUTS(STATION DONUTS),,,VICTORIANO SANTOS,,21146,02/13/2012 10:13:09 AM,12/31/2016 11:59:00 PM,Active,FT,Eating & Drinking w/ Take Out,HE_Pass,02/28/2014 09:57:46 AM,M-3-603.11,***,Consumer Advisories,02/28/2014 09:57:46 AM,Pass,2014-02-28 15:46:02,"ON THE DRIVE THRU MENU BOARDS ( 2 ) -PROVIDE - an ALLERGY AWARENESS  notice to read = BEFORE PLACING YOUR ORDER  PLEASE INFORM YOUR SERVER IF A PERSON IN YOUR PARTY HAS A FOOD ALLERGY---------------& INSIDE OF STORE -at time of inspection the allergy awareness notice is blocked by "" rewards program "" papers-correct-",4610   Washington ST,Roslindale,MA,02131,157298,"(42.275401, -71.139268)"
Durgin Park Restaurant,,,Weinstein,Michael,24748,02/13/2012 11:17:17 AM,12/31/2016 11:59:00 PM,Active,FS,Eating & Drinking,HE_Fail,09/11/2015 12:57:18 PM,M-2-103.11,***,PIC Performing Duties,09/11/2015 12:57:18 PM,Fail,,Employees not performing duties by not maintaining shellstock tags  ensure,300  Faneuil Hall Marketplace,Boston,MA,02109,341035,"(42.360036, -71.056253)"
WINDY CITY AT ADAMS VILLAGE,,BAYTURK MUZAFFER,BAYTURK MUZAFFER,,19800,02/13/2012 10:40:46 AM,12/31/2016 11:59:00 PM,Active,FT,Eating & Drinking w/ Take Out,HE_Fail,01/08/2014 12:08:42 PM,23-4-602.13,*,Non-Food Contact Surfaces Clean,01/08/2014 12:08:42 PM,Fail,,Interior of the 6 drawer under the grill cooler visibly soiled and with food debris. Clean to remove. Floor around the 3 bay sink with what appears to be rodent dropings. Clean to remove.,516   Gallivan BL,Dorchester,MA,02124,156552,"(42.282928, -71.055559)"
Hungry Traveler,,,Jisung Oh,,31164,01/17/2012 04:29:57 PM,12/31/2016 11:59:00 PM,Active,FS,Eating & Drinking,HE_Pass,05/15/2009 01:47:35 PM,15-4-202.16,*,Non-Food Contact Surfaces,05/15/2009 03:13:50 PM,Pass,2009-05-15 15:13:50,Basement. defrost reach in freezer.,27   COURT SQ SQ,BOSTON,MA,02108,,
Slush King,,,KIM NOLAN & MARK NOLAN,,19010,02/15/2012 09:42:58 AM,12/31/2016 11:59:00 PM,Active,FT,Eating & Drinking w/ Take Out,HE_FailExt,05/06/2011 02:19:22 PM,25-4-904.11,*,Single Service Articles Stored Dispensed,05/06/2011 02:19:22 PM,Pass,2011-05-09 08:24:57,Discard old plactic food containers as discussed,211   BENNINGTON,EAST BOSTON,MA,02128,,
NEW YORK FRIED CHICKEN & PIZZA,,AYAZ A. SHAH,AYAZ A. SHAH,,23286,05/02/2012 11:48:20 AM,12/31/2016 11:59:00 PM,Active,FT,Eating & Drinking w/ Take Out,HE_Pass,06/16/2014 12:33:53 PM,42-6-501.113/.114,*,Premises Maintained,06/16/2014 12:33:53 PM,Pass,2014-06-17 08:26:24,Remove all clutter from equipment storage area.,531   Columbia RD,Dorchester,MA,02125,156840,"(42.315432, -71.06626)"
Aramark at Houghton Mifflin,,TWO TWENTY TWO BERKELEY,ARAMARK,C/O JARED LESSARD,24693,02/15/2012 01:55:00 PM,12/31/2016 11:59:00 PM,Active,FS,Eating & Drinking,HE_Pass,09/26/2011 10:35:15 AM,35-6-501.111/.115,**,Insects  Rodents  Animals,09/26/2011 10:35:15 AM,Pass,2011-09-26 15:41:26,Large dead roach trapped on glueboard  remove and replace glueboard.,222   Berkeley ST,Boston,MA,02116,15007,"(42.35084, -71.07311)"
WAI'S STYLE RESTAURANT,,DAVID HUI: WAI'S STYLE RE,DAVID HUI: WAI'S STYLE RE,STAURANT,20355,01/06/2012 09:22:08 AM,12/31/2016 11:59:00 PM,Active,FS,Eating & Drinking,HE_Fail,08/01/2007 03:36:40 PM,03-3-501.16,***,Hot Holding,08/01/2007 03:46:55 PM,Fail,,,99   HARRISON  AV,BOSTON,MA,02111,,
Momogoose 2,,,Smart Gourmet LLC,Loc Vo,68113,12/14/2011 02:53:19 PM,12/31/2016 11:59:00 PM,Active,MFW,Mobile Food Walk On,HE_FailExt,05/31/2012 12:27:01 PM,27-5-103.11-.12,***,Hot and Cold Water,05/31/2012 12:27:01 PM,Pass,2012-06-01 08:28:08,At the onset of the inspection the cold water was not working at either the handsink or the three compartment sink.  An employee was able to fix the cold water and get it running but the hot water was over 165F and the cold water was 98F.  They were able to wash their hands with just the cold side of the water and adjust the heater to return the hot water to a more comfortable temperature.  Have a licensed plumber look at the sinks and make sure that they are working properly and train all the staff on how to setup the sinks to ensure that hands are being washed properly.,1   Citywide ST,Boston,MA,02128,0,
SULTAN'S KITCHEN,,STATE ENTERPRISES LIMITED PA,OZCAN OZAN,,22884,02/06/2012 10:58:13 AM,12/31/2016 11:59:00 PM,Active,FT,Eating & Drinking w/ Take Out,HE_Pass,03/16/2011 01:32:34 PM,17-4-302.14,*,Test Kit Provided,03/16/2011 01:32:34 PM,Pass,2011-03-18 08:38:43,Provide test kit for 3 compartment  sink sanitizer,112   State ST,Boston,MA,02109,130370,"(42.359299, -71.054864)"
NEW YORK FRIED CHICKEN & PIZZA,,AYAZ A. SHAH,AYAZ A. SHAH,,23286,05/02/2012 11:48:20 AM,12/31/2016 11:59:00 PM,Active,FT,Eating & Drinking w/ Take Out,HE_Filed,07/26/2011 11:39:44 AM,38-6-202.11,*,Fixture's not properly shielded,07/26/2011 11:39:44 AM,Pass,2011-07-27 08:11:46,Lights above dough machine not shielded. Provide.,531   Columbia RD,Dorchester,MA,02125,156840,"(42.315432, -71.06626)"
ZESTO'S PIZZA,,FOUR 60-468 CENTRE STREET,K & M Pizza Inc.,,75590,12/12/2011 12:47:41 PM,12/31/2016 11:59:00 PM,Active,FT,Eating & Drinking w/ Take Out,HE_Fail,01/08/2014 11:38:10 AM,23-4-602.13,*,Non-Food Contact Surfaces Clean,01/08/2014 11:38:10 AM,Fail,,Interior of small freezer on cookline soiled. Clean to remove. Wire shelf next to three bay sink visibly soiled. Clean to remove. Shelf above prep sink in basement visibly soiled. Clean to remove.,460   Centre ST,Jamaica Plain,MA,02130,28061,"(42.31935, -71.11154)"
PERKIN'S SQ DELI,,ONE 06 DORCHESTER ST LLC,FALLON,JAMES,18439,12/19/2011 10:37:47 AM,12/31/2016 11:59:00 PM,Active,FT,Eating & Drinking w/ Take Out,HE_Fail,01/07/2009 01:33:12 PM,17-4-302.14,*,Test Kit Provided,01/08/2009 08:19:05 AM,Fail,,1) no test strips to measure quatenary sanitizer  supply,106   Dorchester ST,South Boston,MA,02127,48839,"(42.3352, -71.04583)"
Dunkin' Donuts,,BARRY ASSOCS INC,JOSE S. COUTO,,19736,02/13/2012 10:14:41 AM,12/31/2016 11:59:00 PM,Active,FT,Eating & Drinking w/ Take Out,HE_Fail,05/05/2015 10:20:48 AM,03-3-501.16(A),***,Cold Holding,05/05/2015 10:20:48 AM,Fail,,Walk in and reach in refrigeration temperature between 45F and 50F. Keep door to walk in closed with curtains down. Reach in at front counter should have the lids closed when not in use. Monitor tokeep temperature at or below 41F. Temperature ok when I left.,7   Walk Hill ST,Jamaica Plain,MA,02130,141731,"(42.29556, -71.1161)"
Double Tree Club Hotel,,BOSTON REDEVELOPMENT AUTH,C.J. WASHINGTON STREET L.L.C.,,21472,03/09/2012 11:17:16 AM,12/31/2016 11:59:00 PM,Active,FS,Eating & Drinking,HE_Filed,05/18/2009 12:00:41 PM,33-5-501.13-.17,*,Adequate Number  Frequency Vermin Proof,05/19/2009 09:27:57 AM,Pass,2009-05-19 09:27:57,provide covers for all trash receptacles.,821    Washington ST,BOSTON,MA,02116,,
The Kitchen,,POCKEL JEANNE C TRSTS,Herritt,Scott,79722,06/13/2012 10:16:32 AM,12/31/2016 11:59:00 PM,Active,FS,Eating & Drinking,HE_Fail,03/19/2014 10:57:45 AM,34-5-501.111/.115,*,Outside Storage Improperly Maintained,03/19/2014 10:57:45 AM,Fail,,Remove all unused and unnecessary articles and debris from rear of establishment.,560   Tremont ST,Roxbury,MA,02118,137658,"(42.34363, -71.07176)"
ROSLINDALE HOUSE OF PIZZA,,,VASSILIOS GLYKIS,,19964,01/06/2012 10:23:12 AM,12/31/2016 11:59:00 PM,Active,FT,Eating & Drinking w/ Take Out,HE_Filed,12/01/2011 12:36:58 PM,36-6-501.11-.12,*,Improper Maintenance of Floors,12/01/2011 12:36:58 PM,Pass,2011-12-01 15:42:41,The floor and area around the mixer is soiled.  Clean to remove food debris.,4168   Washington ST,Roslindale,MA,02131,157416,"(42.287818, -71.126399)"
COPLEY PLAZA HOTEL,,DALEY,DALEY,JAMES,18878,02/21/2012 10:53:44 AM,12/31/2016 11:59:00 PM,Active,FS,Eating & Drinking,HE_Fail,02/03/2010 10:51:50 AM,03-3-501.14,***,Cooling,02/03/2010 10:51:50 AM,Fail,,1) products at employee cafeteria cold line not cooled properly to 41f or below before service  ensure proper cooling procedures are followed,138   ST JAMES  AV,BOSTON,MA,02116,,
Happy Garden,,,Brighton Ventures Inc.,,24662,01/31/2012 01:17:53 PM,12/31/2016 11:59:00 PM,Active,FT,Eating & Drinking w/ Take Out,HE_Fail,01/10/2014 12:02:02 PM,41-7-201/04.11,***,Separation/Sanitizer Criteria,01/10/2014 12:02:02 PM,Fail,,They are using regular bleach. Provide commercial grade bleach to properly sanitize equipment.,377   Washington ST,Brighton,MA,02135,156389,"(42.349291, -71.15428)"
WAI WAI ICE CREAM SHOP,,WONG SHU YING TRSTS,HUI,DAVID,24990,01/06/2012 09:20:52 AM,12/31/2016 11:59:00 PM,Active,FS,Eating & Drinking,HE_Fail,01/26/2015 10:10:47 AM,17-4-204.112/.115,*,Equipment Thermometers,01/26/2015 10:10:47 AM,Fail,,Broken refrigeration thermometer.,26   Oxford ST,Boston,MA,02111,106209,"(42.35168, -71.06027)"
Regina Pizza of Allston,,,Regina Pizza of Allston L L C,,68183,01/31/2012 02:16:51 PM,12/31/2016 11:59:00 PM,Active,FS,Eating & Drinking,HE_Fail,10/06/2014 02:35:48 PM,17-4-204.112/.115,*,Equipment Thermometers,10/06/2014 02:35:48 PM,Fail,,The gauge on the high temperature dishwasher is not moving.  Repair.,353   Cambridge ST,Brighton,MA,02134,157036,"(42.356111, -71.132629)"
Aramark at Houghton Mifflin,,TWO TWENTY TWO BERKELEY,ARAMARK,C/O JARED LESSARD,24693,02/15/2012 01:55:00 PM,12/31/2016 11:59:00 PM,Active,FS,Eating & Drinking,HE_Pass,01/27/2010 01:08:22 PM,23-4-602.13,*,Non-Food Contact Surfaces Clean,01/27/2010 01:08:22 PM,Pass,2010-01-28 08:02:29,1) carbon build up on interior of top convection oven  clean to remove 2) vents with dust build up  clean to remove,222   Berkeley ST,Boston,MA,02116,15007,"(42.35084, -71.07311)"
Finagle A Bagel,,,FINALGE A BAGEL,ATTN: Human Resources,20653,12/15/2011 10:47:55 AM,12/31/2016 11:59:00 PM,Active,FT,Eating & Drinking w/ Take Out,HE_Fail,12/27/2007 11:10:25 AM,20-4-703.11,***,Food Contact Surfaces Clean,12/28/2007 08:48:13 AM,Fail,,Quats at 3 bay sink 100 ppm.,275   Cambridge ST,Boston,MA,02114,155973,"(42.361357, -71.068227)"
DRAGON CHEF CHINESE REST.,,,RU BANG CHEN PRES.,,21347,02/06/2012 10:55:13 AM,12/31/2016 11:59:00 PM,Active,FT,Eating & Drinking w/ Take Out,HE_Fail,10/03/2014 05:24:51 PM,32-6-301.11-02.11,*,Hand Cleaner  Drying  Tissue Signage,10/03/2014 05:24:51 PM,Fail,,provide hand soap for all hand sinks.Also clean exterior of hand sink and keep sink clean,411  Washington St,Brighton,MA,02135,156051,"(42.349266, -71.15532)"
ODYSSEY CRUISES,,MASS BAY LINES INC. FREEDOM,ODYSSEY CRUISES PREMIER YACHTS INC.,,24485,02/01/2012 03:02:49 PM,12/31/2016 11:59:00 PM,Active,FS,Eating & Drinking,HE_Fail,07/12/2013 11:35:16 AM,30-5-203.14,**,Cross Connection Back Siphonage  Backflow,07/12/2013 11:35:16 AM,Fail,,There is a hose hooked up in the kitchen without a easily identifiable backflow preventer.  Provide.,60  Rowes Wh,Boston,MA,02110,156112,"(42.356532, -71.050251)"
Boston Globe Cafeteria,,FLIK INTERNATIONAL CORP.,FLIK INTERNATIONAL CORP.,Compass Group,26254,02/06/2012 08:00:29 AM,12/31/2016 11:59:00 PM,Active,FS,Eating & Drinking,HE_FailExt,09/17/2009 01:47:19 PM,29-5-201/02.11,*,Installed and Maintained,09/18/2009 08:27:38 AM,Fail,,Womens toilet not flushing properly. Address.,135   William T Morrissey BL,Dorchester,MA,02125,156975,"(42.315997, -71.049211)"
DAVIO'S,,DIFILLIPO STEVE PRESIDENT,DIFILLIPO STEVE,PRESIDENT,22316,01/04/2012 07:16:36 PM,12/31/2016 11:59:00 PM,Active,FS,Eating & Drinking,HE_Pass,12/04/2015 11:19:25 AM,17-4-204.112/.115,*,Equipment Thermometers,12/04/2015 11:19:25 AM,Pass,2015-12-04 15:46:02,Provide working internal thermometers for all refrigeration units.,75   Arlington ST,Boston,MA,02117,156164,"(42.350682, -71.070358)"
NEW YORK FRIED CHICKEN & PIZZA,,AYAZ A. SHAH,AYAZ A. SHAH,,23286,05/02/2012 11:48:20 AM,12/31/2016 11:59:00 PM,Active,FT,Eating & Drinking w/ Take Out,HE_Fail,07/30/2008 01:55:09 PM,36-6-501.11-.12,*,Improper Maintenance of Floors,07/30/2008 03:36:57 PM,Fail,,Floors of walk-in visibly soiled with chicken juice and food debris. Clean to remove.,531   Columbia RD,Dorchester,MA,02125,156840,"(42.315432, -71.06626)"
Mehak Restaurant,,DE PASQUALE RONALD,Akram,Mohammad,33626,02/29/2012 12:55:00 PM,12/31/2016 11:59:00 PM,Active,FS,Eating & Drinking,HE_Fail,04/08/2010 11:24:26 AM,15-4-202.16,*,Non-Food Contact Surfaces,04/08/2010 11:24:26 AM,Fail,,Remove mop sink located in between the handsink and the three bay sink in the kitchen area..Agreed plans had it downstairs but during construction P.I.C. realized there was no drainage and the owner of the building would not allow him to break ground Use of toilet has been O.K .by Tom Coffill,329   Sumner ST,East Boston,MA,02128,132398,"(42.36711, -71.03607)"
MCKENNA'S CAFE,,KENNETH OSHEROW  PRES.,KENNETH OSHEROW PRES.,,23628,12/28/2011 09:11:33 AM,12/31/2016 11:59:00 PM,Active,FS,Eating & Drinking,HE_Fail,09/14/2011 11:58:27 AM,33-5-501.13-.17,*,Adequate Number  Frequency Vermin Proof,09/14/2011 11:58:27 AM,Fail,,Trash recepticales in kitchen area with no lids. Provide in between busy periods to limit any rodent activity.,109   Savin Hill AV,Dorchester,MA,02125,156864,"(42.311515, -71.05382)"
SPIKE'S JUNKYARD DOGS,,DAVID GETTLEMAN  PRES.,DAVID GETTLEMAN PRES.,,22315,01/05/2012 12:55:56 PM,12/31/2016 11:59:00 PM,Active,FT,Eating & Drinking w/ Take Out,HE_Fail,08/14/2007 03:04:33 PM,34-5-501.111/.115,*,Outside Storage Improperly Maintained,08/14/2007 03:15:16 PM,Fail,,Dumpster cover has been chewed by rodents  replace.,108   Brighton AV,Allston,MA,02134,157936,"(42.352564, -71.130371)"
MCKENNA'S CAFE,,KENNETH OSHEROW  PRES.,KENNETH OSHEROW PRES.,,23628,12/28/2011 09:11:33 AM,12/31/2016 11:59:00 PM,Active,FS,Eating & Drinking,HE_Fail,03/11/2013 11:15:15 AM,08-3-302.11/3-304.11,***,Separation  Segregation Cross Contamination,03/11/2013 11:15:15 AM,Fail,,Raw chicken stored next to raw whole eggs  pork stored next to potato salad  container of cream cheese stored on top of tomatos. Discontinue and store properly.,109   Savin Hill AV,Dorchester,MA,02125,156864,"(42.311515, -71.05382)"
Tri Seafood Restaurant,,,Tri Seafood Restaurant Inc.,Tri Pham,145855,07/02/2015 10:22:40 AM,12/31/2016 11:59:00 PM,Active,FT,Eating & Drinking w/ Take Out,HE_Filed,09/25/2015 10:11:03 AM,01-3-202.18,**,Shellstock ID,09/25/2015 10:11:03 AM,Pass,2015-09-29 08:41:25,No shellstock tags available at the time of the inspection for live clams. Provide and maintain a minimum of 90 days.,1616   Dorchester AV,Dorchester,MA,02122,48361,"(42.2954, -71.06139)"
Beth Isreal Deaconess,,BETH ISRAEL DEACONESS,SODEXO OPERATIONS L L C,,26033,02/13/2012 10:14:16 AM,12/31/2016 11:59:00 PM,Active,FS,Eating & Drinking,HE_Pass,12/19/2012 01:04:04 PM,,,,,,,,330   Brookline AV,Boston,MA,02115,22096,"(42.33982, -71.10568)"
Uno Chicago Grill,,SPENCER AARONN D,UNO RESTAURANTS,LLC  LEGAL DEPARTMENT,18958,01/09/2012 03:53:57 PM,12/31/2016 11:59:00 PM,Active,FT,Eating & Drinking w/ Take Out,HE_Pass,10/17/2007 10:33:22 AM,31-5-204/05.11,***,Location  Accessible,10/17/2007 03:01:51 PM,Pass,2007-10-17 15:01:51,Maintain hand Sinks free of utensils. Restricted use.,727   Boylston ST,Boston,MA,02116,18385,"(42.349589, -71.080292)"
Slush King,,,KIM NOLAN & MARK NOLAN,,19010,02/15/2012 09:42:58 AM,12/31/2016 11:59:00 PM,Active,FT,Eating & Drinking w/ Take Out,HE_FailExt,05/06/2011 02:19:22 PM,32-6-301.11-02.11,*,Hand Cleaner  Drying  Tissue Signage,05/06/2011 02:19:22 PM,Pass,2011-05-09 08:24:57,Provide soap and paper towels for restroom,211   BENNINGTON,EAST BOSTON,MA,02128,,
Lean & Green Gourmet,,,Logan Currito  LLC,,33851,12/22/2011 12:07:35 PM,12/31/2016 11:59:00 PM,Active,FT,Eating & Drinking w/ Take Out,HE_Pass,10/20/2014 01:17:25 PM,,,,,,,,300   LOGAN AIRPORT TRMNL C,EAST BOSTON,MA,02128,,
Double Tree Club Hotel,,BOSTON REDEVELOPMENT AUTH,C.J. WASHINGTON STREET L.L.C.,,21472,03/09/2012 11:17:16 AM,12/31/2016 11:59:00 PM,Active,FS,Eating & Drinking,HE_Fail,10/19/2011 10:08:33 AM,17-4-204.112/.115,*,Equipment Thermometers,10/19/2011 10:08:33 AM,Fail,,Provide visible thermometers where necessary.,821    Washington ST,BOSTON,MA,02116,,
West Napoli Pizza,,VRATTOS SOCRATES TS,BARDHI,SOKOL,21409,06/06/2012 03:38:02 PM,12/31/2016 11:59:00 PM,Active,FT,Eating & Drinking w/ Take Out,HE_Pass,08/21/2007 10:53:02 AM,23-4-602.13,*,Non-Food Contact Surfaces Clean,08/21/2007 02:15:07 PM,Pass,2007-08-21 14:15:07,Portable air-fans dirty.,1946  Centre St,West Roxbury,MA,02132,27764,"(42.28358, -71.15676)"
Anshur Restauruant,,REARDON THOMAS B,Anshur,Abdullah F.,31241,02/08/2012 03:13:24 PM,12/31/2016 11:59:00 PM,Active,FT,Eating & Drinking w/ Take Out,HE_Fail,10/02/2015 12:32:05 PM,32-6-501.11-.12/6-202.14,*,Toilet Enclosed Clean,10/02/2015 12:32:05 PM,Fail,,post employee handwash signage  papertowels /handsoap...,291   Roxbury ST,Roxbury,MA,02119,119179,"(42.33041, -71.0943)"
J J Foley's Cafe,,FOLEY JEREMIAH,J J Foley's Cafe,Inc.,27092,01/31/2012 06:21:48 PM,12/31/2016 11:59:00 PM,Active,FS,Eating & Drinking,HE_Filed,01/07/2010 11:51:49 AM,14-4-202.11,*,Food Contact Surfaces Design,01/07/2010 11:51:49 AM,Pass,2010-01-08 07:06:43,Replace cutting boards  scored   Replace chipped china,117   EAST BERKELEY,BOSTON,MA,02118,,
Guckenheimer @ B.R.E. @ Blue Glass Cafe,,ONE HUNDRED & 200 CLARENDON,Guckenheimer Services LLC,Attn: Accounting Manager,22383,01/10/2012 12:41:15 PM,12/31/2016 11:59:00 PM,Active,FS,Eating & Drinking,HE_Pass,01/28/2013 02:29:58 PM,08-3-302.11/3-304.11,***,Separation  Segregation Cross Contamination,01/28/2013 02:29:58 PM,Pass,2013-01-29 07:54:05,Raw tuna stored over rady to eat foods  store raw products below ready to eat foods,200   Clarendon ST,Boston,MA,02116,33209,"(42.34921, -71.07513)"
SEAPORT ELITE I I,,WATERMARK DONUT COMPANY,SPIRIT CRUISES LLC,,23063,02/01/2012 03:00:30 PM,12/31/2016 11:59:00 PM,Active,FS,Eating & Drinking,HE_Pass,07/30/2014 12:45:13 PM,17-4-302.14,*,Test Kit Provided,07/30/2014 12:45:13 PM,Pass,2014-07-30 15:24:16,provide test kit for the dish machine in the kitchen area.,200   SEAPORT LA,BOSTON,MA,02210,,
NEW YORK FRIED CHICKEN & PIZZA,,AYAZ A. SHAH,AYAZ A. SHAH,,23286,05/02/2012 11:48:20 AM,12/31/2016 11:59:00 PM,Active,FT,Eating & Drinking w/ Take Out,HE_Fail,07/12/2011 10:22:45 AM,24-4-903.11,*,Clean Equipment & Utensils Storage,07/12/2011 10:22:45 AM,Fail,,Knives being left out on soiledcounter tops. Discontinue and store all equipment clean and protected.,531   Columbia RD,Dorchester,MA,02125,156840,"(42.315432, -71.06626)"
Country Kitchen,,AMINPOUR AMIR,Arleen Campbell,,32027,01/05/2012 08:42:50 AM,12/31/2016 11:59:00 PM,Active,FS,Eating & Drinking,HE_FailExt,04/16/2013 11:10:13 AM,39-6-304.11,*,Rooms and Equipment Vented,04/16/2013 11:10:13 AM,Fail,,hood needs to be inspected - asap,830   Blue Hill AV,Dorchester,MA,02124,16567,"(42.29621, -71.08718)"
Uno Chicago Grill,,NICOLE E. ADAMS,NICOLE E. ADAMS,,19118,01/09/2012 03:55:20 PM,12/31/2016 11:59:00 PM,Active,FT,Eating & Drinking w/ Take Out,HE_NotReq,01/05/2015 09:10:00 AM,,,,,,,,270   HUNTINGTON  AV,BOSTON,MA,02125,,
Anshur Restauruant,,REARDON THOMAS B,Anshur,Abdullah F.,31241,02/08/2012 03:13:24 PM,12/31/2016 11:59:00 PM,Active,FT,Eating & Drinking w/ Take Out,HE_Pass,04/06/2010 11:47:05 AM,36-6-501.11-.12,*,Improper Maintenance of Floors,04/06/2010 11:47:05 AM,Pass,2010-04-06 15:37:29,Repair floor  paint chipping.,291   Roxbury ST,Roxbury,MA,02119,119179,"(42.33041, -71.0943)"
FLOUR BAKERY & CAFE,,,JOANNE CHANG,,21518,01/26/2012 03:07:20 PM,12/31/2016 11:59:00 PM,Active,FT,Eating & Drinking w/ Take Out,HE_FailExt,01/16/2015 02:49:28 PM,08-3-305-307.11,*,Food Protection,01/16/2015 02:49:28 PM,Fail,,cover all foods in freezer and reachins...relocate blast chiller and Ice machine from dock/delivery area...discontinue storing foods in dock/delivery area....,1595   Washington ST,Roxbury,MA,02114,157458,"(42.338323, -71.07488)"
BRIGHAM & WOMENS FAULKNER HOSPITAL,,,Susan Langill,Food Serv. Dir.,18286,02/15/2012 09:39:45 AM,12/31/2016 11:59:00 PM,Active,FS,Eating & Drinking,HE_Fail,,36-6-201.11,*,Floors Designed Constructed Installed,03/06/2007 01:24:00 PM,,,Clean floor under around equipment - Dry storage,1153   CENTRE,JAMAICA PLAIN,MA,02130,,
UPTOWN CAFE,,,GARY FORZIATI,,23109,12/14/2011 11:10:59 AM,12/31/2016 11:59:00 PM,Active,FT,Eating & Drinking w/ Take Out,HE_Fail,05/14/2013 02:18:34 PM,35-6-501.111/.115,**,Insects  Rodents  Animals,05/14/2013 02:18:34 PM,Fail,,Evidence of rodent droppings - provide intergrated pest management report and full extermination prior reinspection.,116   CAMBRIDGE,BOSTON,MA,02114,,
DUNKIN DONUTS(STATION DONUTS),,,VICTORIANO SANTOS,,21146,02/13/2012 10:13:09 AM,12/31/2016 11:59:00 PM,Active,FT,Eating & Drinking w/ Take Out,HE_Fail,03/12/2008 01:55:50 PM,31-5-204/05.11,***,Location  Accessible,03/19/2008 08:26:38 AM,Fail,,Employee storage bins and clothes blocking hand sink. Remove items. Remove machine brushes used for cleaning food dispensing units. Store properly,4610   Washington ST,Roslindale,MA,02131,157298,"(42.275401, -71.139268)"
Grille 705,,SEVEN-05 MASSACHUSETTS AVE,Antreassian,Sarkis,28817,01/31/2012 10:52:38 AM,12/31/2016 11:59:00 PM,Active,FT,Eating & Drinking w/ Take Out,HE_Fail,05/21/2009 10:17:14 AM,23-4-602.13,*,Non-Food Contact Surfaces Clean,05/21/2009 03:01:55 PM,Fail,,clean all condiment shelving,705    Massachusetts AV,BOSTON,MA,02118,,
Brighams & Womens Hospital - Tower Cafe,,AU BON PAIN CO  INC. #508 (LAURA),Langill BWH CFSD,Susan,18544,02/08/2012 05:33:24 PM,12/31/2016 11:59:00 PM,Active,FS,Eating & Drinking,HE_Filed,09/11/2008 10:30:51 AM,15-4-202.16,*,Non-Food Contact Surfaces,09/12/2008 08:29:28 AM,Pass,2008-09-12 08:29:28,Properly repair torn door gasket on 2 Door food warmer unit.,75   FRANCIS ST,Boston,MA,02115,158148,"(42.336106, -71.10748)"
Masona Grill,,JOF REALTY LLC,Masona Inc.,,28939,01/18/2012 05:50:35 PM,12/31/2016 11:59:00 PM,Active,FS,Eating & Drinking,HE_Pass,09/30/2013 10:52:46 AM,16-4-501.11/.15,*,Dishwashng Facilities,09/30/2013 10:52:46 AM,Pass,2013-09-30 15:42:38,basement/3 bay sink/provide proper drain plugs and set up of sink,2  Corey St,West Roxbury,MA,02132,42766,"(42.28468, -71.15523)"
Lean & Green Gourmet,,,Logan Currito  LLC,,33851,12/22/2011 12:07:35 PM,12/31/2016 11:59:00 PM,Active,FT,Eating & Drinking w/ Take Out,HE_Fail,10/05/2012 12:02:03 PM,01-3-602.11 B2,***,Labeling of Ingredients,10/05/2012 12:02:03 PM,Fail,,Labels on the muffins are incomplete - no ingredient / allergen information. Provide Small  containers of granola with no labels - provide,300   LOGAN AIRPORT TRMNL C,EAST BOSTON,MA,02128,,
Panera Bread,,,Boston Bread LLc,Attn: Lori Engel,26330,01/18/2012 04:43:59 PM,12/31/2016 11:59:00 PM,Active,FS,Eating & Drinking,HE_Fail,06/05/2008 10:37:09 AM,08-3-305-307.11,*,Food Protection,06/06/2008 09:00:44 AM,Fail,,"Keep all supplies 6"" off of floor",200   High ST,Boston,Ma,02110,,
UPTOWN CAFE,,,GARY FORZIATI,,23109,12/14/2011 11:10:59 AM,12/31/2016 11:59:00 PM,Active,FT,Eating & Drinking w/ Take Out,HE_Filed,05/29/2013 10:56:32 AM,23-4-602.13,*,Non-Food Contact Surfaces Clean,05/29/2013 10:56:32 AM,Pass,2013-05-29 15:09:20,Heavy built up grease  food particles and soils on cooking equipment  refrigeration units  shelving - Clean thoroughly to remove all soils.,116   CAMBRIDGE,BOSTON,MA,02114,,
LOLLICUP TEA ZONE,,PETER LUU  PRES.,LONG JIANG,,22229,02/14/2012 12:48:34 PM,12/31/2016 11:59:00 PM,Active,FT,Eating & Drinking w/ Take Out,HE_FailExt,03/01/2012 02:10:32 PM,37-6-501.11-.12,*,Improper Maintenance of Walls/Ceilings,03/01/2012 02:10:32 PM,Fail,,Wall next to fryer with heavu soils. Side of fryer with excess grease build-up. Clean to remove.,1   Brighton AV,Allston,MA,02134,157732,"(42.352411, -71.125329)"
Burger King,,,MASTORAN CORP.,,19935,12/16/2011 09:50:24 AM,12/31/2016 11:59:00 PM,Active,FT,Eating & Drinking w/ Take Out,HE_Pass,03/19/2009 01:15:30 PM,37-6-501.11-.12,*,Improper Maintenance of Walls/Ceilings,03/19/2009 03:29:48 PM,Pass,2009-03-19 15:29:48,Wall beside self service soda  machine is heavily soiled. Clean to remove all visible soils.,944   Bennington ST,East Boston,MA,02128,155885,"(42.386166, -71.00953)"
Happy Garden,,,Brighton Ventures Inc.,,24662,01/31/2012 01:17:53 PM,12/31/2016 11:59:00 PM,Active,FT,Eating & Drinking w/ Take Out,HE_Fail,01/06/2015 12:03:38 PM,31-5-204/05.11,***,Location  Accessible,01/06/2015 12:03:38 PM,Fail,,The brooms and trash barrel are blocking the handwash sink in the front.  Provide access to handsink.,377   Washington ST,Brighton,MA,02135,156389,"(42.349291, -71.15428)"
J P House of Pizza,,KAHN LEO TRSTS,Katsinis,George,85008,01/03/2013 03:01:12 PM,12/31/2016 11:59:00 PM,Active,FT,Eating & Drinking w/ Take Out,HE_Fail,05/02/2014 01:36:15 PM,13-2-304/402.11,*,Clean Cloths  Hair Restraint,05/02/2014 01:36:15 PM,Fail,,Provide hair restraints for staff working in kitchen and prep areas.,775   Centre ST,Jamaica Plain,MA,02130,28202,"(42.31006, -71.11548)"
Anshur Restauruant,,REARDON THOMAS B,Anshur,Abdullah F.,31241,02/08/2012 03:13:24 PM,12/31/2016 11:59:00 PM,Active,FT,Eating & Drinking w/ Take Out,HE_FailExt,10/30/2012 02:27:19 PM,16-4-501.11/.15,*,Dishwashng Facilities,10/30/2012 02:27:19 PM,Fail,,repair low temp dishwasher,291   Roxbury ST,Roxbury,MA,02119,119179,"(42.33041, -71.0943)"
Country Kitchen,,AMINPOUR AMIR,Arleen Campbell,,32027,01/05/2012 08:42:50 AM,12/31/2016 11:59:00 PM,Active,FS,Eating & Drinking,HE_Fail,12/04/2015 10:46:12 AM,08-3-305-307.11,*,Food Protection,12/04/2015 10:46:12 AM,Fail,,Raw chicken being stored above fish in kitchen reach in unit. Store properly.,830   Blue Hill AV,Dorchester,MA,02124,16567,"(42.29621, -71.08718)"
BUKHARA INDIAN BISTRO,,BRUCE THERESA,AMRIK SINGH PABLA,,21016,01/12/2012 03:33:18 PM,12/31/2016 11:59:00 PM,Active,FS,Eating & Drinking,HE_Pass,10/14/2008 10:17:26 AM,21-3-304.14,*,Wiping Cloths  Clean  Sanitize,10/14/2008 03:27:14 PM,Pass,2008-10-14 15:27:14,store all wipings cloths properly  not on food contact surfaces,701   Centre ST,Jamaica Plain,MA,02130,28172,"(42.31159, -71.11461)"
Dosa Factory,,,Pabla,Jaswiner,138037,01/21/2015 11:05:29 AM,12/31/2016 11:59:00 PM,Active,FS,Eating & Drinking,HE_Hearing,07/10/2015 02:40:39 PM,35-6-501.111/.115,**,Insects  Rodents  Animals,07/10/2015 02:40:39 PM,Fail,,Large amount of fruit flies on walls outside of rest room.PIC will address with pest control company.Provide current IPM report upon re-inspection,316   Newbury ST,Boston,MA,02115,168065,"(42.34862, -71.085413)"
Uno Chicago Grill,,NICOLE E. ADAMS,NICOLE E. ADAMS,,19118,01/09/2012 03:55:20 PM,12/31/2016 11:59:00 PM,Active,FT,Eating & Drinking w/ Take Out,HE_Pass,04/28/2011 12:15:46 PM,42-6-501.113/.114,*,Premises Maintained,04/28/2011 12:15:46 PM,Pass,2011-04-29 08:41:41,clean/organize locker soda area clean/organize chemical room,270   HUNTINGTON  AV,BOSTON,MA,02125,,
Dunkin Donuts,,COUTO JOSE S.,JOSE S. COUTO PRES.,C/O COUTO MANAGEMENT,18326,02/13/2012 10:07:55 AM,12/31/2016 11:59:00 PM,Active,FT,Eating & Drinking w/ Take Out,HE_Fail,06/21/2013 03:31:44 PM,15-4-202.16,*,Non-Food Contact Surfaces,06/21/2013 03:31:44 PM,Fail,,replace all cracked coffee plastic containers...,4175   WASHINGTON,ROSLINDALE,MA,02131,,
NEW YORK FRIED CHICKEN & PIZZA,,AYAZ A. SHAH,AYAZ A. SHAH,,23286,05/02/2012 11:48:20 AM,12/31/2016 11:59:00 PM,Active,FT,Eating & Drinking w/ Take Out,HE_Fail,07/22/2015 12:19:07 PM,23-4-602.13,*,Non-Food Contact Surfaces Clean,07/22/2015 12:19:07 PM,Fail,,Clean top and side of pizza oven and grill to remove grease soil.,531   Columbia RD,Dorchester,MA,02125,156840,"(42.315432, -71.06626)"
Brighams & Womens Hospital - Tower Cafe,,AU BON PAIN CO  INC. #508 (LAURA),Langill BWH CFSD,Susan,18544,02/08/2012 05:33:24 PM,12/31/2016 11:59:00 PM,Active,FS,Eating & Drinking,HE_Fail,08/24/2011 10:06:46 AM,37-6-501.11-.12,*,Improper Maintenance of Walls/Ceilings,08/24/2011 10:06:46 AM,Fail,,kitchen/dishroom/mop closet/replace worn/missing ceiling tiles,75   FRANCIS ST,Boston,MA,02115,158148,"(42.336106, -71.10748)"
COPLEY PLAZA HOTEL,,DALEY,DALEY,JAMES,18878,02/21/2012 10:53:44 AM,12/31/2016 11:59:00 PM,Active,FS,Eating & Drinking,HE_Fail,08/05/2014 10:48:40 AM,22-4-601/602.11,**,Food Contact Surfaces Clean,08/05/2014 10:48:40 AM,Fail,,main kitchen/clean interior of ice machine oak kitchen storage/clean interior of ice machine,138   ST JAMES  AV,BOSTON,MA,02116,,
DUNKIN' DONUTS (LEGION DONUTS),,JOSE S. COUTO,JOSE S. COUTO,,21027,02/13/2012 10:11:05 AM,12/31/2016 11:59:00 PM,Active,FT,Eating & Drinking w/ Take Out,HE_FailExt,04/16/2015 02:37:04 PM,23-4-602.13,*,Non-Food Contact Surfaces Clean,04/16/2015 02:37:04 PM,Fail,,Interior of front cabinets shelves at front and drive thur window. Clean interior of four door reach-in by front counter. Clean interior and exterior of refrigertors and dounut case and shelve at front counter.,684   American Legion HW,Roslindale,MA,02131,156647,"(42.283596, -71.112514)"
PARKWAY LITTLE LEAGUE STAND,,,PARKWAY LITTLE LEAGUE INC.,,26023,03/19/2012 08:30:43 AM,12/31/2016 11:59:00 PM,Active,FS,Eating & Drinking,HE_Fail,06/04/2012 02:05:25 PM,33-5-501.13-.17,*,Adequate Number  Frequency Vermin Proof,06/04/2012 02:05:25 PM,Fail,,provide covers as needed..,315   BAKER ST,WEST ROXBURY,MA,02132,,
Dunkin Donuts,,COUTO JOSE S.,JOSE S. COUTO PRES.,C/O COUTO MANAGEMENT,18326,02/13/2012 10:07:55 AM,12/31/2016 11:59:00 PM,Active,FT,Eating & Drinking w/ Take Out,HE_Fail,02/01/2011 11:08:20 AM,03-3-501.16(A),***,Cold Holding,02/01/2011 11:08:20 AM,Fail,,American cheese holding at 46-47F in refridge.,4175   WASHINGTON,ROSLINDALE,MA,02131,,
Burger King,,,MASTORAN CORP.,,19935,12/16/2011 09:50:24 AM,12/31/2016 11:59:00 PM,Active,FT,Eating & Drinking w/ Take Out,HE_Fail,09/08/2009 12:21:24 PM,14-4-202.11,*,Food Contact Surfaces Design,09/09/2009 08:14:27 AM,Fail,,Soda unit in disrepair. Leaking per PIC. Provide a report for service and proper operation.,944   Bennington ST,East Boston,MA,02128,155885,"(42.386166, -71.00953)"
Anshur Restauruant,,REARDON THOMAS B,Anshur,Abdullah F.,31241,02/08/2012 03:13:24 PM,12/31/2016 11:59:00 PM,Active,FT,Eating & Drinking w/ Take Out,HE_Fail,03/05/2009 11:53:11 AM,29-5-201/02.11,*,Installed and Maintained,03/05/2009 03:24:10 PM,Fail,,ladies restroom/repair clogged toilet,291   Roxbury ST,Roxbury,MA,02119,119179,"(42.33041, -71.0943)"
Ziti's Express,,LAMBERT GREGORY,Tremont Street Burger L L C,,67693,12/19/2011 01:53:23 PM,12/31/2016 11:59:00 PM,Active,FS,Eating & Drinking,HE_Fail,07/15/2011 10:43:11 AM,21-3-304.14,*,Wiping Cloths  Clean  Sanitize,07/15/2011 10:43:11 AM,Fail,,Keep wiping cloths in sanitizer,140   Tremont ST,Boston,MA,02111,156397,"(42.355646, -71.062559)"
Mattapan House of Pizza,,FETFATSIDIS SIMON,Isidoros Poulopoulos,,78448,04/04/2012 10:27:46 AM,12/31/2016 11:59:00 PM,Active,FT,Eating & Drinking w/ Take Out,HE_Pass,06/11/2013 02:10:02 PM,36-6-501.11-.12,*,Improper Maintenance of Floors,06/11/2013 02:10:02 PM,Pass,2013-06-12 09:16:26,floor soiled behind freezer unit  clean. Foods frozen solid -ok.,1621   Blue Hill AV,Mattapan,MA,02126,155684,"(42.268453, -71.094131)"
DAYIB CAFE,,ABDULLAH FARAH ANSHUR,ABDULLAH FARAH ANSHUR,,22700,02/13/2012 12:56:03 PM,12/31/2016 11:59:00 PM,Active,FT,Eating & Drinking w/ Take Out,HE_Filed,03/26/2013 12:32:19 PM,20-4-703.11,***,Food Contact Surfaces Clean,03/26/2013 12:32:19 PM,Pass,2013-03-26 15:12:41,3 bay sink/provide institutional sanitizer,722   Shawmut AV,Roxbury,MA,02119,157649,"(42.332783, -71.083221)"
Spirit of Boston,,SPIRIT CRUISES LLC,SPIRIT CRUISES LLC,,18739,02/01/2012 02:57:48 PM,12/31/2016 11:59:00 PM,Active,FS,Eating & Drinking,HE_Pass,07/30/2014 11:55:58 AM,37-6-201.11,*,Walls/Ceilings Designed Constructed Installed,07/30/2014 11:55:58 AM,Pass,2014-07-30 15:24:16,replace out of place ceiling tiles on ceiling of kitchen. replace broken light shield covers to light fixtures. clean light shield covers to light fixtures,200   SEAPORT LA,BOSTON,MA,02210,,
Zo,,STEVEN KRAVETZ  C. F. O.,Andy Kolokythas,,33151,02/28/2012 09:28:42 AM,12/31/2016 11:59:00 PM,Active,FT,Eating & Drinking w/ Take Out,HE_Fail,01/28/2014 11:45:15 AM,M-2-103.11,***,PIC Performing Duties,01/28/2014 11:45:15 AM,Fail,,m- 8-303.20. Health Permit for 2014 has not been paid  ensure payment,3   CENTER PLAZA,BOSTON,MA,02109,,
Honey Dew Donuts,,MASSARO,De Maria Inc.,,75541,02/06/2012 09:11:25 AM,12/31/2016 11:59:00 PM,Active,FT,Eating & Drinking w/ Take Out,HE_Hearing,02/03/2012 12:08:08 PM,31-5-203.11,***,Number  Convenient,02/03/2012 12:08:08 PM,Fail,,provide properly designated hand sink for the 3 compartment sink area in back room. Employees should be able to wash hands without using restroom hand sink or using hand sink at service counter.,14   Maverick SQ,East Boston,MA,02128,157627,"(42.369388, -71.03982)"
JOHN B. HYNES VET. MEM. CTR.,,MASSACHUSETTS CONVENTION,Levy Premium Foodservice Ltd.,Mitch Phelps,68081,12/13/2011 04:12:44 PM,12/31/2016 11:59:00 PM,Active,FS,Eating & Drinking,HE_Pass,01/10/2012 11:12:07 AM,,,,,,,,880   Boylston ST,Boston,MA,02116,18415,"(42.34753, -71.08411)"
Tavolo,,,Trinity Ashmont Restaurant LLC,Chris Douglass,28452,02/06/2012 01:24:23 PM,12/31/2016 11:59:00 PM,Active,FS,Eating & Drinking,HE_Fail,04/09/2010 12:26:08 PM,40-6-305.11,*,Dressing Rooms Clean/Lockers Provided,04/09/2010 12:26:08 PM,Fail,,,1917   DORCHESTER,DORCHESTER,MA,02124,,
Country Kitchen,,AMINPOUR AMIR,Arleen Campbell,,32027,01/05/2012 08:42:50 AM,12/31/2016 11:59:00 PM,Active,FS,Eating & Drinking,HE_Filed,02/22/2010 10:54:19 AM,02-3-602.11-.12/3-302.12,*,Food Container Labels,02/22/2010 10:54:19 AM,Fail,,PROVIDE label on food bin-( what is in bin-rice ? ),830   Blue Hill AV,Dorchester,MA,02124,16567,"(42.29621, -71.08718)"
PATS PIZZA,,LOWER MILLS RESTAURANT,LOWER MILLS RESTAURANT,GROUP LLC,24124,12/19/2011 11:01:23 AM,12/31/2016 11:59:00 PM,Active,FT,Eating & Drinking w/ Take Out,HE_Fail,03/11/2008 01:27:41 PM,15-4-202.16,*,Non-Food Contact Surfaces,03/12/2008 08:10:19 AM,Fail,,SEAL BARE WOOD,2254   Dorchester AV,Dorchester,MA,02124,156905,"(42.273506, -71.067541)"
Scissors & Pie,,QUERZOLI LYNNE M,DeRosa,Mitchell,112423,03/05/2014 10:19:42 AM,12/31/2015 11:59:00 PM,Inactive,FS,Eating & Drinking,HE_Pass,03/09/2015 12:04:36 PM,22-4-601/602.11,**,Food Contact Surfaces Clean,03/09/2015 12:04:36 PM,Pass,2015-03-09 15:41:28,Slicer with dried up food debris. Interior of Ice machine soiled. Clean and sanitize properly.,225   Newbury ST,Boston,MA,02116,101442,"(42.35003, -71.08169)"
Nicholas Sub & Pizza Shop,,NICHOLAS MARKOPOULOS,Kourtelidis,Nicholas,33364,01/17/2012 03:37:47 PM,12/31/2016 11:59:00 PM,Active,FT,Eating & Drinking w/ Take Out,HE_Fail,07/28/2014 10:43:34 AM,14-4-202.11,*,Food Contact Surfaces Design,07/28/2014 10:43:34 AM,Fail,,Sponge being used at the 3 bay sink. Discontinue and use the appropriate equipment.,600   Hyde Park AV,Roslindale,MA,02131,156517,"(42.280027, -71.118658)"
Minina's Cafe,,ROSA JOSE TS,Jose Rosa,,74391,02/01/2012 01:10:59 PM,12/31/2016 11:59:00 PM,Active,FT,Eating & Drinking w/ Take Out,HE_FailExt,07/01/2011 02:37:51 PM,24-4-903.11,*,Clean Equipment & Utensils Storage,07/01/2011 02:37:51 PM,Pass,2011-07-05 07:51:58,Clean equipment being stored directly under drainage pipes. Discontinue and store all equipment clean and protected.,430   Geneva AV,Dorchester,MA,02122,63341,"(42.30059, -71.06637)"
Nutter  McClennen & Fish LLP,,SODEXHO OPERATIONS  LLC,Flik International Corp,Compass Group,27665,01/18/2012 06:00:22 PM,12/31/2016 11:59:00 PM,Active,FS,Eating & Drinking,HE_Filed,10/16/2007 12:05:14 PM,25-4-904.11,*,Single Service Articles Stored Dispensed,10/16/2007 02:30:52 PM,Pass,2007-10-16 14:30:52,store all utensils with handle presented,155   SEAPORT LA,BOSTON,MA,02110,,
Uno Chicago Grill,,SPENCER AARONN D,UNO RESTAURANTS,LLC  LEGAL DEPARTMENT,18958,01/09/2012 03:53:57 PM,12/31/2016 11:59:00 PM,Active,FT,Eating & Drinking w/ Take Out,HE_Pass,03/26/2015 11:35:16 AM,23-4-602.13,*,Non-Food Contact Surfaces Clean,03/26/2015 11:35:16 AM,Pass,2015-03-26 15:36:00,Produce Bins soiled  inside the produce walk-in unit.Hand wash sink at the prep area soiled. The exterior of the equipment at the cooking line soiled. The two doors glass refrigerator at the bar  with soiled doors. Clean and sanitize properly.,727   Boylston ST,Boston,MA,02116,18385,"(42.349589, -71.080292)"
Brighams & Womens Hospital - Tower Cafe,,AU BON PAIN CO  INC. #508 (LAURA),Langill BWH CFSD,Susan,18544,02/08/2012 05:33:24 PM,12/31/2016 11:59:00 PM,Active,FS,Eating & Drinking,HE_Pass,08/16/2010 10:55:59 AM,35-6-501.111/.115,**,Insects  Rodents  Animals,08/16/2010 10:55:59 AM,Pass,2010-08-16 15:14:34,lower salad prep/remove evidence of fruit flies,75   FRANCIS ST,Boston,MA,02115,158148,"(42.336106, -71.10748)"
Lucy Ethopian Cafe,,OMER HONCA,Netsanet B. Woldesenbet,,67739,02/21/2012 10:26:23 AM,12/31/2016 11:59:00 PM,Active,FS,Eating & Drinking,HE_Fail,12/29/2014 02:16:56 PM,03-3-501.16,***,Hot Holding,12/29/2014 02:16:56 PM,Fail,,Miser Wot hot holding at 107F- Ensure foods are hot held at 140F or above.  Removed by PIC and reheated to 156F,334   Massachusetts AV,Boston,MA,02115,156790,"(42.34261, -71.084169)"
Deli One,,,San Ko Inc.,,29195,01/05/2012 02:41:34 PM,12/31/2016 11:59:00 PM,Active,FT,Eating & Drinking w/ Take Out,HE_Pass,09/22/2011 11:51:39 AM,03-3-501.16,***,Hot Holding,09/22/2011 11:51:39 AM,Pass,2011-09-23 08:37:55,Shrimp in linguini holding at 110F(Steam table not turned on enough?  Product uncovered.There are different means to hold product at required temperatures.Additional product sitting on toaster oven(chicken parm at 160F) as well as rice on cutting board(at 170F).Although the temperature requirement was met this is because product was just made.As product sits temperature will drop.Provide additional equipment(portable steam table to properly hold all hot phf).,85   ARCH ST ST,BOSTON,MA,02110,,
UPTOWN CAFE,,,GARY FORZIATI,,23109,12/14/2011 11:10:59 AM,12/31/2016 11:59:00 PM,Active,FT,Eating & Drinking w/ Take Out,HE_Fail,11/26/2013 11:16:39 AM,33-5-501.116,*,Improper Cleaning of Receptacles,11/26/2013 11:16:39 AM,Fail,,Clean interior and exterior of waste receptacles.,116   CAMBRIDGE,BOSTON,MA,02114,,
MIAMI RESTAURANT,,,JUAN A. REYES,,21019,01/05/2012 10:56:50 AM,12/31/2016 11:59:00 PM,Active,FS,Eating & Drinking,HE_Fail,11/06/2013 11:03:50 AM,21-3-304.14,*,Wiping Cloths  Clean  Sanitize,11/06/2013 11:03:50 AM,Fail,,Set up as discussed,381   Centre ST,Jamaica Plain,MA,02130,158224,"(42.322337, -71.10927)"
Currito Burrito,,,Park,Chan,28764,01/05/2012 12:58:58 PM,12/31/2016 11:59:00 PM,Active,FT,Eating & Drinking w/ Take Out,HE_Pass,04/22/2009 01:14:09 AM,20-4-703.11,***,Food Contact Surfaces Clean,04/27/2009 09:35:55 AM,Pass,2009-04-27 09:35:55,Provide proper methods for hand washing,300   LOGAN AIRPORT TRMNL C,EAST BOSTON,MA,02128,,
RISTORANTE EUNO,,REGNETTA LEIZE,RISTORANTE,EUNO,20538,02/13/2012 02:19:04 PM,12/31/2016 11:59:00 PM,Active,FS,Eating & Drinking,HE_Fail,04/19/2012 06:53:50 PM,32-6-301.11-02.11,*,Hand Cleaner  Drying  Tissue Signage,04/19/2012 06:53:50 PM,Fail,,Provide paper towels for hand sink.,119   Salem ST,Boston,MA,02113,121721,"(42.364531, -71.055371)"
The Corner Tavern,,BACON DOUGLAS F TS,DOUGLAS BACON PRES.,,19829,12/15/2011 11:23:57 AM,12/31/2016 11:59:00 PM,Active,FS,Eating & Drinking,HE_Pass,04/07/2009 11:18:13 AM,17-4-302.14,*,Test Kit Provided,04/08/2009 08:27:34 AM,Pass,2009-04-08 08:27:34,No quats test kit. Provide.,421   Marlborough ST,Boston,MA,02115,91385,"(42.35014, -71.08944)"
Qdoba Mexican Eats No. 2207,,CHAIR 5 RESTAURANTS LLC,Qdoba Mexican Grill #,Attn: Restaurant Accounting,75515,01/05/2012 01:57:51 PM,12/31/2016 11:59:00 PM,Active,FT,Eating & Drinking w/ Take Out,HE_Fail,04/22/2011 10:00:19 AM,37-6-501.11-.12,*,Improper Maintenance of Walls/Ceilings,04/22/2011 10:00:19 AM,Fail,,clean interior of hood clean wall behind 3 bay sink,393   Huntington AV,Boston,MA,02115,157313,"(42.339776, -71.090882)"
Morgan Lewis & Bockius LLP,Flik International,JAMESTOWN ONE FEDERAL LP,Flik International,Peter Molloy,29909,02/29/2012 12:02:02 PM,12/31/2016 11:59:00 PM,Active,FS,Eating & Drinking,HE_Filed,06/26/2008 10:36:10 AM,08-3-305-307.11,*,Food Protection,06/26/2008 03:19:58 PM,Fail,,keep all items 6% off floor of storage area,1   Federal ST,Boston,MA,02110,57149,"(42.3561, -71.05695)"
Dot 2 Dot Cafe,,BERTUCCI JOHN E TRST,Henry-Garrett,Karen,28291,01/24/2012 09:58:41 AM,12/31/2016 11:59:00 PM,Active,FS,Eating & Drinking,HE_Fail,06/08/2010 11:36:06 AM,17-4-302.14,*,Test Kit Provided,06/08/2010 11:36:06 AM,Fail,,,1735   Dorchester AV,Dorchester,MA,02124,48397,"(42.29105, -71.06302)"
ROSLINDALE HOUSE OF PIZZA,,,VASSILIOS GLYKIS,,19964,01/06/2012 10:23:12 AM,12/31/2016 11:59:00 PM,Active,FT,Eating & Drinking w/ Take Out,HE_Fail,01/05/2015 11:57:54 AM,31-5-204/05.11,***,Location  Accessible,01/05/2015 11:57:54 AM,Fail,,Discontinue to store equipment in hand sink in warewashing area. Sink was blocked with equipment at this time. Make sink accessible at all time to promote hand washing.,4168   Washington ST,Roslindale,MA,02131,157416,"(42.287818, -71.126399)"
JOHN B. HYNES VET. MEM. CTR.,,MASSACHUSETTS CONVENTION,Levy Premium Foodservice Ltd.,Mitch Phelps,68081,12/13/2011 04:12:44 PM,12/31/2016 11:59:00 PM,Active,FS,Eating & Drinking,HE_Pass,04/30/2012 12:15:30 PM,,,,,,,,880   Boylston ST,Boston,MA,02116,18415,"(42.34753, -71.08411)"
Durgin Park Restaurant,,,Weinstein,Michael,24748,02/13/2012 11:17:17 AM,12/31/2016 11:59:00 PM,Active,FS,Eating & Drinking,HE_Fail,08/30/2012 10:10:51 AM,27-5-103.11-.12,***,Hot and Cold Water,08/30/2012 10:10:51 AM,Fail,,Missing knob to provide hot water at hand sink to the right (employees instructed to use hand sink to the left),300  Faneuil Hall Marketplace,Boston,MA,02109,341035,"(42.360036, -71.056253)"
NEW YORK FRIED CHICKEN & PIZZA,,AYAZ A. SHAH,AYAZ A. SHAH,,23286,05/02/2012 11:48:20 AM,12/31/2016 11:59:00 PM,Active,FT,Eating & Drinking w/ Take Out,HE_FailExt,09/01/2010 10:37:29 AM,26-4-502.13,*,Re-use of Single Service Articles,09/01/2010 10:37:29 AM,Pass,2010-09-02 08:10:12,Single use plastic containers being re-used to dispense sugar and salt. Discontinue and use a handeled scoop to prevent contamination from hands.,531   Columbia RD,Dorchester,MA,02125,156840,"(42.315432, -71.06626)"
MCKENNA'S CAFE,,KENNETH OSHEROW  PRES.,KENNETH OSHEROW PRES.,,23628,12/28/2011 09:11:33 AM,12/31/2016 11:59:00 PM,Active,FS,Eating & Drinking,HE_Pass,09/21/2011 10:04:55 AM,26-4-502.13,*,Re-use of Single Service Articles,09/21/2011 10:04:55 AM,Pass,2011-09-22 08:07:40,Small plastic single use container being used to dispense Paprika. Discontinue and use a handled scoop to prevent contamination from hands.,109   Savin Hill AV,Dorchester,MA,02125,156864,"(42.311515, -71.05382)"
Guckenheimer @ B.R.E. @ Blue Glass Cafe,,ONE HUNDRED & 200 CLARENDON,Guckenheimer Services LLC,Attn: Accounting Manager,22383,01/10/2012 12:41:15 PM,12/31/2016 11:59:00 PM,Active,FS,Eating & Drinking,HE_Pass,12/05/2008 10:12:07 AM,04-3-501.15/4-301.11,*,Inadequate Facilities/Cooling Methods,12/08/2008 08:46:25 AM,Pass,2008-12-08 08:46:25,Cooked chicken covered in Refridge at 5Of. Provide proper cooling practices.,200   Clarendon ST,Boston,MA,02116,33209,"(42.34921, -71.07513)"
DAYIB CAFE,,ABDULLAH FARAH ANSHUR,ABDULLAH FARAH ANSHUR,,22700,02/13/2012 12:56:03 PM,12/31/2016 11:59:00 PM,Active,FT,Eating & Drinking w/ Take Out,HE_Fail,04/24/2009 11:05:19 AM,21-3-304.14,*,Wiping Cloths  Clean  Sanitize,04/24/2009 03:06:18 PM,Fail,,properly store all wiping cloths in a sanitizing solution,722   Shawmut AV,Roxbury,MA,02119,157649,"(42.332783, -71.083221)"
Subway,,CATALDO JOHN M JR,Patel,Jitendra,98011,09/30/2013 09:43:36 AM,12/31/2016 11:59:00 PM,Active,FT,Eating & Drinking w/ Take Out,HE_Fail,05/15/2014 10:13:58 AM,08-3-305-307.11,*,Food Protection,05/15/2014 10:13:58 AM,Fail,,Do not store food or paper goods under towels at front hand sink.,13   William C Kelly SQ,East Boston,MA,02128,151119,"(42.374597, -71.038799)"
The Upper Crust,,PESIRIDIS THEODORE TRST,Shenefield,Shawn,90116,03/25/2013 02:37:01 PM,12/31/2016 11:59:00 PM,Active,FT,Eating & Drinking w/ Take Out,HE_Fail,03/28/2014 12:21:08 PM,17-4-204.112/.115,*,Equipment Thermometers,03/28/2014 12:21:08 PM,Fail,,walk in/provide accurate internal thermometer front line/provide internal thermometer to 2 door reach in,683   Tremont ST,Roxbury,MA,02118,137919,"(42.34156, -71.07662)"
J J Foley's Cafe,,FOLEY JEREMIAH,J J Foley's Cafe,Inc.,27092,01/31/2012 06:21:48 PM,12/31/2016 11:59:00 PM,Active,FS,Eating & Drinking,HE_Hearing,05/14/2008 12:12:18 PM,17-4-204.112/.115,*,Equipment Thermometers,05/15/2008 08:18:26 AM,Fail,,provide psi gauge at High temp. dish machine.,117   EAST BERKELEY,BOSTON,MA,02118,,
Grille 705,,SEVEN-05 MASSACHUSETTS AVE,Antreassian,Sarkis,28817,01/31/2012 10:52:38 AM,12/31/2016 11:59:00 PM,Active,FT,Eating & Drinking w/ Take Out,HE_Pass,05/28/2013 02:54:18 PM,01-3-602.11 B2,***,Labeling of Ingredients,05/28/2013 02:54:18 PM,Pass,2013-05-29 07:11:56,cookies at front counter without labels  label correctly,705    Massachusetts AV,BOSTON,MA,02118,,
NEW YORK FRIED CHICKEN & PIZZA,,AYAZ A. SHAH,AYAZ A. SHAH,,23286,05/02/2012 11:48:20 AM,12/31/2016 11:59:00 PM,Active,FT,Eating & Drinking w/ Take Out,HE_Fail,08/25/2010 01:41:44 PM,32-6-301.11-02.11,*,Hand Cleaner  Drying  Tissue Signage,08/25/2010 01:41:44 PM,Fail,,No soap at hand sink in kitchen. Provide.,531   Columbia RD,Dorchester,MA,02125,156840,"(42.315432, -71.06626)"
EL PENOL RESTAURANT,,,MIGUEL A. MEDINA BALBIN,,23581,12/29/2011 09:39:51 AM,12/31/2016 11:59:00 PM,Active,FS,Eating & Drinking,HE_Fail,05/12/2014 10:49:52 AM,15-4-202.16,*,Non-Food Contact Surfaces,05/12/2014 10:49:52 AM,Fail,,Kitchen - defrost ice cream freezer.,54   Bennington ST,East Boston,MA,02128,156292,"(42.375798, -71.037101)"
NEW YORK FRIED CHICKEN & PIZZA,,AYAZ A. SHAH,AYAZ A. SHAH,,23286,05/02/2012 11:48:20 AM,12/31/2016 11:59:00 PM,Active,FT,Eating & Drinking w/ Take Out,HE_Filed,04/04/2013 02:59:51 PM,37-6-501.11-.12,*,Improper Maintenance of Walls/Ceilings,04/04/2013 02:59:51 PM,Fail,,Window ledges soiled with visibly soiled. Clean to remove.,531   Columbia RD,Dorchester,MA,02125,156840,"(42.315432, -71.06626)"
Uno Chicago Grill,,NICOLE E. ADAMS,NICOLE E. ADAMS,,19118,01/09/2012 03:55:20 PM,12/31/2016 11:59:00 PM,Active,FT,Eating & Drinking w/ Take Out,HE_Fail,08/24/2009 12:17:34 PM,17-4-204.112/.115,*,Equipment Thermometers,08/25/2009 08:32:30 AM,Fail,,Provide proper working internal thermometers for all refrigerators and freezers.,270   HUNTINGTON  AV,BOSTON,MA,02125,,
SIMCO'S RESTAURANT,,NICK & DENISE FOTOPOULOS,NICK & DENISE FOTOPOULOS,,19450,03/01/2012 03:55:09 PM,12/31/2016 11:59:00 PM,Active,FT,Eating & Drinking w/ Take Out,HE_Pass,05/11/2015 11:05:20 AM,02-3-602.11-.12/3-302.12,*,Food Container Labels,05/11/2015 11:05:20 AM,Pass,2015-05-12 08:46:03,Several  bulk containers unlabeled . Provide proper labeling.,1509   Blue Hill AV,Mattapan,MA,02126,156519,"(42.272368, -71.09389)"
Anshur Restauruant,,REARDON THOMAS B,Anshur,Abdullah F.,31241,02/08/2012 03:13:24 PM,12/31/2016 11:59:00 PM,Active,FT,Eating & Drinking w/ Take Out,HE_FailExt,01/31/2012 11:20:47 AM,29-5-201/02.11,*,Installed and Maintained,01/31/2012 11:20:47 AM,Fail,,repair faucet handle to dishroom handsink,291   Roxbury ST,Roxbury,MA,02119,119179,"(42.33041, -71.0943)"
COPLEY PLAZA HOTEL,,DALEY,DALEY,JAMES,18878,02/21/2012 10:53:44 AM,12/31/2016 11:59:00 PM,Active,FS,Eating & Drinking,HE_Fail,07/05/2011 12:04:30 PM,36-6-501.11-.12,*,Improper Maintenance of Floors,07/05/2011 12:04:30 PM,Fail,,Walk in #10 floors with food debris  clean to remove.,138   ST JAMES  AV,BOSTON,MA,02116,,
DAYIB CAFE,,ABDULLAH FARAH ANSHUR,ABDULLAH FARAH ANSHUR,,22700,02/13/2012 12:56:03 PM,12/31/2016 11:59:00 PM,Active,FT,Eating & Drinking w/ Take Out,HE_Fail,10/22/2012 10:51:11 AM,41-7-201/04.11,***,Separation/Sanitizer Criteria,10/22/2012 10:51:11 AM,Fail,,side storage room/provide proper storage of all paint,722   Shawmut AV,Roxbury,MA,02119,157649,"(42.332783, -71.083221)"
Country Kitchen,,AMINPOUR AMIR,Arleen Campbell,,32027,01/05/2012 08:42:50 AM,12/31/2016 11:59:00 PM,Active,FS,Eating & Drinking,HE_FailExt,04/16/2013 11:10:13 AM,36-6-501.11-.12,*,Improper Maintenance of Floors,04/16/2013 11:10:13 AM,Pass,2013-04-16 15:31:18,clean floor under behind and between all equipment and shelves through-out all cooking and all prep areas,830   Blue Hill AV,Dorchester,MA,02124,16567,"(42.29621, -71.08718)"
Uno Chicago Grill,,NICOLE E. ADAMS,NICOLE E. ADAMS,,19118,01/09/2012 03:55:20 PM,12/31/2016 11:59:00 PM,Active,FT,Eating & Drinking w/ Take Out,HE_Pass,06/26/2015 11:27:33 AM,36-6-501.11-.12,*,Improper Maintenance of Floors,06/26/2015 11:27:33 AM,Pass,2015-06-26 15:47:27,Floors under and around equipment in kitchen  warewashing and basement prep areas with heavy soils and debris- Clean with proper frequency,270   HUNTINGTON  AV,BOSTON,MA,02125,,
Happy Garden,,,Brighton Ventures Inc.,,24662,01/31/2012 01:17:53 PM,12/31/2016 11:59:00 PM,Active,FT,Eating & Drinking w/ Take Out,HE_Fail,01/10/2014 12:02:02 PM,15-4-202.16,*,Non-Food Contact Surfaces,01/10/2014 12:02:02 PM,Fail,,There is unfinished wood along the edges of the older freezer in the basement.  Provide a surface that is smooth  cleanable  and durable.,377   Washington ST,Brighton,MA,02135,156389,"(42.349291, -71.15428)"
BRIGHAM & WOMENS FAULKNER HOSPITAL,,,Susan Langill,Food Serv. Dir.,18286,02/15/2012 09:39:45 AM,12/31/2016 11:59:00 PM,Active,FS,Eating & Drinking,HE_Fail,04/01/2013 12:05:11 PM,37-6-501.11-.12,*,Improper Maintenance of Walls/Ceilings,04/01/2013 12:05:11 PM,Fail,,clean vent. cover in prep area and adjust loose light panel....,1153   CENTRE,JAMAICA PLAIN,MA,02130,,
COPLEY PLAZA HOTEL,,DALEY,DALEY,JAMES,18878,02/21/2012 10:53:44 AM,12/31/2016 11:59:00 PM,Active,FS,Eating & Drinking,HE_Pass,07/13/2011 03:06:13 PM,23-4-602.13,*,Non-Food Contact Surfaces Clean,07/13/2011 03:06:13 PM,Pass,2011-07-14 08:14:51,Walk in #4 -  Dust build up on condensor fans  clean to remove.,138   ST JAMES  AV,BOSTON,MA,02116,,
Anshur Restauruant,,REARDON THOMAS B,Anshur,Abdullah F.,31241,02/08/2012 03:13:24 PM,12/31/2016 11:59:00 PM,Active,FT,Eating & Drinking w/ Take Out,HE_Fail,09/30/2008 11:16:42 AM,17-4-302.14,*,Test Kit Provided,09/30/2008 03:32:39 PM,Fail,,provide test kit for 3 bay and low temp unit,291   Roxbury ST,Roxbury,MA,02119,119179,"(42.33041, -71.0943)"
EL PENOL RESTAURANT,,,MIGUEL A. MEDINA BALBIN,,23581,12/29/2011 09:39:51 AM,12/31/2016 11:59:00 PM,Active,FS,Eating & Drinking,HE_Fail,09/08/2011 01:16:30 PM,M-2-102.11,***,PIC Knowledge,09/08/2011 01:16:30 PM,Fail,,No food allergen certification  provide,54   Bennington ST,East Boston,MA,02128,156292,"(42.375798, -71.037101)"
UPTOWN CAFE,,,GARY FORZIATI,,23109,12/14/2011 11:10:59 AM,12/31/2016 11:59:00 PM,Active,FT,Eating & Drinking w/ Take Out,HE_Pass,03/15/2011 01:53:40 PM,15-4-202.16,*,Non-Food Contact Surfaces,03/15/2011 01:53:40 PM,Pass,2011-03-16 08:42:35,Repair broken freezer door to white freezer  inside storage room remove ice buildup from white GE freezer on hotline,116   CAMBRIDGE,BOSTON,MA,02114,,
A K's Take Out & Delivery,,BOUKOUVALAS ATHENA TS,Saini,Jasbir,28531,12/20/2011 02:29:52 PM,12/31/2016 11:59:00 PM,Active,FT,Eating & Drinking w/ Take Out,HE_Filed,03/13/2008 09:10:37 AM,36-6-501.11-.12,*,Improper Maintenance of Floors,03/13/2008 03:33:50 PM,Pass,2008-03-13 15:33:50,walk in/clean floor throughout,1427   Tremont ST,Mission Hill,MA,02120,136818,"(42.331858, -71.096333)"
Regina Pizza of Allston,,,Regina Pizza of Allston L L C,,68183,01/31/2012 02:16:51 PM,12/31/2016 11:59:00 PM,Active,FS,Eating & Drinking,HE_Fail,04/29/2015 11:37:53 AM,41-7-102.11,***,Labeled  Common Name,04/29/2015 11:37:53 AM,Fail,,Sanitizer spray bottles are unlabeled.  Properly label all chemical bottles.,353   Cambridge ST,Brighton,MA,02134,157036,"(42.356111, -71.132629)"
SIMCO'S INC.,,RUSSO SALVATORE G,DENISE FOTOPOULOS,,21265,03/01/2012 03:54:24 PM,12/31/2016 11:59:00 PM,Active,FT,Eating & Drinking w/ Take Out,HE_Fail,08/15/2007 01:09:47 PM,17-4-204.112/.115,*,Equipment Thermometers,08/15/2007 03:08:02 PM,Fail,,Provide internal thermometer for Walk In  Freezer.,679   Canterbury ST,Roslindale,MA,02131,25482,"(42.28542, -71.11)"
Momogoose 3,,,Smart Gourmet L L C,Loc Vo,78558,03/29/2012 10:46:51 AM,12/31/2016 11:59:00 PM,Active,MFW,Mobile Food Walk On,HE_FailExt,06/14/2012 11:13:53 AM,04-3-501.15/4-301.11,*,Inadequate Facilities/Cooling Methods,06/14/2012 11:13:53 AM,Fail,,There is no mechanical refrigeration on the truck for ready-to-eat items.  Provide mechanical refrigeration.,1   Citywide ST,Boston,MA,02128,0,
Uno Chicago Grill,,NICOLE E. ADAMS,NICOLE E. ADAMS,,19118,01/09/2012 03:55:20 PM,12/31/2016 11:59:00 PM,Active,FT,Eating & Drinking w/ Take Out,HE_Fail,02/09/2012 12:20:31 PM,32-6-501.11-.12/6-202.14,*,Toilet Enclosed Clean,02/09/2012 12:20:31 PM,Fail,,repair automatic dispenser to operate on demand.,270   HUNTINGTON  AV,BOSTON,MA,02125,,
Uno Due Go,,DRUKER BERTRAM A TRSTS,URC L L C,,74800,12/30/2011 01:59:52 PM,12/31/2016 11:59:00 PM,Active,FS,Eating & Drinking,HE_Fail,09/02/2015 01:23:40 PM,35-6-501.111/.115,**,Insects  Rodents  Animals,09/02/2015 01:23:40 PM,Fail,,Several fruit flies noted in back corner area and in pizza station / Contact pest control.,52   Summer ST,Boston,MA,02110,132025,"(42.35445, -71.05881)"
FLOUR BAKERY & CAFE,,,JOANNE CHANG,,21518,01/26/2012 03:07:20 PM,12/31/2016 11:59:00 PM,Active,FT,Eating & Drinking w/ Take Out,HE_Fail,07/23/2012 10:04:36 AM,02-3-602.11-.12/3-302.12,*,Food Container Labels,07/23/2012 10:04:36 AM,Fail,,properly label all spray bottles,1595   Washington ST,Roxbury,MA,02114,157458,"(42.338323, -71.07488)"
Dot 2 Dot Cafe,,BERTUCCI JOHN E TRST,Henry-Garrett,Karen,28291,01/24/2012 09:58:41 AM,12/31/2016 11:59:00 PM,Active,FS,Eating & Drinking,HE_Fail,07/15/2015 12:49:36 PM,35-6-501.111/.115,**,Insects  Rodents  Animals,07/15/2015 12:49:36 PM,Fail,,Evidence of fruit fly activity in the basement dry storage room. Address and provide an up to date pest control report for the re-inspection.,1735   Dorchester AV,Dorchester,MA,02124,48397,"(42.29105, -71.06302)"
Anshur Restauruant,,REARDON THOMAS B,Anshur,Abdullah F.,31241,02/08/2012 03:13:24 PM,12/31/2016 11:59:00 PM,Active,FT,Eating & Drinking w/ Take Out,HE_FailExt,04/01/2014 11:00:31 AM,23-4-602.13,*,Non-Food Contact Surfaces Clean,04/01/2014 11:00:31 AM,Fail,,clean all reach in unit....,291   Roxbury ST,Roxbury,MA,02119,119179,"(42.33041, -71.0943)"
MIAMI RESTAURANT,,,JUAN A. REYES,,21019,01/05/2012 10:56:50 AM,12/31/2016 11:59:00 PM,Active,FS,Eating & Drinking,HE_Pass,12/18/2012 02:18:11 PM,17-4-302.14,*,Test Kit Provided,12/18/2012 02:18:11 PM,Pass,2012-12-19 08:23:26,Missing chlorine test strips,381   Centre ST,Jamaica Plain,MA,02130,158224,"(42.322337, -71.10927)"
Uno Chicago Grill,,NICOLE E. ADAMS,NICOLE E. ADAMS,,19118,01/09/2012 03:55:20 PM,12/31/2016 11:59:00 PM,Active,FT,Eating & Drinking w/ Take Out,HE_Pass,09/26/2011 11:25:02 AM,36-6-501.11-.12,*,Improper Maintenance of Floors,09/26/2011 11:25:02 AM,Pass,2011-09-30 08:24:11,replace cracked floor tile in dishroom,270   HUNTINGTON  AV,BOSTON,MA,02125,,
Masona Grill,,JOF REALTY LLC,Masona Inc.,,28939,01/18/2012 05:50:35 PM,12/31/2016 11:59:00 PM,Active,FS,Eating & Drinking,HE_Pass,10/15/2014 02:41:57 PM,17-4-302.14,*,Test Kit Provided,10/15/2014 02:41:57 PM,Pass,2014-10-16 07:39:26,Provide a test kit for sanitizer in all three bay sinks and dishwashers.,2  Corey St,West Roxbury,MA,02132,42766,"(42.28468, -71.15523)"
Subway,,HASSAN OUCHRAA  OWNER,HASSAN OUCHRAA OWNER,,23872,01/10/2012 12:35:06 PM,12/31/2016 11:59:00 PM,Active,FT,Eating & Drinking w/ Take Out,HE_Filed,12/09/2011 10:13:59 AM,32-6-501.11-.12/6-202.14,*,Toilet Enclosed Clean,12/09/2011 10:13:59 AM,Fail,,Handle of toilet in mens room broken. Repair.,1576   Dorchester AV,Dorchester,MA,02122,156882,"(42.297107, -71.060479)"
Guckenheimer @ B.R.E. @ Blue Glass Cafe,,ONE HUNDRED & 200 CLARENDON,Guckenheimer Services LLC,Attn: Accounting Manager,22383,01/10/2012 12:41:15 PM,12/31/2016 11:59:00 PM,Active,FS,Eating & Drinking,HE_Pass,03/23/2009 10:23:25 AM,21-3-304.14,*,Wiping Cloths  Clean  Sanitize,03/24/2009 08:53:08 AM,Pass,2009-03-24 08:53:08,Wiping cloths lying on counters-throughout.,200   Clarendon ST,Boston,MA,02116,33209,"(42.34921, -71.07513)"
BUKHARA INDIAN BISTRO,,BRUCE THERESA,AMRIK SINGH PABLA,,21016,01/12/2012 03:33:18 PM,12/31/2016 11:59:00 PM,Active,FS,Eating & Drinking,HE_Fail,09/03/2009 11:23:54 AM,15-4-202.16,*,Non-Food Contact Surfaces,09/04/2009 10:43:19 AM,Fail,,Spray arm at 3 bay sink in kitchen being held together with tape. Repair. Hand sink with tape on outside,701   Centre ST,Jamaica Plain,MA,02130,28172,"(42.31159, -71.11461)"
EL PENOL RESTAURANT,,,MIGUEL A. MEDINA BALBIN,,23581,12/29/2011 09:39:51 AM,12/31/2016 11:59:00 PM,Active,FS,Eating & Drinking,HE_Pass,11/06/2015 10:20:23 AM,23-4-602.13,*,Non-Food Contact Surfaces Clean,11/06/2015 10:20:23 AM,Pass,2015-11-09 08:46:59,Clean underside of shelving over prep-tables.,54   Bennington ST,East Boston,MA,02128,156292,"(42.375798, -71.037101)"
Country Kitchen,,AMINPOUR AMIR,Arleen Campbell,,32027,01/05/2012 08:42:50 AM,12/31/2016 11:59:00 PM,Active,FS,Eating & Drinking,HE_Pass,10/16/2013 12:33:15 PM,17-4-204.112/.115,*,Equipment Thermometers,10/16/2013 12:33:15 PM,Pass,2013-10-17 07:38:11,provide a thermometer for reach-in case (counter area)    provide a thermomter in refrigerator in basement area,830   Blue Hill AV,Dorchester,MA,02124,16567,"(42.29621, -71.08718)"
UNION OYSTER HOUSE,,MILANO JOSEPH A JR TRST,MILANO,JOSEPH A.,19089,12/14/2011 02:11:17 PM,12/31/2016 11:59:00 PM,Active,FS,Eating & Drinking,HE_Fail,12/18/2012 11:07:29 AM,24-4-903.11,*,Clean Equipment & Utensils Storage,12/18/2012 11:07:29 AM,Fail,,1st kitchen Do not store clean utensils in equipment crevices,41  Union St,Boston,MA,02108,139293,"(42.36127, -71.05688)"
The Corner Tavern,,BACON DOUGLAS F TS,DOUGLAS BACON PRES.,,19829,12/15/2011 11:23:57 AM,12/31/2016 11:59:00 PM,Active,FS,Eating & Drinking,HE_Fail,06/02/2015 12:30:08 PM,17-4-204.112/.115,*,Equipment Thermometers,06/02/2015 12:30:08 PM,Fail,,Multiple refrigerators missing internal thermometers.Provide all refrigeration with internal thermometers.,421   Marlborough ST,Boston,MA,02115,91385,"(42.35014, -71.08944)"
RISTORANTE EUNO,,REGNETTA LEIZE,RISTORANTE,EUNO,20538,02/13/2012 02:19:04 PM,12/31/2016 11:59:00 PM,Active,FS,Eating & Drinking,HE_Fail,04/19/2012 06:53:50 PM,15-4-202.16,*,Non-Food Contact Surfaces,04/19/2012 06:53:50 PM,Fail,,clean and refinish rusted shelving in walk in,119   Salem ST,Boston,MA,02113,121721,"(42.364531, -71.055371)"
DAYIB CAFE,,ABDULLAH FARAH ANSHUR,ABDULLAH FARAH ANSHUR,,22700,02/13/2012 12:56:03 PM,12/31/2016 11:59:00 PM,Active,FT,Eating & Drinking w/ Take Out,HE_Fail,07/23/2015 11:39:55 AM,39-6-304.11,*,Rooms and Equipment Vented,07/23/2015 11:39:55 AM,Fail,,clean and repair vent.system in restroom...,722   Shawmut AV,Roxbury,MA,02119,157649,"(42.332783, -71.083221)"
MIAMI RESTAURANT,,,JUAN A. REYES,,21019,01/05/2012 10:56:50 AM,12/31/2016 11:59:00 PM,Active,FS,Eating & Drinking,HE_Hearing,06/24/2009 11:01:38 AM,03-3-501.16(A),***,Cold Holding,06/29/2009 11:42:23 AM,Pass,2009-06-29 11:42:23,Walk in 45  F,381   Centre ST,Jamaica Plain,MA,02130,158224,"(42.322337, -71.10927)"
WAI WAI ICE CREAM SHOP,,WONG SHU YING TRSTS,HUI,DAVID,24990,01/06/2012 09:20:52 AM,12/31/2016 11:59:00 PM,Active,FS,Eating & Drinking,HE_Fail,07/17/2007 03:35:39 PM,08-3-305-307.11,*,Food Protection,07/17/2007 03:57:56 PM,Fail,,,26   Oxford ST,Boston,MA,02111,106209,"(42.35168, -71.06027)"
Aramark at Houghton Mifflin,,TWO TWENTY TWO BERKELEY,ARAMARK,C/O JARED LESSARD,24693,02/15/2012 01:55:00 PM,12/31/2016 11:59:00 PM,Active,FS,Eating & Drinking,HE_Fail,04/23/2008 11:39:22 AM,01-3-602.11 B2,***,Labeling of Ingredients,04/23/2008 03:29:19 PM,Fail,,Product premade and packaged with multiple ingredients need ingredient sinage.,222   Berkeley ST,Boston,MA,02116,15007,"(42.35084, -71.07311)"
HAYMARKET PIZZA,,ROSARIO MANUELA,Blackstone Food Inc.,,19192,12/19/2011 10:42:03 AM,12/31/2016 11:59:00 PM,Active,FT,Eating & Drinking w/ Take Out,HE_Pass,05/25/2010 10:48:31 AM,,,,,,,,102   BLACKSTONE,BOSTON,MA,02109,,
Morgan Lewis & Bockius LLP,Flik International,JAMESTOWN ONE FEDERAL LP,Flik International,Peter Molloy,29909,02/29/2012 12:02:02 PM,12/31/2016 11:59:00 PM,Active,FS,Eating & Drinking,HE_Pass,03/04/2010 08:16:38 AM,12-2-301.12-.15,***,Adequate Handwashing/Where/When/How,03/04/2010 08:16:38 AM,Pass,2010-03-04 08:35:18,Staff observed coughing into glove(NO changing of glove nor handwashing until discussed by Inspector) and no handwashing observed between soiled and sanitized sides of dishmachine.,1   Federal ST,Boston,MA,02110,57149,"(42.3561, -71.05695)"
SUSAN'S DELI OF COURSE,,ALTAF AHMAD,KIM,SUNNY S.,20533,02/09/2012 08:45:25 AM,12/31/2016 11:59:00 PM,Active,FT,Eating & Drinking w/ Take Out,HE_Fail,06/03/2014 02:07:05 PM,37-6-501.11-.12,*,Improper Maintenance of Walls/Ceilings,06/03/2014 02:07:05 PM,Fail,,Remove tape from electrical switches,695   ATLANTIC  AV,BOSTON,MA,02111,,
DAYIB CAFE,,ABDULLAH FARAH ANSHUR,ABDULLAH FARAH ANSHUR,,22700,02/13/2012 12:56:03 PM,12/31/2016 11:59:00 PM,Active,FT,Eating & Drinking w/ Take Out,HE_Pass,04/25/2012 10:58:54 AM,37-6-501.11-.12,*,Improper Maintenance of Walls/Ceilings,04/25/2012 10:58:54 AM,Pass,2012-04-25 15:20:22,rear door/provide proper door sweep to remove all daylight clean walls around 3 bay sink and remount detergent and sanitizer pump clean exterior of hot line hood hot line/clean walls around all cooking equipment,722   Shawmut AV,Roxbury,MA,02119,157649,"(42.332783, -71.083221)"
Country Kitchen,,AMINPOUR AMIR,Arleen Campbell,,32027,01/05/2012 08:42:50 AM,12/31/2016 11:59:00 PM,Active,FS,Eating & Drinking,HE_FailExt,10/13/2015 11:44:51 AM,17-4-302.14,*,Test Kit Provided,10/13/2015 11:44:51 AM,Pass,2015-10-14 08:42:04,No test strips were available at the time of the inspection. Provide.,830   Blue Hill AV,Dorchester,MA,02124,16567,"(42.29621, -71.08718)"
Burger King,,,MASTORAN CORP.,,19935,12/16/2011 09:50:24 AM,12/31/2016 11:59:00 PM,Active,FT,Eating & Drinking w/ Take Out,HE_Pass,04/22/2015 12:56:42 PM,36-6-501.11-.12,*,Improper Maintenance of Floors,04/22/2015 12:56:42 PM,Pass,2015-04-23 08:30:35,Clean floor drain cover at grease trap.,944   Bennington ST,East Boston,MA,02128,155885,"(42.386166, -71.00953)"
J J Foley's Cafe,,FOLEY JEREMIAH,J J Foley's Cafe,Inc.,27092,01/31/2012 06:21:48 PM,12/31/2016 11:59:00 PM,Active,FS,Eating & Drinking,HE_Pass,01/28/2009 11:29:02 AM,14-4-202.11,*,Food Contact Surfaces Design,01/30/2009 08:59:57 AM,Pass,2009-01-30 08:59:57,Provide food grade containers for all open food products.  Replace all scored  cutting boards.  Replace all defective equipment.,117   EAST BERKELEY,BOSTON,MA,02118,,
Erie Pub,,STENSON JOHN P TS,IRISH PUB INC,,18026,12/19/2011 11:29:24 AM,12/31/2016 11:59:00 PM,Active,FS,Eating & Drinking,HE_Filed,07/31/2007 11:48:11 AM,37-6-201.11,*,Walls/Ceilings Designed Constructed Installed,08/02/2007 08:41:08 AM,Fail,,ceiling tile stained.,791   Adams ST,Dorchester,MA,02124,975,"(42.28316, -71.05602)"
NEW YORK FRIED CHICKEN & PIZZA,,AYAZ A. SHAH,AYAZ A. SHAH,,23286,05/02/2012 11:48:20 AM,12/31/2016 11:59:00 PM,Active,FT,Eating & Drinking w/ Take Out,HE_Filed,09/18/2009 11:27:22 AM,17-4-204.112/.115,*,Equipment Thermometers,09/22/2009 08:06:31 AM,Pass,2009-09-22 08:06:31,No thermometer inside of 3 door cooler. Provide. No thermometer inside of walk-in cooler. Provide.,531   Columbia RD,Dorchester,MA,02125,156840,"(42.315432, -71.06626)"
Barcelona Restaurant,,,Phorzhiemer,Andy,126674,12/11/2014 09:01:26 AM,12/31/2016 11:59:00 PM,Active,FS,Eating & Drinking,HE_Pass,10/07/2015 01:22:36 PM,23-4-602.13,*,Non-Food Contact Surfaces Clean,10/07/2015 01:22:36 PM,Pass,2015-10-07 15:34:00,Interior of reach in unit soiled.Maintain clean,525   Tremont ST,Boston,MA,02116,344153,"(42.344859, -71.070789)"
BUKHARA INDIAN BISTRO,,BRUCE THERESA,AMRIK SINGH PABLA,,21016,01/12/2012 03:33:18 PM,12/31/2016 11:59:00 PM,Active,FS,Eating & Drinking,HE_Fail,05/29/2014 02:21:07 PM,08-3-305-307.11,*,Food Protection,05/29/2014 02:21:07 PM,Fail,,Provide covers for food in storage in walk in refrigerator and reach in.,701   Centre ST,Jamaica Plain,MA,02130,28172,"(42.31159, -71.11461)"
Panera Bread,,,Boston Bread LLc,Attn: Lori Engel,26330,01/18/2012 04:43:59 PM,12/31/2016 11:59:00 PM,Active,FS,Eating & Drinking,HE_Pass,05/01/2008 09:43:37 AM,M-2-103.11,***,PIC Performing Duties,05/05/2008 09:45:48 AM,Pass,2008-05-05 09:45:48,Review procedures for operating when hot and cold running water is temporarily disabled,200   High ST,Boston,Ma,02110,,
DRAGON CHEF CHINESE REST.,,,RU BANG CHEN PRES.,,21347,02/06/2012 10:55:13 AM,12/31/2016 11:59:00 PM,Active,FT,Eating & Drinking w/ Take Out,HE_FailExt,05/28/2015 12:32:38 PM,42-5-203.13,*,Mop Sink not Provided,05/28/2015 12:32:38 PM,Fail,,provide properly enclosed mop sink,411  Washington St,Brighton,MA,02135,156051,"(42.349266, -71.15532)"
Prime Shoppe,,,Touarsi,Benemar,28544,02/08/2012 04:33:52 PM,12/31/2016 11:59:00 PM,Active,FT,Eating & Drinking w/ Take Out,HE_Fail,07/06/2010 10:03:27 AM,21-3-304.14,*,Wiping Cloths  Clean  Sanitize,07/06/2010 10:03:27 AM,Fail,,Provide proper stage of wiping cloths,104-112   Faneuil Hall Mkt,Boston,Ma,02109,,
NEW YORK FRIED CHICKEN & PIZZA,,AYAZ A. SHAH,AYAZ A. SHAH,,23286,05/02/2012 11:48:20 AM,12/31/2016 11:59:00 PM,Active,FT,Eating & Drinking w/ Take Out,HE_Filed,09/18/2009 11:27:22 AM,14-4-202.11,*,Food Contact Surfaces Design,09/22/2009 08:06:31 AM,Pass,2009-09-22 08:06:31,Coffee cups being used to dispense flour. Discontinue and use handeled scoops.,531   Columbia RD,Dorchester,MA,02125,156840,"(42.315432, -71.06626)"
DUNKIN DONUTS(STATION DONUTS),,,VICTORIANO SANTOS,,21146,02/13/2012 10:13:09 AM,12/31/2016 11:59:00 PM,Active,FT,Eating & Drinking w/ Take Out,HE_Filed,02/07/2008 02:04:43 PM,15-4-202.16,*,Non-Food Contact Surfaces,02/08/2008 07:57:06 AM,Fail,,Repair sugar sure short or provide a guard along Side to prevent. excess spillage.,4610   Washington ST,Roslindale,MA,02131,157298,"(42.275401, -71.139268)"
CAFE ESPLANADE,,,Pamela Bardhi,,91465,07/02/2013 08:38:33 AM,12/31/2016 11:59:00 PM,Active,FT,Eating & Drinking w/ Take Out,HE_Pass,06/26/2015 10:27:45 AM,08-3-302.11/3-304.11,***,Separation  Segregation Cross Contamination,06/26/2015 10:27:45 AM,Pass,2015-06-26 15:40:09,Raw shell eggs stored above ready to eat product.Maintain proper storage to avoid cross contamination,0   David G Mugar WY,Boston,MA,02108,46576,"(42.355594, -71.074207)"
Brighams & Womens Hospital - Tower Cafe,,AU BON PAIN CO  INC. #508 (LAURA),Langill BWH CFSD,Susan,18544,02/08/2012 05:33:24 PM,12/31/2016 11:59:00 PM,Active,FS,Eating & Drinking,HE_Pass,02/01/2008 11:08:04 AM,08-3-305-307.11,*,Food Protection,02/05/2008 09:57:50 AM,Pass,2008-02-05 09:57:50,Use of cloth towel to line food pan(eggs-cwn7).Cranberry sauce not covered out in cafe for self service.,75   FRANCIS ST,Boston,MA,02115,158148,"(42.336106, -71.10748)"
Peggy O'Neil's Pub & Grille,,LIMERICK CO INC,LIMERICK CO INC,,19097,12/13/2011 03:15:33 PM,12/31/2016 11:59:00 PM,Active,FS,Eating & Drinking,HE_Pass,11/28/2008 02:14:27 PM,14-4-202.11,*,Food Contact Surfaces Design,12/01/2008 08:18:14 AM,Pass,2008-12-01 08:18:14,Sponges being used in to pre-scrape dishes. Discontinue to ensure no contamination from sponge.,1310   DORCHESTER  AV,DORCHESTER,MA,02122,,
No.  7 RESTAURANT,,,HUANG FAMILY INC.,REN XIANGHUANG  PRES.,25414,02/08/2012 04:32:36 PM,12/31/2016 11:59:00 PM,Active,FT,Eating & Drinking w/ Take Out,HE_Fail,05/13/2008 01:26:51 PM,08-3-302.15,*,Washing fruits and veg's.,05/13/2008 03:19:08 PM,Fail,,completely sanitize sink between use @ vegetable sink and ware wash,225   Grove ST,West Roxbury,MA,02132,156965,"(42.261873, -71.15741)"
The Gallows,,,Henry's Delicatessen L L C,,68121,01/17/2012 04:30:41 PM,12/31/2016 11:59:00 PM,Active,FS,Eating & Drinking,HE_NotReq,12/30/2013 12:00:00 AM,,,,,,,,1395   Washington ST,Roxbury,MA,02118,171075,"(42.34137, -71.070211)"
Dunkin Donuts,,ONE HUNDRED CAMBRIDGE STREET,DN Donuts Inc.,Danny Haddad,26507,01/11/2012 11:22:31 AM,12/31/2016 11:59:00 PM,Active,FT,Eating & Drinking w/ Take Out,HE_Fail,12/10/2013 10:37:29 AM,M-2-102.11,***,PIC Knowledge,12/10/2013 10:37:29 AM,Fail,,No proof of Allergen Awareness certification,100   Cambridge ST,Boston,MA,02114,25222,"(42.360584, -71.062109)"
Back Bay Social Club,,DHANDA 867 BOYLSTON ST LPS,c/o Lyons Group,,68305,02/08/2012 07:50:46 AM,12/31/2016 11:59:00 PM,Active,FS,Eating & Drinking,HE_Pass,11/03/2014 09:28:33 AM,36-6-501.11-.12,*,Improper Maintenance of Floors,11/03/2014 09:28:33 AM,Pass,2014-11-03 09:42:33,Clean all floors and floor drains.,867   Boylston ST,Boston,MA,02116,18414,"(42.34874, -71.083445)"
Happy Garden,,,Brighton Ventures Inc.,,24662,01/31/2012 01:17:53 PM,12/31/2016 11:59:00 PM,Active,FT,Eating & Drinking w/ Take Out,HE_Fail,01/06/2015 12:03:38 PM,06-3-501.13,*,PHF's Properly Thawed,01/06/2015 12:03:38 PM,Fail,,Chicken and shrimp are thawing in stagnant water.  Propery thaw items.,377   Washington ST,Brighton,MA,02135,156389,"(42.349291, -71.15428)"
J J Foley's Cafe,,FOLEY JEREMIAH,J J Foley's Cafe,Inc.,27092,01/31/2012 06:21:48 PM,12/31/2016 11:59:00 PM,Active,FS,Eating & Drinking,HE_Fail,12/11/2014 04:52:26 PM,14-4-202.11,*,Food Contact Surfaces Design,12/11/2014 04:52:26 PM,Fail,,resurface/replace all worn white cutting boards,117   EAST BERKELEY,BOSTON,MA,02118,,
Dosa Factory,,,Pabla,Jaswiner,138037,01/21/2015 11:05:29 AM,12/31/2016 11:59:00 PM,Active,FS,Eating & Drinking,HE_Hearing,07/10/2015 02:40:39 PM,08-3-305-307.11,*,Food Protection,07/10/2015 02:40:39 PM,Pass,2015-07-10 15:40:49,Lower storage cluttered and soiled.Maintain products in a clean and dry area.,316   Newbury ST,Boston,MA,02115,168065,"(42.34862, -71.085413)"
A K's Take Out & Delivery,,BOUKOUVALAS ATHENA TS,Saini,Jasbir,28531,12/20/2011 02:29:52 PM,12/31/2016 11:59:00 PM,Active,FT,Eating & Drinking w/ Take Out,HE_Fail,08/26/2008 10:27:17 AM,23-4-602.13,*,Non-Food Contact Surfaces Clean,08/26/2008 03:28:31 PM,Fail,,clean dust from tops of all reach in units clean top of pizza unit clean interior/exterior of all front line reach in units front line/clean all silver shelving,1427   Tremont ST,Mission Hill,MA,02120,136818,"(42.331858, -71.096333)"
MCKENNA'S CAFE,,KENNETH OSHEROW  PRES.,KENNETH OSHEROW PRES.,,23628,12/28/2011 09:11:33 AM,12/31/2016 11:59:00 PM,Active,FS,Eating & Drinking,HE_Fail,09/14/2011 11:58:27 AM,M-2-103.11,***,PIC Performing Duties,09/14/2011 11:58:27 AM,Fail,,Management not over seeing employees in proper cooling methods and proper cooling practices. Only one par time employee who is food saftey certified. Only one part time certified person on site. Provide at least one full time or 2 part time employees who are certified. Provide documentation of enrollment  for re-inspection.,109   Savin Hill AV,Dorchester,MA,02125,156864,"(42.311515, -71.05382)"
Tavern Club,,TAVERN CLUB INC.,TAVERN CLUB INC.,,18117,02/14/2012 09:18:43 AM,12/31/2016 11:59:00 PM,Active,FS,Eating & Drinking,HE_FailExt,07/01/2014 08:04:54 AM,24-4-903.11,*,Clean Equipment & Utensils Storage,07/01/2014 08:04:54 AM,Fail,,Food utensils stored in drawers with tools. Remove tools. Clean / sanitize utensils.,4   Boylston PL,Boston,MA,02116,156405,"(42.351901, -71.066169)"
Bar Medallo,,ISABELLA DOMINIC F,Hugo Arango,,75169,12/13/2011 03:09:51 PM,12/31/2016 11:59:00 PM,Active,FS,Eating & Drinking,HE_Filed,10/03/2014 06:14:31 PM,17-4-302.14,*,Test Kit Provided,10/03/2014 06:14:31 PM,Fail,,Provide test kit for sanitizer.,411   Chelsea ST,East Boston,MA,02128,30551,"(42.379899, -71.026814)"
WAI WAI ICE CREAM SHOP,,WONG SHU YING TRSTS,HUI,DAVID,24990,01/06/2012 09:20:52 AM,12/31/2016 11:59:00 PM,Active,FS,Eating & Drinking,HE_Fail,07/17/2007 03:35:39 PM,15-4-202.16,*,Non-Food Contact Surfaces,07/17/2007 03:57:56 PM,Fail,,Reseal peeling paint en the ice cream unit,26   Oxford ST,Boston,MA,02111,106209,"(42.35168, -71.06027)"
A K's Take Out & Delivery,,BOUKOUVALAS ATHENA TS,Saini,Jasbir,28531,12/20/2011 02:29:52 PM,12/31/2016 11:59:00 PM,Active,FT,Eating & Drinking w/ Take Out,HE_Fail,02/19/2009 10:46:57 AM,33-5-501.13-.17,*,Adequate Number  Frequency Vermin Proof,02/19/2009 03:32:37 PM,Fail,,basement/provide covers to waste receptacles,1427   Tremont ST,Mission Hill,MA,02120,136818,"(42.331858, -71.096333)"
Durgin Park Restaurant,,,Weinstein,Michael,24748,02/13/2012 11:17:17 AM,12/31/2016 11:59:00 PM,Active,FS,Eating & Drinking,HE_Fail,12/30/2013 10:09:57 AM,31-5-204/05.11,***,Location  Accessible,12/30/2013 10:09:57 AM,Pass,2013-12-30 15:38:48,Pitcher in hand sink basin (Corrected on site).,300  Faneuil Hall Marketplace,Boston,MA,02109,341035,"(42.360036, -71.056253)"
FLOUR BAKERY & CAFE,,,JOANNE CHANG,,21518,01/26/2012 03:07:20 PM,12/31/2016 11:59:00 PM,Active,FT,Eating & Drinking w/ Take Out,HE_Pass,01/11/2012 12:52:01 PM,32-6-301.11-02.11,*,Hand Cleaner  Drying  Tissue Signage,01/11/2012 12:52:01 PM,Pass,2012-01-12 09:08:47,handsink/provide employee must wash hands signage,1595   Washington ST,Roxbury,MA,02114,157458,"(42.338323, -71.07488)"
COPLEY PLAZA HOTEL,,DALEY,DALEY,JAMES,18878,02/21/2012 10:53:44 AM,12/31/2016 11:59:00 PM,Active,FS,Eating & Drinking,HE_Fail,06/29/2007 02:58:46 PM,15-4-202.16,*,Non-Food Contact Surfaces,09/14/2007 03:11:38 PM,Fail,,,138   ST JAMES  AV,BOSTON,MA,02116,,
NEW YORK FRIED CHICKEN & PIZZA,,AYAZ A. SHAH,AYAZ A. SHAH,,23286,05/02/2012 11:48:20 AM,12/31/2016 11:59:00 PM,Active,FT,Eating & Drinking w/ Take Out,HE_Fail,04/14/2009 02:10:24 PM,21-3-304.14,*,Wiping Cloths  Clean  Sanitize,04/15/2009 08:15:33 AM,Fail,,Soiled wiping cloths left out on counter. Discontinue and use proper sanitizing solution.,531   Columbia RD,Dorchester,MA,02125,156840,"(42.315432, -71.06626)"
NEW YORK FRIED CHICKEN & PIZZA,,AYAZ A. SHAH,AYAZ A. SHAH,,23286,05/02/2012 11:48:20 AM,12/31/2016 11:59:00 PM,Active,FT,Eating & Drinking w/ Take Out,HE_Fail,07/22/2015 12:19:07 PM,37-6-501.11-.12,*,Improper Maintenance of Walls/Ceilings,07/22/2015 12:19:07 PM,Fail,,Grease trap rusty  repair.,531   Columbia RD,Dorchester,MA,02125,156840,"(42.315432, -71.06626)"
Daily Catch,,RICCIO GERALDO TS,CALAMARI FISHERIES INC.,,18578,02/15/2012 01:09:29 PM,12/31/2016 11:59:00 PM,Active,FS,Eating & Drinking,HE_FailExt,05/06/2015 11:03:52 AM,01-3-203.12,**,Tags & Records,05/06/2015 11:03:52 AM,Pass,2015-05-08 08:00:39,Keep tags for all shellfish on site for at least 90 days [ chronological order ],319   Hanover ST,Boston,MA,02113,69107,"(42.36408, -71.05395)"
Uno Chicago Grill,,SPENCER AARONN D,UNO RESTAURANTS,LLC  LEGAL DEPARTMENT,18958,01/09/2012 03:53:57 PM,12/31/2016 11:59:00 PM,Active,FT,Eating & Drinking w/ Take Out,HE_Filed,06/12/2009 12:19:13 PM,15-4-202.16,*,Non-Food Contact Surfaces,06/12/2009 03:30:53 PM,Fail,,The basement walk in containing salad dressings and dough is operating between 41 and 45 degrees F.  The unit may have been in a defrost mode.  However  management should monitor the unit and confirm with BISD that the unit is maintaining an internal temperature of 41 degrees F or below.,727   Boylston ST,Boston,MA,02116,18385,"(42.349589, -71.080292)"
Anshur Restauruant,,REARDON THOMAS B,Anshur,Abdullah F.,31241,02/08/2012 03:13:24 PM,12/31/2016 11:59:00 PM,Active,FT,Eating & Drinking w/ Take Out,HE_Fail,05/06/2011 11:57:09 AM,37-6-501.11-.12,*,Improper Maintenance of Walls/Ceilings,05/06/2011 11:57:09 AM,Fail,,Repair exposed ceiling.,291   Roxbury ST,Roxbury,MA,02119,119179,"(42.33041, -71.0943)"
Prime Shoppe,,,Touarsi,Benemar,28544,02/08/2012 04:33:52 PM,12/31/2016 11:59:00 PM,Active,FT,Eating & Drinking w/ Take Out,HE_Fail,09/03/2014 10:03:39 AM,20-4-703.11,***,Food Contact Surfaces Clean,09/03/2014 10:03:39 AM,Fail,,cutting boards and pans not being properly washed   rinsed and sanitized. Ensure proper wash rinse and sanitizing,104-112   Faneuil Hall Mkt,Boston,Ma,02109,,
Fenmore American Bistro,,,Buckminster Restaurant Group L L C,,86937,07/29/2013 08:50:28 AM,12/31/2016 11:59:00 PM,Active,FS,Eating & Drinking,HE_Pass,06/12/2015 01:22:58 PM,02-3-602.11-.12/3-302.12,*,Food Container Labels,06/12/2015 01:22:58 PM,Pass,2015-06-12 15:48:30,Bulk food bins without labeling. Provide proper labeling.,645   Beacon ST,Boston,MA,02215,161922,"(42.348363, -71.097697)"
West Napoli Pizza,,VRATTOS SOCRATES TS,BARDHI,SOKOL,21409,06/06/2012 03:38:02 PM,12/31/2016 11:59:00 PM,Active,FT,Eating & Drinking w/ Take Out,HE_Fail,05/21/2009 11:40:12 AM,37-6-501.11-.12,*,Improper Maintenance of Walls/Ceilings,05/21/2009 03:33:08 PM,Fail,,clean fan inside and out to removell dust and soil,1946  Centre St,West Roxbury,MA,02132,27764,"(42.28358, -71.15676)"
Uno Chicago Grill,,NICOLE E. ADAMS,NICOLE E. ADAMS,,18961,01/09/2012 03:57:09 PM,12/31/2016 11:59:00 PM,Active,FT,Eating & Drinking w/ Take Out,HE_Fail,11/28/2014 02:14:37 PM,36-6-501.11-.12,*,Improper Maintenance of Floors,11/28/2014 02:14:37 PM,Fail,,Floor soiled inside cleaning supply room. Clean properly.,1   Brookline AV,Boston,MA,02215,157196,"(42.34842, -71.097471)"
The Corner Tavern,,BACON DOUGLAS F TS,DOUGLAS BACON PRES.,,19829,12/15/2011 11:23:57 AM,12/31/2016 11:59:00 PM,Active,FS,Eating & Drinking,HE_Pass,11/22/2010 02:36:19 PM,29-5-201/02.11,*,Installed and Maintained,11/22/2010 02:36:19 PM,Pass,2010-11-23 08:12:01,repair leak at  base of handsink,421   Marlborough ST,Boston,MA,02115,91385,"(42.35014, -71.08944)"
Minina's Cafe,,ROSA JOSE TS,Jose Rosa,,74391,02/01/2012 01:10:59 PM,12/31/2016 11:59:00 PM,Active,FT,Eating & Drinking w/ Take Out,HE_Fail,06/29/2011 02:18:02 PM,23-4-602.13,*,Non-Food Contact Surfaces Clean,06/29/2011 02:18:02 PM,Fail,,Interior of bulk food containers visibly soiled and with cacked on foods. Clean to remove. Lower shelf of preparation table visibly soiled. Clean to remove.,430   Geneva AV,Dorchester,MA,02122,63341,"(42.30059, -71.06637)"
Nicholas Sub & Pizza Shop,,NICHOLAS MARKOPOULOS,Kourtelidis,Nicholas,33364,01/17/2012 03:37:47 PM,12/31/2016 11:59:00 PM,Active,FT,Eating & Drinking w/ Take Out,HE_Hearing,09/02/2015 02:27:30 PM,04-3-501.15/4-301.11,*,Inadequate Facilities/Cooling Methods,09/02/2015 02:27:30 PM,Fail,,1 reach in units 55-60F.Repair.PIC states it will remain out of service until repair is complete.,600   Hyde Park AV,Roslindale,MA,02131,156517,"(42.280027, -71.118658)"
Guckenheimer @ B.R.E. @ Blue Glass Cafe,,ONE HUNDRED & 200 CLARENDON,Guckenheimer Services LLC,Attn: Accounting Manager,22383,01/10/2012 12:41:15 PM,12/31/2016 11:59:00 PM,Active,FS,Eating & Drinking,HE_Fail,01/27/2014 10:37:46 AM,M-8-103.12,***,Conformance w/ Approved Procedures,01/27/2014 10:37:46 AM,Fail,,provide training on proper method of testing sushi rice update haccp binder,200   Clarendon ST,Boston,MA,02116,33209,"(42.34921, -71.07513)"
Dudley Sq. Grill,,,Saini,Jasbir S.,138433,08/21/2015 02:00:41 PM,12/31/2016 11:59:00 PM,Active,FS,Eating & Drinking,HE_Fail,12/18/2014 11:21:14 AM,36-6-501.11-.12,*,Improper Maintenance of Floors,12/18/2014 11:21:14 AM,Fail,,seal bare kitchen floor in cellar...,152   Dudley ST,Roxbury,MA,02119,340711,"(42.328865, -71.083212)"
No.  7 RESTAURANT,,,HUANG FAMILY INC.,REN XIANGHUANG  PRES.,25414,02/08/2012 04:32:36 PM,12/31/2016 11:59:00 PM,Active,FT,Eating & Drinking w/ Take Out,HE_Filed,05/27/2008 01:19:54 PM,08-3-302.15,*,Washing fruits and veg's.,05/27/2008 03:43:45 PM,Pass,2008-05-27 15:43:45,completely sanitize sink between use @ vegetable sink and ware wash,225   Grove ST,West Roxbury,MA,02132,156965,"(42.261873, -71.15741)"
JOHN B. HYNES VET. MEM. CTR.,,MASSACHUSETTS CONVENTION,Levy Premium Foodservice Ltd.,Mitch Phelps,68081,12/13/2011 04:12:44 PM,12/31/2016 11:59:00 PM,Active,FS,Eating & Drinking,HE_Pass,08/16/2013 11:15:18 AM,,,,,,,,880   Boylston ST,Boston,MA,02116,18415,"(42.34753, -71.08411)"
DAYIB CAFE,,ABDULLAH FARAH ANSHUR,ABDULLAH FARAH ANSHUR,,22700,02/13/2012 12:56:03 PM,12/31/2016 11:59:00 PM,Active,FT,Eating & Drinking w/ Take Out,HE_Fail,08/21/2014 10:46:57 AM,37-6-501.11-.12,*,Improper Maintenance of Walls/Ceilings,08/21/2014 10:46:57 AM,Fail,,clean all ceiling fan covers...clean walls and door in kitchen.....clean encrusted hood and filters....hood cleaning sticker is expired 2013  provide hood cleaning from a certified company....clean ceiling throughout...clean attached grease encrusted pipes....replace defective baseboard covemolding...provide a rear screen door or door shall remain shut...degrease entire kitchen....clean wall mounted exhaust fan and loovers interior and exterior....,722   Shawmut AV,Roxbury,MA,02119,157649,"(42.332783, -71.083221)"
COPLEY PLAZA HOTEL,,DALEY,DALEY,JAMES,18878,02/21/2012 10:53:44 AM,12/31/2016 11:59:00 PM,Active,FS,Eating & Drinking,HE_Fail,07/29/2015 10:15:22 AM,32-6-301.11-02.11,*,Hand Cleaner  Drying  Tissue Signage,07/29/2015 10:15:22 AM,Fail,,main bar handsink/provide proper liquid pump soap room service/provide employee must wash hands signage,138   ST JAMES  AV,BOSTON,MA,02116,,
MCKENNA'S CAFE,,KENNETH OSHEROW  PRES.,KENNETH OSHEROW PRES.,,23628,12/28/2011 09:11:33 AM,12/31/2016 11:59:00 PM,Active,FS,Eating & Drinking,HE_TSOP,01/16/2008 09:04:25 AM,M-2-201.11/.14 .15,***,Non-Compliance w/Employee Health Policy,01/17/2008 02:54:02 PM,Fail,,No illness policy developed by CFPM. Provide in accordance with regulations. Train staff. Handout provided.,109   Savin Hill AV,Dorchester,MA,02125,156864,"(42.311515, -71.05382)"
The Corner Tavern,,BACON DOUGLAS F TS,DOUGLAS BACON PRES.,,19829,12/15/2011 11:23:57 AM,12/31/2016 11:59:00 PM,Active,FS,Eating & Drinking,HE_Fail,11/03/2009 02:05:02 PM,16-4-501.11/.15,*,Dishwashng Facilities,11/03/2009 02:05:02 PM,Fail,,Neither the bar's glass machine  nor the kitchen's dish machine were properly sanitizing at the start of the inspection.  The establishment had just opened.  No customers had been serviced prior to BISD's arrival.  BISD and the staff were able to replace the empty sanitizing container and properly prime the kitchen's dish machine before the inspection was completed.  The bar's dish machine was not properly primed before the end of the inspection.  The bar's dish machine must be serviced/repaired before it can be utilized.  All bar wares must we washed within the dish machine until the bar machine has been repaired.,421   Marlborough ST,Boston,MA,02115,91385,"(42.35014, -71.08944)"
Masona Grill,,JOF REALTY LLC,Masona Inc.,,28939,01/18/2012 05:50:35 PM,12/31/2016 11:59:00 PM,Active,FS,Eating & Drinking,HE_Pass,10/05/2015 02:37:58 PM,15-4-202.16,*,Non-Food Contact Surfaces,10/05/2015 02:37:58 PM,Pass,2015-10-06 08:47:36,Clean cloth curtains at the entrance to the kitchen. Visibly soiled.,2  Corey St,West Roxbury,MA,02132,42766,"(42.28468, -71.15523)"
Durgin Park Restaurant,,,Weinstein,Michael,24748,02/13/2012 11:17:17 AM,12/31/2016 11:59:00 PM,Active,FS,Eating & Drinking,HE_Hearing,09/07/2012 11:14:11 AM,16-4-501.11/.15,*,Dishwashng Facilities,09/07/2012 11:14:11 AM,Fail,,Information on low temp dishmachine indicates machine is a high temp.,300  Faneuil Hall Marketplace,Boston,MA,02109,341035,"(42.360036, -71.056253)"
Dot 2 Dot Cafe,,BERTUCCI JOHN E TRST,Henry-Garrett,Karen,28291,01/24/2012 09:58:41 AM,12/31/2016 11:59:00 PM,Active,FS,Eating & Drinking,HE_Fail,08/08/2014 10:16:45 AM,14-4-202.11,*,Food Contact Surfaces Design,08/08/2014 10:16:45 AM,Fail,,Sponges observed at the 3 bay sink. Discontibue use.,1735   Dorchester AV,Dorchester,MA,02124,48397,"(42.29105, -71.06302)"
Prime Shoppe,,,Touarsi,Benemar,28544,02/08/2012 04:33:52 PM,12/31/2016 11:59:00 PM,Active,FT,Eating & Drinking w/ Take Out,HE_Filed,03/27/2009 10:42:20 AM,23-4-602.13,*,Non-Food Contact Surfaces Clean,03/30/2009 07:38:52 AM,Fail,,Clean and refinish rusted shelving in walk in.,104-112   Faneuil Hall Mkt,Boston,Ma,02109,,
Erie Pub,,STENSON JOHN P TS,IRISH PUB INC,,18026,12/19/2011 11:29:24 AM,12/31/2016 11:59:00 PM,Active,FS,Eating & Drinking,HE_Pass,02/10/2010 02:06:24 PM,,,,,,,,791   Adams ST,Dorchester,MA,02124,975,"(42.28316, -71.05602)"
Pueblo Viejo,,STELLA JAMES S,Pupuseria & Mexican Grill Inc. II,Marvin B. Jimenez,143374,08/04/2015 09:30:05 AM,12/31/2016 11:59:00 PM,Active,FT,Eating & Drinking w/ Take Out,HE_Pass,07/27/2015 01:48:03 PM,,,,,,,,309   Bennington ST,East Boston,MA,02128,14712,"(42.378888, -71.027796)"
DRAGON CHEF CHINESE REST.,,,RU BANG CHEN PRES.,,21347,02/06/2012 10:55:13 AM,12/31/2016 11:59:00 PM,Active,FT,Eating & Drinking w/ Take Out,HE_Pass,09/25/2013 07:43:02 PM,,,,,,,,411  Washington St,Brighton,MA,02135,156051,"(42.349266, -71.15532)"
FLOUR BAKERY & CAFE,,,JOANNE CHANG,,21518,01/26/2012 03:07:20 PM,12/31/2016 11:59:00 PM,Active,FT,Eating & Drinking w/ Take Out,HE_Filed,05/23/2008 12:07:07 PM,42-6-501.113/.114,*,Premises Maintained,05/27/2008 08:18:11 AM,Pass,2008-05-27 08:18:11,ice machine/remove items on top of unit,1595   Washington ST,Roxbury,MA,02114,157458,"(42.338323, -71.07488)"
Double Tree Club Hotel,,BOSTON REDEVELOPMENT AUTH,C.J. WASHINGTON STREET L.L.C.,,21472,03/09/2012 11:17:16 AM,12/31/2016 11:59:00 PM,Active,FS,Eating & Drinking,HE_Hearing,03/24/2015 01:34:37 PM,36-6-501.11-.12,*,Improper Maintenance of Floors,03/24/2015 01:34:37 PM,Fail,,Clean floor  under & behind all equipment,821    Washington ST,BOSTON,MA,02116,,
The Upper Crust,,PESIRIDIS THEODORE TRST,Shenefield,Shawn,90116,03/25/2013 02:37:01 PM,12/31/2016 11:59:00 PM,Active,FT,Eating & Drinking w/ Take Out,HE_Hearing,04/08/2014 10:52:24 AM,39-6-304.11,*,Rooms and Equipment Vented,04/08/2014 10:52:24 AM,Pass,2014-04-08 15:21:29,side restroom/repair exhaust fan,683   Tremont ST,Roxbury,MA,02118,137919,"(42.34156, -71.07662)"
Durgin Park Restaurant,,,Weinstein,Michael,24748,02/13/2012 11:17:17 AM,12/31/2016 11:59:00 PM,Active,FS,Eating & Drinking,HE_Fail,08/31/2011 12:55:29 PM,36-6-201.11,*,Floors Designed Constructed Installed,08/31/2011 12:55:29 PM,Fail,,clean floor area throughout laundry room floor including both locker rooms andf storage area,300  Faneuil Hall Marketplace,Boston,MA,02109,341035,"(42.360036, -71.056253)"
Uno Chicago Grill,,SPENCER AARONN D,UNO RESTAURANTS,LLC  LEGAL DEPARTMENT,18958,01/09/2012 03:53:57 PM,12/31/2016 11:59:00 PM,Active,FT,Eating & Drinking w/ Take Out,HE_Pass,04/27/2012 11:53:05 AM,29-5-201/02.11,*,Installed and Maintained,04/27/2012 11:53:05 AM,Pass,2012-04-27 15:21:29,Hot water faucet at handsink leaking  repair.,727   Boylston ST,Boston,MA,02116,18385,"(42.349589, -71.080292)"
No.  7 RESTAURANT,,,HUANG FAMILY INC.,REN XIANGHUANG  PRES.,25414,02/08/2012 04:32:36 PM,12/31/2016 11:59:00 PM,Active,FT,Eating & Drinking w/ Take Out,HE_FailExt,01/11/2013 03:01:38 PM,20-4-703.11,***,Food Contact Surfaces Clean,01/11/2013 03:01:38 PM,Pass,2013-01-15 08:45:56,provide proper sanitizing training for all employees....,225   Grove ST,West Roxbury,MA,02132,156965,"(42.261873, -71.15741)"
Abbott's Frozen Custard,,SA & ZE CO LLC,Mary P. Dauria,,74489,12/22/2011 03:03:52 PM,12/31/2016 11:59:00 PM,Active,FT,Eating & Drinking w/ Take Out,HE_NotReq,12/30/2013 12:00:00 AM,,,,,,,,362   Washington ST,Brighton,MA,02135,143525,"(42.348955, -71.153641)"
Boston Globe Cafeteria,,FLIK INTERNATIONAL CORP.,FLIK INTERNATIONAL CORP.,Compass Group,26254,02/06/2012 08:00:29 AM,12/31/2016 11:59:00 PM,Active,FS,Eating & Drinking,HE_Filed,02/03/2012 10:49:52 AM,37-6-501.11-.12,*,Improper Maintenance of Walls/Ceilings,02/03/2012 10:49:52 AM,Fail,,Clean light shield(shield also loose-reaffix) in Dishroom.Reminder to keep current with the BFD requirements on Hotline hood(s).,135   William T Morrissey BL,Dorchester,MA,02125,156975,"(42.315997, -71.049211)"
No.  7 RESTAURANT,,,HUANG FAMILY INC.,REN XIANGHUANG  PRES.,25414,02/08/2012 04:32:36 PM,12/31/2016 11:59:00 PM,Active,FT,Eating & Drinking w/ Take Out,HE_Fail,05/13/2008 01:26:51 PM,21-3-304.14,*,Wiping Cloths  Clean  Sanitize,05/13/2008 03:19:08 PM,Fail,,set up pails with  sanitizer,225   Grove ST,West Roxbury,MA,02132,156965,"(42.261873, -71.15741)"
Prime Shoppe,,,Touarsi,Benemar,28544,02/08/2012 04:33:52 PM,12/31/2016 11:59:00 PM,Active,FT,Eating & Drinking w/ Take Out,HE_Hearing,10/24/2013 01:46:18 PM,32-6-301.11-02.11,*,Hand Cleaner  Drying  Tissue Signage,10/24/2013 01:46:18 PM,Fail,,Provide dispenser for paper towel at hand sink,104-112   Faneuil Hall Mkt,Boston,Ma,02109,,
Durgin Park Restaurant,,,Weinstein,Michael,24748,02/13/2012 11:17:17 AM,12/31/2016 11:59:00 PM,Active,FS,Eating & Drinking,HE_Pass,02/28/2012 11:02:52 AM,,,,,,,,300  Faneuil Hall Marketplace,Boston,MA,02109,341035,"(42.360036, -71.056253)"
Nicholas Sub & Pizza Shop,,NICHOLAS MARKOPOULOS,Kourtelidis,Nicholas,33364,01/17/2012 03:37:47 PM,12/31/2016 11:59:00 PM,Active,FT,Eating & Drinking w/ Take Out,HE_Fail,07/28/2014 10:43:34 AM,23-4-602.13,*,Non-Food Contact Surfaces Clean,07/28/2014 10:43:34 AM,Fail,,Exterior of fryers in main kitchen area heavily soiled and with food debris. Clean to remove. Interior of the white coffin style freezer with frost build up and food debris. Clean to remove. Interior of the pizza cooler visibly soiled and with food debris. Clean to remove. Lower shelf under the hand sink in the main kitchen area visibly soiled and with what appears to be rodent droppings. Clean to remove. Interior of the mop sink heavily soiled. Clean to remove. Storage shelves throughout the main kitchen and preparation area's visibly soiled. Clean to remove. Exterior of the Hobart stand mixer with cacked on foods. Clean to remove.,600   Hyde Park AV,Roslindale,MA,02131,156517,"(42.280027, -71.118658)"
Mehak Restaurant,,DE PASQUALE RONALD,Akram,Mohammad,33626,02/29/2012 12:55:00 PM,12/31/2016 11:59:00 PM,Active,FS,Eating & Drinking,HE_Fail,04/17/2013 02:31:11 PM,23-4-602.13,*,Non-Food Contact Surfaces Clean,04/17/2013 02:31:11 PM,Fail,,clean interior of the microwave oven. clean interior of one door reach in located in kitchen.,329   Sumner ST,East Boston,MA,02128,132398,"(42.36711, -71.03607)"
BOSTON WING IT,,MYONG JO SONG,MYONG JO SONG,,22141,02/09/2012 10:35:11 AM,12/31/2016 11:59:00 PM,Active,FT,Eating & Drinking w/ Take Out,HE_Filed,12/28/2007 02:16:27 PM,37-6-501.11-.12,*,Improper Maintenance of Walls/Ceilings,12/28/2007 03:40:09 PM,Pass,2007-12-28 15:40:09,Hood vent filters are soiled with grease. Clean to remove. The wall behind the sink is soiled with moldlike debris. Clean to remove.,1153   COMMONWEALTH  AV,ALLSTON,MA,02134,,
MCKENNA'S CAFE,,KENNETH OSHEROW  PRES.,KENNETH OSHEROW PRES.,,23628,12/28/2011 09:11:33 AM,12/31/2016 11:59:00 PM,Active,FS,Eating & Drinking,HE_Pass,02/13/2012 12:52:52 PM,03-3-501.16,***,Hot Holding,02/13/2012 12:52:52 PM,Pass,2012-02-13 14:59:50,Cooked chicken strips sitting in bowl on top of stove at 103.7F.Discussed possible solutions for product(Hot holding or Cooling?).,109   Savin Hill AV,Dorchester,MA,02125,156864,"(42.311515, -71.05382)"
PHO 2000,,SCHIAVO BRUNO A TS,Dung Ngu,,76202,04/06/2012 12:14:16 PM,12/31/2016 11:59:00 PM,Active,FS,Eating & Drinking,HE_Fail,06/07/2013 11:43:48 AM,03-3-501.16(A),***,Cold Holding,06/07/2013 11:43:48 AM,Fail,,Cat fish out hang drying at a temperature between 48F to 52F. PIC stated that she took out fish less than a hour ago. PIC removed and put cat fish back into walk in and will take out only what she can cook. Monitor Bean sprouts at front counter at 74F. PIC voluntary discarded. Sprouts must be keeped at 41F or below.,198   Adams ST,Dorchester,MA,02122,606,"(42.30224, -71.06)"
CANTON HOUSE,,,LI TING LI PRESIDENT,,23526,02/01/2012 03:06:08 PM,12/31/2016 11:59:00 PM,Active,FT,Eating & Drinking w/ Take Out,HE_Pass,08/05/2015 02:49:44 PM,26-4-502.13,*,Re-use of Single Service Articles,08/05/2015 02:49:44 PM,Pass,2015-08-05 15:52:00,Remove all single use buckets and provide food service grade food storage equipment.,6  Hancock St,Dorchester,MA,02125,158300,"(42.315595, -71.065919)"
Anshur Restauruant,,REARDON THOMAS B,Anshur,Abdullah F.,31241,02/08/2012 03:13:24 PM,12/31/2016 11:59:00 PM,Active,FT,Eating & Drinking w/ Take Out,HE_Fail,09/30/2008 11:16:42 AM,32-6-301.11-02.11,*,Hand Cleaner  Drying  Tissue Signage,09/30/2008 03:32:39 PM,Fail,,handsink/provide paper towels and employee handwash signage,291   Roxbury ST,Roxbury,MA,02119,119179,"(42.33041, -71.0943)"
MCKENNA'S CAFE,,KENNETH OSHEROW  PRES.,KENNETH OSHEROW PRES.,,23628,12/28/2011 09:11:33 AM,12/31/2016 11:59:00 PM,Active,FS,Eating & Drinking,HE_TSOP,01/16/2008 09:04:25 AM,25-4-904.11,*,Single Service Articles Stored Dispensed,01/17/2008 02:54:02 PM,Fail,,Open paper products  foods stored on shelves in area without smooth  durable cleanable surfaces. Store protected from dust contamination in area where properly constructed.,109   Savin Hill AV,Dorchester,MA,02125,156864,"(42.311515, -71.05382)"
Cafeteria Y Pizzaria Mi Columbia,,,E.B. Crown Fried Chicken & Pizza Inc.,,124996,01/09/2014 01:41:04 PM,12/31/2016 11:59:00 PM,Active,FT,Eating & Drinking w/ Take Out,HE_Pass,06/06/2014 10:57:57 AM,17-4-204.112/.115,*,Equipment Thermometers,06/06/2014 10:57:57 AM,Pass,2014-06-06 15:37:07,Provide thermometers where needed,50   Maverick SQ,East Boston,MA,02128,92897,"(42.37017, -71.03868)"
Brighams & Womens Hospital - Tower Cafe,,AU BON PAIN CO  INC. #508 (LAURA),Langill BWH CFSD,Susan,18544,02/08/2012 05:33:24 PM,12/31/2016 11:59:00 PM,Active,FS,Eating & Drinking,HE_Fail,07/29/2014 01:40:22 PM,15-4-202.16,*,Non-Food Contact Surfaces,07/29/2014 01:40:22 PM,Fail,,Walk in cooler temperature at 46F- Repair to maintain temperatures of 41F or below,75   FRANCIS ST,Boston,MA,02115,158148,"(42.336106, -71.10748)"
ROSLINDALE HOUSE OF PIZZA,,,VASSILIOS GLYKIS,,19964,01/06/2012 10:23:12 AM,12/31/2016 11:59:00 PM,Active,FT,Eating & Drinking w/ Take Out,HE_Fail,01/05/2015 11:57:54 AM,36-6-501.11-.12,*,Improper Maintenance of Floors,01/05/2015 11:57:54 AM,Fail,,Repair any broken or missing floor tiles in kitchen prep area.  Clean floor under shelves in basement and kitchen area.,4168   Washington ST,Roslindale,MA,02131,157416,"(42.287818, -71.126399)"
LOLLICUP TEA ZONE,,PETER LUU  PRES.,LONG JIANG,,22229,02/14/2012 12:48:34 PM,12/31/2016 11:59:00 PM,Active,FT,Eating & Drinking w/ Take Out,HE_Fail,02/23/2012 10:47:03 AM,05-4-302.12,*,Food Thermometers Provided,02/23/2012 10:47:03 AM,Fail,,No food thermometers on site. Provide.,1   Brighton AV,Allston,MA,02134,157732,"(42.352411, -71.125329)"
Durgin Park Restaurant,,,Weinstein,Michael,24748,02/13/2012 11:17:17 AM,12/31/2016 11:59:00 PM,Active,FS,Eating & Drinking,HE_Fail,08/13/2014 12:10:17 PM,36-6-201.11,*,Floors Designed Constructed Installed,08/13/2014 12:10:17 PM,Fail,,floors in ladies locker room with missing tiles and holes   repair,300  Faneuil Hall Marketplace,Boston,MA,02109,341035,"(42.360036, -71.056253)"
UNION OYSTER HOUSE,,MILANO JOSEPH A JR TRST,MILANO,JOSEPH A.,19089,12/14/2011 02:11:17 PM,12/31/2016 11:59:00 PM,Active,FS,Eating & Drinking,HE_Pass,05/10/2013 11:03:52 AM,23-4-602.13,*,Non-Food Contact Surfaces Clean,05/10/2013 11:03:52 AM,Pass,2013-05-13 08:04:20,Clean underside of shelving over 1st kitchen hot hold unit.,41  Union St,Boston,MA,02108,139293,"(42.36127, -71.05688)"
Cafeteria Y Pizzaria Mi Columbia,,,E.B. Crown Fried Chicken & Pizza Inc.,,124996,01/09/2014 01:41:04 PM,12/31/2016 11:59:00 PM,Active,FT,Eating & Drinking w/ Take Out,HE_Pass,06/06/2014 10:57:57 AM,09-3-301.11(C),*,Handling of Food & Ice,06/06/2014 10:57:57 AM,Pass,2014-06-06 15:37:07,Provide scoops for bulk food containers.,50   Maverick SQ,East Boston,MA,02128,92897,"(42.37017, -71.03868)"
Uno Chicago Grill,,SPENCER AARONN D,UNO RESTAURANTS,LLC  LEGAL DEPARTMENT,18958,01/09/2012 03:53:57 PM,12/31/2016 11:59:00 PM,Active,FT,Eating & Drinking w/ Take Out,HE_Pass,09/10/2015 01:02:02 PM,24-4-903.11,*,Clean Equipment & Utensils Storage,09/10/2015 01:02:02 PM,Pass,2015-09-10 15:36:36,At the small wear storage room   equipment and utensils stored on the floor. Elevate 6 inches or above.,727   Boylston ST,Boston,MA,02116,18385,"(42.349589, -71.080292)"
Spirit of Boston,,SPIRIT CRUISES LLC,SPIRIT CRUISES LLC,,18739,02/01/2012 02:57:48 PM,12/31/2016 11:59:00 PM,Active,FS,Eating & Drinking,HE_Fail,08/08/2012 09:53:01 AM,06-3-501.13,*,PHF's Properly Thawed,08/08/2012 09:53:01 AM,Fail,,thawing in stagnant water - provide cold runnig water,200   SEAPORT LA,BOSTON,MA,02210,,
Minina's Cafe,,ROSA JOSE TS,Jose Rosa,,74391,02/01/2012 01:10:59 PM,12/31/2016 11:59:00 PM,Active,FT,Eating & Drinking w/ Take Out,HE_Fail,09/04/2013 02:31:01 PM,31-5-204/05.11,***,Location  Accessible,09/04/2013 02:31:01 PM,Fail,,Hand sink in kitchen blocked with pots and pans. Address with staff and keep sink area open so staff can wash hands.,430   Geneva AV,Dorchester,MA,02122,63341,"(42.30059, -71.06637)"
S & I TO GO,,DOANGPRATHEEP,DOANGPRATHEEP,SAENSUKH,22982,02/15/2012 10:35:28 AM,12/31/2016 11:59:00 PM,Active,FT,Eating & Drinking w/ Take Out,HE_Fail,11/27/2015 12:01:18 PM,35-6-501.111/.115,**,Insects  Rodents  Animals,11/27/2015 12:01:18 PM,Fail,,There are some droppings in the basement but the activity is much smaller.  Provide pest reports to show continued treatment.,168   BRIGHTON  AV,ALLSTON,MA,02134,,
Uno Due Go,,DRUKER BERTRAM A TRSTS,URC L L C,,74800,12/30/2011 01:59:52 PM,12/31/2016 11:59:00 PM,Active,FS,Eating & Drinking,HE_Pass,07/01/2014 11:22:09 AM,06-3-501.13,*,PHF's Properly Thawed,07/01/2014 11:22:09 AM,Pass,2014-07-02 07:47:27,Observed thawing at room temperature / Discontinue and provide thawing.,52   Summer ST,Boston,MA,02110,132025,"(42.35445, -71.05881)"
Frog Pond Boston @ Boston Common,,,The Skating Club of Boston,,75274,02/24/2012 02:04:35 PM,12/31/2016 11:59:00 PM,Active,FT,Eating & Drinking w/ Take Out,HE_Fail,06/21/2013 11:00:31 AM,17-4-302.14,*,Test Kit Provided,06/21/2013 11:00:31 AM,Fail,,They ran out of quats sanitizer  they have bleach but no bleach test strips.  Provide the correct test strips for the sanitizer provided.,,,,,,
A K's Take Out & Delivery,,BOUKOUVALAS ATHENA TS,Saini,Jasbir,28531,12/20/2011 02:29:52 PM,12/31/2016 11:59:00 PM,Active,FT,Eating & Drinking w/ Take Out,HE_Hearing,02/26/2009 10:47:56 AM,36-6-501.11-.12,*,Improper Maintenance of Floors,02/27/2009 08:17:22 AM,Pass,2009-02-27 08:17:22,walk in and freezer/clean floor area under shelving prep area/thoroughly clean floor under/around and behind all equipment and shelving cooking line/reach ins/clean floor under around and behind all equipment,1427   Tremont ST,Mission Hill,MA,02120,136818,"(42.331858, -71.096333)"
COPLEY PLAZA HOTEL,,DALEY,DALEY,JAMES,18878,02/21/2012 10:53:44 AM,12/31/2016 11:59:00 PM,Active,FS,Eating & Drinking,HE_Fail,02/11/2014 10:01:56 AM,08-3-305-307.11,*,Food Protection,02/11/2014 10:01:56 AM,Fail,,employee cafe/provide utensils only signage to all self service stations employee cafe/properly store all eating utensils with handle presented oak room/bulk food bins/remove bowls/provide scoop with handle,138   ST JAMES  AV,BOSTON,MA,02116,,
Uno Due Go,,DRUKER BERTRAM A TRSTS,URC L L C,,74800,12/30/2011 01:59:52 PM,12/31/2016 11:59:00 PM,Active,FS,Eating & Drinking,HE_Fail,09/02/2015 01:23:40 PM,35-6-501.111/.115,**,Insects  Rodents  Animals,09/02/2015 01:23:40 PM,Fail,,Flies noted in area / Contact pest control.,52   Summer ST,Boston,MA,02110,132025,"(42.35445, -71.05881)"
HAYMARKET PIZZA,,ROSARIO MANUELA,Blackstone Food Inc.,,19192,12/19/2011 10:42:03 AM,12/31/2016 11:59:00 PM,Active,FT,Eating & Drinking w/ Take Out,HE_Pass,08/20/2007 03:17:08 PM,,,,,,,,102   BLACKSTONE,BOSTON,MA,02109,,
PARKWAY LITTLE LEAGUE STAND,,,PARKWAY LITTLE LEAGUE INC.,,26023,03/19/2012 08:30:43 AM,12/31/2016 11:59:00 PM,Active,FS,Eating & Drinking,HE_Pass,04/24/2015 10:20:41 AM,,,,,,,,315   BAKER ST,WEST ROXBURY,MA,02132,,
ZESTO'S PIZZA,,FOUR 60-468 CENTRE STREET,K & M Pizza Inc.,,75590,12/12/2011 12:47:41 PM,12/31/2016 11:59:00 PM,Active,FT,Eating & Drinking w/ Take Out,HE_FailExt,09/23/2014 01:46:55 PM,13-2-304/402.11,*,Clean Cloths  Hair Restraint,09/23/2014 01:46:55 PM,Pass,2014-09-23 15:30:32,Provide hair restraints for staff in kitchen area.,460   Centre ST,Jamaica Plain,MA,02130,28061,"(42.31935, -71.11154)"
Anshur Restauruant,,REARDON THOMAS B,Anshur,Abdullah F.,31241,02/08/2012 03:13:24 PM,12/31/2016 11:59:00 PM,Active,FT,Eating & Drinking w/ Take Out,HE_Pass,02/15/2012 11:38:48 AM,29-5-201/02.11,*,Installed and Maintained,02/15/2012 11:38:48 AM,Pass,2012-02-15 15:41:02,repair faucet handle to dishroom handsink repair leak to mens restroom handsink,291   Roxbury ST,Roxbury,MA,02119,119179,"(42.33041, -71.0943)"
Ziti's Express,,LAMBERT GREGORY,Tremont Street Burger L L C,,67693,12/19/2011 01:53:23 PM,12/31/2016 11:59:00 PM,Active,FS,Eating & Drinking,HE_Fail,10/29/2014 10:56:07 AM,35-6-501.111/.115,**,Insects  Rodents  Animals,10/29/2014 10:56:07 AM,Fail,,Small fruit/drain flies noted in the basement prep / Manager unsure of last extermintion / Contact exterminators.,140   Tremont ST,Boston,MA,02111,156397,"(42.355646, -71.062559)"
Durgin Park Restaurant,,,Weinstein,Michael,24748,02/13/2012 11:17:17 AM,12/31/2016 11:59:00 PM,Active,FS,Eating & Drinking,HE_Pass,04/25/2013 02:45:38 PM,09-3-301.11(C),*,Handling of Food & Ice,04/25/2013 02:45:38 PM,Pass,2013-04-26 08:02:18,Using small bowls to scoop food items on salad unit.,300  Faneuil Hall Marketplace,Boston,MA,02109,341035,"(42.360036, -71.056253)"
Dunkin Donuts,,ONE HUNDRED CAMBRIDGE STREET,DN Donuts Inc.,Danny Haddad,26507,01/11/2012 11:22:31 AM,12/31/2016 11:59:00 PM,Active,FT,Eating & Drinking w/ Take Out,HE_Filed,02/25/2013 12:08:26 PM,10-3-304.12,*,Food Utensil Storage,02/25/2013 12:08:26 PM,Fail,,Properly store ice scoop,100   Cambridge ST,Boston,MA,02114,25222,"(42.360584, -71.062109)"
Peggy O'Neil's Pub & Grille,,LIMERICK CO INC,LIMERICK CO INC,,19097,12/13/2011 03:15:33 PM,12/31/2016 11:59:00 PM,Active,FS,Eating & Drinking,HE_Fail,05/08/2009 01:48:24 PM,15-4-202.16,*,Non-Food Contact Surfaces,05/11/2009 08:04:21 AM,Pass,2009-05-11 08:04:21,,1310   DORCHESTER  AV,DORCHESTER,MA,02122,,
West Napoli Pizza,,VRATTOS SOCRATES TS,BARDHI,SOKOL,21409,06/06/2012 03:38:02 PM,12/31/2016 11:59:00 PM,Active,FT,Eating & Drinking w/ Take Out,HE_Pass,05/16/2013 03:31:25 PM,37-6-501.11-.12,*,Improper Maintenance of Walls/Ceilings,05/16/2013 03:31:25 PM,Pass,2013-05-17 08:07:56,clean vent hood filters.,1946  Centre St,West Roxbury,MA,02132,27764,"(42.28358, -71.15676)"
FLOUR BAKERY & CAFE,,,JOANNE CHANG,,21518,01/26/2012 03:07:20 PM,12/31/2016 11:59:00 PM,Active,FT,Eating & Drinking w/ Take Out,HE_Fail,06/04/2013 10:01:20 AM,37-6-501.11-.12,*,Improper Maintenance of Walls/Ceilings,06/04/2013 10:01:20 AM,Fail,,bakery/clean interior of hot line and window ledges clean stained ceiling tiles,1595   Washington ST,Roxbury,MA,02114,157458,"(42.338323, -71.07488)"
CAFE ESPLANADE,,,Pamela Bardhi,,91465,07/02/2013 08:38:33 AM,12/31/2016 11:59:00 PM,Active,FT,Eating & Drinking w/ Take Out,HE_FailExt,06/27/2013 10:38:18 AM,32-6-501.11-.12/6-202.14,*,Toilet Enclosed Clean,06/27/2013 10:38:18 AM,Fail,,restroom/provide self closing door to restroom,0   David G Mugar WY,Boston,MA,02108,46576,"(42.355594, -71.074207)"
BOSTON WING IT,,MYONG JO SONG,MYONG JO SONG,,22141,02/09/2012 10:35:11 AM,12/31/2016 11:59:00 PM,Active,FT,Eating & Drinking w/ Take Out,HE_Fail,10/30/2009 11:35:19 AM,12-2-301.12-.15,***,Adequate Handwashing/Where/When/How,10/30/2009 03:26:42 PM,Fail,,Staff observed improperly washing hands.CFM needs to retrain staff on proper procedures.,1153   COMMONWEALTH  AV,ALLSTON,MA,02134,,
Uno Chicago Grill,,SPENCER AARONN D,UNO RESTAURANTS,LLC  LEGAL DEPARTMENT,18958,01/09/2012 03:53:57 PM,12/31/2016 11:59:00 PM,Active,FT,Eating & Drinking w/ Take Out,HE_Pass,02/28/2008 02:27:43 PM,01-3-101/701.11,***,Spoilage Unsafe Food,02/28/2008 03:22:56 PM,Pass,2008-02-28 15:22:56,Kitchen Some pizza sauce cans are heavily dented. Discard or return unsafe food.,727   Boylston ST,Boston,MA,02116,18385,"(42.349589, -71.080292)"
Eaton Vance Harbor Cafe (13th fl.),,,Prince Street Caterers,,32124,01/06/2012 03:25:41 PM,12/31/2016 11:59:00 PM,Active,FS,Eating & Drinking,HE_Fail,04/01/2010 11:12:57 AM,03-3-501.16,***,Hot Holding,04/01/2010 11:12:57 AM,Fail,,Vegetable medley in warmer unit at 75F.,2   International PL,Boston,Ma,02110,,
UPTOWN CAFE,,,GARY FORZIATI,,23109,12/14/2011 11:10:59 AM,12/31/2016 11:59:00 PM,Active,FT,Eating & Drinking w/ Take Out,HE_Filed,11/17/2009 11:07:09 AM,36-6-501.11-.12,*,Improper Maintenance of Floors,11/17/2009 11:07:09 AM,Fail,,Walk in Clean floor and vent,116   CAMBRIDGE,BOSTON,MA,02114,,
Uno Chicago Grill,,NICOLE E. ADAMS,NICOLE E. ADAMS,,19118,01/09/2012 03:55:20 PM,12/31/2016 11:59:00 PM,Active,FT,Eating & Drinking w/ Take Out,HE_Pass,09/01/2009 10:31:22 AM,17-4-204.112/.115,*,Equipment Thermometers,09/02/2009 08:41:06 AM,Pass,2009-09-02 08:41:06,Properly repair temperature gauge on High Temp dishwasher in kitchen to ensure at least 150F.,270   HUNTINGTON  AV,BOSTON,MA,02125,,
Durgin Park Restaurant,,,Weinstein,Michael,24748,02/13/2012 11:17:17 AM,12/31/2016 11:59:00 PM,Active,FS,Eating & Drinking,HE_Fail,12/30/2013 10:09:57 AM,36-6-501.11-.12,*,Improper Maintenance of Floors,12/30/2013 10:09:57 AM,Fail,,Resurface floor,300  Faneuil Hall Marketplace,Boston,MA,02109,341035,"(42.360036, -71.056253)"
UPTOWN CAFE,,,GARY FORZIATI,,23109,12/14/2011 11:10:59 AM,12/31/2016 11:59:00 PM,Active,FT,Eating & Drinking w/ Take Out,HE_Fail,04/22/2008 11:15:34 AM,32-6-301.11-02.11,*,Hand Cleaner  Drying  Tissue Signage,04/23/2008 08:09:03 AM,Fail,,HAHDSINK,116   CAMBRIDGE,BOSTON,MA,02114,,
COPLEY PLAZA HOTEL,,DALEY,DALEY,JAMES,18878,02/21/2012 10:53:44 AM,12/31/2016 11:59:00 PM,Active,FS,Eating & Drinking,HE_Pass,07/13/2011 03:06:13 PM,37-6-501.11-.12,*,Improper Maintenance of Walls/Ceilings,07/13/2011 03:06:13 PM,Pass,2011-07-14 08:14:51,Walls in pot wash room with soil and dried spatter  clean to remove.,138   ST JAMES  AV,BOSTON,MA,02116,,
COPLEY PLAZA HOTEL,,DALEY,DALEY,JAMES,18878,02/21/2012 10:53:44 AM,12/31/2016 11:59:00 PM,Active,FS,Eating & Drinking,HE_Fail,02/23/2015 10:10:09 AM,36-6-501.11-.12,*,Improper Maintenance of Floors,02/23/2015 10:10:09 AM,Fail,,old bakery walk in/repair worn/damaged floor dishroom/regrout floor as needed,138   ST JAMES  AV,BOSTON,MA,02116,,
Dosa Factory,,,Pabla,Jaswiner,138037,01/21/2015 11:05:29 AM,12/31/2016 11:59:00 PM,Active,FS,Eating & Drinking,HE_Fail,07/02/2015 12:45:39 PM,02-3-602.11-.12/3-302.12,*,Food Container Labels,07/02/2015 12:45:39 PM,Fail,,Bulk food containers missing labels.Provide,316   Newbury ST,Boston,MA,02115,168065,"(42.34862, -71.085413)"
Brigham & Women Hospital OR Lounge,,AU BON PAIN CO  INC. #508 (LAURA),Langill BWH CFSD,Susan,34631,03/29/2012 10:14:09 AM,12/31/2016 11:59:00 PM,Active,FS,Eating & Drinking,HE_Pass,11/23/2010 11:42:59 AM,,,,,,,,75   FRANCIS ST,Boston,MA,02115,158148,"(42.336106, -71.10748)"
WAI WAI ICE CREAM SHOP,,WONG SHU YING TRSTS,HUI,DAVID,24990,01/06/2012 09:20:52 AM,12/31/2016 11:59:00 PM,Active,FS,Eating & Drinking,HE_Fail,01/26/2015 10:10:47 AM,20-4-703.11,***,Food Contact Surfaces Clean,01/26/2015 10:10:47 AM,Fail,,Using regular bleach to sanitize,26   Oxford ST,Boston,MA,02111,106209,"(42.35168, -71.06027)"
EL PENOL RESTAURANT,,,MIGUEL A. MEDINA BALBIN,,23581,12/29/2011 09:39:51 AM,12/31/2016 11:59:00 PM,Active,FS,Eating & Drinking,HE_Pass,09/28/2011 12:00:21 PM,22-4-601/602.11,**,Food Contact Surfaces Clean,09/28/2011 12:00:21 PM,Pass,2011-09-29 08:25:45,Clean and sanitize heavily scorned cutting board as discussed,54   Bennington ST,East Boston,MA,02128,156292,"(42.375798, -71.037101)"
WAI'S STYLE RESTAURANT,,DAVID HUI: WAI'S STYLE RE,DAVID HUI: WAI'S STYLE RE,STAURANT,20355,01/06/2012 09:22:08 AM,12/31/2016 11:59:00 PM,Active,FS,Eating & Drinking,HE_Filed,01/14/2010 10:06:27 AM,21-3-304.14,*,Wiping Cloths  Clean  Sanitize,01/14/2010 10:06:27 AM,Fail,,Store wiping cloths in sanitizer and replaced frayed cloths,99   HARRISON  AV,BOSTON,MA,02111,,
Subway,,CATALDO JOHN M JR,Patel,Jitendra,98011,09/30/2013 09:43:36 AM,12/31/2016 11:59:00 PM,Active,FT,Eating & Drinking w/ Take Out,HE_Fail,10/27/2015 10:07:22 AM,36-6-501.11-.12,*,Improper Maintenance of Floors,10/27/2015 10:07:22 AM,Fail,,Repair floor at slop sink.,13   William C Kelly SQ,East Boston,MA,02128,151119,"(42.374597, -71.038799)"
MCKENNA'S CAFE,,KENNETH OSHEROW  PRES.,KENNETH OSHEROW PRES.,,23628,12/28/2011 09:11:33 AM,12/31/2016 11:59:00 PM,Active,FS,Eating & Drinking,HE_Fail,11/18/2009 10:06:16 AM,23-4-602.13,*,Non-Food Contact Surfaces Clean,11/18/2009 10:06:16 AM,Fail,,Interior of small coffin style freezer with heavy frost build-up and fod spills. Defrost and clean to remove. Heavy frost build-up on condenser of 4 door Traulsen. Defrost to remove. Interior of small coffin style freezer in basement visibly soiled. Clean to remove.,109   Savin Hill AV,Dorchester,MA,02125,156864,"(42.311515, -71.05382)"
Hungry Traveler,,,Jisung Oh,,31164,01/17/2012 04:29:57 PM,12/31/2016 11:59:00 PM,Active,FS,Eating & Drinking,HE_Fail,03/20/2013 10:37:21 AM,41-7-201/04.11,***,Separation/Sanitizer Criteria,03/20/2013 10:37:21 AM,Pass,2013-03-20 15:38:48,Hand soap stored at food prep sink. (Corrected on site),27   COURT SQ SQ,BOSTON,MA,02108,,
DRAGON CHEF CHINESE REST.,,,RU BANG CHEN PRES.,,21347,02/06/2012 10:55:13 AM,12/31/2016 11:59:00 PM,Active,FT,Eating & Drinking w/ Take Out,HE_Filed,11/20/2009 02:51:44 PM,21-3-304.14,*,Wiping Cloths  Clean  Sanitize,11/20/2009 02:51:44 PM,Pass,2009-11-23 08:05:05,Wet  soiled cloth on counter. Store in sanitizing solution between use.,411  Washington St,Brighton,MA,02135,156051,"(42.349266, -71.15532)"
Grille 705,,SEVEN-05 MASSACHUSETTS AVE,Antreassian,Sarkis,28817,01/31/2012 10:52:38 AM,12/31/2016 11:59:00 PM,Active,FT,Eating & Drinking w/ Take Out,HE_Fail,11/20/2015 11:17:58 AM,13-2-304/402.11,*,Clean Cloths  Hair Restraint,11/20/2015 11:17:58 AM,Fail,,observed staff with no hair restrainst  provide.,705    Massachusetts AV,BOSTON,MA,02118,,
WINDY CITY AT ADAMS VILLAGE,,BAYTURK MUZAFFER,BAYTURK MUZAFFER,,19800,02/13/2012 10:40:46 AM,12/31/2016 11:59:00 PM,Active,FT,Eating & Drinking w/ Take Out,HE_Fail,07/23/2009 01:49:41 PM,12-3--301.11,***,Prevention of Contamination from Hands,07/24/2009 09:04:34 AM,Fail,,elimlnate,516   Gallivan BL,Dorchester,MA,02124,156552,"(42.282928, -71.055559)"
COPLEY PLAZA HOTEL,,DALEY,DALEY,JAMES,18878,02/21/2012 10:53:44 AM,12/31/2016 11:59:00 PM,Active,FS,Eating & Drinking,HE_Fail,09/19/2012 12:17:00 PM,37-6-501.11-.12,*,Improper Maintenance of Walls/Ceilings,09/19/2012 12:17:00 PM,Fail,,1) hood vents with grease build up  clean to remove(oak room kitchen) 2) hoods with grease build up  clean to remove(main kitchen hoods),138   ST JAMES  AV,BOSTON,MA,02116,,
Dunkin' Donuts,,BARRY ASSOCS INC,JOSE S. COUTO,,19736,02/13/2012 10:14:41 AM,12/31/2016 11:59:00 PM,Active,FT,Eating & Drinking w/ Take Out,HE_Fail,05/05/2015 10:20:48 AM,29-5-201/02.11,*,Installed and Maintained,05/05/2015 10:20:48 AM,Fail,,Repair leak from faucet at three bay sink.,7   Walk Hill ST,Jamaica Plain,MA,02130,141731,"(42.29556, -71.1161)"
Durgin Park Restaurant,,,Weinstein,Michael,24748,02/13/2012 11:17:17 AM,12/31/2016 11:59:00 PM,Active,FS,Eating & Drinking,HE_Pass,01/02/2013 12:55:20 PM,21-3-304.14,*,Wiping Cloths  Clean  Sanitize,01/02/2013 12:55:20 PM,Pass,2013-01-02 15:40:21,Wiping cloths not stored in a sanitizing solution,300  Faneuil Hall Marketplace,Boston,MA,02109,341035,"(42.360036, -71.056253)"
Anshur Restauruant,,REARDON THOMAS B,Anshur,Abdullah F.,31241,02/08/2012 03:13:24 PM,12/31/2016 11:59:00 PM,Active,FT,Eating & Drinking w/ Take Out,HE_Fail,01/27/2012 12:07:25 PM,36-6-501.11-.12,*,Improper Maintenance of Floors,01/27/2012 12:07:25 PM,Fail,,clean floor area under around and behind all shelving,291   Roxbury ST,Roxbury,MA,02119,119179,"(42.33041, -71.0943)"
Minina's Cafe,,ROSA JOSE TS,Jose Rosa,,74391,02/01/2012 01:10:59 PM,12/31/2016 11:59:00 PM,Active,FT,Eating & Drinking w/ Take Out,HE_Fail,08/08/2014 10:54:25 AM,22-4-601/602.11,**,Food Contact Surfaces Clean,08/08/2014 10:54:25 AM,Fail,,Replace soiled grease with new.,430   Geneva AV,Dorchester,MA,02122,63341,"(42.30059, -71.06637)"
COPLEY PLAZA HOTEL,,DALEY,DALEY,JAMES,18878,02/21/2012 10:53:44 AM,12/31/2016 11:59:00 PM,Active,FS,Eating & Drinking,HE_Fail,05/24/2010 11:39:29 AM,29-5-201/02.11,*,Installed and Maintained,05/24/2010 11:39:29 AM,Fail,,1) hand sink pipe leaking  repair,138   ST JAMES  AV,BOSTON,MA,02116,,
Prime Shoppe,,,Touarsi,Benemar,28544,02/08/2012 04:33:52 PM,12/31/2016 11:59:00 PM,Active,FT,Eating & Drinking w/ Take Out,HE_Hearing,11/09/2007 12:26:18 PM,23-4-602.13,*,Non-Food Contact Surfaces Clean,11/13/2007 12:36:08 PM,Pass,2007-11-13 12:36:08,Back area -Clean interior & exterior of ovens. Back area -clean & resurface or replace wire shelving.,104-112   Faneuil Hall Mkt,Boston,Ma,02109,,
The Atrium Cafe@Brigham & Womens Faulkner Hosp.,,,Susan Langill,Food Serv. Dir.,27490,02/22/2012 11:16:00 AM,12/31/2016 11:59:00 PM,Active,FT,Eating & Drinking w/ Take Out,HE_Pass,11/10/2008 12:10:17 PM,,,,,,,,1153   Centre ST,Jamaica Plain,Ma,02130,,
Royal Fried Chicken,,,Akbar Hussain,,125207,02/24/2014 11:03:46 AM,12/31/2016 11:59:00 PM,Active,FT,Eating & Drinking w/ Take Out,HE_Filed,01/08/2014 02:36:20 PM,21-3-304.14,*,Wiping Cloths  Clean  Sanitize,01/08/2014 02:36:20 PM,Pass,2014-01-09 08:39:18,provide sanitizing solution for all storage of wiping cloths...,2360   Washington ST,Roxbury,MA,02119,171105,"(42.329364, -71.084435)"
Currito Burrito,,,Park,Chan,28764,01/05/2012 12:58:58 PM,12/31/2016 11:59:00 PM,Active,FT,Eating & Drinking w/ Take Out,HE_Filed,04/16/2010 02:29:21 PM,36-6-501.11-.12,*,Improper Maintenance of Floors,04/16/2010 02:29:21 PM,Fail,,Clean floors throughout kitchen area from all visible stains and soils,300   LOGAN AIRPORT TRMNL C,EAST BOSTON,MA,02128,,
J J Foley's Cafe,,FOLEY JEREMIAH,J J Foley's Cafe,Inc.,27092,01/31/2012 06:21:48 PM,12/31/2016 11:59:00 PM,Active,FS,Eating & Drinking,HE_Pass,10/25/2011 12:29:34 PM,34-5-501.111/.115,*,Outside Storage Improperly Maintained,10/25/2011 12:29:34 PM,Pass,2011-10-26 08:19:14,Clean outside grease band and storage area.,117   EAST BERKELEY,BOSTON,MA,02118,,
CANTON HOUSE,,,LI TING LI PRESIDENT,,23526,02/01/2012 03:06:08 PM,12/31/2016 11:59:00 PM,Active,FT,Eating & Drinking w/ Take Out,HE_Fail,11/05/2014 02:20:26 PM,M-2-103.11,***,PIC Performing Duties,11/05/2014 02:20:26 PM,Fail,,Food Safety Manager not onsite  manager must be onsite during all hours of operation.,6  Hancock St,Dorchester,MA,02125,158300,"(42.315595, -71.065919)"
COPLEY PLAZA HOTEL,,DALEY,DALEY,JAMES,18878,02/21/2012 10:53:44 AM,12/31/2016 11:59:00 PM,Active,FS,Eating & Drinking,HE_Filed,08/05/2015 11:29:28 AM,05-4-302.12,*,Food Thermometers Provided,08/05/2015 11:29:28 AM,Pass,2015-08-05 15:15:18,room service/provide metal stem cooks thermometer,138   ST JAMES  AV,BOSTON,MA,02116,,
Slush King,,,KIM NOLAN & MARK NOLAN,,19010,02/15/2012 09:42:58 AM,12/31/2016 11:59:00 PM,Active,FT,Eating & Drinking w/ Take Out,HE_Pass,05/07/2010 12:44:37 PM,42-6-501.113/.114,*,Premises Maintained,05/07/2010 12:44:37 PM,Pass,2010-05-10 08:43:43,Remove all clutter and debris empty boxes and unusable equipment from front counter,211   BENNINGTON,EAST BOSTON,MA,02128,,
Tavern In The Square,,MC CLURE,JAJB INC.,,68446,12/29/2011 01:49:27 PM,12/31/2016 11:59:00 PM,Active,FS,Eating & Drinking,HE_Pass,11/05/2010 12:46:59 PM,,,,,,,,161   Brighton AV,Allston,MA,02134,157226,"(42.353257, -71.132449)"
No.  7 RESTAURANT,,,HUANG FAMILY INC.,REN XIANGHUANG  PRES.,25414,02/08/2012 04:32:36 PM,12/31/2016 11:59:00 PM,Active,FT,Eating & Drinking w/ Take Out,HE_Fail,12/02/2008 01:00:22 PM,20-4-703.11,***,Food Contact Surfaces Clean,12/02/2008 03:26:23 PM,Fail,,provide sanitizer at sink for properly sanitizing all equipment,225   Grove ST,West Roxbury,MA,02132,156965,"(42.261873, -71.15741)"
UPTOWN CAFE,,,GARY FORZIATI,,23109,12/14/2011 11:10:59 AM,12/31/2016 11:59:00 PM,Active,FT,Eating & Drinking w/ Take Out,HE_Pass,03/25/2010 11:05:38 AM,14-4-202.11,*,Food Contact Surfaces Design,03/25/2010 11:05:38 AM,Pass,2010-03-26 08:25:52,Replace worn and heavily stained cutting boards,116   CAMBRIDGE,BOSTON,MA,02114,,
BRIGHAM & WOMENS FAULKNER HOSPITAL,,,Susan Langill,Food Serv. Dir.,18286,02/15/2012 09:39:45 AM,12/31/2016 11:59:00 PM,Active,FS,Eating & Drinking,HE_Pass,04/02/2010 10:17:46 AM,23-4-602.13,*,Non-Food Contact Surfaces Clean,04/02/2010 10:17:46 AM,Pass,2010-04-05 08:18:47,The spaces in between fryolator are soiled. Clean to remove.,1153   CENTRE,JAMAICA PLAIN,MA,02130,,
Citra A Fresh Cafe,,BOSTON HOSPITAL FOR WOMEN,PMK FOODS INC.,,80224,09/07/2012 10:50:57 AM,12/31/2016 11:59:00 PM,Active,FT,Eating & Drinking w/ Take Out,HE_Filed,08/26/2014 02:34:00 PM,08-3-305-307.11,*,Food Protection,08/26/2014 02:34:00 PM,Pass,2014-08-26 15:47:08,Large bag of rice stored under handwash sink- Remove and store food safe from contamination,221   Longwood AV,Boston,MA,02115,87166,"(42.33724, -71.10217)"
Pino's Pizza House,,CLEVELAND REALTY CO,PETRUZZOELLO,FELICIAN,18067,02/15/2012 02:11:04 PM,12/31/2016 11:59:00 PM,Active,FT,Eating & Drinking w/ Take Out,HE_Pass,04/25/2013 08:20:28 AM,03-3-501.16(A),***,Cold Holding,04/25/2013 08:20:28 AM,Pass,2013-04-30 08:39:06,Deli meats of 3 door deli cooler with elevated temperatures of between 49-52F. PIC stated that the deli meats had been stocked in the morning. All potentially hazardous foods out of temperature to be removed and placed into a refrigeration if unit is unable to maintain a temperature of below 41F. Ensure all potentially hazardous foods are maintianed at below 41F. Maintenance call was on site at the time of the inspection.,1918   Beacon ST,Brighton,MA,02135,10006,"(42.336527, -71.149151)"
DRAGON CHEF CHINESE REST.,,,RU BANG CHEN PRES.,,21347,02/06/2012 10:55:13 AM,12/31/2016 11:59:00 PM,Active,FT,Eating & Drinking w/ Take Out,HE_Fail,11/13/2009 05:11:05 PM,31-5-204/05.11,***,Location  Accessible,11/13/2009 05:11:05 PM,Fail,,Meat grinder blocking access to hand wash station. Hand wash station a source of contamination. Remove,411  Washington St,Brighton,MA,02135,156051,"(42.349266, -71.15532)"
LATINO RESTAURANT,,CABRAL FREDDY,RAFAEL E. VERAS,,19972,02/15/2012 10:28:57 AM,12/31/2016 11:59:00 PM,Active,FS,Eating & Drinking,HE_Fail,11/04/2013 02:57:45 PM,36-6-201.11,*,Floors Designed Constructed Installed,11/04/2013 02:57:45 PM,Fail,,Floor has some pooling water - appears to be coming in from the outside. Contact landlord as discussed,302   Centre ST,Jamaica Plain,MA,02130,27963,"(42.32273, -71.10325)"
Royal Fried Chicken,,,Akbar Hussain,,125207,02/24/2014 11:03:46 AM,12/31/2016 11:59:00 PM,Active,FT,Eating & Drinking w/ Take Out,HE_Fail,11/18/2015 11:18:40 AM,08-3-305-307.11,*,Food Protection,11/18/2015 11:18:40 AM,Fail,,Container of fish stored on floor inside walk in cooler  elevate 6 to 8 inches or higher.,2360   Washington ST,Roxbury,MA,02119,171105,"(42.329364, -71.084435)"
UNION OYSTER HOUSE,,MILANO JOSEPH A JR TRST,MILANO,JOSEPH A.,19089,12/14/2011 02:11:17 PM,12/31/2016 11:59:00 PM,Active,FS,Eating & Drinking,HE_Fail,12/11/2013 10:09:40 AM,17-4-302.14,*,Test Kit Provided,12/11/2013 10:09:40 AM,Fail,,Oyster bar - Provide test kit for sanitizer.,41  Union St,Boston,MA,02108,139293,"(42.36127, -71.05688)"
Momogoose 2,,,Smart Gourmet LLC,Loc Vo,68113,12/14/2011 02:53:19 PM,12/31/2016 11:59:00 PM,Active,MFW,Mobile Food Walk On,HE_Fail,05/30/2012 12:32:57 PM,41-7-201/04.11,***,Separation/Sanitizer Criteria,05/30/2012 12:32:57 PM,Fail,,At the onset of the inspection the sanitizer was setup with more than 200ppm chlorine (The manager was able to adjust the sanitizer).  Train the staff in proper setup of sanitizer.,1   Citywide ST,Boston,MA,02128,0,
FLOUR BAKERY & CAFE,,,JOANNE CHANG,,21518,01/26/2012 03:07:20 PM,12/31/2016 11:59:00 PM,Active,FT,Eating & Drinking w/ Take Out,HE_Pass,01/11/2012 12:52:01 PM,16-4-501.11/.15,*,Dishwashng Facilities,01/11/2012 12:52:01 PM,Pass,2012-01-12 09:08:47,3 bay sink/provide proper drain plugs,1595   Washington ST,Roxbury,MA,02114,157458,"(42.338323, -71.07488)"
Mattapan House of Pizza,,FETFATSIDIS SIMON,Isidoros Poulopoulos,,78448,04/04/2012 10:27:46 AM,12/31/2016 11:59:00 PM,Active,FT,Eating & Drinking w/ Take Out,HE_Fail,06/03/2013 11:29:44 AM,37-6-501.11-.12,*,Improper Maintenance of Walls/Ceilings,06/03/2013 11:29:44 AM,Fail,,Sticker expired on exhausthood  post current Sticker  to be serviced by licensed exhausthood cleaner.,1621   Blue Hill AV,Mattapan,MA,02126,155684,"(42.268453, -71.094131)"
No.  7 RESTAURANT,,,HUANG FAMILY INC.,REN XIANGHUANG  PRES.,25414,02/08/2012 04:32:36 PM,12/31/2016 11:59:00 PM,Active,FT,Eating & Drinking w/ Take Out,HE_Pass,03/27/2014 12:30:42 PM,08-3-305-307.11,*,Food Protection,03/27/2014 12:30:42 PM,Pass,2014-03-27 15:31:11,Discontinue to store product of the floor in walk in. Must be 6 inches off the floor.,225   Grove ST,West Roxbury,MA,02132,156965,"(42.261873, -71.15741)"
CANTON HOUSE,,,LI TING LI PRESIDENT,,23526,02/01/2012 03:06:08 PM,12/31/2016 11:59:00 PM,Active,FT,Eating & Drinking w/ Take Out,HE_Fail,07/29/2015 02:19:23 PM,23-4-602.13,*,Non-Food Contact Surfaces Clean,07/29/2015 02:19:23 PM,Fail,,Exterior of BBQ box soiled  clean to remove food spills.,6  Hancock St,Dorchester,MA,02125,158300,"(42.315595, -71.065919)"
Daily Catch,,RICCIO GERALDO TS,CALAMARI FISHERIES INC.,,18578,02/15/2012 01:09:29 PM,12/31/2016 11:59:00 PM,Active,FS,Eating & Drinking,HE_Pass,09/02/2008 12:49:02 PM,15-4-202.16,*,Non-Food Contact Surfaces,09/02/2008 02:57:07 PM,Pass,2008-09-02 14:57:07,secure the 3 bay sink to wall--BASEMENT repair or replace the white  kenmore refrig-shelves are broken & door does not work properly& inside walls are cracked& have exposed insulation---REPAIR the lid of the top loading freezer-has exposed insulation--,319   Hanover ST,Boston,MA,02113,69107,"(42.36408, -71.05395)"
The Upper Crust,,PESIRIDIS THEODORE TRST,Shenefield,Shawn,90116,03/25/2013 02:37:01 PM,12/31/2016 11:59:00 PM,Active,FT,Eating & Drinking w/ Take Out,HE_Hearing,04/08/2014 10:52:24 AM,23-4-602.13,*,Non-Food Contact Surfaces Clean,04/08/2014 10:52:24 AM,Pass,2014-04-08 15:21:29,front line/clean interior of all reach in units,683   Tremont ST,Roxbury,MA,02118,137919,"(42.34156, -71.07662)"
Tavern In The Square,,MC CLURE,JAJB INC.,,68446,12/29/2011 01:49:27 PM,12/31/2016 11:59:00 PM,Active,FS,Eating & Drinking,HE_Filed,07/25/2012 02:33:00 PM,17-4-302.14,*,Test Kit Provided,07/25/2012 02:33:00 PM,Pass,2012-07-26 08:11:43,Wrong test kit being used for Quatinary sanitizer at 3 bay sink. Provide appropriate test kit for sanitizer.,161   Brighton AV,Allston,MA,02134,157226,"(42.353257, -71.132449)"
WAI WAI ICE CREAM SHOP,,WONG SHU YING TRSTS,HUI,DAVID,24990,01/06/2012 09:20:52 AM,12/31/2016 11:59:00 PM,Active,FS,Eating & Drinking,HE_Fail,08/14/2008 11:56:06 AM,14-4-202.11,*,Food Contact Surfaces Design,08/15/2008 08:40:32 AM,Fail,,Replace all defective or worn equipment.,26   Oxford ST,Boston,MA,02111,106209,"(42.35168, -71.06027)"
Momogoose 4,,,Loc Vo,,76220,12/14/2011 02:53:20 PM,12/31/2016 11:59:00 PM,Active,MFW,Mobile Food Walk On,HE_Fail,10/22/2015 12:07:05 PM,03-3-501.16,***,Hot Holding,10/22/2015 12:07:05 PM,Fail,,Noodles in premade take out dishes 90F. PIC discarded out of temperture food  spring rolls under steam table 104F  PIC removed replace in steam counter for proper hot holding.Maintain 140F and above for all hot holding,1   Citywide ST,Boston,MA,02128,0,
ODYSSEY CRUISES,,MASS BAY LINES INC. FREEDOM,ODYSSEY CRUISES PREMIER YACHTS INC.,,24485,02/01/2012 03:02:49 PM,12/31/2016 11:59:00 PM,Active,FS,Eating & Drinking,HE_Pass,03/06/2009 10:08:36 AM,37-6-501.11-.12,*,Improper Maintenance of Walls/Ceilings,03/06/2009 03:14:39 PM,Pass,2009-03-06 15:14:39,Basement -Repair ceiling tiles.,60  Rowes Wh,Boston,MA,02110,156112,"(42.356532, -71.050251)"
NEW YORK FRIED CHICKEN & PIZZA,,AYAZ A. SHAH,AYAZ A. SHAH,,23286,05/02/2012 11:48:20 AM,12/31/2016 11:59:00 PM,Active,FT,Eating & Drinking w/ Take Out,HE_FailExt,04/24/2009 11:29:15 AM,31-5-204/05.11,***,Location  Accessible,04/27/2009 08:31:43 AM,Pass,2009-04-27 08:31:43,Hand sink at front service station blocked by boxes of soda. Discontinue and ensure all hand sinks are accessible.,531   Columbia RD,Dorchester,MA,02125,156840,"(42.315432, -71.06626)"
MCKENNA'S CAFE,,KENNETH OSHEROW  PRES.,KENNETH OSHEROW PRES.,,23628,12/28/2011 09:11:33 AM,12/31/2016 11:59:00 PM,Active,FS,Eating & Drinking,HE_Pass,01/13/2009 11:32:00 AM,42-6-501.113/.114,*,Premises Maintained,01/14/2009 08:24:14 AM,Pass,2009-01-14 08:24:14,Cans of paint stored in kitchen area. Discontinue and store separetly and protected.,109   Savin Hill AV,Dorchester,MA,02125,156864,"(42.311515, -71.05382)"
Tenoch Mexican,,,Tenoch Mexican Food Corp.,,122265,02/19/2014 11:21:49 AM,12/31/2016 11:59:00 PM,Active,FT,Eating & Drinking w/ Take Out,HE_Fail,12/18/2015 03:01:47 PM,13-2-304/402.11,*,Clean Cloths  Hair Restraint,12/18/2015 03:01:47 PM,Fail,,No hair restraint worn by prep cook,3   Lewis ST,Boston,MA,02109,263801,"(42.36328, -71.05188)"
CALIFORNIA PIZZA KITCHEN,,,CALIFORNIA PIZZA KITCHEN,INC. LIC.DIV.,19754,04/03/2012 01:47:18 PM,12/31/2016 11:59:00 PM,Active,FS,Eating & Drinking,HE_Fail,03/31/2015 10:04:37 AM,35-6-501.111/.115,**,Insects  Rodents  Animals,03/31/2015 10:04:37 AM,Fail,,dining room/remove evidence of rodent droppings from floor area under baseboard heaters and under seat cushions at table for 2 kitchen/remove evidence of rodent droppings from cabinet under soda station,800   Boylston ST,Boston,MA,02199,194357,"(42.34716, -71.08251)"
UNION OYSTER HOUSE,,MILANO JOSEPH A JR TRST,MILANO,JOSEPH A.,19089,12/14/2011 02:11:17 PM,12/31/2016 11:59:00 PM,Active,FS,Eating & Drinking,HE_Fail,08/12/2015 11:31:19 AM,02-3-602.11-.12/3-302.12,*,Food Container Labels,08/12/2015 11:31:19 AM,Fail,,Label all bulk food containers where needed,41  Union St,Boston,MA,02108,139293,"(42.36127, -71.05688)"
Lanta Asian Cuisine,,,Yee Yang,J & Y Enterperises Inc.,84979,01/03/2013 03:06:25 PM,12/31/2016 11:59:00 PM,Active,FT,Eating & Drinking w/ Take Out,HE_Filed,07/16/2015 01:59:04 PM,23-4-602.13,*,Non-Food Contact Surfaces Clean,07/16/2015 01:59:04 PM,Pass,2015-07-27 08:08:15,Exterior of rice bins with visible soils / Clean to remove.,38   Batterymarch ST,Boston,MA,02110,157539,"(42.357589, -71.053939)"
CANTON HOUSE,,,LI TING LI PRESIDENT,,23526,02/01/2012 03:06:08 PM,12/31/2016 11:59:00 PM,Active,FT,Eating & Drinking w/ Take Out,HE_Fail,05/13/2014 02:44:23 PM,24-4-904.11AB,*,Improper Storage of Re-usable Utensils,05/13/2014 02:44:23 PM,Fail,,"Wok stored on floor  elevate 6 to ""8 higher.",6  Hancock St,Dorchester,MA,02125,158300,"(42.315595, -71.065919)"
ODYSSEY CRUISES,,MASS BAY LINES INC. FREEDOM,ODYSSEY CRUISES PREMIER YACHTS INC.,,24485,02/01/2012 03:02:49 PM,12/31/2016 11:59:00 PM,Active,FS,Eating & Drinking,HE_Fail,06/10/2015 11:45:17 AM,23-4-602.13,*,Non-Food Contact Surfaces Clean,06/10/2015 11:45:17 AM,Fail,,1. vents covers in walk-ins with mold-like substances and dusts  clean to remove,60  Rowes Wh,Boston,MA,02110,156112,"(42.356532, -71.050251)"
Boston Globe Cafeteria,,FLIK INTERNATIONAL CORP.,FLIK INTERNATIONAL CORP.,Compass Group,26254,02/06/2012 08:00:29 AM,12/31/2016 11:59:00 PM,Active,FS,Eating & Drinking,HE_Pass,07/17/2008 02:37:01 PM,38-6-303.11,*,Inadequate Lighting,07/18/2008 08:12:08 AM,Pass,2008-07-18 08:12:08,Light out in walk-in # 1. Replace.,135   William T Morrissey BL,Dorchester,MA,02125,156975,"(42.315997, -71.049211)"
Zo,,STEVEN KRAVETZ  C. F. O.,Andy Kolokythas,,33151,02/28/2012 09:28:42 AM,12/31/2016 11:59:00 PM,Active,FT,Eating & Drinking w/ Take Out,HE_Fail,10/09/2012 01:39:35 PM,36-6-501.11-.12,*,Improper Maintenance of Floors,10/09/2012 01:39:35 PM,Fail,,Clean floor under & behind all equipment.,3   CENTER PLAZA,BOSTON,MA,02109,,
MCKENNA'S CAFE,,KENNETH OSHEROW  PRES.,KENNETH OSHEROW PRES.,,23628,12/28/2011 09:11:33 AM,12/31/2016 11:59:00 PM,Active,FS,Eating & Drinking,HE_Pass,01/18/2008 08:23:10 AM,01-3-101/701.11,***,Spoilage Unsafe Food,01/25/2008 08:58:05 AM,Pass,2008-01-25 08:58:05,Produce- Remove wilted leaves from greens.,109   Savin Hill AV,Dorchester,MA,02125,156864,"(42.311515, -71.05382)"
Nicholas Sub & Pizza Shop,,NICHOLAS MARKOPOULOS,Kourtelidis,Nicholas,33364,01/17/2012 03:37:47 PM,12/31/2016 11:59:00 PM,Active,FT,Eating & Drinking w/ Take Out,HE_FailExt,08/12/2015 01:00:46 PM,05-4-302.12,*,Food Thermometers Provided,08/12/2015 01:00:46 PM,Pass,2015-08-13 07:41:21,Provide working metal stem cooks thermometer,600   Hyde Park AV,Roslindale,MA,02131,156517,"(42.280027, -71.118658)"
Durgin Park Restaurant,,,Weinstein,Michael,24748,02/13/2012 11:17:17 AM,12/31/2016 11:59:00 PM,Active,FS,Eating & Drinking,HE_FailExt,05/11/2015 08:34:19 AM,37-6-501.11-.12,*,Improper Maintenance of Walls/Ceilings,05/11/2015 08:34:19 AM,Fail,,2. Wall in men's room missing panel  replace,300  Faneuil Hall Marketplace,Boston,MA,02109,341035,"(42.360036, -71.056253)"
West Napoli Pizza,,VRATTOS SOCRATES TS,BARDHI,SOKOL,21409,06/06/2012 03:38:02 PM,12/31/2016 11:59:00 PM,Active,FT,Eating & Drinking w/ Take Out,HE_Filed,09/04/2013 11:25:48 AM,14-4-202.11,*,Food Contact Surfaces Design,09/04/2013 11:25:48 AM,Pass,2013-09-05 08:43:17,replace all non food grade containers...replace all worn equipment...remove all store bags covering foods and provide food grade bags...,1946  Centre St,West Roxbury,MA,02132,27764,"(42.28358, -71.15676)"
Country Kitchen,,AMINPOUR AMIR,Arleen Campbell,,32027,01/05/2012 08:42:50 AM,12/31/2016 11:59:00 PM,Active,FS,Eating & Drinking,HE_Pass,06/06/2011 01:09:52 PM,31-5-204/05.11,***,Location  Accessible,06/06/2011 01:09:52 PM,Pass,2011-06-06 14:51:20,outside-b.b.q.-NO HANDWASHING equiptment-,830   Blue Hill AV,Dorchester,MA,02124,16567,"(42.29621, -71.08718)"
Hungry Traveler,,,Jisung Oh,,31164,01/17/2012 04:29:57 PM,12/31/2016 11:59:00 PM,Active,FS,Eating & Drinking,HE_Fail,01/26/2010 12:58:35 PM,17-4-204.112/.115,*,Equipment Thermometers,01/26/2010 12:58:35 PM,Fail,,Provide thermometers for all refrigerators,27   COURT SQ SQ,BOSTON,MA,02108,,
Boston Globe Cafeteria,,FLIK INTERNATIONAL CORP.,FLIK INTERNATIONAL CORP.,Compass Group,26254,02/06/2012 08:00:29 AM,12/31/2016 11:59:00 PM,Active,FS,Eating & Drinking,HE_Fail,09/02/2009 01:17:14 PM,14-4-202.11,*,Food Contact Surfaces Design,09/03/2009 08:15:24 AM,Fail,,Long cutting board at service station visibly soiled and heavily scoared. Repair or replace.,135   William T Morrissey BL,Dorchester,MA,02125,156975,"(42.315997, -71.049211)"
CAPPY'S SUB NO. 2,,CHEUNG RICKY C Y TS,CAPPY'S SUBS NO. 2 INC.,SOPHIA LAMBRIANIDIS,25874,01/05/2012 12:40:18 PM,12/31/2014 11:59:00 PM,Inactive,FT,Eating & Drinking w/ Take Out,Pass,,,,,,,,,309A    Huntington AV,BOSTON,MA,02115,,
J P House of Pizza,,KAHN LEO TRSTS,Katsinis,George,85008,01/03/2013 03:01:12 PM,12/31/2016 11:59:00 PM,Active,FT,Eating & Drinking w/ Take Out,HE_Pass,01/13/2015 02:40:59 PM,15-4-202.16,*,Non-Food Contact Surfaces,01/13/2015 02:40:59 PM,Pass,2015-01-13 15:39:33,Paint to seal natual wood shelf above pizza prep aera.  Paint any rust spots in walk in refrigerator seiling.,775   Centre ST,Jamaica Plain,MA,02130,28202,"(42.31006, -71.11548)"
CALIFORNIA PIZZA KITCHEN,,,CALIFORNIA PIZZA KITCHEN,INC. LIC.DIV.,19754,04/03/2012 01:47:18 PM,12/31/2016 11:59:00 PM,Active,FS,Eating & Drinking,HE_Fail,02/09/2010 11:10:24 AM,29-5-201/02.11,*,Installed and Maintained,02/09/2010 11:10:24 AM,Fail,,1) plumbing issue at hand sink  repair,800   Boylston ST,Boston,MA,02199,194357,"(42.34716, -71.08251)"
CARLOS CUCINA ITALIANA,,BARONE CARLOS,CARLO BARONE,,20273,06/07/2012 10:51:20 AM,12/31/2016 11:59:00 PM,Active,FS,Eating & Drinking,HE_Fail,10/28/2015 02:42:58 PM,04-3-501.15/4-301.11,*,Inadequate Facilities/Cooling Methods,10/28/2015 02:42:58 PM,Fail,,They are cooling large amounts of sauce in plastic containers at room temperature and then moving into the refrigerator in the containers to cool.  Provide proper cooling methods to adequately cool food from 140F to 70F in two hours and then from 70F to 41F in an additional four hours.,131   BRIGHTON  AV,ALLSTON,MA,02134,,
Union Club of Boston,,UNION CLUB OF BOSTON INC,UNION CLUB OF BOSTON INC,,18725,12/13/2011 11:17:44 AM,12/31/2016 11:59:00 PM,Active,FS,Eating & Drinking,HE_Pass,07/22/2014 01:06:35 PM,16-4-501.11/.15,*,Dishwashng Facilities,07/22/2014 01:06:35 PM,Pass,2014-07-23 07:43:50,guages at high temperature dish machine not registering properly  repair,8   Park ST,Boston,MA,02108,107194,"(42.3575, -71.0627)"
BUKHARA INDIAN BISTRO,,BRUCE THERESA,AMRIK SINGH PABLA,,21016,01/12/2012 03:33:18 PM,12/31/2016 11:59:00 PM,Active,FS,Eating & Drinking,HE_Fail,03/24/2011 12:18:45 PM,23-4-602.13,*,Non-Food Contact Surfaces Clean,03/24/2011 12:18:45 PM,Fail,,The refirgerator handles and kitchen surfaces are soiled.  Clean to remove. The exterior of the dishwasher is soiled.  Clean to remove.,701   Centre ST,Jamaica Plain,MA,02130,28172,"(42.31159, -71.11461)"
No.  7 RESTAURANT,,,HUANG FAMILY INC.,REN XIANGHUANG  PRES.,25414,02/08/2012 04:32:36 PM,12/31/2016 11:59:00 PM,Active,FT,Eating & Drinking w/ Take Out,HE_Fail,10/26/2015 11:49:04 AM,08-3-305-307.11,*,Food Protection,10/26/2015 11:49:04 AM,Fail,,Discontinue to store product on the floor in the walk ins.  Provide covers for food in storage. Multiple containers in walk in with covers.  Discontinue to store cut vegetables in cardboard boxs.,225   Grove ST,West Roxbury,MA,02132,156965,"(42.261873, -71.15741)"
LOLLICUP TEA ZONE,,PETER LUU  PRES.,LONG JIANG,,22229,02/14/2012 12:48:34 PM,12/31/2016 11:59:00 PM,Active,FT,Eating & Drinking w/ Take Out,HE_Pass,12/05/2007 01:38:13 PM,03-3-501.16(A),***,Cold Holding,12/06/2007 08:21:52 AM,Pass,2007-12-06 08:21:52,Flip top refrigerator 50 F. Red beans 46 F; Chicken 50 F. Provide proper cold holding of 41 F or below.,1   Brighton AV,Allston,MA,02134,157732,"(42.352411, -71.125329)"
FENWAY PARK H.M.S. INC.,,JACK LYONS  MANAGER,FENWAY PARK H.M.S. INC.,,18275,10/27/2008 10:04:53 AM,12/31/2008 11:59:00 PM,Inactive,FT,Eating & Drinking w/ Take Out,HE_Fail,07/09/2008 10:48:12 AM,41-7-102.11,***,Labeled  Common Name,07/10/2008 09:07:09 AM,Fail,,Generic spray bottles filled with chemical not labeled(RF roof stand 3 c-4).Reminder to store chemical seperately from food.Generic spray bottle not labeled at Pavbeer 1.Chemical bottle at Pavc1).Chemical spray bottle not labeled in commissary.Unlabeled chemical bottles and bottles mislabeled at LC2.,4  Yawkey Wy,Boston,MA,02215,156417,"(42.346723, -71.09868)"
Honey Dew Donuts,,MASSARO,De Maria Inc.,,75541,02/06/2012 09:11:25 AM,12/31/2016 11:59:00 PM,Active,FT,Eating & Drinking w/ Take Out,HE_Fail,01/12/2012 11:20:42 AM,42-6-501.113/.114,*,Premises Maintained,01/12/2012 11:20:42 AM,Fail,,remove broken equipment(toaster) from storage in back room.,14   Maverick SQ,East Boston,MA,02128,157627,"(42.369388, -71.03982)"
Morgan Lewis & Bockius LLP,Flik International,JAMESTOWN ONE FEDERAL LP,Flik International,Peter Molloy,29909,02/29/2012 12:02:02 PM,12/31/2016 11:59:00 PM,Active,FS,Eating & Drinking,HE_Pass,03/04/2010 08:16:38 AM,24-4-903.11,*,Clean Equipment & Utensils Storage,03/04/2010 08:16:38 AM,Pass,2010-03-04 08:35:18,Clean equipment taken out of dishmachine and stored on floor.Oven racks stored on floor.,1   Federal ST,Boston,MA,02110,57149,"(42.3561, -71.05695)"
UNION OYSTER HOUSE,,MILANO JOSEPH A JR TRST,MILANO,JOSEPH A.,19089,12/14/2011 02:11:17 PM,12/31/2016 11:59:00 PM,Active,FS,Eating & Drinking,HE_Pass,05/07/2012 10:08:31 AM,15-4-202.16,*,Non-Food Contact Surfaces,05/07/2012 10:08:31 AM,Pass,2012-05-08 07:23:26,Dry storage Refinish rusted shelving in walk in.,41  Union St,Boston,MA,02108,139293,"(42.36127, -71.05688)"
No.  7 RESTAURANT,,,HUANG FAMILY INC.,REN XIANGHUANG  PRES.,25414,02/08/2012 04:32:36 PM,12/31/2016 11:59:00 PM,Active,FT,Eating & Drinking w/ Take Out,HE_Fail,01/25/2010 01:36:34 PM,36-6-501.11-.12,*,Improper Maintenance of Floors,01/25/2010 01:36:34 PM,Fail,,Floors are heavily soiled with grease and debris. Clean. Floors are lined with cardboard.  Clean.,225   Grove ST,West Roxbury,MA,02132,156965,"(42.261873, -71.15741)"
A K's Take Out & Delivery,,BOUKOUVALAS ATHENA TS,Saini,Jasbir,28531,12/20/2011 02:29:52 PM,12/31/2016 11:59:00 PM,Active,FT,Eating & Drinking w/ Take Out,HE_Fail,06/24/2015 09:00:15 AM,14-4-202.11,*,Food Contact Surfaces Design,06/24/2015 09:00:15 AM,Fail,,provide foodgrade bags for storage,1427   Tremont ST,Mission Hill,MA,02120,136818,"(42.331858, -71.096333)"
FLOUR BAKERY & CAFE,,,JOANNE CHANG,,21518,01/26/2012 03:07:20 PM,12/31/2016 11:59:00 PM,Active,FT,Eating & Drinking w/ Take Out,HE_Pass,01/11/2013 01:07:07 PM,03-3-501.16(A),***,Cold Holding,01/11/2013 01:07:07 PM,Pass,2013-01-14 08:04:25,walk in/chicken 44 degrees/provide proper temperature of 41 degrees or below,1595   Washington ST,Roxbury,MA,02114,157458,"(42.338323, -71.07488)"
Happy Garden,,,Brighton Ventures Inc.,,24662,01/31/2012 01:17:53 PM,12/31/2016 11:59:00 PM,Active,FT,Eating & Drinking w/ Take Out,HE_Filed,02/03/2012 03:28:22 PM,M-2-103.11,***,PIC Performing Duties,02/03/2012 03:28:22 PM,Pass,2012-02-06 08:22:58,Management not overseeing employees in proper cooling and storage methods of meats. Address. Ensure staff is being properly trained in safe food handling practices.,377   Washington ST,Brighton,MA,02135,156389,"(42.349291, -71.15428)"
LOCONTES RESTAURANT,,,BROOK FARM INC.,,19366,12/29/2011 02:31:28 PM,12/31/2016 11:59:00 PM,Active,FS,Eating & Drinking,HE_Fail,02/13/2013 12:49:35 PM,32-6-301.11-02.11,*,Hand Cleaner  Drying  Tissue Signage,02/13/2013 12:49:35 PM,Fail,,Kitchen - Provide paper towels for hand sink.,116   Salem ST,Boston,MA,02113,157396,"(42.364676, -71.055658)"
SEAPORT ELITE I I,,WATERMARK DONUT COMPANY,SPIRIT CRUISES LLC,,23063,02/01/2012 03:00:30 PM,12/31/2016 11:59:00 PM,Active,FS,Eating & Drinking,HE_Fail,08/20/2007 02:37:15 PM,42-6-501.113/.114,*,Premises Maintained,08/20/2007 02:42:07 PM,Fail,,,200   SEAPORT LA,BOSTON,MA,02210,,
EQUATOR RESTAURANT,,HOOPER FRANK III,SARAH PLABUTONG,,23186,12/16/2011 10:19:57 AM,12/31/2016 11:59:00 PM,Active,FS,Eating & Drinking,HE_Filed,01/23/2013 02:23:09 PM,15-4-202.16,*,Non-Food Contact Surfaces,01/23/2013 02:23:09 PM,Pass,2013-01-23 15:21:26,remove all cardboard boxes for storage,1721   Washington ST,Roxbury,MA,02118,144411,"(42.337071, -71.076601)"
The Upper Crust,,PESIRIDIS THEODORE TRST,Shenefield,Shawn,90116,03/25/2013 02:37:01 PM,12/31/2016 11:59:00 PM,Active,FT,Eating & Drinking w/ Take Out,HE_Hearing,04/08/2014 10:52:24 AM,22-4-601/602.11,**,Food Contact Surfaces Clean,04/08/2014 10:52:24 AM,Fail,,clean can opener blade,683   Tremont ST,Roxbury,MA,02118,137919,"(42.34156, -71.07662)"
Happy Garden,,,Brighton Ventures Inc.,,24662,01/31/2012 01:17:53 PM,12/31/2016 11:59:00 PM,Active,FT,Eating & Drinking w/ Take Out,HE_Fail,10/04/2012 01:58:07 PM,17-4-204.112/.115,*,Equipment Thermometers,10/04/2012 01:58:07 PM,Fail,,No evidence of an equipment thermometer inside of small deli cooler or white upright refrigerator near fryers. Provide.,377   Washington ST,Brighton,MA,02135,156389,"(42.349291, -71.15428)"
UNION OYSTER HOUSE,,MILANO JOSEPH A JR TRST,MILANO,JOSEPH A.,19089,12/14/2011 02:11:17 PM,12/31/2016 11:59:00 PM,Active,FS,Eating & Drinking,HE_Fail,10/06/2015 04:17:47 PM,22-4-601/602.11,**,Food Contact Surfaces Clean,10/06/2015 04:17:47 PM,Fail,,hand sink with soils  clean to remove,41  Union St,Boston,MA,02108,139293,"(42.36127, -71.05688)"
Double Tree Club Hotel,,BOSTON REDEVELOPMENT AUTH,C.J. WASHINGTON STREET L.L.C.,,21472,03/09/2012 11:17:16 AM,12/31/2016 11:59:00 PM,Active,FS,Eating & Drinking,HE_Fail,03/17/2015 11:02:35 AM,15-4-202.16,*,Non-Food Contact Surfaces,03/17/2015 11:02:35 AM,Fail,,Remove plastic wrap from hot water booster,821    Washington ST,BOSTON,MA,02116,,
ZESTO'S PIZZA,,FOUR 60-468 CENTRE STREET,K & M Pizza Inc.,,75590,12/12/2011 12:47:41 PM,12/31/2016 11:59:00 PM,Active,FT,Eating & Drinking w/ Take Out,HE_Pass,05/10/2011 02:40:57 PM,37-6-501.11-.12,*,Improper Maintenance of Walls/Ceilings,05/10/2011 02:40:57 PM,Pass,2011-05-10 15:41:22,The hood vent is due for a cleaning.  Have the vent cleaned by a licensed company. The ceiling tile in the basement is damaged.  Repair or replace damaged tiles.,460   Centre ST,Jamaica Plain,MA,02130,28061,"(42.31935, -71.11154)"
Uno Chicago Grill,,NICOLE E. ADAMS,NICOLE E. ADAMS,,18961,01/09/2012 03:57:09 PM,12/31/2016 11:59:00 PM,Active,FT,Eating & Drinking w/ Take Out,HE_Fail,03/03/2015 12:36:31 PM,37-6-201.11,*,Walls/Ceilings Designed Constructed Installed,03/03/2015 12:36:31 PM,Fail,,Hood vent at the lower level with grease. Clean properly.,1   Brookline AV,Boston,MA,02215,157196,"(42.34842, -71.097471)"
LOCONTES RESTAURANT,,,BROOK FARM INC.,,19366,12/29/2011 02:31:28 PM,12/31/2016 11:59:00 PM,Active,FS,Eating & Drinking,HE_Pass,04/19/2012 01:32:11 PM,21-3-304.14,*,Wiping Cloths  Clean  Sanitize,04/19/2012 01:32:11 PM,Pass,2012-04-19 15:32:19,Keep wiping cloths in sanitizer,116   Salem ST,Boston,MA,02113,157396,"(42.364676, -71.055658)"
Boston Globe Cafeteria,,FLIK INTERNATIONAL CORP.,FLIK INTERNATIONAL CORP.,Compass Group,26254,02/06/2012 08:00:29 AM,12/31/2016 11:59:00 PM,Active,FS,Eating & Drinking,HE_Fail,12/05/2008 10:42:48 AM,32-6-301.11-02.11,*,Hand Cleaner  Drying  Tissue Signage,12/05/2008 03:37:03 PM,Fail,,No paper towels at back hand wash sink. Provide.,135   William T Morrissey BL,Dorchester,MA,02125,156975,"(42.315997, -71.049211)"
Union Club of Boston,,UNION CLUB OF BOSTON INC,UNION CLUB OF BOSTON INC,,18725,12/13/2011 11:17:44 AM,12/31/2016 11:59:00 PM,Active,FS,Eating & Drinking,HE_NotReq,12/30/2012 12:00:00 AM,,,,,,,,8   Park ST,Boston,MA,02108,107194,"(42.3575, -71.0627)"
Pino's Pizza House,,CLEVELAND REALTY CO,PETRUZZOELLO,FELICIAN,18067,02/15/2012 02:11:04 PM,12/31/2016 11:59:00 PM,Active,FT,Eating & Drinking w/ Take Out,HE_Fail,10/01/2013 12:56:02 PM,08-3-302.11/3-304.11,***,Separation  Segregation Cross Contamination,10/01/2013 12:56:02 PM,Fail,,at inspection found in walk-in - RAW  food stored above READY TO EAT  food - reviewed w/ mgr. as to proper storage -,1918   Beacon ST,Brighton,MA,02135,10006,"(42.336527, -71.149151)"
Durgin Park Restaurant,,,Weinstein,Michael,24748,02/13/2012 11:17:17 AM,12/31/2016 11:59:00 PM,Active,FS,Eating & Drinking,HE_Filed,01/10/2014 12:15:34 PM,37-6-501.11-.12,*,Improper Maintenance of Walls/Ceilings,01/10/2014 12:15:34 PM,Pass,2014-01-13 08:08:46,Chipped and peeling paint  Clean wall and attachments.,300  Faneuil Hall Marketplace,Boston,MA,02109,341035,"(42.360036, -71.056253)"
Ziti's Express,,LAMBERT GREGORY,Tremont Street Burger L L C,,67693,12/19/2011 01:53:23 PM,12/31/2016 11:59:00 PM,Active,FS,Eating & Drinking,HE_Pass,11/07/2014 12:00:11 PM,08-3-305-307.11,*,Food Protection,11/07/2014 12:00:11 PM,Pass,2014-11-10 08:04:40,Open bag of panko breadcrumbs in basement prep / Transfer to covered food grade container.,140   Tremont ST,Boston,MA,02111,156397,"(42.355646, -71.062559)"
No.  7 RESTAURANT,,,HUANG FAMILY INC.,REN XIANGHUANG  PRES.,25414,02/08/2012 04:32:36 PM,12/31/2016 11:59:00 PM,Active,FT,Eating & Drinking w/ Take Out,HE_Fail,04/21/2009 12:18:44 PM,08-3-305-307.11,*,Food Protection,04/21/2009 03:09:19 PM,Fail,,provide proper storage of all foods  on shelves  not on floor.,225   Grove ST,West Roxbury,MA,02132,156965,"(42.261873, -71.15741)"
PERKIN'S SQ DELI,,ONE 06 DORCHESTER ST LLC,FALLON,JAMES,18439,12/19/2011 10:37:47 AM,12/31/2016 11:59:00 PM,Active,FT,Eating & Drinking w/ Take Out,HE_Pass,05/07/2015 12:25:19 PM,36-6-201.11,*,Floors Designed Constructed Installed,05/07/2015 12:25:19 PM,Pass,2015-05-08 08:43:51,clean floor area near and around the ice machine in the back basement area.,106   Dorchester ST,South Boston,MA,02127,48839,"(42.3352, -71.04583)"
A K's Take Out & Delivery@Reggie Lewis Track,,,Sohan Saini Pres.,,31365,02/14/2012 12:14:03 PM,12/31/2016 11:59:00 PM,Active,FT,Eating & Drinking w/ Take Out,HE_Fail,06/18/2015 02:26:16 PM,15-4-202.16,*,Non-Food Contact Surfaces,06/18/2015 02:26:16 PM,Fail,,provide shelving 6 to 8 inches off the floor...seal rusty greasetrap....,1350   Tremont ST,Boston,Ma,02116,,
Finagle A Bagel,,,FINALGE A BAGEL,ATTN: Human Resources,20653,12/15/2011 10:47:55 AM,12/31/2016 11:59:00 PM,Active,FT,Eating & Drinking w/ Take Out,HE_Pass,08/30/2012 02:07:15 PM,32-6-501.11-.12/6-202.14,*,Toilet Enclosed Clean,08/30/2012 02:07:15 PM,Pass,2012-08-30 15:29:52,No employee hand wash sign at hand sink,275   Cambridge ST,Boston,MA,02114,155973,"(42.361357, -71.068227)"
A K's Take Out & Delivery,,BOUKOUVALAS ATHENA TS,Saini,Jasbir,28531,12/20/2011 02:29:52 PM,12/31/2016 11:59:00 PM,Active,FT,Eating & Drinking w/ Take Out,HE_Fail,02/19/2009 10:46:57 AM,15-4-202.16,*,Non-Food Contact Surfaces,02/19/2009 03:32:37 PM,Fail,,1 door pepsi/replace missing door handle pizza reach in/repair condensor and replace worn door gaskets,1427   Tremont ST,Mission Hill,MA,02120,136818,"(42.331858, -71.096333)"
Union Club of Boston,,UNION CLUB OF BOSTON INC,UNION CLUB OF BOSTON INC,,18725,12/13/2011 11:17:44 AM,12/31/2016 11:59:00 PM,Active,FS,Eating & Drinking,HE_Fail,10/29/2013 10:30:17 AM,08-3-302.11/3-304.11,***,Separation  Segregation Cross Contamination,10/29/2013 10:30:17 AM,Fail,,Raw animal products improperly stored with vegetables etc.,8   Park ST,Boston,MA,02108,107194,"(42.3575, -71.0627)"
Uno Due Go,,DRUKER BERTRAM A TRSTS,URC L L C,,74800,12/30/2011 01:59:52 PM,12/31/2016 11:59:00 PM,Active,FS,Eating & Drinking,HE_Fail,03/27/2015 01:17:33 PM,31-5-204/05.11,***,Location  Accessible,03/27/2015 01:17:33 PM,Fail,,Knives noted in hand sink / Remove and ensure hand sinks are kept free and clear at all times.,52   Summer ST,Boston,MA,02110,132025,"(42.35445, -71.05881)"
FLOUR BAKERY & CAFE,,,JOANNE CHANG,,21518,01/26/2012 03:07:20 PM,12/31/2016 11:59:00 PM,Active,FT,Eating & Drinking w/ Take Out,HE_Fail,07/23/2012 10:04:36 AM,22-4-601/602.11,**,Food Contact Surfaces Clean,07/23/2012 10:04:36 AM,Fail,,clean interior of ice machine,1595   Washington ST,Roxbury,MA,02114,157458,"(42.338323, -71.07488)"
The Kitchen,,POCKEL JEANNE C TRSTS,Herritt,Scott,79722,06/13/2012 10:16:32 AM,12/31/2016 11:59:00 PM,Active,FS,Eating & Drinking,HE_Hearing,04/02/2014 02:16:08 PM,15-4-202.16,*,Non-Food Contact Surfaces,04/02/2014 02:16:08 PM,Pass,2014-04-03 09:15:07,Rust on interior of Upright freezer,560   Tremont ST,Roxbury,MA,02118,137658,"(42.34363, -71.07176)"
Salty Pig,,SHERRY BERGER FIREFLY AN AMERICAN BISTR,Trivr Inc.,,75013,03/01/2012 09:53:39 AM,12/31/2016 11:59:00 PM,Active,FS,Eating & Drinking,HE_Pass,07/03/2014 11:18:46 AM,36-6-501.11-.12,*,Improper Maintenance of Floors,07/03/2014 11:18:46 AM,Pass,2014-07-03 15:19:18,walk in/clean floor area under all shelving,130   Dartmouth ST,Boston,MA,02116,158249,"(42.346779, -71.0761)"
J J Foley's Cafe,,FOLEY JEREMIAH,J J Foley's Cafe,Inc.,27092,01/31/2012 06:21:48 PM,12/31/2016 11:59:00 PM,Active,FS,Eating & Drinking,HE_FailExt,01/21/2009 11:52:36 AM,10-3-304.12,*,Food Utensil Storage,01/26/2009 08:54:19 AM,Pass,2009-01-26 08:54:19,Properly store all scoops.,117   EAST BERKELEY,BOSTON,MA,02118,,
Morgan Lewis & Bockius LLP,Flik International,JAMESTOWN ONE FEDERAL LP,Flik International,Peter Molloy,29909,02/29/2012 12:02:02 PM,12/31/2016 11:59:00 PM,Active,FS,Eating & Drinking,HE_Fail,07/26/2010 11:43:28 AM,04-3-501.15/4-301.11,*,Inadequate Facilities/Cooling Methods,07/26/2010 11:43:28 AM,Fail,,Breakfast potato covered in deep pan in Walk-in at 80F+,1   Federal ST,Boston,MA,02110,57149,"(42.3561, -71.05695)"
Burger King,,,MASTORAN CORP.,,19935,12/16/2011 09:50:24 AM,12/31/2016 11:59:00 PM,Active,FT,Eating & Drinking w/ Take Out,HE_Pass,11/15/2011 11:07:13 AM,,,,,,,,944   Bennington ST,East Boston,MA,02128,155885,"(42.386166, -71.00953)"
MCKENNA'S CAFE,,KENNETH OSHEROW  PRES.,KENNETH OSHEROW PRES.,,23628,12/28/2011 09:11:33 AM,12/31/2016 11:59:00 PM,Active,FS,Eating & Drinking,HE_Fail,05/16/2011 10:59:32 AM,32-6-301.11-02.11,*,Hand Cleaner  Drying  Tissue Signage,05/16/2011 10:59:32 AM,Fail,,Post hand wash signage at hand sink near window area.,109   Savin Hill AV,Dorchester,MA,02125,156864,"(42.311515, -71.05382)"
CANTON HOUSE,,,LI TING LI PRESIDENT,,23526,02/01/2012 03:06:08 PM,12/31/2016 11:59:00 PM,Active,FT,Eating & Drinking w/ Take Out,HE_Filed,03/10/2009 01:21:41 PM,14-4-202.11,*,Food Contact Surfaces Design,03/10/2009 03:13:43 PM,Pass,2009-03-10 15:13:43,Cloths being used to cover ready to eat produce. Discontinue and use food grade  equipment.,6  Hancock St,Dorchester,MA,02125,158300,"(42.315595, -71.065919)"
HAYMARKET PIZZA,,ROSARIO MANUELA,Blackstone Food Inc.,,19192,12/19/2011 10:42:03 AM,12/31/2016 11:59:00 PM,Active,FT,Eating & Drinking w/ Take Out,HE_Pass,10/12/2010 10:45:46 AM,32-6-301.11-02.11,*,Hand Cleaner  Drying  Tissue Signage,10/12/2010 10:45:46 AM,Pass,2010-10-12 15:26:35,Provide proper paper towels for hand sink in basement food prep area.,102   BLACKSTONE,BOSTON,MA,02109,,
Uno Chicago Grill,,NICOLE E. ADAMS,NICOLE E. ADAMS,,18961,01/09/2012 03:57:09 PM,12/31/2016 11:59:00 PM,Active,FT,Eating & Drinking w/ Take Out,HE_Fail,12/28/2009 11:36:10 AM,20-4-703.11,***,Food Contact Surfaces Clean,12/28/2009 11:36:10 AM,Fail,,Bar: Dishwasher is not reaching 180F or the rinse. Provide proper temperatures.,1   Brookline AV,Boston,MA,02215,157196,"(42.34842, -71.097471)"
Uno Chicago Grill,,NICOLE E. ADAMS,NICOLE E. ADAMS,,19118,01/09/2012 03:55:20 PM,12/31/2016 11:59:00 PM,Active,FT,Eating & Drinking w/ Take Out,HE_Pass,02/18/2010 11:00:43 AM,42-6-501.113/.114,*,Premises Maintained,02/18/2010 11:00:43 AM,Pass,2010-02-18 15:10:53,locker area/clean/organize,270   HUNTINGTON  AV,BOSTON,MA,02125,,
Momogoose 4,,,Loc Vo,,76220,12/14/2011 02:53:20 PM,12/31/2016 11:59:00 PM,Active,MFW,Mobile Food Walk On,HE_Hearing,09/21/2012 11:34:36 AM,M-2-103.11,***,PIC Performing Duties,09/21/2012 11:34:36 AM,Fail,,Provide Certification for Food Service Manager onsite.   Ensure Hot Holding Temperatures are monitored before Serving to the public and Ensure Hot Holding  Temperatures for equipment before storing foods to maintain temperature.,1   Citywide ST,Boston,MA,02128,0,
Currito Burrito,,,Park,Chan,28764,01/05/2012 12:58:58 PM,12/31/2016 11:59:00 PM,Active,FT,Eating & Drinking w/ Take Out,HE_Fail,04/03/2008 10:39:28 AM,16-4-501.11/.15,*,Dishwashng Facilities,04/03/2008 12:56:46 PM,Fail,,3 bay/properly label sink,300   LOGAN AIRPORT TRMNL C,EAST BOSTON,MA,02128,,
CANTON HOUSE,,,LI TING LI PRESIDENT,,23526,02/01/2012 03:06:08 PM,12/31/2016 11:59:00 PM,Active,FT,Eating & Drinking w/ Take Out,HE_Fail,07/29/2010 01:38:12 PM,17-4-302.14,*,Test Kit Provided,07/29/2010 01:38:12 PM,Fail,,No test kit for 3 bay sink provided at time of inspection. Provide for re-inspection.,6  Hancock St,Dorchester,MA,02125,158300,"(42.315595, -71.065919)"
BUKHARA INDIAN BISTRO,,BRUCE THERESA,AMRIK SINGH PABLA,,21016,01/12/2012 03:33:18 PM,12/31/2016 11:59:00 PM,Active,FS,Eating & Drinking,HE_Pass,,37-6-501.11-.12,*,Improper Maintenance of Walls/Ceilings,05/16/2007 03:03:00 PM,Pass,2007-05-17 14:14:32,,701   Centre ST,Jamaica Plain,MA,02130,28172,"(42.31159, -71.11461)"
Country Kitchen,,AMINPOUR AMIR,Arleen Campbell,,32027,01/05/2012 08:42:50 AM,12/31/2016 11:59:00 PM,Active,FS,Eating & Drinking,HE_Fail,10/20/2009 08:50:24 AM,08-3-302.11/3-304.11,***,Separation  Segregation Cross Contamination,10/23/2009 08:09:28 AM,Fail,,Raw chicken stored over uncovered container of cabbage  store in properly.,830   Blue Hill AV,Dorchester,MA,02124,16567,"(42.29621, -71.08718)"
BOSTON WING IT,,MYONG JO SONG,MYONG JO SONG,,22141,02/09/2012 10:35:11 AM,12/31/2016 11:59:00 PM,Active,FT,Eating & Drinking w/ Take Out,HE_Fail,10/24/2008 01:20:46 PM,34-5-501.111/.115,*,Outside Storage Improperly Maintained,10/24/2008 03:30:42 PM,Fail,,Dumpster is uncovered. Cover and  remove excess trash.,1153   COMMONWEALTH  AV,ALLSTON,MA,02134,,
Langham Hotel,,CHRISTINE GILPIN  CONTROL LER,CHRISTINE GILPIN CONTROL,LER,23003,01/11/2012 08:50:36 AM,12/31/2016 11:59:00 PM,Active,FS,Eating & Drinking,HE_Pass,09/09/2015 11:42:46 AM,15-4-202.16,*,Non-Food Contact Surfaces,09/09/2015 11:42:46 AM,Pass,2015-09-10 09:05:40,Cover missing for top reach in unit / Provide.,250   Franklin ST,Boston,MA,02110,157806,"(42.35663, -71.054279)"
Finagle A Bagel,,,FINALGE A BAGEL,ATTN: Human Resources,20653,12/15/2011 10:47:55 AM,12/31/2016 11:59:00 PM,Active,FT,Eating & Drinking w/ Take Out,HE_Hearing,12/31/2007 11:36:40 AM,17-4-302.14,*,Test Kit Provided,01/02/2008 08:40:49 AM,Fail,,,275   Cambridge ST,Boston,MA,02114,155973,"(42.361357, -71.068227)"
SPIKE'S JUNKYARD DOGS,,DAVID GETTLEMAN  PRES.,DAVID GETTLEMAN PRES.,,22315,01/05/2012 12:55:56 PM,12/31/2016 11:59:00 PM,Active,FT,Eating & Drinking w/ Take Out,HE_Pass,04/03/2015 12:12:50 PM,12-3--301.11,***,Prevention of Contamination from Hands,04/03/2015 12:12:50 PM,Pass,2015-04-06 08:49:59,Handsinks are not working properly.  Repair sinks so employees can properly wash their hands.,108   Brighton AV,Allston,MA,02134,157936,"(42.352564, -71.130371)"
ZESTO'S PIZZA,,FOUR 60-468 CENTRE STREET,K & M Pizza Inc.,,75590,12/12/2011 12:47:41 PM,12/31/2016 11:59:00 PM,Active,FT,Eating & Drinking w/ Take Out,HE_Fail,10/24/2013 12:58:52 PM,15-4-202.16,*,Non-Food Contact Surfaces,10/24/2013 12:58:52 PM,Fail,,provide elevated shelving 6 to 8 inches off the floor....repair or replace all defective indoor panels at all reachin freezers.....repair or replace all defective door gaskets.....seal barewood door at restroom...provide guard inbetween mop sink and prep table....reseal rusty grease trap...caulk all sinks....,460   Centre ST,Jamaica Plain,MA,02130,28061,"(42.31935, -71.11154)"
EQUATOR RESTAURANT,,HOOPER FRANK III,SARAH PLABUTONG,,23186,12/16/2011 10:19:57 AM,12/31/2016 11:59:00 PM,Active,FS,Eating & Drinking,HE_Fail,07/27/2012 11:40:08 AM,32-6-301.11-02.11,*,Hand Cleaner  Drying  Tissue Signage,07/27/2012 11:40:08 AM,Fail,,bar handsink/provide employee must wash hands signage hot line handsink/provide paper towels in dispenser,1721   Washington ST,Roxbury,MA,02118,144411,"(42.337071, -71.076601)"
Durgin Park Restaurant,,,Weinstein,Michael,24748,02/13/2012 11:17:17 AM,12/31/2016 11:59:00 PM,Active,FS,Eating & Drinking,HE_Filed,04/16/2014 12:35:18 PM,35-6-501.111/.115,**,Insects  Rodents  Animals,04/16/2014 12:35:18 PM,Pass,2014-04-17 08:02:30,droppings found at end of bar  clean to remove,300  Faneuil Hall Marketplace,Boston,MA,02109,341035,"(42.360036, -71.056253)"
Qdoba Mexican Eats No. 2207,,CHAIR 5 RESTAURANTS LLC,Qdoba Mexican Grill #,Attn: Restaurant Accounting,75515,01/05/2012 01:57:51 PM,12/31/2016 11:59:00 PM,Active,FT,Eating & Drinking w/ Take Out,HE_Filed,03/30/2015 03:03:59 PM,03-3-501.16,***,Hot Holding,03/30/2015 03:03:59 PM,Pass,2015-03-30 15:15:37,Brown rice 132F  White rice 129F Must maintain foods hot held at 140F or above. Removed by PIC and reheated to 163F,393   Huntington AV,Boston,MA,02115,157313,"(42.339776, -71.090882)"
Durgin Park Restaurant,,,Weinstein,Michael,24748,02/13/2012 11:17:17 AM,12/31/2016 11:59:00 PM,Active,FS,Eating & Drinking,HE_Filed,01/10/2014 12:15:34 PM,37-6-501.11-.12,*,Improper Maintenance of Walls/Ceilings,01/10/2014 12:15:34 PM,Pass,2014-01-13 08:08:46,Exposed wood on door and frame,300  Faneuil Hall Marketplace,Boston,MA,02109,341035,"(42.360036, -71.056253)"
New York Fried Chicken (1251 River St.),,DANA MARSHALL A,Shah,Raiz Ali,29713,12/08/2011 11:14:53 AM,12/31/2016 11:59:00 PM,Active,FT,Eating & Drinking w/ Take Out,HE_Filed,05/19/2014 01:16:30 PM,38-6-202.11,*,Fixture's not properly shielded,05/19/2014 01:16:30 PM,Fail,,KITCHEN  - replace missing light shield ( ceiling light ) OR provide protective light tubes for bulbs -,1251   River ST,Hyde Park,MA,02136,116347,"(42.25605, -71.12345)"
Subway,,HASSAN OUCHRAA  OWNER,HASSAN OUCHRAA OWNER,,23872,01/10/2012 12:35:06 PM,12/31/2016 11:59:00 PM,Active,FT,Eating & Drinking w/ Take Out,HE_Pass,03/15/2012 11:32:18 AM,42-6-501.113/.114,*,Premises Maintained,03/15/2012 11:32:18 AM,Pass,2012-03-15 14:57:25,WHEN NOT IN USE- store mops clean  dry  & off the floor-,1576   Dorchester AV,Dorchester,MA,02122,156882,"(42.297107, -71.060479)"
Dunkin Donuts,,ONE HUNDRED CAMBRIDGE STREET,DN Donuts Inc.,Danny Haddad,26507,01/11/2012 11:22:31 AM,12/31/2016 11:59:00 PM,Active,FT,Eating & Drinking w/ Take Out,HE_Pass,07/27/2010 11:58:41 AM,,,,,,,,100   Cambridge ST,Boston,MA,02114,25222,"(42.360584, -71.062109)"
Ester,,,2261 Dot LLC.,LLC,127375,04/08/2014 09:58:35 AM,12/31/2016 11:59:00 PM,Active,FS,Eating & Drinking,HE_Fail,04/28/2015 01:06:34 PM,14-4-202.11,*,Food Contact Surfaces Design,04/28/2015 01:06:34 PM,Fail,,Plastic container being used to dipense out of bulk sugar container. Discontinue and use a handled scoop to prevent contamination from hands.,2261   Dorchester AV,Dorchester,MA,02124,48561,"(42.27317, -71.06801)"
RISTORANTE EUNO,,REGNETTA LEIZE,RISTORANTE,EUNO,20538,02/13/2012 02:19:04 PM,12/31/2016 11:59:00 PM,Active,FS,Eating & Drinking,HE_Pass,04/15/2011 01:16:52 PM,02-3-602.11-.12/3-302.12,*,Food Container Labels,04/15/2011 01:16:52 PM,Pass,2011-04-15 15:14:00,properly label all bulk food bins,119   Salem ST,Boston,MA,02113,121721,"(42.364531, -71.055371)"
Hungry Traveler,,,Jisung Oh,,31164,01/17/2012 04:29:57 PM,12/31/2016 11:59:00 PM,Active,FS,Eating & Drinking,HE_Pass,03/05/2015 12:12:20 PM,,,,,,,,27   COURT SQ SQ,BOSTON,MA,02108,,
LOLLICUP TEA ZONE,,PETER LUU  PRES.,LONG JIANG,,22229,02/14/2012 12:48:34 PM,12/31/2016 11:59:00 PM,Active,FT,Eating & Drinking w/ Take Out,HE_FailExt,03/01/2012 02:10:32 PM,M-2-102.11,***,PIC Knowledge,03/01/2012 02:10:32 PM,Fail,,No one on site with a Food Allergy Certificate. Provide for re-inspection. Hand-out provided at time of inspection.,1   Brighton AV,Allston,MA,02134,157732,"(42.352411, -71.125329)"
Finagle A Bagel,,,FINALGE A BAGEL,ATTN: Human Resources,20653,12/15/2011 10:47:55 AM,12/31/2016 11:59:00 PM,Active,FT,Eating & Drinking w/ Take Out,HE_Filed,04/17/2013 02:14:45 PM,38-6-303.11,*,Inadequate Lighting,04/17/2013 02:14:45 PM,Pass,2013-04-17 15:30:49,lights not working at hoods above bagel hood & kettle,275   Cambridge ST,Boston,MA,02114,155973,"(42.361357, -71.068227)"
Uno Chicago Grill,,SPENCER AARONN D,UNO RESTAURANTS,LLC  LEGAL DEPARTMENT,18958,01/09/2012 03:53:57 PM,12/31/2016 11:59:00 PM,Active,FT,Eating & Drinking w/ Take Out,HE_Pass,08/17/2010 01:56:40 PM,35-6-501.111/.115,**,Insects  Rodents  Animals,08/17/2010 01:56:40 PM,Pass,2010-08-18 08:39:44,thoroughly clean area  including the area under the island oasis machine to eliminate food source for flies  and continue pest control program by Ecolab.,727   Boylston ST,Boston,MA,02116,18385,"(42.349589, -71.080292)"
Tavolo,,,Trinity Ashmont Restaurant LLC,Chris Douglass,28452,02/06/2012 01:24:23 PM,12/31/2016 11:59:00 PM,Active,FS,Eating & Drinking,HE_FailExt,12/20/2011 12:04:03 PM,37-6-501.11-.12,*,Improper Maintenance of Walls/Ceilings,12/20/2011 12:04:03 PM,Pass,2011-12-21 08:20:58,clean wall base cove behind dishmachine.,1917   DORCHESTER,DORCHESTER,MA,02124,,
Double Tree Club Hotel,,BOSTON REDEVELOPMENT AUTH,C.J. WASHINGTON STREET L.L.C.,,21472,03/09/2012 11:17:16 AM,12/31/2016 11:59:00 PM,Active,FS,Eating & Drinking,HE_Fail,03/17/2015 11:02:35 AM,21-3-304.14,*,Wiping Cloths  Clean  Sanitize,03/17/2015 11:02:35 AM,Fail,,In use wiping cloth store on top of ice bin. All in use wiping cloths must be stored in a sanitizing solution.,821    Washington ST,BOSTON,MA,02116,,
CALIFORNIA PIZZA KITCHEN,,,CALIFORNIA PIZZA KITCHEN,INC. LIC.DIV.,19754,04/03/2012 01:47:18 PM,12/31/2016 11:59:00 PM,Active,FS,Eating & Drinking,HE_Filed,09/16/2013 11:34:44 AM,37-6-501.11-.12,*,Improper Maintenance of Walls/Ceilings,09/16/2013 11:34:44 AM,Pass,2013-09-16 15:20:10,wait station/clean silver shelving along wall,800   Boylston ST,Boston,MA,02199,194357,"(42.34716, -71.08251)"
Prime Shoppe,,,Touarsi,Benemar,28544,02/08/2012 04:33:52 PM,12/31/2016 11:59:00 PM,Active,FT,Eating & Drinking w/ Take Out,HE_Fail,11/19/2010 12:13:35 PM,36-6-201.11,*,Floors Designed Constructed Installed,11/19/2010 12:13:35 PM,Fail,,clean floor behind ice machine,104-112   Faneuil Hall Mkt,Boston,Ma,02109,,
CALIFORNIA PIZZA KITCHEN,,,CALIFORNIA PIZZA KITCHEN,INC. LIC.DIV.,19754,04/03/2012 01:47:18 PM,12/31/2016 11:59:00 PM,Active,FS,Eating & Drinking,HE_FailExt,02/23/2010 10:56:19 AM,29-5-201/02.11,*,Installed and Maintained,02/23/2010 10:56:19 AM,Pass,2010-02-24 07:57:52,1) plumbing issue at hand sink  repair,800   Boylston ST,Boston,MA,02199,194357,"(42.34716, -71.08251)"
Boston Globe Cafeteria,,FLIK INTERNATIONAL CORP.,FLIK INTERNATIONAL CORP.,Compass Group,26254,02/06/2012 08:00:29 AM,12/31/2016 11:59:00 PM,Active,FS,Eating & Drinking,HE_FailExt,09/17/2009 01:47:19 PM,14-4-202.11,*,Food Contact Surfaces Design,09/18/2009 08:27:38 AM,Pass,2009-09-18 08:27:38,Long cutting board at service station visibly soiled and heavily scoared. Repair or replace.,135   William T Morrissey BL,Dorchester,MA,02125,156975,"(42.315997, -71.049211)"
Uno Chicago Grill,,SPENCER AARONN D,UNO RESTAURANTS,LLC  LEGAL DEPARTMENT,18958,01/09/2012 03:53:57 PM,12/31/2016 11:59:00 PM,Active,FT,Eating & Drinking w/ Take Out,HE_Pass,09/10/2015 01:02:02 PM,35-6-501.111/.115,**,Insects  Rodents  Animals,09/10/2015 01:02:02 PM,Pass,2015-09-10 15:36:36,Evidence of droppings found at the lower level. Provide a current IPM report from a licensed pest control company. Clean the dropings.,727   Boylston ST,Boston,MA,02116,18385,"(42.349589, -71.080292)"
PHO 2000,,SCHIAVO BRUNO A TS,Dung Ngu,,76202,04/06/2012 12:14:16 PM,12/31/2016 11:59:00 PM,Active,FS,Eating & Drinking,HE_Fail,11/09/2012 02:44:40 PM,M-2-102.11,***,PIC Knowledge,11/09/2012 02:44:40 PM,Fail,,PIC unable to state cooking temperatures  cooling process. Certified person needs to train staff.,198   Adams ST,Dorchester,MA,02122,606,"(42.30224, -71.06)"
No.  7 RESTAURANT,,,HUANG FAMILY INC.,REN XIANGHUANG  PRES.,25414,02/08/2012 04:32:36 PM,12/31/2016 11:59:00 PM,Active,FT,Eating & Drinking w/ Take Out,HE_Pass,03/27/2014 12:30:42 PM,23-4-602.13,*,Non-Food Contact Surfaces Clean,03/27/2014 12:30:42 PM,Pass,2014-03-27 15:31:11,Exterior of bulk food containers (sauses flour etc) visibly soiled. Clean to remove.,225   Grove ST,West Roxbury,MA,02132,156965,"(42.261873, -71.15741)"
Durgin Park Restaurant,,,Weinstein,Michael,24748,02/13/2012 11:17:17 AM,12/31/2016 11:59:00 PM,Active,FS,Eating & Drinking,HE_Fail,04/20/2010 10:36:48 AM,31-5-204/05.11,***,Location  Accessible,04/20/2010 10:36:48 AM,Fail,,Use hand sink at butcher shop for hand  washing only.  Remove knife from Sink and clean  sink,300  Faneuil Hall Marketplace,Boston,MA,02109,341035,"(42.360036, -71.056253)"
EQUATOR RESTAURANT,,HOOPER FRANK III,SARAH PLABUTONG,,23186,12/16/2011 10:19:57 AM,12/31/2016 11:59:00 PM,Active,FS,Eating & Drinking,HE_Pass,06/30/2015 10:00:17 AM,29-5-201/02.11,*,Installed and Maintained,06/30/2015 10:00:17 AM,Pass,2015-07-15 10:18:02,repair defective handle at kitchen handsink...,1721   Washington ST,Roxbury,MA,02118,144411,"(42.337071, -71.076601)"
Boston Globe Cafeteria,,FLIK INTERNATIONAL CORP.,FLIK INTERNATIONAL CORP.,Compass Group,26254,02/06/2012 08:00:29 AM,12/31/2016 11:59:00 PM,Active,FS,Eating & Drinking,HE_Pass,02/22/2010 10:10:35 AM,41-7-201/04.11,***,Separation/Sanitizer Criteria,02/22/2010 10:10:35 AM,Pass,2010-02-23 09:03:50,Sanitizer at 3 bay sink was testing at close to 400ppm. Corrective actions were taken at time of inspection. Ensure sanitizer is set up at the proper dilution.,135   William T Morrissey BL,Dorchester,MA,02125,156975,"(42.315997, -71.049211)"
WINDY CITY AT ADAMS VILLAGE,,BAYTURK MUZAFFER,BAYTURK MUZAFFER,,19800,02/13/2012 10:40:46 AM,12/31/2016 11:59:00 PM,Active,FT,Eating & Drinking w/ Take Out,HE_Fail,10/02/2015 01:39:47 PM,31-5-203.11,***,Number  Convenient,10/02/2015 01:39:47 PM,Fail,,Batering station observed set in the back room with no hand sink available. Either discontinue preapration in the back room or re-install hand sink with splash guards. There is to be no preparation in the back room until hand sink has been installed.,516   Gallivan BL,Dorchester,MA,02124,156552,"(42.282928, -71.055559)"
LOLLICUP TEA ZONE,,PETER LUU  PRES.,LONG JIANG,,22229,02/14/2012 12:48:34 PM,12/31/2016 11:59:00 PM,Active,FT,Eating & Drinking w/ Take Out,HE_Pass,10/05/2012 11:28:02 AM,29-5-201/02.11,*,Installed and Maintained,10/05/2012 11:28:02 AM,Pass,2012-10-05 14:51:02,DRAIN  under the wash bay of 3 bay sink is leaking- REPAIR--,1   Brighton AV,Allston,MA,02134,157732,"(42.352411, -71.125329)"
FLOUR BAKERY & CAFE,,,JOANNE CHANG,,21518,01/26/2012 03:07:20 PM,12/31/2016 11:59:00 PM,Active,FT,Eating & Drinking w/ Take Out,HE_FailExt,11/18/2014 02:57:06 PM,42-6-501.113/.114,*,Premises Maintained,11/18/2014 02:57:06 PM,Pass,2014-11-19 08:43:48,provide a mop/broom maintenance rack....,1595   Washington ST,Roxbury,MA,02114,157458,"(42.338323, -71.07488)"
EQUATOR RESTAURANT,,HOOPER FRANK III,SARAH PLABUTONG,,23186,12/16/2011 10:19:57 AM,12/31/2016 11:59:00 PM,Active,FS,Eating & Drinking,HE_Pass,05/21/2008 11:49:28 AM,38-6-303.11,*,Inadequate Lighting,05/21/2008 03:22:17 PM,Pass,2008-05-21 15:22:17,kitchen/replace all burnt out lights,1721   Washington ST,Roxbury,MA,02118,144411,"(42.337071, -71.076601)"
Uno Chicago Grill,,SPENCER AARONN D,UNO RESTAURANTS,LLC  LEGAL DEPARTMENT,18958,01/09/2012 03:53:57 PM,12/31/2016 11:59:00 PM,Active,FT,Eating & Drinking w/ Take Out,HE_Pass,11/13/2013 11:10:05 AM,35-6-501.111/.115,**,Insects  Rodents  Animals,11/13/2013 11:10:05 AM,Pass,2013-11-14 08:13:28,Remove live evidence of small fruit/drain flies in basement.,727   Boylston ST,Boston,MA,02116,18385,"(42.349589, -71.080292)"
J J Foley's Cafe,,FOLEY JEREMIAH,J J Foley's Cafe,Inc.,27092,01/31/2012 06:21:48 PM,12/31/2016 11:59:00 PM,Active,FS,Eating & Drinking,HE_Fail,10/17/2011 11:42:45 AM,22-4-601/602.11,**,Food Contact Surfaces Clean,10/17/2011 11:42:45 AM,Fail,,Clean and sanitize any food processing equipment.,117   EAST BERKELEY,BOSTON,MA,02118,,
Prime Shoppe,,,Touarsi,Benemar,28544,02/08/2012 04:33:52 PM,12/31/2016 11:59:00 PM,Active,FT,Eating & Drinking w/ Take Out,HE_Fail,02/03/2010 01:49:30 PM,23-4-602.13,*,Non-Food Contact Surfaces Clean,02/03/2010 01:49:30 PM,Fail,,Clean storage  rack inside freezer,104-112   Faneuil Hall Mkt,Boston,Ma,02109,,
Uno Chicago Grill,,SPENCER AARONN D,UNO RESTAURANTS,LLC  LEGAL DEPARTMENT,18958,01/09/2012 03:53:57 PM,12/31/2016 11:59:00 PM,Active,FT,Eating & Drinking w/ Take Out,HE_Pass,03/26/2015 11:35:16 AM,22-4-601/602.11,**,Food Contact Surfaces Clean,03/26/2015 11:35:16 AM,Pass,2015-03-26 15:36:00,Kitchen- Knife stored soiled on knife holder. Clean and sanitize properly. Fryolator oiled extremly dark and soiled. Change properly.,727   Boylston ST,Boston,MA,02116,18385,"(42.349589, -71.080292)"
West Napoli Pizza,,VRATTOS SOCRATES TS,BARDHI,SOKOL,21409,06/06/2012 03:38:02 PM,12/31/2016 11:59:00 PM,Active,FT,Eating & Drinking w/ Take Out,HE_Fail,05/09/2013 01:37:19 PM,36-6-501.11-.12,*,Improper Maintenance of Floors,05/09/2013 01:37:19 PM,Fail,,Remove carpet from rear stairwell,1946  Centre St,West Roxbury,MA,02132,27764,"(42.28358, -71.15676)"
Tavolo,,,Trinity Ashmont Restaurant LLC,Chris Douglass,28452,02/06/2012 01:24:23 PM,12/31/2016 11:59:00 PM,Active,FS,Eating & Drinking,HE_Fail,04/09/2010 12:26:08 PM,31-5-204/05.11,***,Location  Accessible,04/09/2010 12:26:08 PM,Fail,,handwash sink shall be made accessible..,1917   DORCHESTER,DORCHESTER,MA,02124,,
CAFE ESPLANADE,,,Pamela Bardhi,,91465,07/02/2013 08:38:33 AM,12/31/2016 11:59:00 PM,Active,FT,Eating & Drinking w/ Take Out,HE_Pass,06/26/2015 10:27:45 AM,25-4-904.11,*,Single Service Articles Stored Dispensed,06/26/2015 10:27:45 AM,Pass,2015-06-26 15:40:09,Plastic wares dispensers are soiled.Maintain clean.,0   David G Mugar WY,Boston,MA,02108,46576,"(42.355594, -71.074207)"
CANTON HOUSE,,,LI TING LI PRESIDENT,,23526,02/01/2012 03:06:08 PM,12/31/2016 11:59:00 PM,Active,FT,Eating & Drinking w/ Take Out,HE_Pass,08/05/2015 02:49:44 PM,29-5-201/02.11,*,Installed and Maintained,08/05/2015 02:49:44 PM,Pass,2015-08-05 15:52:00,Leaky pipe below warewashing sink  repair.,6  Hancock St,Dorchester,MA,02125,158300,"(42.315595, -71.065919)"
Double Tree Club Hotel,,BOSTON REDEVELOPMENT AUTH,C.J. WASHINGTON STREET L.L.C.,,21472,03/09/2012 11:17:16 AM,12/31/2016 11:59:00 PM,Active,FS,Eating & Drinking,HE_Hearing,03/24/2015 01:34:37 PM,20-4-703.11,***,Food Contact Surfaces Clean,03/24/2015 01:34:37 PM,Pass,2015-03-24 15:25:53,Final Rinse 170 F Establishment is equipped with a three bay sink and quatanary sanitizer. All ware washing must be performed in three bay sink until dish washing facilities are operating per code.,821    Washington ST,BOSTON,MA,02116,,
J J Foley's Cafe,,FOLEY JEREMIAH,J J Foley's Cafe,Inc.,27092,01/31/2012 06:21:48 PM,12/31/2016 11:59:00 PM,Active,FS,Eating & Drinking,HE_Fail,04/30/2008 09:56:39 AM,17-4-204.112/.115,*,Equipment Thermometers,05/01/2008 03:41:44 PM,Fail,,provide psi gauge at High temp. dish machine.,117   EAST BERKELEY,BOSTON,MA,02118,,
Subway (1868 Centre St.),,HOMSI TANIOS TS,Varahi Inc.,,77727,06/13/2012 01:03:19 PM,12/31/2016 11:59:00 PM,Active,FT,Eating & Drinking w/ Take Out,HE_Fail,05/16/2012 10:51:59 AM,15-4-202.16,*,Non-Food Contact Surfaces,05/16/2012 10:51:59 AM,Fail,,caulk all sinks....,1868   Centre ST,West Roxbury,MA,02132,27744,"(42.28588, -71.15506)"
PATS PIZZA,,LOWER MILLS RESTAURANT,LOWER MILLS RESTAURANT,GROUP LLC,24124,12/19/2011 11:01:23 AM,12/31/2016 11:59:00 PM,Active,FT,Eating & Drinking w/ Take Out,HE_Pass,10/19/2007 02:08:24 PM,42-6-501.113/.114,*,Premises Maintained,10/19/2007 03:46:01 PM,Pass,2007-10-19 15:46:01,Noted Tools and Empty Boxes stored in preparation area remove and  organize.,2254   Dorchester AV,Dorchester,MA,02124,156905,"(42.273506, -71.067541)"
CANTON HOUSE,,,LI TING LI PRESIDENT,,23526,02/01/2012 03:06:08 PM,12/31/2016 11:59:00 PM,Active,FT,Eating & Drinking w/ Take Out,HE_Fail,05/13/2014 02:44:23 PM,08-3-305-307.11,*,Food Protection,05/13/2014 02:44:23 PM,Fail,,container of starch no cover  provide during storage.,6  Hancock St,Dorchester,MA,02125,158300,"(42.315595, -71.065919)"
BUKHARA INDIAN BISTRO,,BRUCE THERESA,AMRIK SINGH PABLA,,21016,01/12/2012 03:33:18 PM,12/31/2016 11:59:00 PM,Active,FS,Eating & Drinking,HE_FailExt,09/04/2009 02:18:04 PM,13-2-304/402.11,*,Clean Cloths  Hair Restraint,09/09/2009 08:22:25 AM,Pass,2009-09-09 08:22:25,Employee observed preparing foods with no hair restraint. Provide.,701   Centre ST,Jamaica Plain,MA,02130,28172,"(42.31159, -71.11461)"
The Upper Crust,,PESIRIDIS THEODORE TRST,Shenefield,Shawn,90116,03/25/2013 02:37:01 PM,12/31/2016 11:59:00 PM,Active,FT,Eating & Drinking w/ Take Out,HE_Fail,03/28/2014 12:21:08 PM,22-4-601/602.11,**,Food Contact Surfaces Clean,03/28/2014 12:21:08 PM,Fail,,clean can opener blade,683   Tremont ST,Roxbury,MA,02118,137919,"(42.34156, -71.07662)"
Durgin Park Restaurant,,,Weinstein,Michael,24748,02/13/2012 11:17:17 AM,12/31/2016 11:59:00 PM,Active,FS,Eating & Drinking,HE_Fail,12/30/2013 10:09:57 AM,37-6-501.11-.12,*,Improper Maintenance of Walls/Ceilings,12/30/2013 10:09:57 AM,Fail,,Chipped  peeling pant and exposed wood on walls  in stair well to Main Kitchen,300  Faneuil Hall Marketplace,Boston,MA,02109,341035,"(42.360036, -71.056253)"
SULTAN'S KITCHEN,,STATE ENTERPRISES LIMITED PA,OZCAN OZAN,,22884,02/06/2012 10:58:13 AM,12/31/2016 11:59:00 PM,Active,FT,Eating & Drinking w/ Take Out,HE_Fail,09/27/2013 11:06:20 AM,36-6-501.11-.12,*,Improper Maintenance of Floors,09/27/2013 11:06:20 AM,Fail,,clean floor in walk in freezer,112   State ST,Boston,MA,02109,130370,"(42.359299, -71.054864)"
Uno Due Go,,DRUKER BERTRAM A TRSTS,URC L L C,,74800,12/30/2011 01:59:52 PM,12/31/2016 11:59:00 PM,Active,FS,Eating & Drinking,HE_Fail,06/05/2013 02:23:24 PM,32-6-301.11-02.11,*,Hand Cleaner  Drying  Tissue Signage,06/05/2013 02:23:24 PM,Fail,,There are no paper towels at the handsink near the salad station.  Provide.,52   Summer ST,Boston,MA,02110,132025,"(42.35445, -71.05881)"
Lean & Green Gourmet,,,Logan Currito  LLC,,33851,12/22/2011 12:07:35 PM,12/31/2016 11:59:00 PM,Active,FT,Eating & Drinking w/ Take Out,HE_NotReq,12/30/2012 12:00:00 AM,,,,,,,,300   LOGAN AIRPORT TRMNL C,EAST BOSTON,MA,02128,,
A K's Take Out & Delivery,,BOUKOUVALAS ATHENA TS,Saini,Jasbir,28531,12/20/2011 02:29:52 PM,12/31/2016 11:59:00 PM,Active,FT,Eating & Drinking w/ Take Out,HE_FailExt,05/22/2012 11:58:29 AM,32-6-301.11-02.11,*,Hand Cleaner  Drying  Tissue Signage,05/22/2012 11:58:29 AM,Pass,2012-05-23 08:17:14,Provide soap and paper towels in the restroom,1427   Tremont ST,Mission Hill,MA,02120,136818,"(42.331858, -71.096333)"
PATS PIZZA,,LOWER MILLS RESTAURANT,LOWER MILLS RESTAURANT,GROUP LLC,24124,12/19/2011 11:01:23 AM,12/31/2016 11:59:00 PM,Active,FT,Eating & Drinking w/ Take Out,HE_Filed,08/12/2013 12:00:14 PM,15-4-202.16,*,Non-Food Contact Surfaces,08/12/2013 12:00:14 PM,Fail,,"COUNTER AT REGISTER AREA - seal the bare wood- bare wood is not allowed in foodservice estb. bare wood holds  moisture & "" germs - can seal by - paint  stain or poly",2254   Dorchester AV,Dorchester,MA,02124,156905,"(42.273506, -71.067541)"
The Gallows,,,Henry's Delicatessen L L C,,68121,01/17/2012 04:30:41 PM,12/31/2016 11:59:00 PM,Active,FS,Eating & Drinking,HE_Fail,10/07/2014 06:33:54 PM,17-4-204.112/.115,*,Equipment Thermometers,10/07/2014 06:33:54 PM,Fail,,Basement -Repair temp gauges to dishwasher.,1395   Washington ST,Roxbury,MA,02118,171075,"(42.34137, -71.070211)"
Mehak Restaurant,,DE PASQUALE RONALD,Akram,Mohammad,33626,02/29/2012 12:55:00 PM,12/31/2016 11:59:00 PM,Active,FS,Eating & Drinking,HE_Pass,01/21/2014 12:06:56 PM,37-6-501.11-.12,*,Improper Maintenance of Walls/Ceilings,01/21/2014 12:06:56 PM,Pass,2014-01-21 15:23:41,Clean cooking vent hood and update cleaning sticker.,329   Sumner ST,East Boston,MA,02128,132398,"(42.36711, -71.03607)"
Currito Burrito,,,Park,Chan,28764,01/05/2012 12:58:58 PM,12/31/2016 11:59:00 PM,Active,FT,Eating & Drinking w/ Take Out,HE_Fail,07/31/2009 11:09:49 AM,23-4-602.13,*,Non-Food Contact Surfaces Clean,08/03/2009 08:11:55 AM,Fail,,Clean cabinet from old syrup spills under fountain machine -,300   LOGAN AIRPORT TRMNL C,EAST BOSTON,MA,02128,,
Durgin Park Restaurant,,,Weinstein,Michael,24748,02/13/2012 11:17:17 AM,12/31/2016 11:59:00 PM,Active,FS,Eating & Drinking,HE_Pass,08/12/2013 11:37:12 AM,29-5-201/02.11,*,Installed and Maintained,08/12/2013 11:37:12 AM,Pass,2013-08-12 15:24:27,3rd floor - Repair insulation on plumbing at grill area.,300  Faneuil Hall Marketplace,Boston,MA,02109,341035,"(42.360036, -71.056253)"
DUNKIN DONUTS(STATION DONUTS),,,VICTORIANO SANTOS,,21146,02/13/2012 10:13:09 AM,12/31/2016 11:59:00 PM,Active,FT,Eating & Drinking w/ Take Out,HE_Fail,08/06/2013 02:18:51 PM,35-6-501.111/.115,**,Insects  Rodents  Animals,08/06/2013 02:18:51 PM,Fail,,Evidence of flies inside establishment at front entrance  provide a current exterminators report.,4610   Washington ST,Roslindale,MA,02131,157298,"(42.275401, -71.139268)"
No.  7 RESTAURANT,,,HUANG FAMILY INC.,REN XIANGHUANG  PRES.,25414,02/08/2012 04:32:36 PM,12/31/2016 11:59:00 PM,Active,FT,Eating & Drinking w/ Take Out,HE_Fail,01/10/2013 02:26:41 PM,10-3-304.12,*,Food Utensil Storage,01/10/2013 02:26:41 PM,Fail,,remove all utensils from stagnant water....properly store all scoops...,225   Grove ST,West Roxbury,MA,02132,156965,"(42.261873, -71.15741)"
WINDY CITY AT ADAMS VILLAGE,,BAYTURK MUZAFFER,BAYTURK MUZAFFER,,19800,02/13/2012 10:40:46 AM,12/31/2016 11:59:00 PM,Active,FT,Eating & Drinking w/ Take Out,HE_Filed,02/17/2010 11:40:46 AM,42-6-501.113/.114,*,Premises Maintained,02/17/2010 11:40:46 AM,Pass,2010-02-18 09:18:53,Remove all articles and equipment from above cooler.,516   Gallivan BL,Dorchester,MA,02124,156552,"(42.282928, -71.055559)"
Peggy O'Neil's Pub & Grille,,LIMERICK CO INC,LIMERICK CO INC,,19097,12/13/2011 03:15:33 PM,12/31/2016 11:59:00 PM,Active,FS,Eating & Drinking,HE_Fail,04/17/2015 12:27:50 PM,37-6-501.11-.12,*,Improper Maintenance of Walls/Ceilings,04/17/2015 12:27:50 PM,Fail,,Exhausthood sticker expired  post current sticker.,1310   DORCHESTER  AV,DORCHESTER,MA,02122,,
BUKHARA INDIAN BISTRO,,BRUCE THERESA,AMRIK SINGH PABLA,,21016,01/12/2012 03:33:18 PM,12/31/2016 11:59:00 PM,Active,FS,Eating & Drinking,HE_Fail,03/24/2011 12:18:45 PM,01-3-602.11 B2,***,Labeling of Ingredients,03/24/2011 12:18:45 PM,Fail,,There is no allergy warning at the lunch buffet.  Post the allergy warning sign at the lunch and properly label all the items at the buffet.,701   Centre ST,Jamaica Plain,MA,02130,28172,"(42.31159, -71.11461)"
CANTON HOUSE,,,LI TING LI PRESIDENT,,23526,02/01/2012 03:06:08 PM,12/31/2016 11:59:00 PM,Active,FT,Eating & Drinking w/ Take Out,HE_Fail,03/06/2009 01:41:18 PM,17-4-302.14,*,Test Kit Provided,03/09/2009 08:08:30 AM,Fail,,Wrong test kit being used at 3 bay sink. Provide proper test kit.,6  Hancock St,Dorchester,MA,02125,158300,"(42.315595, -71.065919)"
The Upper Crust,,,Snow,John,140027,03/02/2015 08:46:12 AM,12/31/2016 11:59:00 PM,Active,FT,Eating & Drinking w/ Take Out,HE_Fail,12/28/2015 01:42:56 PM,37-6-501.11-.12,*,Improper Maintenance of Walls/Ceilings,12/28/2015 01:42:56 PM,Fail,,Hood vent at the pizza oven with large amount of grease. Clean properly.,20   Charles ST,Boston,MA,02114,163154,"(42.356834, -71.07005)"
Durgin Park Restaurant,,,Weinstein,Michael,24748,02/13/2012 11:17:17 AM,12/31/2016 11:59:00 PM,Active,FS,Eating & Drinking,HE_Pass,05/27/2014 01:57:02 PM,23-4-602.13,*,Non-Food Contact Surfaces Clean,05/27/2014 01:57:02 PM,Pass,2014-05-28 08:04:44,1) cornbread holder with old food particles  clean to remove 2) cornbread holder with old food particles  clean to remove,300  Faneuil Hall Marketplace,Boston,MA,02109,341035,"(42.360036, -71.056253)"
New York Fried Chicken,,HAZRAT KHAN,Syed Hakim Shah,,67392,12/19/2011 10:40:10 AM,12/31/2016 11:59:00 PM,Active,FT,Eating & Drinking w/ Take Out,HE_Filed,05/13/2015 03:43:29 PM,08-3-305-307.11,*,Food Protection,05/13/2015 03:43:29 PM,Pass,2015-05-13 15:52:57,Food stored in freezer uncovered in mel fry containers. Maintain covered when stored.,442   Blue Hill AV,Dorchester,MA,02121,156812,"(42.309591, -71.082238)"
The Kitchen,,POCKEL JEANNE C TRSTS,Herritt,Scott,79722,06/13/2012 10:16:32 AM,12/31/2016 11:59:00 PM,Active,FS,Eating & Drinking,HE_Hearing,04/02/2014 02:16:08 PM,17-4-204.112/.115,*,Equipment Thermometers,04/02/2014 02:16:08 PM,Pass,2014-04-03 09:15:07,No thermometer in Refrigeration Draws,560   Tremont ST,Roxbury,MA,02118,137658,"(42.34363, -71.07176)"
Aramark at Houghton Mifflin,,TWO TWENTY TWO BERKELEY,ARAMARK,C/O JARED LESSARD,24693,02/15/2012 01:55:00 PM,12/31/2016 11:59:00 PM,Active,FS,Eating & Drinking,HE_Filed,08/21/2008 11:01:42 AM,15-4-202.16,*,Non-Food Contact Surfaces,08/22/2008 07:39:13 AM,Fail,,Worn counter at single service item area(straws coffee stirers etc.).Hole in wall/worn wall by coffee station.,222   Berkeley ST,Boston,MA,02116,15007,"(42.35084, -71.07311)"
WAI'S STYLE RESTAURANT,,DAVID HUI: WAI'S STYLE RE,DAVID HUI: WAI'S STYLE RE,STAURANT,20355,01/06/2012 09:22:08 AM,12/31/2016 11:59:00 PM,Active,FS,Eating & Drinking,HE_Filed,01/14/2010 10:06:27 AM,15-4-202.16,*,Non-Food Contact Surfaces,01/14/2010 10:06:27 AM,Fail,,Defrost reach in refrigerator,99   HARRISON  AV,BOSTON,MA,02111,,
CANTON HOUSE,,,LI TING LI PRESIDENT,,23526,02/01/2012 03:06:08 PM,12/31/2016 11:59:00 PM,Active,FT,Eating & Drinking w/ Take Out,HE_Pass,08/19/2009 02:40:19 PM,03-3-501.16(A),***,Cold Holding,08/21/2009 08:26:50 AM,Pass,2009-08-21 08:26:50,Meats and fish in small 2 door cooler by Wok station at 46F. Maintain all PHF'S at 40F and below. PIC removed to ensure no bacterial growth. Unit unable to maintain a temperature of 40F and below. Technician called at time of inspection 8/17/09. Provide receipt for work done by re-inspection.,6  Hancock St,Dorchester,MA,02125,158300,"(42.315595, -71.065919)"
EQUATOR RESTAURANT,,HOOPER FRANK III,SARAH PLABUTONG,,23186,12/16/2011 10:19:57 AM,12/31/2016 11:59:00 PM,Active,FS,Eating & Drinking,HE_FailExt,01/09/2012 02:42:29 PM,17-4-204.112/.115,*,Equipment Thermometers,01/09/2012 02:42:29 PM,Fail,,high temp/repair gauges to unit,1721   Washington ST,Roxbury,MA,02118,144411,"(42.337071, -71.076601)"
A K's Take Out & Delivery,,BOUKOUVALAS ATHENA TS,Saini,Jasbir,28531,12/20/2011 02:29:52 PM,12/31/2016 11:59:00 PM,Active,FT,Eating & Drinking w/ Take Out,HE_Fail,04/28/2014 10:39:03 AM,33-5-501.13-.17,*,Adequate Number  Frequency Vermin Proof,04/28/2014 10:39:03 AM,Fail,,provide covers as needed for all trash receptacles...,1427   Tremont ST,Mission Hill,MA,02120,136818,"(42.331858, -71.096333)"
BUKHARA INDIAN BISTRO,,BRUCE THERESA,AMRIK SINGH PABLA,,21016,01/12/2012 03:33:18 PM,12/31/2016 11:59:00 PM,Active,FS,Eating & Drinking,HE_Fail,05/29/2014 02:21:07 PM,08-3-302.11/3-304.11,***,Separation  Segregation Cross Contamination,05/29/2014 02:21:07 PM,Fail,,Raw lamb stored above cooked spinch in walk in refrigerator. Hand out left.,701   Centre ST,Jamaica Plain,MA,02130,28172,"(42.31159, -71.11461)"
DRAGON CHEF CHINESE REST.,,,RU BANG CHEN PRES.,,21347,02/06/2012 10:55:13 AM,12/31/2016 11:59:00 PM,Active,FT,Eating & Drinking w/ Take Out,HE_Fail,10/23/2015 07:11:12 PM,12-2-401.11-.12,***,Good Hygienic Practices,10/23/2015 07:11:12 PM,Fail,,provide covers for all personal drinks in the kitchen.,411  Washington St,Brighton,MA,02135,156051,"(42.349266, -71.15532)"
Lean & Green Gourmet,,,Logan Currito  LLC,,33851,12/22/2011 12:07:35 PM,12/31/2016 11:59:00 PM,Active,FT,Eating & Drinking w/ Take Out,HE_Pass,03/04/2011 03:02:12 PM,,,,,,,,300   LOGAN AIRPORT TRMNL C,EAST BOSTON,MA,02128,,
UNION OYSTER HOUSE,,MILANO JOSEPH A JR TRST,MILANO,JOSEPH A.,19089,12/14/2011 02:11:17 PM,12/31/2016 11:59:00 PM,Active,FS,Eating & Drinking,HE_Pass,05/07/2012 10:08:31 AM,22-4-601/602.11,**,Food Contact Surfaces Clean,05/07/2012 10:08:31 AM,Pass,2012-05-08 07:23:26,Main-clean mixer,41  Union St,Boston,MA,02108,139293,"(42.36127, -71.05688)"
J J Foley's Cafe,,FOLEY JEREMIAH,J J Foley's Cafe,Inc.,27092,01/31/2012 06:21:48 PM,12/31/2016 11:59:00 PM,Active,FS,Eating & Drinking,HE_Fail,10/17/2011 11:42:45 AM,08-3-305-307.11,*,Food Protection,10/17/2011 11:42:45 AM,Fail,,"Elevate foods 6"" off floor in walk ins",117   EAST BERKELEY,BOSTON,MA,02118,,
CANTON HOUSE,,,LI TING LI PRESIDENT,,23526,02/01/2012 03:06:08 PM,12/31/2016 11:59:00 PM,Active,FT,Eating & Drinking w/ Take Out,HE_Filed,11/24/2008 02:03:59 PM,23-4-602.13,*,Non-Food Contact Surfaces Clean,11/25/2008 09:41:53 AM,Fail,,Interior and exterior of Beverage Air cold holding unit visibly smiled. Clean to remove.  Interior of 3 door Isdn cooler visibly soiled. Clean to remove.  Metal shelves a 2 door Jordon Cooler visible soiled and paint chipping. Address. Hand sink heavily soiled. Clean to remove. Exterior of Duck sauce container with heavy  soils. Clean to remove.,6  Hancock St,Dorchester,MA,02125,158300,"(42.315595, -71.065919)"
Deli One,,,San Ko Inc.,,29195,01/05/2012 02:41:34 PM,12/31/2016 11:59:00 PM,Active,FT,Eating & Drinking w/ Take Out,HE_NotReq,12/30/2012 12:00:00 AM,,,,,,,,85   ARCH ST ST,BOSTON,MA,02110,,
Tavolo,,,Trinity Ashmont Restaurant LLC,Chris Douglass,28452,02/06/2012 01:24:23 PM,12/31/2016 11:59:00 PM,Active,FS,Eating & Drinking,HE_Pass,07/16/2009 11:45:34 AM,35-6-501.111/.115,**,Insects  Rodents  Animals,07/17/2009 08:10:10 AM,Pass,2009-07-17 08:10:10,evidence of drain\ fruit flies - remove,1917   DORCHESTER,DORCHESTER,MA,02124,,
Peggy O'Neil's Pub & Grille,,LIMERICK CO INC,LIMERICK CO INC,,19097,12/13/2011 03:15:33 PM,12/31/2016 11:59:00 PM,Active,FS,Eating & Drinking,HE_Pass,05/15/2009 01:50:43 PM,21-3-304.14,*,Wiping Cloths  Clean  Sanitize,05/18/2009 08:10:37 AM,Pass,2009-05-18 08:10:37,Soiled wiping cloths out on counter top. Discontinue and store in proper sanitizing solution.,1310   DORCHESTER  AV,DORCHESTER,MA,02122,,
Peggy O'Neil's Pub & Grille,,LIMERICK CO INC,LIMERICK CO INC,,19097,12/13/2011 03:15:33 PM,12/31/2016 11:59:00 PM,Active,FS,Eating & Drinking,HE_Filed,12/14/2009 11:52:14 AM,08-3-305-307.11,*,Food Protection,12/14/2009 11:52:14 AM,Pass,2009-12-15 09:08:09,Container of potatoes stored on ground in kitchen area. Discontinue and store elevated at least 6 inches off the ground.,1310   DORCHESTER  AV,DORCHESTER,MA,02122,,
Double Tree Club Hotel,,BOSTON REDEVELOPMENT AUTH,C.J. WASHINGTON STREET L.L.C.,,21472,03/09/2012 11:17:16 AM,12/31/2016 11:59:00 PM,Active,FS,Eating & Drinking,HE_Fail,05/04/2009 12:11:43 PM,41-7-201/04.11,***,Separation/Sanitizer Criteria,05/05/2009 09:16:33 AM,Fail,,Properly store all toxic chemicals.,821    Washington ST,BOSTON,MA,02116,,
Durgin Park Restaurant,,,Weinstein,Michael,24748,02/13/2012 11:17:17 AM,12/31/2016 11:59:00 PM,Active,FS,Eating & Drinking,HE_Fail,08/24/2010 11:20:31 AM,35-6-501.111/.115,**,Insects  Rodents  Animals,08/24/2010 11:20:31 AM,Fail,,Keep all windows closed or provide screens  for all windows while they are opened.,300  Faneuil Hall Marketplace,Boston,MA,02109,341035,"(42.360036, -71.056253)"
Tavolo,,,Trinity Ashmont Restaurant LLC,Chris Douglass,28452,02/06/2012 01:24:23 PM,12/31/2016 11:59:00 PM,Active,FS,Eating & Drinking,HE_Pass,02/24/2009 02:06:18 PM,M-2-102.11,***,PIC Knowledge,02/25/2009 08:22:10 AM,Pass,2009-02-25 08:22:10,provide proof of a certified food manager,1917   DORCHESTER,DORCHESTER,MA,02124,,
West Napoli Pizza,,VRATTOS SOCRATES TS,BARDHI,SOKOL,21409,06/06/2012 03:38:02 PM,12/31/2016 11:59:00 PM,Active,FT,Eating & Drinking w/ Take Out,HE_Pass,04/05/2011 11:03:47 AM,M-2-102.11,***,PIC Knowledge,04/05/2011 11:03:47 AM,Pass,2011-04-06 08:27:47,The certified food manager does not have her allergy awareness certificate.  Post 2011 health permit  certified food manager's certificate  and allergy awareness certificate in the front of the establishment.,1946  Centre St,West Roxbury,MA,02132,27764,"(42.28358, -71.15676)"
Pino's Pizza House,,CLEVELAND REALTY CO,PETRUZZOELLO,FELICIAN,18067,02/15/2012 02:11:04 PM,12/31/2016 11:59:00 PM,Active,FT,Eating & Drinking w/ Take Out,HE_Pass,01/10/2012 12:08:34 PM,08-3-305-307.11,*,Food Protection,01/10/2012 12:08:34 PM,Pass,2012-01-11 09:02:08,Containers of onions and other foods stored on floor of walk-in. Discontinue and store elevated at least 6 inches off the ground.,1918   Beacon ST,Brighton,MA,02135,10006,"(42.336527, -71.149151)"
EL PENOL RESTAURANT,,,MIGUEL A. MEDINA BALBIN,,23581,12/29/2011 09:39:51 AM,12/31/2016 11:59:00 PM,Active,FS,Eating & Drinking,HE_Pass,08/19/2015 03:20:49 PM,44-4-802/03.11,*,Soiled Linen Storage,08/19/2015 03:20:49 PM,Pass,2015-08-19 15:51:07,Keep dirty linen in covered containers.,54   Bennington ST,East Boston,MA,02128,156292,"(42.375798, -71.037101)"
Dot 2 Dot Cafe,,BERTUCCI JOHN E TRST,Henry-Garrett,Karen,28291,01/24/2012 09:58:41 AM,12/31/2016 11:59:00 PM,Active,FS,Eating & Drinking,HE_Fail,06/08/2010 11:36:06 AM,03-3-501.16(A),***,Cold Holding,06/08/2010 11:36:06 AM,Fail,,properly maintain all eggs and egg mix at 41f.....,1735   Dorchester AV,Dorchester,MA,02124,48397,"(42.29105, -71.06302)"
Nicholas Sub & Pizza Shop,,NICHOLAS MARKOPOULOS,Kourtelidis,Nicholas,33364,01/17/2012 03:37:47 PM,12/31/2016 11:59:00 PM,Active,FT,Eating & Drinking w/ Take Out,HE_Fail,07/28/2014 10:43:34 AM,38-6-202.11,*,Fixture's not properly shielded,07/28/2014 10:43:34 AM,Fail,,Lights over preparation trables not shielded. Provide.,600   Hyde Park AV,Roslindale,MA,02131,156517,"(42.280027, -71.118658)"
Grille 705,,SEVEN-05 MASSACHUSETTS AVE,Antreassian,Sarkis,28817,01/31/2012 10:52:38 AM,12/31/2016 11:59:00 PM,Active,FT,Eating & Drinking w/ Take Out,HE_Fail,07/06/2012 10:59:47 AM,23-4-602.13,*,Non-Food Contact Surfaces Clean,07/06/2012 10:59:47 AM,Pass,2012-07-09 07:53:20,Stove backboard soiled  clean.,705    Massachusetts AV,BOSTON,MA,02118,,
FENWAY PARK H.M.S. INC.,,JACK LYONS  MANAGER,FENWAY PARK H.M.S. INC.,,18275,10/27/2008 10:04:53 AM,12/31/2008 11:59:00 PM,Inactive,FT,Eating & Drinking w/ Take Out,HE_Filed,07/26/2008 04:36:11 PM,15-4-202.16,*,Non-Food Contact Surfaces,07/28/2008 08:09:18 AM,Pass,2008-07-28 08:09:18,Interior of lid to prep refridge loose(RF roof).Drip line missing at dispensers at RF Roof bar.Condenser to Walk-in at L5B3 leaking.Exposed insulation overhead in dry good room at commissary.,4  Yawkey Wy,Boston,MA,02215,156417,"(42.346723, -71.09868)"
Anshur Restauruant,,REARDON THOMAS B,Anshur,Abdullah F.,31241,02/08/2012 03:13:24 PM,12/31/2016 11:59:00 PM,Active,FT,Eating & Drinking w/ Take Out,HE_FailExt,10/27/2015 08:36:19 AM,33-5-501.13-.17,*,Adequate Number  Frequency Vermin Proof,10/27/2015 08:36:19 AM,Pass,2015-10-28 08:55:27,replace missing trash receptacle covers....,291   Roxbury ST,Roxbury,MA,02119,119179,"(42.33041, -71.0943)"
The Gallows,,,Henry's Delicatessen L L C,,68121,01/17/2012 04:30:41 PM,12/31/2016 11:59:00 PM,Active,FS,Eating & Drinking,HE_Fail,10/07/2014 06:33:54 PM,05-4-302.12,*,Food Thermometers Provided,10/07/2014 06:33:54 PM,Fail,,Provide food thermometer,1395   Washington ST,Roxbury,MA,02118,171075,"(42.34137, -71.070211)"
DRAGON CHEF CHINESE REST.,,,RU BANG CHEN PRES.,,21347,02/06/2012 10:55:13 AM,12/31/2016 11:59:00 PM,Active,FT,Eating & Drinking w/ Take Out,HE_Fail,11/13/2009 05:11:05 PM,21-3-304.14,*,Wiping Cloths  Clean  Sanitize,11/13/2009 05:11:05 PM,Fail,,Wet  soiled cloth on counter. Store in sanitizing solution between use.,411  Washington St,Brighton,MA,02135,156051,"(42.349266, -71.15532)"
FLOUR BAKERY & CAFE,,,JOANNE CHANG,,21518,01/26/2012 03:07:20 PM,12/31/2016 11:59:00 PM,Active,FT,Eating & Drinking w/ Take Out,HE_Pass,12/05/2008 03:31:48 PM,16-4-501.11/.15,*,Dishwashng Facilities,12/05/2008 03:42:52 PM,Pass,2008-12-05 15:42:52,3 bay/provide proper drain plugs,1595   Washington ST,Roxbury,MA,02114,157458,"(42.338323, -71.07488)"
CANTON HOUSE,,,LI TING LI PRESIDENT,,23526,02/01/2012 03:06:08 PM,12/31/2016 11:59:00 PM,Active,FT,Eating & Drinking w/ Take Out,HE_Pass,04/22/2015 02:26:28 PM,22-4-601/602.11,**,Food Contact Surfaces Clean,04/22/2015 02:26:28 PM,Pass,2015-04-22 15:48:46,Replace heavily soiled grease.,6  Hancock St,Dorchester,MA,02125,158300,"(42.315595, -71.065919)"
Durgin Park Restaurant,,,Weinstein,Michael,24748,02/13/2012 11:17:17 AM,12/31/2016 11:59:00 PM,Active,FS,Eating & Drinking,HE_Fail,12/11/2012 10:12:46 AM,15-4-202.16,*,Non-Food Contact Surfaces,12/11/2012 10:12:46 AM,Fail,,Resurface wooden counter top,300  Faneuil Hall Marketplace,Boston,MA,02109,341035,"(42.360036, -71.056253)"
Uno Chicago Grill,,NICOLE E. ADAMS,NICOLE E. ADAMS,,19118,01/09/2012 03:55:20 PM,12/31/2016 11:59:00 PM,Active,FT,Eating & Drinking w/ Take Out,HE_Fail,08/29/2007 08:49:08 AM,02-3-602.11-.12/3-302.12,*,Food Container Labels,09/05/2007 09:06:12 AM,Fail,,Bulk food items are unlabeled. Label bulk items.,270   HUNTINGTON  AV,BOSTON,MA,02125,,
Grille 705,,SEVEN-05 MASSACHUSETTS AVE,Antreassian,Sarkis,28817,01/31/2012 10:52:38 AM,12/31/2016 11:59:00 PM,Active,FT,Eating & Drinking w/ Take Out,HE_Fail,10/28/2009 12:41:34 PM,03-3-501.16(A),***,Cold Holding,10/28/2009 03:17:37 PM,Fail,,hamburger 45 degrees/provide proper temperature of 41 degrees or below,705    Massachusetts AV,BOSTON,MA,02118,,
Prime Shoppe,,,Touarsi,Benemar,28544,02/08/2012 04:33:52 PM,12/31/2016 11:59:00 PM,Active,FT,Eating & Drinking w/ Take Out,HE_Fail,06/09/2015 12:08:45 PM,37-6-501.11-.12,*,Improper Maintenance of Walls/Ceilings,06/09/2015 12:08:45 PM,Fail,,ceiling and fan coil unit in walk-in cooler with soils  clean to remove,104-112   Faneuil Hall Mkt,Boston,Ma,02109,,
No.  7 RESTAURANT,,,HUANG FAMILY INC.,REN XIANGHUANG  PRES.,25414,02/08/2012 04:32:36 PM,12/31/2016 11:59:00 PM,Active,FT,Eating & Drinking w/ Take Out,HE_Pass,10/16/2012 01:00:58 PM,03-3-501.14,***,Cooling,10/16/2012 01:00:58 PM,Pass,2012-10-16 15:41:52,The rice cooked earlier in the day and allowed to cool in a deep container at room temperature is still 74F.  Provide proper cooling methods so phf's cool from 140F to 70F in two hours and then from 70F to 41F in an additional four hours. (discarded by manager),225   Grove ST,West Roxbury,MA,02132,156965,"(42.261873, -71.15741)"
Happy Garden,,,Brighton Ventures Inc.,,24662,01/31/2012 01:17:53 PM,12/31/2016 11:59:00 PM,Active,FT,Eating & Drinking w/ Take Out,HE_Fail,01/10/2014 12:02:02 PM,08-3-305-307.11,*,Food Protection,01/10/2014 12:02:02 PM,Fail,,The freezer and refrigerator are overcrowded.  There are items stored in the coolers that are unwrapped and large amounts of items stored on the ground.  store items elavated and wrapped.,377   Washington ST,Brighton,MA,02135,156389,"(42.349291, -71.15428)"
Aramark at Houghton Mifflin,,TWO TWENTY TWO BERKELEY,ARAMARK,C/O JARED LESSARD,24693,02/15/2012 01:55:00 PM,12/31/2016 11:59:00 PM,Active,FS,Eating & Drinking,HE_Fail,04/23/2008 11:39:22 AM,03-3-501.16,***,Hot Holding,04/23/2008 03:29:19 PM,Fail,,Baked chicken hot holding at 100F-110F  Flank steak hot holding at 122F.,222   Berkeley ST,Boston,MA,02116,15007,"(42.35084, -71.07311)"
Union Club of Boston,,UNION CLUB OF BOSTON INC,UNION CLUB OF BOSTON INC,,18725,12/13/2011 11:17:44 AM,12/31/2016 11:59:00 PM,Active,FS,Eating & Drinking,HE_Fail,10/29/2013 10:30:17 AM,08-3-305-307.11,*,Food Protection,10/29/2013 10:30:17 AM,Fail,,Remove items from top of ice machine,8   Park ST,Boston,MA,02108,107194,"(42.3575, -71.0627)"
Shanghai Social Club,,MILLER TUCKER REED TRSTS,Douglas Bacon Pres.,c/o White Horse Tavern,80857,09/05/2013 11:22:39 AM,12/31/2016 11:59:00 PM,Active,FS,Eating & Drinking,HE_Fail,07/25/2014 02:29:36 PM,35-6-501.111/.115,**,Insects  Rodents  Animals,07/25/2014 02:29:36 PM,Fail,,The floor in the storage area is soiled with rodent droppings.  Clean and continur to treat for rodents.,1277   Commonwealth AV,Allston,MA,02134,37258,"(42.34982, -71.13342)"
Boston Globe Cafeteria,,FLIK INTERNATIONAL CORP.,FLIK INTERNATIONAL CORP.,Compass Group,26254,02/06/2012 08:00:29 AM,12/31/2016 11:59:00 PM,Active,FS,Eating & Drinking,HE_Filed,03/15/2011 01:21:55 PM,23-4-602.13,*,Non-Food Contact Surfaces Clean,03/15/2011 01:21:55 PM,Fail,,Filters above stove top and grill with heavy grease build-up. Clean to remove.,135   William T Morrissey BL,Dorchester,MA,02125,156975,"(42.315997, -71.049211)"
MCKENNA'S CAFE,,KENNETH OSHEROW  PRES.,KENNETH OSHEROW PRES.,,23628,12/28/2011 09:11:33 AM,12/31/2016 11:59:00 PM,Active,FS,Eating & Drinking,HE_Filed,03/22/2010 10:32:16 AM,37-6-501.11-.12,*,Improper Maintenance of Walls/Ceilings,03/22/2010 10:32:16 AM,Pass,2010-03-23 08:20:49,Filters above stove top and grill with heavy grease build-up. Clean to remove.,109   Savin Hill AV,Dorchester,MA,02125,156864,"(42.311515, -71.05382)"
Tavolo,,,Trinity Ashmont Restaurant LLC,Chris Douglass,28452,02/06/2012 01:24:23 PM,12/31/2016 11:59:00 PM,Active,FS,Eating & Drinking,HE_FailExt,12/20/2011 12:04:03 PM,08-3-305-307.11,*,Food Protection,12/20/2011 12:04:03 PM,Fail,,Spice containers being stored under waste pipe of hand sink near panini machine. Discontinue and store all spices clean and protected.,1917   DORCHESTER,DORCHESTER,MA,02124,,
Aramark at Houghton Mifflin,,TWO TWENTY TWO BERKELEY,ARAMARK,C/O JARED LESSARD,24693,02/15/2012 01:55:00 PM,12/31/2016 11:59:00 PM,Active,FS,Eating & Drinking,HE_Filed,08/21/2008 11:01:42 AM,03-3-501.16(A),***,Cold Holding,08/22/2008 07:39:13 AM,Pass,2008-08-22 07:39:13,Deli turkey piled up over lip of container at open top refridge at 44F.Roast beef at 46-48F.Yellow american cheese at 50F(all product piled high over lip of container).8-14-08 observed same issue with Turkey at deli at 58F roastbeef at deli at 44F as well as cornbeef.,222   Berkeley ST,Boston,MA,02116,15007,"(42.35084, -71.07311)"
PHO 2000,,SCHIAVO BRUNO A TS,Dung Ngu,,76202,04/06/2012 12:14:16 PM,12/31/2016 11:59:00 PM,Active,FS,Eating & Drinking,HE_Filed,11/13/2012 01:49:35 PM,21-3-304.14,*,Wiping Cloths  Clean  Sanitize,11/13/2012 01:49:35 PM,Pass,2012-11-13 15:42:20,Soiled wiping cloths on cutting board. Discontinue store in bucket with sanitizer,198   Adams ST,Dorchester,MA,02122,606,"(42.30224, -71.06)"
UNION OYSTER HOUSE,,MILANO JOSEPH A JR TRST,MILANO,JOSEPH A.,19089,12/14/2011 02:11:17 PM,12/31/2016 11:59:00 PM,Active,FS,Eating & Drinking,HE_Fail,08/20/2013 10:07:00 AM,36-6-501.11-.12,*,Improper Maintenance of Floors,08/20/2013 10:07:00 AM,Fail,,Upstairs -clean floor in walk in freezer.,41  Union St,Boston,MA,02108,139293,"(42.36127, -71.05688)"
Boston Globe Cafeteria,,FLIK INTERNATIONAL CORP.,FLIK INTERNATIONAL CORP.,Compass Group,26254,02/06/2012 08:00:29 AM,12/31/2016 11:59:00 PM,Active,FS,Eating & Drinking,HE_Filed,02/03/2012 10:49:52 AM,23-4-602.13,*,Non-Food Contact Surfaces Clean,02/03/2012 10:49:52 AM,Fail,,Clean tops of equipment throughout.Clean portable air fans.,135   William T Morrissey BL,Dorchester,MA,02125,156975,"(42.315997, -71.049211)"
Durgin Park Restaurant,,,Weinstein,Michael,24748,02/13/2012 11:17:17 AM,12/31/2016 11:59:00 PM,Active,FS,Eating & Drinking,HE_Fail,04/09/2013 10:43:32 AM,15-4-202.16,*,Non-Food Contact Surfaces,04/09/2013 10:43:32 AM,Fail,,Rusted shelving next to 3 Bay sink.,300  Faneuil Hall Marketplace,Boston,MA,02109,341035,"(42.360036, -71.056253)"
Langham Hotel,,CHRISTINE GILPIN  CONTROL LER,CHRISTINE GILPIN CONTROL,LER,23003,01/11/2012 08:50:36 AM,12/31/2016 11:59:00 PM,Active,FS,Eating & Drinking,HE_Fail,11/30/2010 11:42:06 AM,23-4-602.13,*,Non-Food Contact Surfaces Clean,11/30/2010 11:42:06 AM,Fail,,Top of dishmachine needs attention(corners encrusted etc.).Please clean routinely.,250   Franklin ST,Boston,MA,02110,157806,"(42.35663, -71.054279)"
A K's Take Out & Delivery@Reggie Lewis Track,,,Sohan Saini Pres.,,31365,02/14/2012 12:14:03 PM,12/31/2016 11:59:00 PM,Active,FT,Eating & Drinking w/ Take Out,HE_NotReq,12/30/2012 12:00:00 AM,,,,,,,,1350   Tremont ST,Boston,Ma,02116,,
UNION OYSTER HOUSE,,MILANO JOSEPH A JR TRST,MILANO,JOSEPH A.,19089,12/14/2011 02:11:17 PM,12/31/2016 11:59:00 PM,Active,FS,Eating & Drinking,HE_Fail,08/20/2013 10:07:00 AM,37-6-501.11-.12,*,Improper Maintenance of Walls/Ceilings,08/20/2013 10:07:00 AM,Fail,,Kitchen -Clean cooking vent hood t plumbing at broiler.,41  Union St,Boston,MA,02108,139293,"(42.36127, -71.05688)"
The Upper Crust,,PESIRIDIS THEODORE TRST,Shenefield,Shawn,90116,03/25/2013 02:37:01 PM,12/31/2016 11:59:00 PM,Active,FT,Eating & Drinking w/ Take Out,HE_Filed,10/01/2014 12:05:02 PM,21-3-304.14,*,Wiping Cloths  Clean  Sanitize,10/01/2014 12:05:02 PM,Pass,2014-10-01 15:22:13,properly store all wiping cloths in a sanitizing solution,683   Tremont ST,Roxbury,MA,02118,137919,"(42.34156, -71.07662)"
Happy Garden,,,Brighton Ventures Inc.,,24662,01/31/2012 01:17:53 PM,12/31/2016 11:59:00 PM,Active,FT,Eating & Drinking w/ Take Out,Fail,11/30/2006 04:32:00 PM,,,,,,,,377   Washington ST,Brighton,MA,02135,156389,"(42.349291, -71.15428)"
Dunkin Donuts,,ONE HUNDRED CAMBRIDGE STREET,DN Donuts Inc.,Danny Haddad,26507,01/11/2012 11:22:31 AM,12/31/2016 11:59:00 PM,Active,FT,Eating & Drinking w/ Take Out,HE_Pass,,42-6-501.113/.114,*,Premises Maintained,05/18/2007 02:38:00 PM,Pass,2007-05-18 14:43:17,,100   Cambridge ST,Boston,MA,02114,25222,"(42.360584, -71.062109)"
Country Kitchen,,AMINPOUR AMIR,Arleen Campbell,,32027,01/05/2012 08:42:50 AM,12/31/2016 11:59:00 PM,Active,FS,Eating & Drinking,HE_Pass,09/16/2011 10:09:50 AM,23-4-602.13,*,Non-Food Contact Surfaces Clean,09/16/2011 10:09:50 AM,Pass,2011-09-16 14:55:03,"STOVE- CLEAN  stove of built-up grease  grime  & food ""splatter""-",830   Blue Hill AV,Dorchester,MA,02124,16567,"(42.29621, -71.08718)"
Durgin Park Restaurant,,,Weinstein,Michael,24748,02/13/2012 11:17:17 AM,12/31/2016 11:59:00 PM,Active,FS,Eating & Drinking,HE_Filed,10/14/2008 12:08:08 PM,35-6-501.111/.115,**,Insects  Rodents  Animals,10/14/2008 03:20:29 PM,Pass,2008-10-14 15:20:29,Upstairs - Numerous flying insects at electrical closet.Numerous rodent droppings near windows,300  Faneuil Hall Marketplace,Boston,MA,02109,341035,"(42.360036, -71.056253)"
Ester,,,2261 Dot LLC.,LLC,127375,04/08/2014 09:58:35 AM,12/31/2016 11:59:00 PM,Active,FS,Eating & Drinking,HE_Fail,04/28/2015 01:06:34 PM,12-3--301.11,***,Prevention of Contamination from Hands,04/28/2015 01:06:34 PM,Fail,,Employee observed dicing ready to eat lettuce with bare hands. Discontinue and ensure there is no bare hand contact with any ready to eat foods.,2261   Dorchester AV,Dorchester,MA,02124,48561,"(42.27317, -71.06801)"
Deli One,,,San Ko Inc.,,29195,01/05/2012 02:41:34 PM,12/31/2016 11:59:00 PM,Active,FT,Eating & Drinking w/ Take Out,HE_Pass,01/26/2010 11:42:38 AM,03-3-501.16,***,Hot Holding,01/26/2010 11:42:38 AM,Pass,2010-01-26 14:58:49,Chicken Parm sitting on counter at 120F.Turkey sitting on toaster at 120F.Multiple other foods sitting on shelving(temperature was coincidentally within required range).Provide proper holding of All hot foods.Inspector explained various different approved methods.,85   ARCH ST ST,BOSTON,MA,02110,,
Nicholas Sub & Pizza Shop,,NICHOLAS MARKOPOULOS,Kourtelidis,Nicholas,33364,01/17/2012 03:37:47 PM,12/31/2016 11:59:00 PM,Active,FT,Eating & Drinking w/ Take Out,HE_Fail,07/28/2014 10:43:34 AM,29-5-201/02.11,*,Installed and Maintained,07/28/2014 10:43:34 AM,Fail,,Hand sink in the main kitchen area not draining properly. Address and make all necessary repairs. Pipe under the 3 bay sink not draining properly. Repair. Mop sink visibly soiled and not draining properly. Repair.,600   Hyde Park AV,Roslindale,MA,02131,156517,"(42.280027, -71.118658)"
Union Club of Boston,,UNION CLUB OF BOSTON INC,UNION CLUB OF BOSTON INC,,18725,12/13/2011 11:17:44 AM,12/31/2016 11:59:00 PM,Active,FS,Eating & Drinking,HE_Fail,09/10/2008 01:15:24 PM,37-6-201.11,*,Walls/Ceilings Designed Constructed Installed,09/11/2008 08:08:34 AM,Fail,,clean wall by ice machine,8   Park ST,Boston,MA,02108,107194,"(42.3575, -71.0627)"
J J Foley's Cafe,,FOLEY JEREMIAH,J J Foley's Cafe,Inc.,27092,01/31/2012 06:21:48 PM,12/31/2016 11:59:00 PM,Active,FS,Eating & Drinking,HE_Fail,12/31/2009 12:48:15 PM,42-6-501.113/.114,*,Premises Maintained,12/31/2009 12:48:15 PM,Fail,,Relocate all brooms equip. from kitchen.,117   EAST BERKELEY,BOSTON,MA,02118,,
Prime Shoppe,,,Touarsi,Benemar,28544,02/08/2012 04:33:52 PM,12/31/2016 11:59:00 PM,Active,FT,Eating & Drinking w/ Take Out,HE_Pass,10/19/2010 11:58:48 AM,36-6-201.11,*,Floors Designed Constructed Installed,10/19/2010 11:58:48 AM,Pass,2010-10-21 08:38:31,Clean floor of walk in  freezer,104-112   Faneuil Hall Mkt,Boston,Ma,02109,,
Durgin Park Restaurant,,,Weinstein,Michael,24748,02/13/2012 11:17:17 AM,12/31/2016 11:59:00 PM,Active,FS,Eating & Drinking,HE_Hearing,09/07/2012 11:14:11 AM,19-4-501.18-.110,*,Wash Rinse Water Clean Proper Temperature.,09/07/2012 11:14:11 AM,Pass,2012-09-07 15:16:06,High temp dish machine wash temperature 100 F,300  Faneuil Hall Marketplace,Boston,MA,02109,341035,"(42.360036, -71.056253)"
BOSTON WING IT,,MYONG JO SONG,MYONG JO SONG,,22141,02/09/2012 10:35:11 AM,12/31/2016 11:59:00 PM,Active,FT,Eating & Drinking w/ Take Out,HE_Hearing,11/12/2009 01:30:31 PM,35-6-501.111/.115,**,Insects  Rodents  Animals,11/12/2009 01:30:31 PM,Fail,,Evidence of numerous cockroaches in lightshields glueboards in upper and lower portions of establishment.Provide IPM report.,1153   COMMONWEALTH  AV,ALLSTON,MA,02134,,
MCKENNA'S CAFE,,KENNETH OSHEROW  PRES.,KENNETH OSHEROW PRES.,,23628,12/28/2011 09:11:33 AM,12/31/2016 11:59:00 PM,Active,FS,Eating & Drinking,HE_Pass,02/27/2014 10:41:28 AM,14-4-202.11,*,Food Contact Surfaces Design,02/27/2014 10:41:28 AM,Pass,2014-02-28 09:27:47,Replace heavily scoreded and grooved cutting board at salad unit.,109   Savin Hill AV,Dorchester,MA,02125,156864,"(42.311515, -71.05382)"
Panera Bread,,,Boston Bread LLc,Attn: Lori Engel,26330,01/18/2012 04:43:59 PM,12/31/2016 11:59:00 PM,Active,FS,Eating & Drinking,HE_Pass,09/13/2011 11:37:05 AM,33-5-501.116,*,Improper Cleaning of Receptacles,09/13/2011 11:37:05 AM,Pass,2011-09-14 08:27:44,Trash receptacles filthy.Please clean.Staff are not cleaning in between use and excessive soil build up in units.This is a hinderance to eliminating pest issue.,200   High ST,Boston,Ma,02110,,
WINDY CITY AT ADAMS VILLAGE,,BAYTURK MUZAFFER,BAYTURK MUZAFFER,,19800,02/13/2012 10:40:46 AM,12/31/2016 11:59:00 PM,Active,FT,Eating & Drinking w/ Take Out,HE_Fail,01/08/2014 12:08:42 PM,03-3-501.16(A),***,Cold Holding,01/08/2014 12:08:42 PM,Fail,,Sliced pineapple and ham inside of the pizza cooler with elevated temperatures of 48F. PIC removed and voluntarily discarded out of temperature foods at the time of the inspection. All other foods inside of cooler at below 41F. Ensure all potentially hazardous foods are being maintained at below 41F.,516   Gallivan BL,Dorchester,MA,02124,156552,"(42.282928, -71.055559)"
Grille 705,,SEVEN-05 MASSACHUSETTS AVE,Antreassian,Sarkis,28817,01/31/2012 10:52:38 AM,12/31/2016 11:59:00 PM,Active,FT,Eating & Drinking w/ Take Out,HE_Pass,11/21/2012 10:40:10 AM,22-4-601/602.11,**,Food Contact Surfaces Clean,11/21/2012 10:40:10 AM,Pass,2012-11-23 08:38:34,interior of ice machine with rust like substance  clean to remove,705    Massachusetts AV,BOSTON,MA,02118,,
ZESTO'S PIZZA,,FOUR 60-468 CENTRE STREET,K & M Pizza Inc.,,75590,12/12/2011 12:47:41 PM,12/31/2016 11:59:00 PM,Active,FT,Eating & Drinking w/ Take Out,HE_FailExt,09/23/2014 01:46:55 PM,22-4-601/602.11,**,Food Contact Surfaces Clean,09/23/2014 01:46:55 PM,Pass,2014-09-23 15:30:32,Can opener in basement has dry food on blade. Clean to remove and monitor.,460   Centre ST,Jamaica Plain,MA,02130,28061,"(42.31935, -71.11154)"
CALIFORNIA PIZZA KITCHEN,,,CALIFORNIA PIZZA KITCHEN,INC. LIC.DIV.,19754,04/03/2012 01:47:18 PM,12/31/2016 11:59:00 PM,Active,FS,Eating & Drinking,HE_Pass,02/01/2013 07:19:40 AM,,,,,,,,800   Boylston ST,Boston,MA,02199,194357,"(42.34716, -71.08251)"
Momogoose 2,,,Smart Gourmet LLC,Loc Vo,68113,12/14/2011 02:53:19 PM,12/31/2016 11:59:00 PM,Active,MFW,Mobile Food Walk On,HE_Fail,05/02/2012 12:00:02 PM,21-3-304.14,*,Wiping Cloths  Clean  Sanitize,05/02/2012 12:00:02 PM,Fail,,Cloths are stored outside of sanitizer.  Store properly.,1   Citywide ST,Boston,MA,02128,0,
Uno Chicago Grill,,NICOLE E. ADAMS,NICOLE E. ADAMS,,19118,01/09/2012 03:55:20 PM,12/31/2016 11:59:00 PM,Active,FT,Eating & Drinking w/ Take Out,HE_Pass,02/24/2012 12:25:35 PM,32-6-501.11-.12/6-202.14,*,Toilet Enclosed Clean,02/24/2012 12:25:35 PM,Pass,2012-02-28 08:18:23,repair automatic dispenser to operate on demand.,270   HUNTINGTON  AV,BOSTON,MA,02125,,
Mattapan House of Pizza,,FETFATSIDIS SIMON,Isidoros Poulopoulos,,78448,04/04/2012 10:27:46 AM,12/31/2016 11:59:00 PM,Active,FT,Eating & Drinking w/ Take Out,HE_Fail,06/03/2013 11:29:44 AM,15-4-202.16,*,Non-Food Contact Surfaces,06/03/2013 11:29:44 AM,Fail,,Exterior of freezer unit rusty  repair.,1621   Blue Hill AV,Mattapan,MA,02126,155684,"(42.268453, -71.094131)"
CARLOS CUCINA ITALIANA,,BARONE CARLOS,CARLO BARONE,,20273,06/07/2012 10:51:20 AM,12/31/2016 11:59:00 PM,Active,FS,Eating & Drinking,HE_Filed,04/26/2013 11:54:35 AM,32-6-301.11-02.11,*,Hand Cleaner  Drying  Tissue Signage,04/26/2013 11:54:35 AM,Pass,2013-04-30 08:39:07,No paper towels or signage at hand sink. Provide.,131   BRIGHTON  AV,ALLSTON,MA,02134,,
Tenoch Mexican,,,Tenoch Mexican Food Corp.,,122265,02/19/2014 11:21:49 AM,12/31/2016 11:59:00 PM,Active,FT,Eating & Drinking w/ Take Out,HE_Pass,05/08/2014 07:57:58 AM,23-4-602.13,*,Non-Food Contact Surfaces Clean,05/08/2014 07:57:58 AM,Pass,2014-05-09 08:05:10,Clean inside all refrigeration units fropm all visible soils,3   Lewis ST,Boston,MA,02109,263801,"(42.36328, -71.05188)"
No.  7 RESTAURANT,,,HUANG FAMILY INC.,REN XIANGHUANG  PRES.,25414,02/08/2012 04:32:36 PM,12/31/2016 11:59:00 PM,Active,FT,Eating & Drinking w/ Take Out,HE_Filed,05/27/2008 01:19:54 PM,34-5-501.111/.115,*,Outside Storage Improperly Maintained,05/27/2008 03:43:45 PM,Pass,2008-05-27 15:43:45,clear around rear of  restaurant to remove all leaves  boxes and debris,225   Grove ST,West Roxbury,MA,02132,156965,"(42.261873, -71.15741)"
Durgin Park Restaurant,,,Weinstein,Michael,24748,02/13/2012 11:17:17 AM,12/31/2016 11:59:00 PM,Active,FS,Eating & Drinking,HE_Hearing,12/18/2012 11:47:43 AM,15-4-202.16,*,Non-Food Contact Surfaces,12/18/2012 11:47:43 AM,Fail,,Exposed wood on shelving,300  Faneuil Hall Marketplace,Boston,MA,02109,341035,"(42.360036, -71.056253)"
EQUATOR RESTAURANT,,HOOPER FRANK III,SARAH PLABUTONG,,23186,12/16/2011 10:19:57 AM,12/31/2016 11:59:00 PM,Active,FS,Eating & Drinking,HE_Fail,05/07/2008 11:13:59 AM,38-6-303.11,*,Inadequate Lighting,05/07/2008 03:09:52 PM,Fail,,kitchen/replace all burnt out lights,1721   Washington ST,Roxbury,MA,02118,144411,"(42.337071, -71.076601)"
Uno Chicago Grill,,NICOLE E. ADAMS,NICOLE E. ADAMS,,19118,01/09/2012 03:55:20 PM,12/31/2016 11:59:00 PM,Active,FT,Eating & Drinking w/ Take Out,HE_Pass,09/07/2007 02:39:07 PM,19-4-501.18-.110,*,Wash Rinse Water Clean Proper Temperature.,09/07/2007 02:40:05 PM,Pass,2007-09-07 14:40:05,High temperature machine wash 125F and rinse 187F. Provide proper wash temperature.,270   HUNTINGTON  AV,BOSTON,MA,02125,,
Qdoba Mexican Eats No. 2207,,CHAIR 5 RESTAURANTS LLC,Qdoba Mexican Grill #,Attn: Restaurant Accounting,75515,01/05/2012 01:57:51 PM,12/31/2016 11:59:00 PM,Active,FT,Eating & Drinking w/ Take Out,HE_Fail,04/22/2011 10:00:19 AM,42-6-501.113/.114,*,Premises Maintained,04/22/2011 10:00:19 AM,Fail,,clean/organize basement,393   Huntington AV,Boston,MA,02115,157313,"(42.339776, -71.090882)"
Durgin Park Restaurant,,,Weinstein,Michael,24748,02/13/2012 11:17:17 AM,12/31/2016 11:59:00 PM,Active,FS,Eating & Drinking,HE_Fail,08/13/2014 12:10:17 PM,41-7-201/04.11,***,Separation/Sanitizer Criteria,08/13/2014 12:10:17 PM,Fail,,chlorine not registering @ 2 nd floor low temp. machine   repair,300  Faneuil Hall Marketplace,Boston,MA,02109,341035,"(42.360036, -71.056253)"
PHO 2000,,SCHIAVO BRUNO A TS,Dung Ngu,,76202,04/06/2012 12:14:16 PM,12/31/2016 11:59:00 PM,Active,FS,Eating & Drinking,HE_Pass,03/06/2013 01:24:07 PM,36-6-501.11-.12,*,Improper Maintenance of Floors,03/06/2013 01:24:07 PM,Pass,2013-03-06 15:43:00,Floors behinds cooking equipment soiled with grease and food. Clean,198   Adams ST,Dorchester,MA,02122,606,"(42.30224, -71.06)"
Prime Shoppe,,,Touarsi,Benemar,28544,02/08/2012 04:33:52 PM,12/31/2016 11:59:00 PM,Active,FT,Eating & Drinking w/ Take Out,HE_Fail,03/03/2014 11:40:41 AM,29-5-201/02.11,*,Installed and Maintained,03/03/2014 11:40:41 AM,Fail,,faucet leaking and handles broken  repair,104-112   Faneuil Hall Mkt,Boston,Ma,02109,,
Grille 705,,SEVEN-05 MASSACHUSETTS AVE,Antreassian,Sarkis,28817,01/31/2012 10:52:38 AM,12/31/2016 11:59:00 PM,Active,FT,Eating & Drinking w/ Take Out,HE_Pass,06/04/2009 11:59:27 AM,08-3-305-307.11,*,Food Protection,06/05/2009 08:27:18 AM,Pass,2009-06-05 08:27:18,provide covered/sealed container for croutons,705    Massachusetts AV,BOSTON,MA,02118,,
Chestnut Park at Cleveland Circle,,ET SUB CLEVELAND CIRCLE LLC,B-X Brighton L L C,,75173,01/19/2012 05:34:28 PM,12/31/2016 11:59:00 PM,Active,FS,Eating & Drinking,HE_Fail,09/30/2014 11:24:44 AM,03-3-501.16(A),***,Cold Holding,09/30/2014 11:24:44 AM,Fail,,The refrigerator on the third floor is reading 50F and two contaniers of milk are 46F and 47F.  Provide proper cold holding of 41F or below.,50   Sutherland RD,Brighton,MA,02135,133016,"(42.33799, -71.14993)"
CANTON HOUSE,,,LI TING LI PRESIDENT,,23526,02/01/2012 03:06:08 PM,12/31/2016 11:59:00 PM,Active,FT,Eating & Drinking w/ Take Out,HE_Fail,03/04/2010 01:47:36 PM,12-2-401.11-.12,***,Good Hygienic Practices,03/04/2010 01:47:36 PM,Fail,,Evidence of employee smoking in kitchen. Discontinue.,6  Hancock St,Dorchester,MA,02125,158300,"(42.315595, -71.065919)"
PERKIN'S SQ DELI,,ONE 06 DORCHESTER ST LLC,FALLON,JAMES,18439,12/19/2011 10:37:47 AM,12/31/2016 11:59:00 PM,Active,FT,Eating & Drinking w/ Take Out,HE_Pass,05/07/2015 12:25:19 PM,37-6-201.11,*,Walls/Ceilings Designed Constructed Installed,05/07/2015 12:25:19 PM,Pass,2015-05-08 08:43:51,clean walls opposite of the ice machine. RAemove buildup and keep walls clean at all times.,106   Dorchester ST,South Boston,MA,02127,48839,"(42.3352, -71.04583)"
Nicholas Sub & Pizza Shop,,NICHOLAS MARKOPOULOS,Kourtelidis,Nicholas,33364,01/17/2012 03:37:47 PM,12/31/2016 11:59:00 PM,Active,FT,Eating & Drinking w/ Take Out,HE_Hearing,05/31/2012 11:44:19 AM,16-4-501.11/.15,*,Dishwashng Facilities,05/31/2012 11:44:19 AM,Fail,,Ware washing sink missing dividers  repair or replace.,600   Hyde Park AV,Roslindale,MA,02131,156517,"(42.280027, -71.118658)"
PATS PIZZA,,LOWER MILLS RESTAURANT,LOWER MILLS RESTAURANT,GROUP LLC,24124,12/19/2011 11:01:23 AM,12/31/2016 11:59:00 PM,Active,FT,Eating & Drinking w/ Take Out,HE_Fail,04/27/2015 11:26:47 AM,37-6-501.11-.12,*,Improper Maintenance of Walls/Ceilings,04/27/2015 11:26:47 AM,Fail,,Small portion of ceiling in the basement area near the 3 bay sink appears to have some type of water damage. Make all of the necessary repairs.,2254   Dorchester AV,Dorchester,MA,02124,156905,"(42.273506, -71.067541)"
J J Foley's Cafe,,FOLEY JEREMIAH,J J Foley's Cafe,Inc.,27092,01/31/2012 06:21:48 PM,12/31/2016 11:59:00 PM,Active,FS,Eating & Drinking,HE_Fail,12/31/2009 12:48:15 PM,22-4-601/602.11,**,Food Contact Surfaces Clean,12/31/2009 12:48:15 PM,Fail,,,117   EAST BERKELEY,BOSTON,MA,02118,,
The Upper Crust,,PESIRIDIS THEODORE TRST,Shenefield,Shawn,90116,03/25/2013 02:37:01 PM,12/31/2016 11:59:00 PM,Active,FT,Eating & Drinking w/ Take Out,HE_Fail,03/28/2014 12:21:08 PM,35-6-501.111/.115,**,Insects  Rodents  Animals,03/28/2014 12:21:08 PM,Fail,,dry goods room/remove evidence of rodent droppings from floor,683   Tremont ST,Roxbury,MA,02118,137919,"(42.34156, -71.07662)"
Deli One,,,San Ko Inc.,,29195,01/05/2012 02:41:34 PM,12/31/2016 11:59:00 PM,Active,FT,Eating & Drinking w/ Take Out,HE_Pass,07/26/2010 02:01:32 PM,12-2-301.12-.15,***,Adequate Handwashing/Where/When/How,07/26/2010 02:01:32 PM,Pass,2010-07-27 08:16:20,Multiple staff observed wiping hands on aprons and equipment stored in handsink(?),85   ARCH ST ST,BOSTON,MA,02110,,
CANTON HOUSE,,,LI TING LI PRESIDENT,,23526,02/01/2012 03:06:08 PM,12/31/2016 11:59:00 PM,Active,FT,Eating & Drinking w/ Take Out,HE_Fail,03/06/2009 01:41:18 PM,31-5-204/05.11,***,Location  Accessible,03/09/2009 08:08:30 AM,Fail,,Hand sink being blocked by card board egg crates. Discontinue and ensure hand sink is accessible.,6  Hancock St,Dorchester,MA,02125,158300,"(42.315595, -71.065919)"
Grille 705,,SEVEN-05 MASSACHUSETTS AVE,Antreassian,Sarkis,28817,01/31/2012 10:52:38 AM,12/31/2016 11:59:00 PM,Active,FT,Eating & Drinking w/ Take Out,HE_Fail,12/08/2010 01:44:11 PM,22-4-601/602.11,**,Food Contact Surfaces Clean,12/08/2010 01:44:11 PM,Fail,,Cutting boards at front service station visibly soiled and scoared. Clean to remove.,705    Massachusetts AV,BOSTON,MA,02118,,
FLOUR BAKERY & CAFE,,,JOANNE CHANG,,21518,01/26/2012 03:07:20 PM,12/31/2016 11:59:00 PM,Active,FT,Eating & Drinking w/ Take Out,HE_Filed,06/11/2013 11:37:57 AM,21-3-304.14,*,Wiping Cloths  Clean  Sanitize,06/11/2013 11:37:57 AM,Pass,2013-06-11 15:15:04,properly store all wiping cloths in a sanitizing solution,1595   Washington ST,Roxbury,MA,02114,157458,"(42.338323, -71.07488)"
J J Foley's Cafe,,FOLEY JEREMIAH,J J Foley's Cafe,Inc.,27092,01/31/2012 06:21:48 PM,12/31/2016 11:59:00 PM,Active,FS,Eating & Drinking,HE_Fail,01/12/2009 01:45:58 PM,10-3-304.12,*,Food Utensil Storage,01/13/2009 08:42:11 AM,Fail,,Properly store all scoops.,117   EAST BERKELEY,BOSTON,MA,02118,,
PATS PIZZA,,LOWER MILLS RESTAURANT,LOWER MILLS RESTAURANT,GROUP LLC,24124,12/19/2011 11:01:23 AM,12/31/2016 11:59:00 PM,Active,FT,Eating & Drinking w/ Take Out,HE_Fail,03/11/2008 01:27:41 PM,08-3-305-307.11,*,Food Protection,03/12/2008 08:10:19 AM,Fail,,REMOVE FOOD FROM FREEZER FLOOR,2254   Dorchester AV,Dorchester,MA,02124,156905,"(42.273506, -71.067541)"
CANTON HOUSE,,,LI TING LI PRESIDENT,,23526,02/01/2012 03:06:08 PM,12/31/2016 11:59:00 PM,Active,FT,Eating & Drinking w/ Take Out,HE_Pass,05/20/2014 03:03:51 PM,24-4-904.11AB,*,Improper Storage of Re-usable Utensils,05/20/2014 03:03:51 PM,Pass,2014-05-21 09:50:37,"Wok stored on floor  elevate 6 to ""8 higher.",6  Hancock St,Dorchester,MA,02125,158300,"(42.315595, -71.065919)"
BUKHARA INDIAN BISTRO,,BRUCE THERESA,AMRIK SINGH PABLA,,21016,01/12/2012 03:33:18 PM,12/31/2016 11:59:00 PM,Active,FS,Eating & Drinking,HE_Fail,11/02/2012 11:21:40 AM,37-6-501.11-.12,*,Improper Maintenance of Walls/Ceilings,11/02/2012 11:21:40 AM,Fail,,BASEMENT KITCHEN  the hood over stoves does not have a HOOD / VENT  cleaning service tag-	PROVIDE  hood / vent cleaning service- from  a city of boston fire dept approved service company- list given by inspector-,701   Centre ST,Jamaica Plain,MA,02130,28172,"(42.31159, -71.11461)"
BUKHARA INDIAN BISTRO,,BRUCE THERESA,AMRIK SINGH PABLA,,21016,01/12/2012 03:33:18 PM,12/31/2016 11:59:00 PM,Active,FS,Eating & Drinking,HE_Fail,11/19/2013 11:49:43 AM,15-4-202.16,*,Non-Food Contact Surfaces,11/19/2013 11:49:43 AM,Fail,,Resurface rusted shelvi ng under all prep tables in the kitchen Replace worn wooden shelf being used to line the shelving for clean pots and pans,701   Centre ST,Jamaica Plain,MA,02130,28172,"(42.31159, -71.11461)"
Uno Due Go,,DRUKER BERTRAM A TRSTS,URC L L C,,74800,12/30/2011 01:59:52 PM,12/31/2016 11:59:00 PM,Active,FS,Eating & Drinking,HE_Pass,06/12/2013 10:35:06 AM,04-3-501.15/4-301.11,*,Inadequate Facilities/Cooling Methods,06/12/2013 10:35:06 AM,Pass,2013-06-13 08:45:47,The quinoa salad and fruit salads are cooling in the grab and go refrigerator.  Provide proper cooling methods to ensure that items are cooled from 140F to 70F in two hours and then from 70F to 41F in an additional four hours.,52   Summer ST,Boston,MA,02110,132025,"(42.35445, -71.05881)"
Uno Chicago Grill,,NICOLE E. ADAMS,NICOLE E. ADAMS,,19118,01/09/2012 03:55:20 PM,12/31/2016 11:59:00 PM,Active,FT,Eating & Drinking w/ Take Out,HE_Fail,06/19/2015 02:12:59 PM,23-4-602.13,*,Non-Food Contact Surfaces Clean,06/19/2015 02:12:59 PM,Fail,,Multiple areas including faucets  exteriors of paper towel dispensers and soap dispensers with heavy soil buildup. Exteriors and interiors of refrigerators with built up food soils- Clean with proper frequency.,270   HUNTINGTON  AV,BOSTON,MA,02125,,
Durgin Park Restaurant,,,Weinstein,Michael,24748,02/13/2012 11:17:17 AM,12/31/2016 11:59:00 PM,Active,FS,Eating & Drinking,HE_Fail,04/09/2013 10:43:32 AM,15-4-202.16,*,Non-Food Contact Surfaces,04/09/2013 10:43:32 AM,Fail,,Exposed wood on shelving.,300  Faneuil Hall Marketplace,Boston,MA,02109,341035,"(42.360036, -71.056253)"
No.  7 RESTAURANT,,,HUANG FAMILY INC.,REN XIANGHUANG  PRES.,25414,02/08/2012 04:32:36 PM,12/31/2016 11:59:00 PM,Active,FT,Eating & Drinking w/ Take Out,HE_Fail,01/10/2013 02:26:41 PM,40-6-305.11,*,Dressing Rooms Clean/Lockers Provided,01/10/2013 02:26:41 PM,Fail,,,225   Grove ST,West Roxbury,MA,02132,156965,"(42.261873, -71.15741)"
Durgin Park Restaurant,,,Weinstein,Michael,24748,02/13/2012 11:17:17 AM,12/31/2016 11:59:00 PM,Active,FS,Eating & Drinking,HE_Fail,12/11/2012 10:12:46 AM,15-4-202.16,*,Non-Food Contact Surfaces,12/11/2012 10:12:46 AM,Fail,,Resurface wooden shelving,300  Faneuil Hall Marketplace,Boston,MA,02109,341035,"(42.360036, -71.056253)"
EQUATOR RESTAURANT,,HOOPER FRANK III,SARAH PLABUTONG,,23186,12/16/2011 10:19:57 AM,12/31/2016 11:59:00 PM,Active,FS,Eating & Drinking,HE_FailExt,06/12/2014 02:28:58 PM,15-4-202.16,*,Non-Food Contact Surfaces,06/12/2014 02:28:58 PM,Fail,,repair all defective doorgaskets as needed...,1721   Washington ST,Roxbury,MA,02118,144411,"(42.337071, -71.076601)"
The Kitchen,,POCKEL JEANNE C TRSTS,Herritt,Scott,79722,06/13/2012 10:16:32 AM,12/31/2016 11:59:00 PM,Active,FS,Eating & Drinking,HE_Fail,03/19/2014 10:57:45 AM,M-3-603.11,***,Consumer Advisories,03/19/2014 10:57:45 AM,Fail,,Consumer advisory missing disclosure regarding Raw Animals Product and missing (*)  asterisk denoting raw animal product.,560   Tremont ST,Roxbury,MA,02118,137658,"(42.34363, -71.07176)"
J J Foley's Cafe,,FOLEY JEREMIAH,J J Foley's Cafe,Inc.,27092,01/31/2012 06:21:48 PM,12/31/2016 11:59:00 PM,Active,FS,Eating & Drinking,HE_Filed,03/15/2013 12:38:11 PM,36-6-501.11-.12,*,Improper Maintenance of Floors,03/15/2013 12:38:11 PM,Fail,,Clean the basin of the mop sink.,117   EAST BERKELEY,BOSTON,MA,02118,,
West Napoli Pizza,,VRATTOS SOCRATES TS,BARDHI,SOKOL,21409,06/06/2012 03:38:02 PM,12/31/2016 11:59:00 PM,Active,FT,Eating & Drinking w/ Take Out,HE_Filed,05/11/2015 01:29:58 PM,13-2-304/402.11,*,Clean Cloths  Hair Restraint,05/11/2015 01:29:58 PM,Fail,,Provide hair restraints for staff working with food.,1946  Centre St,West Roxbury,MA,02132,27764,"(42.28358, -71.15676)"
CANTON HOUSE,,,LI TING LI PRESIDENT,,23526,02/01/2012 03:06:08 PM,12/31/2016 11:59:00 PM,Active,FT,Eating & Drinking w/ Take Out,HE_Fail,06/26/2008 01:48:37 PM,08-3-305-307.11,*,Food Protection,06/27/2008 08:18:39 AM,Fail,,Raw onion's stored on ground in kitchen preparation area. Store elevated at least 6 inches off the ground. Broccoli and chicken stored on ground of cooler in basement. Store elevated at least 6 inches off the ground.,6  Hancock St,Dorchester,MA,02125,158300,"(42.315595, -71.065919)"
Dunkin' Donuts,,BARRY ASSOCS INC,JOSE S. COUTO,,19736,02/13/2012 10:14:41 AM,12/31/2016 11:59:00 PM,Active,FT,Eating & Drinking w/ Take Out,HE_Hearing,11/02/2015 02:27:45 PM,15-4-202.16,*,Non-Food Contact Surfaces,11/02/2015 02:27:45 PM,Fail,,Repair divider at hand sink next to prep table.,7   Walk Hill ST,Jamaica Plain,MA,02130,141731,"(42.29556, -71.1161)"
Burger King,,,MASTORAN CORP.,,19935,12/16/2011 09:50:24 AM,12/31/2016 11:59:00 PM,Active,FT,Eating & Drinking w/ Take Out,HE_Pass,06/20/2012 02:07:55 PM,21-3-304.14,*,Wiping Cloths  Clean  Sanitize,06/20/2012 02:07:55 PM,Pass,2012-06-20 15:20:38,provide proper storage of wiping cloths. Keep in a sanitizing solution when not in use.,944   Bennington ST,East Boston,MA,02128,155885,"(42.386166, -71.00953)"
EQUATOR RESTAURANT,,HOOPER FRANK III,SARAH PLABUTONG,,23186,12/16/2011 10:19:57 AM,12/31/2016 11:59:00 PM,Active,FS,Eating & Drinking,HE_Pass,05/18/2009 12:56:18 PM,15-4-202.16,*,Non-Food Contact Surfaces,05/18/2009 03:10:13 PM,Pass,2009-05-18 15:10:13,remove home tables/provide food service grade shelving for rice cooker,1721   Washington ST,Roxbury,MA,02118,144411,"(42.337071, -71.076601)"
CALIFORNIA PIZZA KITCHEN,,,CALIFORNIA PIZZA KITCHEN,INC. LIC.DIV.,19754,04/03/2012 01:47:18 PM,12/31/2016 11:59:00 PM,Active,FS,Eating & Drinking,HE_Filed,09/16/2013 11:34:44 AM,35-6-501.111/.115,**,Insects  Rodents  Animals,09/16/2013 11:34:44 AM,Pass,2013-09-16 15:20:10,bar/remove evidence of fruit flies dry goods room/soda storage and trash room/remove evidence of rodent droppings from gray tray dining room/remove evidence of rodent droppings from under seat cushions,800   Boylston ST,Boston,MA,02199,194357,"(42.34716, -71.08251)"
UNION OYSTER HOUSE,,MILANO JOSEPH A JR TRST,MILANO,JOSEPH A.,19089,12/14/2011 02:11:17 PM,12/31/2016 11:59:00 PM,Active,FS,Eating & Drinking,HE_Pass,05/07/2012 10:08:31 AM,23-4-602.13,*,Non-Food Contact Surfaces Clean,05/07/2012 10:08:31 AM,Pass,2012-05-08 07:23:26,1st floor kitchen -Clean underside of shelving over prep tables.,41  Union St,Boston,MA,02108,139293,"(42.36127, -71.05688)"
Dunkin Donuts,,ONE HUNDRED CAMBRIDGE STREET,DN Donuts Inc.,Danny Haddad,26507,01/11/2012 11:22:31 AM,12/31/2016 11:59:00 PM,Active,FT,Eating & Drinking w/ Take Out,HE_Filed,02/25/2013 12:08:26 PM,37-6-501.11-.12,*,Improper Maintenance of Walls/Ceilings,02/25/2013 12:08:26 PM,Fail,,Clean light shields,100   Cambridge ST,Boston,MA,02114,25222,"(42.360584, -71.062109)"
Nutter  McClennen & Fish LLP,,SODEXHO OPERATIONS  LLC,Flik International Corp,Compass Group,27665,01/18/2012 06:00:22 PM,12/31/2016 11:59:00 PM,Active,FS,Eating & Drinking,HE_Filed,10/16/2007 12:05:14 PM,37-6-501.11-.12,*,Improper Maintenance of Walls/Ceilings,10/16/2007 02:30:52 PM,Pass,2007-10-16 14:30:52,replace loose ceiling tile replace all stained ceiling tiles,155   SEAPORT LA,BOSTON,MA,02110,,
Durgin Park Restaurant,,,Weinstein,Michael,24748,02/13/2012 11:17:17 AM,12/31/2016 11:59:00 PM,Active,FS,Eating & Drinking,HE_Hearing,12/18/2012 11:47:43 AM,37-6-501.11-.12,*,Improper Maintenance of Walls/Ceilings,12/18/2012 11:47:43 AM,Fail,,Repair walls and stall wall,300  Faneuil Hall Marketplace,Boston,MA,02109,341035,"(42.360036, -71.056253)"
UNION OYSTER HOUSE,,MILANO JOSEPH A JR TRST,MILANO,JOSEPH A.,19089,12/14/2011 02:11:17 PM,12/31/2016 11:59:00 PM,Active,FS,Eating & Drinking,HE_Fail,08/12/2015 11:31:19 AM,38-6-202.11,*,Fixture's not properly shielded,08/12/2015 11:31:19 AM,Fail,,Cover lights above rear bar on the first floor that are located near the ice machine Replace all light bulbs that are not -[ tough skin ] located above the grill area on the first floor [ kitchen area that cooks burgers - chicken tenders ],41  Union St,Boston,MA,02108,139293,"(42.36127, -71.05688)"
CANTON HOUSE,,,LI TING LI PRESIDENT,,23526,02/01/2012 03:06:08 PM,12/31/2016 11:59:00 PM,Active,FT,Eating & Drinking w/ Take Out,HE_FailExt,03/05/2010 02:18:08 PM,03-3-501.16(A),***,Cold Holding,03/05/2010 02:18:08 PM,Pass,2010-03-08 08:00:12,Raw chicken wings at 59F and  ribs 60F. Discontinue and ensure all foods are kept at 40F and below. PIC stated they been left out for around 45 min.  and placed them in a refrigeration unit to maintain a temperature of 40F and below.,6  Hancock St,Dorchester,MA,02125,158300,"(42.315595, -71.065919)"
WINDY CITY AT ADAMS VILLAGE,,BAYTURK MUZAFFER,BAYTURK MUZAFFER,,19800,02/13/2012 10:40:46 AM,12/31/2016 11:59:00 PM,Active,FT,Eating & Drinking w/ Take Out,HE_Filed,10/21/2011 11:25:32 AM,23-4-602.13,*,Non-Food Contact Surfaces Clean,10/21/2011 11:25:32 AM,Pass,2011-10-24 08:31:54,clean reachins..clean all shelving...clean all cooking equipment...cleanm all sinks...,516   Gallivan BL,Dorchester,MA,02124,156552,"(42.282928, -71.055559)"
CANTON HOUSE,,,LI TING LI PRESIDENT,,23526,02/01/2012 03:06:08 PM,12/31/2016 11:59:00 PM,Active,FT,Eating & Drinking w/ Take Out,HE_FailExt,07/01/2008 12:10:03 PM,23-4-602.13,*,Non-Food Contact Surfaces Clean,07/01/2008 03:37:36 PM,Pass,2008-07-01 15:37:36,Interior of South Bend grill with heavy grease build-up. Clean to remove.  Interior of coffin style freezer with frost build. Defrost to  remove. Exterior of meat grinder heavily soiled. Clean to remove. Exteriors of rice  sauce and other food containers in kitchen area heavily soiled. Clean to remove. Shelf under meat slicer heavily soiled. Clean to remove.,6  Hancock St,Dorchester,MA,02125,158300,"(42.315595, -71.065919)"
Durgin Park Restaurant,,,Weinstein,Michael,24748,02/13/2012 11:17:17 AM,12/31/2016 11:59:00 PM,Active,FS,Eating & Drinking,HE_Pass,05/05/2011 11:48:25 AM,17-4-204.112/.115,*,Equipment Thermometers,05/05/2011 11:48:25 AM,Pass,2011-05-06 08:15:56,Provide thermometers for all refrigerators without one.,300  Faneuil Hall Marketplace,Boston,MA,02109,341035,"(42.360036, -71.056253)"
J J Foley's Cafe,,FOLEY JEREMIAH,J J Foley's Cafe,Inc.,27092,01/31/2012 06:21:48 PM,12/31/2016 11:59:00 PM,Active,FS,Eating & Drinking,HE_Filed,12/22/2014 11:39:20 AM,38-6-202.11,*,Fixture's not properly shielded,12/22/2014 11:39:20 AM,Pass,2014-12-22 15:32:02,kitchen/provide proper light shields,117   EAST BERKELEY,BOSTON,MA,02118,,
Durgin Park Restaurant,,,Weinstein,Michael,24748,02/13/2012 11:17:17 AM,12/31/2016 11:59:00 PM,Active,FS,Eating & Drinking,HE_Fail,12/30/2013 10:09:57 AM,37-6-501.11-.12,*,Improper Maintenance of Walls/Ceilings,12/30/2013 10:09:57 AM,Fail,,Clean ceiling  pipes and all attachments.,300  Faneuil Hall Marketplace,Boston,MA,02109,341035,"(42.360036, -71.056253)"
Finagle A Bagel,,,FINALGE A BAGEL,ATTN: Human Resources,20653,12/15/2011 10:47:55 AM,12/31/2016 11:59:00 PM,Active,FT,Eating & Drinking w/ Take Out,HE_Pass,10/14/2008 10:08:26 AM,17-4-302.14,*,Test Kit Provided,10/14/2008 03:20:29 PM,Pass,2008-10-14 15:20:29,Kitchen Provide test kit for sanitizer.,275   Cambridge ST,Boston,MA,02114,155973,"(42.361357, -71.068227)"
A K's Take Out & Delivery,,BOUKOUVALAS ATHENA TS,Saini,Jasbir,28531,12/20/2011 02:29:52 PM,12/31/2016 11:59:00 PM,Active,FT,Eating & Drinking w/ Take Out,HE_Fail,02/19/2009 10:46:57 AM,38-6-303.11,*,Inadequate Lighting,02/19/2009 03:32:37 PM,Fail,,soda storage/replace burnt out light,1427   Tremont ST,Mission Hill,MA,02120,136818,"(42.331858, -71.096333)"
SULLY'S PUB,,SULLIVAN JOHN,SULLIVAN,JOHN,18892,01/10/2012 12:05:50 PM,12/31/2016 11:59:00 PM,Active,FS,Eating & Drinking,HE_Pass,01/25/2008 12:05:33 PM,,,,,,,,85   Main ST,Charlestown,MA,02129,88685,"(42.373922, -71.062762)"
Cafeteria Y Pizzaria Mi Columbia,,,E.B. Crown Fried Chicken & Pizza Inc.,,124996,01/09/2014 01:41:04 PM,12/31/2016 11:59:00 PM,Active,FT,Eating & Drinking w/ Take Out,HE_Pass,12/23/2013 11:03:58 AM,,,,,,,,50   Maverick SQ,East Boston,MA,02128,92897,"(42.37017, -71.03868)"
Momogoose 4,,,Loc Vo,,76220,12/14/2011 02:53:20 PM,12/31/2016 11:59:00 PM,Active,MFW,Mobile Food Walk On,HE_Fail,10/22/2015 12:07:05 PM,M-2-103.11,***,PIC Performing Duties,10/22/2015 12:07:05 PM,Fail,,PIC not monitoring temperatures of food or equipment. PIC must monitor temperatures throughtout day to ensure  food safety,1   Citywide ST,Boston,MA,02128,0,
N.E. Deaconess Hospital Cafe,,BETH ISRAEL DEACONESS,SODEXO OPERATIONS L L C,,26029,02/15/2012 09:27:05 AM,12/31/2016 11:59:00 PM,Active,FS,Eating & Drinking,HE_Fail,11/07/2008 01:52:38 PM,03-3-501.16,***,Hot Holding,11/07/2008 03:49:13 PM,Fail,,Provide proper hot holding tempera tires to all PHF's. Cheeseburger - 122 F.,1    Deaconess RD,BOSTON,MA,02215,,
Finagle A Bagel,,,FINALGE A BAGEL,ATTN: Human Resources,20653,12/15/2011 10:47:55 AM,12/31/2016 11:59:00 PM,Active,FT,Eating & Drinking w/ Take Out,HE_Fail,12/27/2007 11:10:25 AM,21-3-304.14,*,Wiping Cloths  Clean  Sanitize,12/28/2007 08:48:13 AM,Fail,,serving line -wiping cloth hanging from sandwich refrig unit. Not using separate sanitizing solution for wiping cloths.  Provide separate wiping cloth brackets for Rand animal products  ready to eat foods & nonfood contacts. Using sponges to clean equipment.,275   Cambridge ST,Boston,MA,02114,155973,"(42.361357, -71.068227)"
West Napoli Pizza,,VRATTOS SOCRATES TS,BARDHI,SOKOL,21409,06/06/2012 03:38:02 PM,12/31/2016 11:59:00 PM,Active,FT,Eating & Drinking w/ Take Out,HE_Filed,09/04/2013 11:25:48 AM,23-4-602.13,*,Non-Food Contact Surfaces Clean,09/04/2013 11:25:48 AM,Pass,2013-09-05 08:43:17,clean all shelving throughout as needed...clean floor fan unit....defrost all freezer units..,1946  Centre St,West Roxbury,MA,02132,27764,"(42.28358, -71.15676)"
Anshur Restauruant,,REARDON THOMAS B,Anshur,Abdullah F.,31241,02/08/2012 03:13:24 PM,12/31/2016 11:59:00 PM,Active,FT,Eating & Drinking w/ Take Out,HE_Fail,03/31/2014 11:54:33 AM,22-4-601/602.11,**,Food Contact Surfaces Clean,03/31/2014 11:54:33 AM,Fail,,clean and sanitize all encrusted pots and pans....,291   Roxbury ST,Roxbury,MA,02119,119179,"(42.33041, -71.0943)"
CANTON HOUSE,,,LI TING LI PRESIDENT,,23526,02/01/2012 03:06:08 PM,12/31/2016 11:59:00 PM,Active,FT,Eating & Drinking w/ Take Out,HE_Fail,07/25/2011 02:34:27 PM,37-6-501.11-.12,*,Improper Maintenance of Walls/Ceilings,07/25/2011 02:34:27 PM,Fail,,Ceiling above meat slicer and preparation table peeling. Address.,6  Hancock St,Dorchester,MA,02125,158300,"(42.315595, -71.065919)"
Erie Pub,,STENSON JOHN P TS,IRISH PUB INC,,18026,12/19/2011 11:29:24 AM,12/31/2016 11:59:00 PM,Active,FS,Eating & Drinking,HE_Fail,04/07/2014 11:03:02 AM,03-3-501.16(A),***,Cold Holding,04/07/2014 11:03:02 AM,Fail,,Sliced deli meats and cheese inside of the small deli cooler in the main kitchen area with slightly elevated temperatures of around 50F. All foods were removed at the time of the inspection. Ensure all potentially hazardous foods are maintained at below 41F.,791   Adams ST,Dorchester,MA,02124,975,"(42.28316, -71.05602)"
Double Tree Club Hotel,,BOSTON REDEVELOPMENT AUTH,C.J. WASHINGTON STREET L.L.C.,,21472,03/09/2012 11:17:16 AM,12/31/2016 11:59:00 PM,Active,FS,Eating & Drinking,HE_Pass,05/12/2015 10:47:43 AM,35-6-501.111/.115,**,Insects  Rodents  Animals,05/12/2015 10:47:43 AM,Pass,2015-05-13 08:05:07,Evidence of flies around floor drain Provide treatment by licensed exterminator and report.,821    Washington ST,BOSTON,MA,02116,,
Durgin Park Restaurant,,,Weinstein,Michael,24748,02/13/2012 11:17:17 AM,12/31/2016 11:59:00 PM,Active,FS,Eating & Drinking,HE_Fail,08/31/2011 12:55:29 PM,17-4-302.14,*,Test Kit Provided,08/31/2011 12:55:29 PM,Fail,,Provide accurate test kit for dish machine. High temp or low temp machines?,300  Faneuil Hall Marketplace,Boston,MA,02109,341035,"(42.360036, -71.056253)"
ZESTO'S PIZZA,,FOUR 60-468 CENTRE STREET,K & M Pizza Inc.,,75590,12/12/2011 12:47:41 PM,12/31/2016 11:59:00 PM,Active,FT,Eating & Drinking w/ Take Out,HE_Pass,12/01/2011 10:33:38 AM,21-3-304.14,*,Wiping Cloths  Clean  Sanitize,12/01/2011 10:33:38 AM,Pass,2011-12-01 15:42:41,,460   Centre ST,Jamaica Plain,MA,02130,28061,"(42.31935, -71.11154)"
FLOUR BAKERY & CAFE,,,JOANNE CHANG,,21518,01/26/2012 03:07:20 PM,12/31/2016 11:59:00 PM,Active,FT,Eating & Drinking w/ Take Out,HE_Filed,05/23/2008 12:07:07 PM,20-4-703.11,***,Food Contact Surfaces Clean,05/27/2008 08:18:11 AM,Pass,2008-05-27 08:18:11,3 bay/provide sanitizer strength at 200ppm/tested at 100 ppm,1595   Washington ST,Roxbury,MA,02114,157458,"(42.338323, -71.07488)"
Aramark at Houghton Mifflin,,TWO TWENTY TWO BERKELEY,ARAMARK,C/O JARED LESSARD,24693,02/15/2012 01:55:00 PM,12/31/2016 11:59:00 PM,Active,FS,Eating & Drinking,HE_Fail,09/14/2015 11:01:09 AM,22-4-601/602.11,**,Food Contact Surfaces Clean,09/14/2015 11:01:09 AM,Fail,,ice machine/clean interior white panel and can opener blade,222   Berkeley ST,Boston,MA,02116,15007,"(42.35084, -71.07311)"
Langham Hotel,,CHRISTINE GILPIN  CONTROL LER,CHRISTINE GILPIN CONTROL,LER,23003,01/11/2012 08:50:36 AM,12/31/2016 11:59:00 PM,Active,FS,Eating & Drinking,HE_Fail,01/05/2012 02:26:45 PM,15-4-202.16,*,Non-Food Contact Surfaces,01/05/2012 02:26:45 PM,Fail,,Items inn freezers and dry storage are stored on milk crates.  Provide cleanable  food grade shelving. The handle to the walk-in is broken and there is tape covering the area.  Provide a new handle that is smooth  cleanable and durable. There is an unpainted wood block holding up one of the shelves in the freezer.  Ensure that all surfaces are smooth  cleanable  and durable.,250   Franklin ST,Boston,MA,02110,157806,"(42.35663, -71.054279)"
The Corner Tavern,,BACON DOUGLAS F TS,DOUGLAS BACON PRES.,,19829,12/15/2011 11:23:57 AM,12/31/2016 11:59:00 PM,Active,FS,Eating & Drinking,HE_Fail,06/02/2015 12:30:08 PM,20-4-703.11,***,Food Contact Surfaces Clean,06/02/2015 12:30:08 PM,Fail,,Interior of ice machine soiled rusty mold like substance.Maintain clean and sanitized.,421   Marlborough ST,Boston,MA,02115,91385,"(42.35014, -71.08944)"
Doughboy Donuts & Deli,,POWERS JAMES R TRST,Doughboy Corp.,,85000,12/05/2012 08:56:12 AM,12/31/2016 11:59:00 PM,Active,FT,Eating & Drinking w/ Take Out,HE_Fail,06/11/2014 12:30:23 PM,36-6-201.11,*,Floors Designed Constructed Installed,06/11/2014 12:30:23 PM,Fail,,keep all supplies at least 6 inches off the floor,220   Dorchester AV,South Boston,MA,02127,48549,"(42.34012, -71.05676)"
Qdoba Mexican Eats No. 2207,,CHAIR 5 RESTAURANTS LLC,Qdoba Mexican Grill #,Attn: Restaurant Accounting,75515,01/05/2012 01:57:51 PM,12/31/2016 11:59:00 PM,Active,FT,Eating & Drinking w/ Take Out,HE_Fail,09/30/2011 11:01:05 AM,36-6-501.11-.12,*,Improper Maintenance of Floors,09/30/2011 11:01:05 AM,Fail,,repair ramp in walk in to remove water build up under floor,393   Huntington AV,Boston,MA,02115,157313,"(42.339776, -71.090882)"
The Upper Crust,,PESIRIDIS THEODORE TRST,Shenefield,Shawn,90116,03/25/2013 02:37:01 PM,12/31/2016 11:59:00 PM,Active,FT,Eating & Drinking w/ Take Out,HE_Filed,01/30/2015 01:43:24 PM,22-4-601/602.11,**,Food Contact Surfaces Clean,01/30/2015 01:43:24 PM,Pass,2015-02-02 08:31:46,clean/sanitize pizza slicer and pizza paddles clean/sanitize knife in knive rack,683   Tremont ST,Roxbury,MA,02118,137919,"(42.34156, -71.07662)"
Nicholas Sub & Pizza Shop,,NICHOLAS MARKOPOULOS,Kourtelidis,Nicholas,33364,01/17/2012 03:37:47 PM,12/31/2016 11:59:00 PM,Active,FT,Eating & Drinking w/ Take Out,HE_Fail,10/05/2010 01:13:32 PM,36-6-501.11-.12,*,Improper Maintenance of Floors,10/05/2010 01:13:32 PM,Fail,,CLEAN  the kitchen floor of built-up grime-,600   Hyde Park AV,Roslindale,MA,02131,156517,"(42.280027, -71.118658)"
WINDY CITY AT ADAMS VILLAGE,,BAYTURK MUZAFFER,BAYTURK MUZAFFER,,19800,02/13/2012 10:40:46 AM,12/31/2016 11:59:00 PM,Active,FT,Eating & Drinking w/ Take Out,HE_Filed,10/21/2011 11:25:32 AM,M-3-603.11,***,Consumer Advisories,10/21/2011 11:25:32 AM,Pass,2011-10-24 08:31:54,provide for menu and menu board...,516   Gallivan BL,Dorchester,MA,02124,156552,"(42.282928, -71.055559)"
Durgin Park Restaurant,,,Weinstein,Michael,24748,02/13/2012 11:17:17 AM,12/31/2016 11:59:00 PM,Active,FS,Eating & Drinking,HE_Hearing,12/18/2012 11:47:43 AM,42-6-501.113/.114,*,Premises Maintained,12/18/2012 11:47:43 AM,Fail,,Remove broken & unused equipment,300  Faneuil Hall Marketplace,Boston,MA,02109,341035,"(42.360036, -71.056253)"
MCKENNA'S CAFE,,KENNETH OSHEROW  PRES.,KENNETH OSHEROW PRES.,,23628,12/28/2011 09:11:33 AM,12/31/2016 11:59:00 PM,Active,FS,Eating & Drinking,HE_Fail,03/11/2013 11:15:15 AM,20-4-703.11,***,Food Contact Surfaces Clean,03/11/2013 11:15:15 AM,Fail,,Warewashing machine not at the proper PPM for chlorine sanitizer. PIC stated that we will discontinue using and use single service articles untill repaired.,109   Savin Hill AV,Dorchester,MA,02125,156864,"(42.311515, -71.05382)"
Burger King,,,MASTORAN CORP.,,19935,12/16/2011 09:50:24 AM,12/31/2016 11:59:00 PM,Active,FT,Eating & Drinking w/ Take Out,HE_Filed,08/01/2007 02:18:44 PM,36-6-501.11-.12,*,Improper Maintenance of Floors,08/01/2007 02:30:38 PM,Fail,,,944   Bennington ST,East Boston,MA,02128,155885,"(42.386166, -71.00953)"
Langham Hotel,,CHRISTINE GILPIN  CONTROL LER,CHRISTINE GILPIN CONTROL,LER,23003,01/11/2012 08:50:36 AM,12/31/2016 11:59:00 PM,Active,FS,Eating & Drinking,HE_Fail,01/06/2010 12:06:41 PM,08-3-305-307.11,*,Food Protection,01/06/2010 12:06:41 PM,Fail,,Food exposed in Employee Cafe. Provide protection.,250   Franklin ST,Boston,MA,02110,157806,"(42.35663, -71.054279)"
PATS PIZZA,,LOWER MILLS RESTAURANT,LOWER MILLS RESTAURANT,GROUP LLC,24124,12/19/2011 11:01:23 AM,12/31/2016 11:59:00 PM,Active,FT,Eating & Drinking w/ Take Out,HE_Filed,11/02/2011 11:35:50 AM,15-4-202.16,*,Non-Food Contact Surfaces,11/02/2011 11:35:50 AM,Pass,2011-11-03 09:01:40,replace defective doorgaskets...reseal all rusty interiors of all reachins..provide elevated shelving as needed...,2254   Dorchester AV,Dorchester,MA,02124,156905,"(42.273506, -71.067541)"
A K's Take Out & Delivery,,BOUKOUVALAS ATHENA TS,Saini,Jasbir,28531,12/20/2011 02:29:52 PM,12/31/2016 11:59:00 PM,Active,FT,Eating & Drinking w/ Take Out,HE_Pass,11/13/2012 11:54:01 AM,06-3-501.13,*,PHF's Properly Thawed,11/13/2012 11:54:01 AM,Pass,2012-11-13 15:19:17,properly defrost all frozen shrimp under refrigeration  not stagnate water,1427   Tremont ST,Mission Hill,MA,02120,136818,"(42.331858, -71.096333)"
Yamato II,,,Jiang,Ming,137896,06/30/2015 08:46:46 AM,12/31/2016 11:59:00 PM,Active,FS,Eating & Drinking,HE_Fail,08/12/2015 02:45:43 PM,14-4-202.11,*,Food Contact Surfaces Design,08/12/2015 02:45:43 PM,Fail,,Plastic cup being used to dispense bulk food items. Use handled utensils/scoop only.,545  Boylston St,Boston,MA,02116,193086,"(42.35081, -71.07581)"
DUNKIN' DONUTS (LEGION DONUTS),,JOSE S. COUTO,JOSE S. COUTO,,21027,02/13/2012 10:11:05 AM,12/31/2016 11:59:00 PM,Active,FT,Eating & Drinking w/ Take Out,HE_Pass,10/27/2014 11:49:27 AM,35-6-501.111/.115,**,Insects  Rodents  Animals,10/27/2014 11:49:27 AM,Pass,2014-10-27 15:38:10,Fruit flies in back prep and ware washing area. Address with pest control company.,684   American Legion HW,Roslindale,MA,02131,156647,"(42.283596, -71.112514)"
The Upper Crust,,PESIRIDIS THEODORE TRST,Shenefield,Shawn,90116,03/25/2013 02:37:01 PM,12/31/2016 11:59:00 PM,Active,FT,Eating & Drinking w/ Take Out,HE_Pass,03/22/2013 10:07:52 AM,29-5-201/02.11,*,Installed and Maintained,03/22/2013 10:07:52 AM,Pass,2013-03-25 07:23:31,hot water faucet not shutting off  repair,683   Tremont ST,Roxbury,MA,02118,137919,"(42.34156, -71.07662)"
No.  7 RESTAURANT,,,HUANG FAMILY INC.,REN XIANGHUANG  PRES.,25414,02/08/2012 04:32:36 PM,12/31/2016 11:59:00 PM,Active,FT,Eating & Drinking w/ Take Out,HE_Fail,01/10/2013 02:26:41 PM,21-3-304.14,*,Wiping Cloths  Clean  Sanitize,01/10/2013 02:26:41 PM,Fail,,properly store all wiping cloths...,225   Grove ST,West Roxbury,MA,02132,156965,"(42.261873, -71.15741)"
CANTON HOUSE,,,LI TING LI PRESIDENT,,23526,02/01/2012 03:06:08 PM,12/31/2016 11:59:00 PM,Active,FT,Eating & Drinking w/ Take Out,HE_FailExt,08/17/2009 02:08:06 PM,38-6-202.11,*,Fixture's not properly shielded,08/18/2009 08:40:38 AM,Pass,2009-08-18 08:40:38,Light inside upright freezer not properly shielded. Provide.,6  Hancock St,Dorchester,MA,02125,158300,"(42.315595, -71.065919)"
A K's Take Out & Delivery,,BOUKOUVALAS ATHENA TS,Saini,Jasbir,28531,12/20/2011 02:29:52 PM,12/31/2016 11:59:00 PM,Active,FT,Eating & Drinking w/ Take Out,HE_Filed,03/13/2008 09:10:37 AM,16-4-501.11/.15,*,Dishwashng Facilities,03/13/2008 03:33:50 PM,Pass,2008-03-13 15:33:50,properly label wash bay and provide 3 drain plugs,1427   Tremont ST,Mission Hill,MA,02120,136818,"(42.331858, -71.096333)"
Panera Bread,,,Boston Bread LLc,Attn: Lori Engel,26330,01/18/2012 04:43:59 PM,12/31/2016 11:59:00 PM,Active,FS,Eating & Drinking,HE_Fail,09/09/2011 11:34:18 AM,35-6-501.111/.115,**,Insects  Rodents  Animals,09/09/2011 11:34:18 AM,Fail,,Evidence of fruit/drain fly type insects throughout facility.Insufficient vector controls in place(Nothing upstairs).No IPM style reports to view at this time but Inspection highlighted establishment is very dirty(Walls equipment floors ledges etc.).Please deep clean all surface areas.Please clean out all floor drains(Drain covers need to be removed-cleaned with soap and water).Drains will need to be acessed from Extermination Co. on whether they need to be treated with an enzyme type treatment to break life cycle of pests.Provide adequate controls in place for adult population and as discussed tight food protection in place.,200   High ST,Boston,Ma,02110,,
N.E. Deaconess Hospital Cafe,,BETH ISRAEL DEACONESS,SODEXO OPERATIONS L L C,,26029,02/15/2012 09:27:05 AM,12/31/2016 11:59:00 PM,Active,FS,Eating & Drinking,HE_Fail,12/13/2012 01:09:09 PM,33-5-501.116,*,Improper Cleaning of Receptacles,12/13/2012 01:09:09 PM,Fail,,Properly clean interior and exterior of trash storage receptacles in salad bar area.,1    Deaconess RD,BOSTON,MA,02215,,
FENWAY PARK H.M.S. INC.,,JACK LYONS  MANAGER,FENWAY PARK H.M.S. INC.,,18275,10/27/2008 10:04:53 AM,12/31/2008 11:59:00 PM,Inactive,FT,Eating & Drinking w/ Take Out,HE_Filed,07/26/2008 04:36:11 PM,21-3-304.14,*,Wiping Cloths  Clean  Sanitize,07/28/2008 08:09:18 AM,Pass,2008-07-28 08:09:18,Cloth at Pavilion b3 lying over handsink.,4  Yawkey Wy,Boston,MA,02215,156417,"(42.346723, -71.09868)"
DAYIB CAFE,,ABDULLAH FARAH ANSHUR,ABDULLAH FARAH ANSHUR,,22700,02/13/2012 12:56:03 PM,12/31/2016 11:59:00 PM,Active,FT,Eating & Drinking w/ Take Out,HE_Fail,03/25/2010 10:40:44 AM,08-3-305-307.11,*,Food Protection,03/25/2010 10:40:44 AM,Fail,,Replace heavily scoreded cutting boards.,722   Shawmut AV,Roxbury,MA,02119,157649,"(42.332783, -71.083221)"
FENWAY PARK H.M.S. INC.,,JACK LYONS  MANAGER,FENWAY PARK H.M.S. INC.,,18275,10/27/2008 10:04:53 AM,12/31/2008 11:59:00 PM,Inactive,FT,Eating & Drinking w/ Take Out,HE_FailExt,04/11/2008 02:43:01 PM,17-4-302.14,*,Test Kit Provided,04/11/2008 03:11:32 PM,Fail,,,4  Yawkey Wy,Boston,MA,02215,156417,"(42.346723, -71.09868)"
WAI WAI ICE CREAM SHOP,,WONG SHU YING TRSTS,HUI,DAVID,24990,01/06/2012 09:20:52 AM,12/31/2016 11:59:00 PM,Active,FS,Eating & Drinking,HE_Filed,02/18/2015 11:57:30 AM,15-4-202.16,*,Non-Food Contact Surfaces,02/18/2015 11:57:30 AM,Pass,2015-02-19 07:58:39,Remove newspaper from wall and 3 bay sink,26   Oxford ST,Boston,MA,02111,106209,"(42.35168, -71.06027)"
Spirit of Boston,,SPIRIT CRUISES LLC,SPIRIT CRUISES LLC,,18739,02/01/2012 02:57:48 PM,12/31/2016 11:59:00 PM,Active,FS,Eating & Drinking,HE_Pass,11/19/2008 10:29:24 AM,23-4-602.13,*,Non-Food Contact Surfaces Clean,11/20/2008 08:15:22 AM,Pass,2008-11-20 08:15:22,1) hot box with soils  clean to remove 2) hot box withsoils  clean to remove,200   SEAPORT LA,BOSTON,MA,02210,,
Peggy O'Neil's Pub & Grille,,LIMERICK CO INC,LIMERICK CO INC,,19097,12/13/2011 03:15:33 PM,12/31/2016 11:59:00 PM,Active,FS,Eating & Drinking,HE_Pass,10/13/2010 01:49:24 PM,29-5-201/02.11,*,Installed and Maintained,10/13/2010 01:49:24 PM,Pass,2010-10-14 08:05:13,Hand wash sink not draining properly. Address. Plumber on site at time of inspection.,1310   DORCHESTER  AV,DORCHESTER,MA,02122,,
Double Tree Club Hotel,,BOSTON REDEVELOPMENT AUTH,C.J. WASHINGTON STREET L.L.C.,,21472,03/09/2012 11:17:16 AM,12/31/2016 11:59:00 PM,Active,FS,Eating & Drinking,HE_Filed,04/23/2008 12:44:39 PM,27-5-103.11-.12,***,Hot and Cold Water,04/24/2008 08:19:00 AM,Pass,2008-04-24 08:19:00,Provide Hot Running Water under pressure.,821    Washington ST,BOSTON,MA,02116,,
CANTON HOUSE,,,LI TING LI PRESIDENT,,23526,02/01/2012 03:06:08 PM,12/31/2016 11:59:00 PM,Active,FT,Eating & Drinking w/ Take Out,HE_Fail,11/17/2008 01:20:41 PM,23-4-602.13,*,Non-Food Contact Surfaces Clean,11/18/2008 07:59:31 AM,Fail,,Interior and exterior of Beverage Air cold holding unit visibly smiled. Clean to remove.  Interior of 3 door Isdn cooler visibly soiled. Clean to remove.  Metal shelves a 2 door Jordon Cooler visible soiled and paint chipping. Address. Hand sink heavily soiled. Clean to remove. Exterior of Duck sauce container with heavy  soils. Clean to remove.,6  Hancock St,Dorchester,MA,02125,158300,"(42.315595, -71.065919)"
SULTAN'S KITCHEN,,STATE ENTERPRISES LIMITED PA,OZCAN OZAN,,22884,02/06/2012 10:58:13 AM,12/31/2016 11:59:00 PM,Active,FT,Eating & Drinking w/ Take Out,HE_Fail,09/27/2013 11:06:20 AM,16-4-501.11/.15,*,Dishwashng Facilities,09/27/2013 11:06:20 AM,Fail,,Operate 3 bay sink properly (wash  Rinse; Sanitize),112   State ST,Boston,MA,02109,130370,"(42.359299, -71.054864)"
Back Bay Social Club,,DHANDA 867 BOYLSTON ST LPS,c/o Lyons Group,,68305,02/08/2012 07:50:46 AM,12/31/2016 11:59:00 PM,Active,FS,Eating & Drinking,HE_Fail,08/12/2015 12:14:31 PM,22-4-601/602.11,**,Food Contact Surfaces Clean,08/12/2015 12:14:31 PM,Fail,,Prep Area- Slicer with dried up food debris. Can opener with dried up food debris. Clean and sanitize properly. Pizza Station- Pizza Peel stored on top of the oven. Store properly in a clean and sanitized surface. Wooden Pizza Peels chipped. Resurface or replace. Ice Machine- interior soiled. Clean Properly.,867   Boylston ST,Boston,MA,02116,18414,"(42.34874, -71.083445)"
Uno Chicago Grill,,NICOLE E. ADAMS,NICOLE E. ADAMS,,19118,01/09/2012 03:55:20 PM,12/31/2016 11:59:00 PM,Active,FT,Eating & Drinking w/ Take Out,HE_Fail,11/01/2010 10:04:01 AM,36-6-501.11-.12,*,Improper Maintenance of Floors,11/01/2010 10:04:01 AM,Fail,,clean floor area in liquor room and around ice machine dishroom/replace cracked/loose floor tile,270   HUNTINGTON  AV,BOSTON,MA,02125,,
West Napoli Pizza,,VRATTOS SOCRATES TS,BARDHI,SOKOL,21409,06/06/2012 03:38:02 PM,12/31/2016 11:59:00 PM,Active,FT,Eating & Drinking w/ Take Out,HE_Filed,09/04/2013 11:25:48 AM,23-4-602.13,*,Non-Food Contact Surfaces Clean,09/04/2013 11:25:48 AM,Pass,2013-09-05 08:43:17,clean all door gaskets..clean and degrease all cooking equipment...,1946  Centre St,West Roxbury,MA,02132,27764,"(42.28358, -71.15676)"
Durgin Park Restaurant,,,Weinstein,Michael,24748,02/13/2012 11:17:17 AM,12/31/2016 11:59:00 PM,Active,FS,Eating & Drinking,HE_Filed,02/23/2015 07:08:55 AM,28-5-402.13,**,Sewage and Waste Water,02/23/2015 07:08:55 AM,Pass,2015-03-09 07:55:42,Water coming from the top of the building onto all four levels. Repair.,300  Faneuil Hall Marketplace,Boston,MA,02109,341035,"(42.360036, -71.056253)"
No.  7 RESTAURANT,,,HUANG FAMILY INC.,REN XIANGHUANG  PRES.,25414,02/08/2012 04:32:36 PM,12/31/2016 11:59:00 PM,Active,FT,Eating & Drinking w/ Take Out,HE_Fail,01/10/2013 02:26:41 PM,20-4-703.11,***,Food Contact Surfaces Clean,01/10/2013 02:26:41 PM,Fail,,provide proper sanitizing training for all employees....,225   Grove ST,West Roxbury,MA,02132,156965,"(42.261873, -71.15741)"
Nicholas Sub & Pizza Shop,,NICHOLAS MARKOPOULOS,Kourtelidis,Nicholas,33364,01/17/2012 03:37:47 PM,12/31/2016 11:59:00 PM,Active,FT,Eating & Drinking w/ Take Out,HE_Pass,10/02/2013 02:50:27 PM,34-5-501.111/.115,*,Outside Storage Improperly Maintained,10/02/2013 02:50:27 PM,Pass,2013-10-03 13:39:29,Clean exterior grounds to remove debris.,600   Hyde Park AV,Roslindale,MA,02131,156517,"(42.280027, -71.118658)"
DAYIB CAFE,,ABDULLAH FARAH ANSHUR,ABDULLAH FARAH ANSHUR,,22700,02/13/2012 12:56:03 PM,12/31/2016 11:59:00 PM,Active,FT,Eating & Drinking w/ Take Out,HE_Fail,03/19/2013 11:35:27 AM,36-6-501.11-.12,*,Improper Maintenance of Floors,03/19/2013 11:35:27 AM,Fail,,storage room/properly seal bare wood floor hot line/clean floor area behind all cooking equipment,722   Shawmut AV,Roxbury,MA,02119,157649,"(42.332783, -71.083221)"
UNION OYSTER HOUSE,,MILANO JOSEPH A JR TRST,MILANO,JOSEPH A.,19089,12/14/2011 02:11:17 PM,12/31/2016 11:59:00 PM,Active,FS,Eating & Drinking,HE_Fail,,02-3-602.11-.12/3-302.12,*,Food Container Labels,07/12/2007 03:27:38 PM,,,,41  Union St,Boston,MA,02108,139293,"(42.36127, -71.05688)"
SULTAN'S KITCHEN,,STATE ENTERPRISES LIMITED PA,OZCAN OZAN,,22884,02/06/2012 10:58:13 AM,12/31/2016 11:59:00 PM,Active,FT,Eating & Drinking w/ Take Out,HE_Pass,08/30/2011 12:55:50 PM,36-6-201.11,*,Floors Designed Constructed Installed,08/30/2011 12:55:50 PM,Pass,2011-08-31 08:15:33,Clear floor of freezer in basement,112   State ST,Boston,MA,02109,130370,"(42.359299, -71.054864)"
WINDY CITY AT ADAMS VILLAGE,,BAYTURK MUZAFFER,BAYTURK MUZAFFER,,19800,02/13/2012 10:40:46 AM,12/31/2016 11:59:00 PM,Active,FT,Eating & Drinking w/ Take Out,HE_Fail,10/08/2008 11:01:45 AM,29-5-201/02.11,*,Installed and Maintained,10/09/2008 08:18:36 AM,Fail,,repai faucet that is leaking under handsink,516   Gallivan BL,Dorchester,MA,02124,156552,"(42.282928, -71.055559)"